Date,Event,Passage,Source
1942,"In Winn v. Federal Land Bank of Houston, the Texas Court of Appeals dismissed an appeal due to the appellants' failure to meet the burden of proof for their affidavit of inability to pay costs. This case highlights the requirement for parties to provide competent proof of their inability to pay to avoid dismissal.","""Winn v. Federal Land Bank of Houston, 164 S.W.2d 864 (Tex. App. 1942)""","(vLex-Vincent-Can-a-divorce-case-be.pdf, p. 3)"
1976,"The Texas Supreme Court's decision in Holley v. Adams established a non-exhaustive list of considerations, known as the Holley factors, for determining the best interest of the child in custody cases. These factors have been repeatedly reaffirmed and applied in subsequent appellate and Supreme Court decisions.","""The most influential judicial articulation of relevant factors is found in the Texas Supreme Court’s decision in Holley v. Adams, which set out a non-exhaustive list of considerations for determining the best interest of the child.""","(vLex-Vincent-What-factors-can-a-trial.pdf, p. 2)"
1983,"The case 'Quintero v. Jim Walter Homes, Inc.' was referenced, indicating a legal proceeding or decision that took place in 1983.","""Quintero v. Jim Walter Homes, Inc., 654 S.W.2d 442, 1983""","(vLex-Vincent-In-Texas,-if-a-party (2).pdf, p. 1)"
1983,"The case 'Quintero v. Jim Walter Homes, Inc.' was referenced, indicating a legal proceeding related to the revocation of consent in Texas.","""Quintero v. Jim Walter Homes, Inc., 654 S.W.2d 442, 1983""","(vLex-Vincent-In-Texas,-if-a-party (3).pdf, p. 1)"
1990-1993,"A series of earlier Texas Court of Appeals cases, including Brewer v. Collins (1993), Carson v. Gomez (1992), Timmons v. Luce (1992), Thompson v. Ereckson (1991), Huntsberry v. Lynaugh (1991), and Kendrick v. Lynaugh (1990), confirm that a court may dismiss an action if it finds that the affidavit of inability to pay is false. These cases collectively establish a precedent that the rule is not limited to any particular type of civil case.","""Earlier cases, such as Brewer v. Collins, 857 S.W.2d 819 (Tex. App. 1993), Carson v. Gomez, 841 S.W.2d 491 (Tex. App. 1992), Timmons v. Luce, 840 S.W.2d 582 (Tex. App. 1992), Thompson v. Ereckson, 814 S.W.2d 805 (Tex. App. 1991), Huntsberry v. Lynaugh, 807 S.W.2d 16 (Tex. App. 1991), and Kendrick v. Lynaugh, 804 S.W.2d 153 (Tex. App. 1990), all confirm that a court may dismiss an action if it finds that the affidavit of inability to pay is false, and none of these decisions limit the rule to any particular type of civil case.""","(vLex-Vincent-Can-a-divorce-case-be.pdf, p. 1)"
1990,"In Kendrick v. Lynaugh, the Texas Court of Appeals ruled that under Section 13.001 of the Texas Civil Practice and Remedies Code, a court may dismiss a case if it finds that the affidavit of inability to pay is false. This case supports the dismissal of cases with false affidavits.","""Kendrick v. Lynaugh, 804 S.W.2d 153 (Tex. App. 1990)""","(id., p. 5)"
1990,"The Texas Court of Appeals in HBA East, Ltd. v. JEA Boxing Co., Inc. held that the plain language of Rule 237a places the burden on the plaintiff to file the remand order and provide written notice to the defendant. This decision clarifies the procedural responsibilities of the plaintiff in the remand process.","""The Texas Court of Appeals in HBA East, Ltd. v. JEA Boxing Co., Inc., 796 S.W.2d 534 (Tex. App. 1990) held that the plain language of Rule 237a places the burden on the plaintiff to file the remand order and provide written notice to the defendant.""","(vLex-Vincent-Does-a-defendant's-prior-answer.pdf, p. 1)"
1990,"The court in HBA East, Ltd. v. JEA Boxing Co., Inc. clarified that the plaintiff controls the timing of the remand order filing and notice, and the defendant’s conduct does not alter the plaintiff’s procedural duties under Rule 237a.","""Similarly, HBA East, Ltd. v. JEA Boxing Co., Inc., 796 S.W.2d 534 (Tex. App. 1990) made clear that the plaintiff controls the timing of the remand order filing and notice, and that the defendant’s conduct does not alter the plaintiff’s procedural duties under Rule 237a.""","(vLex-Vincent-Does-a-defendant's-attempt-to.pdf, p. 1)"
1990,"In HBA East, Ltd. v. JEA Boxing Co., Inc., the court explained that the plaintiff’s filing and notice are the operative events that trigger the defendant’s answer deadline.","""In HBA East, Ltd. v. JEA Boxing Co., Inc., the court explained that the plaintiff’s filing and notice are the operative events that trigger the defendant’s answer deadline.""","(id., p. 2)"
1990,"DFW Hospital Council cites HBA East Ltd. v. JEA Boxing Co., Inc. for the proposition that Rule 237a requires the plaintiff to file a copy of the remand order with the state court clerk and notify defendants to trigger the fifteen-day deadline for filing an answer.","""DFW Hospital Council also cites HBA East Ltd. v. JEA Boxing Co., Inc., 796 S.W.2d 534, 538 (Tex.App.-Houston [1st Dist.] 1990, writ denied) for the proposition that rule 237a requires the plaintiff to file a copy of the remand order with the state court clerk and notify defendants of the filing in order to trigger the fifteen-day deadline for filing an answer.""","(id., p. 3)"
1990,The case was removed to federal court and quickly remanded back to the state court.,"""In this case, the cause was removed to federal court and quickly remanded back to the state court.""","(id., p. 3)"
1990,"The Texas Court of Appeals interpreted Rule 237a in HBA East, Ltd. v. JEA Boxing Co., Inc., establishing a fifteen-day period for defendants to answer after receiving notice of remand.","""The Texas Court of Appeals in HBA East, Ltd. v. JEA Boxing Co., Inc., 796 S.W.2d 534 (Tex. App. 1990) interpreted Rule 237a as establishing a fifteen-day period for defendants to answer after receiving notice of remand, regardless of whether the defendant had already answered in federal court.""","(vLex-Vincent-Is-Rule-237a-of-the.pdf, p. 1)"
1991,"In Huntsberry v. Lynaugh, the Texas Court of Appeals ruled that a court has the authority to dismiss an action if it finds that the affidavit of inability to pay contains false allegations of poverty. This case applies to any case where such an affidavit is filed, including divorce cases.","""Huntsberry v. Lynaugh, 807 S.W.2d 16 (Tex. App. 1991)""","(vLex-Vincent-Can-a-divorce-case-be.pdf, p. 4)"
1991,"In Thompson v. Ereckson, the Texas Court of Appeals ruled that a court has the authority to dismiss an action if it finds that the allegation of poverty in an affidavit of inability to pay is false. This case provides a legal basis for dismissal in cases where false information is provided in the affidavit.","""Thompson v. Ereckson, 814 S.W.2d 805 (Tex. App. 1991)""","(id., p. 5)"
1992,"In Carson v. Gomez, the Texas Court of Appeals ruled that under section 13.001 of the Civil Practices and Remedies Code, a court may dismiss an action if it finds that the allegation of poverty in the affidavit is false. This case provides a legal basis for dismissing cases with false affidavits.","""Carson v. Gomez, 841 S.W.2d 491 (Tex. App. 1992)""","(id., p. 4)"
1992,"In Timmons v. Luce, the Texas Court of Appeals ruled that under TEX.CIV.PRAC. & REM.CODE ANN. § 13.001, a court may dismiss an action if it finds that the allegation of poverty in the affidavit is false. This statute is applicable to any case in Texas where such an affidavit is filed, including divorce cases.","""Timmons v. Luce, 840 S.W.2d 582 (Tex. App. 1992)""","(id., p. 5)"
1993,"In Brewer v. Collins, the Texas Court of Appeals ruled that under section 13.001 of the Texas Civil Practice and Remedies Code, a court may dismiss an action if it finds that the allegation of poverty in an affidavit of inability to pay is false. This case supports the dismissal of cases with false affidavits.","""Brewer v. Collins, 857 S.W.2d 819 (Tex. App. 1993)""","(id., p. 4)"
1995,"The case 'Padilla v. LaFrance' was referenced, indicating a legal proceeding or decision that took place in 1995.","""Padilla v. LaFrance, 907 S.W.2d 454, 1995""","(vLex-Vincent-In-Texas,-if-a-party (2).pdf, p. 1)"
1995,"The case 'Padilla v. LaFrance' was referenced, indicating a legal proceeding related to the revocation of consent in Texas.","""Padilla v. LaFrance, 907 S.W.2d 454, 1995""","(vLex-Vincent-In-Texas,-if-a-party (3).pdf, p. 1)"
1996,"In Aguilar v. Chastain, the Texas Court of Appeals ruled that when a lawsuit is filed in forma pauperis, it can be dismissed if found to be frivolous or malicious. This case implies that if a lie on an affidavit renders the case frivolous or malicious, it could be dismissed.","""Aguilar v. Chastain, 923 S.W.2d 740 (Tex. App. 1996)""","(vLex-Vincent-Can-a-divorce-case-be.pdf, p. 4)"
1996,"The case 'Peacock v. Humble' was referenced, indicating a legal proceeding or decision that took place in 1996.","""Peacock v. Humble, 933 S.W.2d 341, 1996""","(vLex-Vincent-In-Texas,-if-a-party (2).pdf, p. 1)"
1996,"The case 'Peacock v. Humble' was referenced, indicating a legal proceeding or decision that took place in 1996.","""Peacock v. Humble, 933 S.W.2d 341 (Tex. App. 1996)""","(id., p. 4)"
1996,"The case 'Peacock v. Humble' was referenced, indicating a legal proceeding related to the effect of lack of notice in Texas.","""Peacock v. Humble, 933 S.W.2d 341, 1996""","(vLex-Vincent-In-Texas,-if-a-party (3).pdf, p. 1)"
1996,"The case 'Peacock v. Humble' was referenced, indicating a legal proceeding related to the requirement of notice of the substance of an associate judge's report in Texas.","""Peacock v. Humble, 933 S.W.2d 341 (Tex. App. 1996)""","(id., p. 4)"
1998,"The Texas Court of Appeals found that an associate judge's report can be considered valid if it is noted on the trial court's docket sheet and pronounced in open court, even if a party is absent.","""Robles v. Robles, 965 S.W.2d 605 (Tex. App. 1998)""","(vLex-Vincent-In-Texas,-if-a-party.pdf, p. 3)"
1998,"The Texas Court of Appeals rules that an associate judge's report can be considered valid if it is noted on the trial court's docket sheet and pronounced in open court, even if a party is absent.","""Robles v. Robles, 965 S.W.2d 605 (Tex. App. 1998)""","(vLex-Vincent-In-Texas,-if-a-party (1).pdf, p. 3)"
1999,"In Denson v. T.D.C.J.-I.D., the Texas Court of Appeals ruled that when a plaintiff files an affidavit of inability to pay, the trial court has broad discretion to dismiss the suit as frivolous or malicious. This case underscores the court's discretion in handling cases involving affidavits of inability to pay.","""Denson v. T.D.C.J.-I.D. (Tex. App. 1999)""","(vLex-Vincent-Can-a-divorce-case-be.pdf, p. 3)"
1999,"In the case of Quaestor Investments, Inc. v. State of Chiapas, the Texas Supreme Court emphasized that the defendant's obligation to answer in state court is not triggered until the plaintiff files the remand order and provides notice.","""Quaestor Investments, Inc. v. State of Chiapas, 997 S.W.2d 226 (Tex. 1999), the Texas Supreme Court again emphasized that the defendant’s obligation to answer in state court is not triggered until the plaintiff files the remand order and provides notice.""","(vLex-Vincent-Is-the-plaintiff-required-to.pdf, p. 1)"
1999,"The Texas Supreme Court in Quaestor Investments, Inc. v. State of Chiapas addressed Rule 237a, emphasizing that the rule requires the plaintiff to file the remand order and notify adverse parties' attorneys. The court noted that the defendant's answer deadline is triggered by this notice, highlighting the procedural importance of the plaintiff's actions post-remand.","""The Texas Supreme Court in Quaestor Investments, Inc. v. State of Chiapas, 997 S.W.2d 226 (Tex. 1999) also addressed Rule 237a, noting that the rule requires the plaintiff to file the remand order and notify adverse parties’ attorneys, and that the answer deadline is triggered by this notice.""","(vLex-Vincent-Does-a-defendant's-prior-answer.pdf, p. 1)"
1999,"The Texas Court of Appeals ruled that even if a referring court fails to hear an appeal from an associate judge's report within the 30-day period specified by the Texas Family Code, this does not deprive the court of jurisdiction.","""Lopez v. Lopez, 995 S.W.2d 896 (Tex. App. 1999)""","(vLex-Vincent-In-Texas,-if-a-party.pdf, p. 4)"
1999,"The Texas Court of Appeals rules that even if a referring court fails to hear an appeal from an associate judge's report within the 30-day period specified by the Texas Family Code, this does not deprive the court of jurisdiction.","""Lopez v. Lopez, 995 S.W.2d 896 (Tex. App. 1999)""","(vLex-Vincent-In-Texas,-if-a-party (1).pdf, p. 4)"
1999,"The Texas Supreme Court discussed Rule 237a in Quaestor Investments, Inc. v. State of Chiapas, emphasizing the fifteen-day period for answering after notice of remand is given.","""In Quaestor Investments, Inc. v. State of Chiapas, 997 S.W.2d 226 (Tex. 1999), the Texas Supreme Court again discussed Rule 237a, emphasizing that the rule provides a fifteen-day period for answering after notice of remand is given.""","(vLex-Vincent-Is-Rule-237a-of-the.pdf, p. 1)"
2000,"The case 'Phagan v. Aleman' was referenced, indicating a legal proceeding or decision that took place in 2000.","""Phagan v. Aleman, 29 S.W.3d 632, 2000""","(vLex-Vincent-In-Texas,-if-a-party (2).pdf, p. 1)"
2000,"The Texas Court of Appeals case 'In Re: Jane Doe 2' was documented, discussing the review of a trial court's best interests findings for abuse of discretion.","""In Re: Jane Doe 2, 19 S.W.3d 278 (Tex. App. 2000)""","(vLex-Vincent-What-factors-can-a-trial.pdf, p. 9)"
2000,"The case 'Phagan v. Aleman' was referenced, indicating a legal proceeding related to the mandatory nature of de novo hearings in Texas.","""Phagan v. Aleman, 29 S.W.3d 632, 2000""","(vLex-Vincent-In-Texas,-if-a-party (3).pdf, p. 1)"
2000,The Texas Court of Appeals ruled that a district or statutory county court judge in Texas has the authority to hear and determine matters pending in any district or statutory county court within the same county.,"""In re Nash, 13 S.W.3d 894 (Tex. App. 2000)""","(vLex-Vincent-In-Texas,-if-a-party.pdf, p. 6)"
2000,The Texas Court of Appeals rules that a district or statutory county court judge in Texas has the authority to hear and determine matters pending in any district or statutory county court within the same county.,"""In re Nash, 13 S.W.3d 894 (Tex. App. 2000)""","(vLex-Vincent-In-Texas,-if-a-party (1).pdf, p. 6)"
2002,"In the case In re K.R.P., the Texas Court of Appeals addressed the presumption in favor of appointing parents as joint managing conservators, which can be rebutted by evidence that such an appointment would significantly impair the child's physical health or emotional development, or by a history of family violence.","""The presumption in favor of appointing parents as joint managing conservators can be rebutted by evidence that such an appointment would significantly impair the child’s physical health or emotional development, or by a history of family violence (Tex. Fam. Code § 153.131; In re K.R.P., 80 S.W.3d 669 (Tex. App. 2002)).""","(vLex-Vincent-What-factors-can-a-trial.pdf, p. 3)"
2004,"The Holley factors were codified by statute, as recognized in the case Corrales v. Department of Family and Prot. in 2004. This codification ensures their continued relevance and application in custody cases.","""It is important to note that the Holley factors have been codified by statute, as recognized in Corrales v. Department of Family and Prot., 155 S.W.3d 478 (Tex. App. 2004).""","(id., p. 2)"
2004,"The Texas Court of Appeals ruled that the trial court retains ultimate jurisdiction over the matters heard by associate judges, as their recommendations do not become final without the trial judge's ratification unless an appeal is filed.","""In re G.S.G., 145 S.W.3d 351 (Tex. App. 2004)""","(vLex-Vincent-In-Texas,-if-a-party.pdf, p. 6)"
2004,"The Texas Court of Appeals provides insight into the procedural framework of how associate judges operate within the Texas Family Code, clarifying that associate judges can hear matters under the jurisdiction of the trial court, but their recommendations do not become final without the trial judge's ratification unless an appeal is filed.","""In re G.S.G., 145 S.W.3d 351 (Tex. App. 2004)""","(vLex-Vincent-In-Texas,-if-a-party (1).pdf, p. 6)"
2006 and 1990,"In the cases of Toliver v. Dallas Fort Worth Hosp. Council and HBA East, Ltd. v. JEA Boxing Co., Inc., the Texas Court of Appeals reinforced that the plaintiff's obligation to file the certified remand order and provide notice is absolute and not contingent on the defendant's actions in federal court.","""Toliver v. Dallas Fort Worth Hosp. Council, 198 S.W.3d 444 (Tex. App. 2006) and HBA East, Ltd. v. JEA Boxing Co., Inc., 796 S.W.2d 534 (Tex. App. 1990) both reinforce that the plaintiff’s obligation to file the certified remand order and provide notice is absolute and not contingent on the defendant’s actions in federal court.""","(vLex-Vincent-Is-the-plaintiff-required-to.pdf, p. 1)"
2006,The Texas Court of Appeals in Toliver v. Dallas Fort Worth Hosp. Council explained that the plaintiff's filing and notice under Rule 237a are necessary to trigger the fifteen-day deadline for the defendant to file an answer. This decision underscores the procedural requirement for the plaintiff to act post-remand to initiate the defendant's answer period.,"""In Toliver v. Dallas Fort Worth Hosp. Council, 198 S.W.3d 444 (Tex. App. 2006), the court explained that the plaintiff’s filing and notice under Rule 237a are necessary to trigger the fifteen-day deadline for the defendant to file an answer.""","(vLex-Vincent-Does-a-defendant's-prior-answer.pdf, p. 1)"
2006,The court in Toliver v. Dallas Fort Worth Hosp. Council held that the fifteen-day deadline for the defendant to file an answer is triggered only by the plaintiff’s filing of the remand order and written notice.,"""In Toliver v. Dallas Fort Worth Hosp. Council, 198 S.W.3d 444 (Tex. App. 2006), the court held that the fifteen-day deadline for the defendant to file an answer is triggered only by the plaintiff’s filing of the remand order and written notice.""","(vLex-Vincent-Does-a-defendant's-attempt-to.pdf, p. 1)"
2006 and 1990,"The courts in Toliver v. Dallas Fort Worth Hosp. Council and HBA East, Ltd. v. JEA Boxing Co., Inc. confirmed that the fifteen-day answer deadline for the defendant is triggered only by the plaintiff’s filing and notice.","""Similarly, Toliver v. Dallas Fort Worth Hosp. Council (198 S.W.3d 444, 447–48 [Tex. App. 2006]) and HBA East, Ltd. v. JEA Boxing Co., Inc. (796 S.W.2d 534, 538 [Tex. App. 1990]) both confirm that the fifteen-day answer deadline for the defendant is triggered only by the plaintiff’s filing and notice, not by any action of the defendant.""","(id., p. 2)"
2006,"In Toliver v. Dallas Fort Worth Hosp. Council, the court held that the defendant’s deadline to answer was not triggered because the plaintiff had not provided the required notice.","""Similarly, in Toliver v. Dallas Fort Worth Hosp. Council, the court held that the defendant’s deadline to answer was not triggered because the plaintiff had not provided the required notice, even though the defendant was aware of the remand and had participated in the case.""","(id., p. 2)"
2007,"The Texas Court of Appeals issued a decision in the case of In re B.F.B., 241 S.W.3d 643, in 2007. This case addressed the limitations of a visiting judge's authority, emphasizing that actions beyond the scope of their assignment render judgments void.","""In re B.F.B., 241 S.W.3d 643 (Tex. App. 2007).""","(vLex-Vincent-Is-it-appropriate-for-a.pdf, p. 2)"
2008,"In Higgins v. Randall County Sheriff's Office, the Texas Supreme Court noted that if no contest is filed against an affidavit of indigence, the affidavit’s allegations are deemed true, allowing the party to proceed without paying costs. This case highlights the importance of contesting false affidavits to prevent them from being accepted as true.","""Higgins v. Randall County Sheriff's Office, 257 S.W.3d 684 (Tex. 2008) (noting that if no contest is filed, the affidavit’s allegations are deemed true).""","(vLex-Vincent-Can-a-divorce-case-be.pdf, p. 2)"
2008,"In Higgins v. Randall County Sheriff's Office, the Texas Supreme Court ruled that if an affidavit of indigence is not contested, its allegations are deemed true, and the party can proceed without paying costs. This case emphasizes the importance of contesting affidavits to prevent false claims from being accepted.","""Higgins v. Randall County Sheriff's Office, 257 S.W.3d 684 (Tex. 2008)""","(id., p. 3)"
2008,"The Texas Court of Appeals issued a decision in the case of In re Gulf Coast Business Development Corp., 247 S.W.3d 787, in 2008. This case discussed the criteria under Rule 174 for consolidating cases, emphasizing the need for common issues of law or fact and the trial court's discretion.","""In re Gulf Coast Business Development Corp., 247 S.W.3d 787 (Tex. App. 2008).""","(vLex-Vincent-Is-it-appropriate-for-a.pdf, p. 3)"
2010,"In the case of Gonzalez v. Guilbot, the Texas Supreme Court confirmed the requirement under Rule 237a for the plaintiff to file a certified copy of the remand order and notify adverse parties.","""Gonzalez v. Guilbot, 315 S.W.3d 533 (Tex. 2010), the Texas Supreme Court confirmed that Rule 237a requires the plaintiff to file a certified copy of the remand order and to notify adverse parties.""","(vLex-Vincent-Is-the-plaintiff-required-to.pdf, p. 1)"
2010,The Texas Supreme Court confirmed in Gonzalez v. Guilbot that Rule 237a requires the plaintiff to file a certified copy of the remand order with the state court clerk. This decision emphasizes the procedural requirement for plaintiffs to ensure the prompt recommencement of proceedings in state court after a case is remanded from federal court.,"""In Gonzalez v. Guilbot, 315 S.W.3d 533 (Tex. 2010), the Texas Supreme Court confirmed that Rule 237a expressly requires the plaintiff to file a certified copy of the remand order with the state court clerk.""","(vLex-Vincent-Does-a-defendant's-prior-answer.pdf, p. 1)"
2010,The Texas Supreme Court in Gonzalez v. Guilbot emphasized the plaintiff's obligation under Rule 237a to file a certified copy of the remand order with the state court clerk.,"""In Gonzalez v. Guilbot, 315 S.W.3d 533 (Tex. 2010), the Texas Supreme Court underscored that Rule 237a expressly places the obligation on the plaintiff to file a certified copy of the remand order with the state court clerk.""","(vLex-Vincent-Does-a-defendant's-attempt-to.pdf, p. 1)"
2010,The Texas Supreme Court in Gonzalez v. Guilbot emphasized the importance of Rule 237a in ensuring clarity and uniformity in the transfer of jurisdiction back to the state court.,"""The Texas Supreme Court in Gonzalez v. Guilbot (315 S.W.3d 533, 540–41 [Tex. 2010]) emphasized that the procedural requirements of Rule 237a are designed to ensure clarity and uniformity in the transfer of jurisdiction back to the state court.""","(id., p. 1)"
2010,The Texas Supreme Court in Gonzalez v. Guilbot emphasized the plaintiff's obligation under Rule 237a to file a certified copy of the remand order with the state court clerk.,"""In Gonzalez v. Guilbot, 315 S.W.3d 533 (Tex. 2010), the Texas Supreme Court underscored that Rule 237a expressly places the obligation on the plaintiff to file a certified copy of the remand order with the state court clerk.""","(id., p. 4)"
2010,"The Texas Supreme Court addressed the operation of Rule 237a in the case of Gonzalez v. Guilbot, clarifying that if a defendant has already answered in federal court, no default judgment may be rendered against them for failing to file a new answer in state court.","""The Texas Supreme Court in Gonzalez v. Guilbot, 315 S.W.3d 533 (Tex. 2010) directly addressed the operation of Rule 237a.""","(vLex-Vincent-Is-Rule-237a-of-the.pdf, p. 1)"
"2012, 2018, 2022, 2023","The Holley factors have been reaffirmed and applied in various Texas appellate and Supreme Court decisions, including In re A.C. in 2018, In re E.N.C. in 2012, In re S.C. in 2022, In re A.A.C. in 2023, and C.L.W. v. R.V.W. in 2023. These cases demonstrate the continued relevance and application of the Holley factors in determining the best interest of the child in custody cases.","""These factors have been repeatedly reaffirmed and applied in subsequent appellate and Supreme Court decisions (In re A.C., 560 S.W.3d 624 (Tex. 2018); In re E.N.C., 384 S.W.3d 796 (Tex. 2012); In re S.C., 04-22-00125-CV (Tex. App. Aug 17, 2022); In re A.A.C. (Tex. App. Oct. 5, 2023); C.L.W. v. R.V.W. (Tex. App. Aug. 10, 2023)).""","(vLex-Vincent-What-factors-can-a-trial.pdf, p. 2)"
2012,"The Texas Supreme Court case 'In re E.N.C.' was documented, providing a list of nonexclusive factors for determining whether termination of parental rights is in a child's best interest.","""In re E.N.C., 384 S.W.3d 796, 56 Tex. Sup. Ct. J. 19 (Tex. 2012)""","(id., p. 9)"
2012,The Court of Appeals in Kashan v. McLane Co. clarified that the plaintiff’s obligation under Rule 237a is not waived by the defendant’s actions.,"""The Court of Appeals in Kashan v. McLane Co. (No. 03-11-00125-CV) further clarified that the plaintiff’s obligation is not waived by the defendant’s actions, including attempts to set motions in the trial court after remand.""","(vLex-Vincent-Does-a-defendant's-attempt-to.pdf, p. 1)"
