corpus,source_pdf,source_txt,source_exists,date,year,month,day,case_numbers,doc_tags,pages,text_chars,ocr_chars,word_count,status
case,CASE DOCS\02-24-00149-CV_24149CV-1.pdf,extracted_text\02-24-00149-CV_24149CV-1.txt,yes,2014-02-24,2014,02,24,,,2,691,587,197,ok
case,CASE DOCS\02-24-00149-CV_24149CV.cor-1.pdf,extracted_text\02-24-00149-CV_24149CV.cor-1.txt,yes,2014-02-24,2014,02,24,,,2,690,586,197,ok
case,CASE DOCS\02-24-00149-CV_24149CV.cor_961223C6-03e9250a-1.pdf,extracted_text\02-24-00149-CV_24149CV.cor_961223C6-03e9250a-1.txt,yes,2014-02-24,2014,02,24,,,2,734,632,213,ok
case,CASE DOCS\02-24-00149-CV_24149CV.cor_961223C6-1.pdf,extracted_text\02-24-00149-CV_24149CV.cor_961223C6-1.txt,yes,2014-02-24,2014,02,24,,,2,734,632,213,ok
case,CASE DOCS\02-24-00149-CV_CORR OPINION PAGE_FILECOPY_FC8D2EE3-0f787c6f-1.pdf,extracted_text\02-24-00149-CV_CORR OPINION PAGE_FILECOPY_FC8D2EE3-0f787c6f-1.txt,yes,2014-02-24,2014,02,24,,,2,1663,1625,561,ok
case,CASE DOCS\02-24-00149-CV_MEM OPINION ISSD_OPINION ISSD_FILECOPY-1.pdf,extracted_text\02-24-00149-CV_MEM OPINION ISSD_OPINION ISSD_FILECOPY-1.txt,yes,2014-02-24,2014,02,24,,,1,1457,1435,485,ok
case,CASE DOCS\02-24-00149-CV_MT REHEAR DISP ORIG PROC CV_FILECOPY_BDCA6517-1-1.pdf,extracted_text\02-24-00149-CV_MT REHEAR DISP ORIG PROC CV_FILECOPY_BDCA6517-1-1.txt,yes,2014-02-24,2014,02,24,,,1,690,699,248,ok
case,CASE DOCS\02-24-00149-CV_MT REHEAR DISP ORIG PROC CV_FILECOPY_BDCA6517-1.pdf,extracted_text\02-24-00149-CV_MT REHEAR DISP ORIG PROC CV_FILECOPY_BDCA6517-1.txt,yes,2014-02-24,2014,02,24,,,1,690,699,248,ok
case,CASE DOCS\02-24-00149-CV_PET MAND FLD_FILECOPY (2)-1.pdf,extracted_text\02-24-00149-CV_PET MAND FLD_FILECOPY (2)-1.txt,yes,2014-02-24,2014,02,24,,,1,1257,1212,421,ok
case,CASE DOCS\02-24-00149-CV_PET MAND FLD_FILECOPY (2)_3D0FAE00-07353b0d-1.pdf,extracted_text\02-24-00149-CV_PET MAND FLD_FILECOPY (2)_3D0FAE00-07353b0d-1.txt,yes,2014-02-24,2014,02,24,,,1,1257,1212,421,ok
case,CASE DOCS\02-24-00149-CV_PET MAND FLD_FILECOPY (2)_3D0FAE00-1-1.pdf,extracted_text\02-24-00149-CV_PET MAND FLD_FILECOPY (2)_3D0FAE00-1-1.txt,yes,2014-02-24,2014,02,24,,,1,1257,1212,421,ok
case,CASE DOCS\02-24-00149-CV_PET MAND FLD_FILECOPY (2)_3D0FAE00-1.pdf,extracted_text\02-24-00149-CV_PET MAND FLD_FILECOPY (2)_3D0FAE00-1.txt,yes,2014-02-24,2014,02,24,,,1,1257,1212,421,ok
case,CASE DOCS\02-25-00164-CV_25164CV-1.pdf,extracted_text\02-25-00164-CV_25164CV-1.txt,yes,2016-02-25,2016,02,25,,,2,700,601,199,ok
case,CASE DOCS\02-25-00164-CV_MANDAMUS_FILED - 04.10.2025-1.pdf,extracted_text\02-25-00164-CV_MANDAMUS_FILED - 04.10.2025-1.txt,yes,2016-02-25,2016,02,25,,mandamus,1,1328,1267,427,ok
case,CASE DOCS\02-25-00164-CV_MT REHEAR DISP ORIG PROC CV_FILECOPY-1.pdf,extracted_text\02-25-00164-CV_MT REHEAR DISP ORIG PROC CV_FILECOPY-1.txt,yes,2016-02-25,2016,02,25,,,1,668,676,240,ok
case,CASE DOCS\02-25-00166-CV_25166CV-1.pdf,extracted_text\02-25-00166-CV_25166CV-1.txt,yes,2016-02-25,2016,02,25,,,2,722,620,203,ok
case,CASE DOCS\02-25-00166-CV_MEM OPINION ISSD_OPINION ISSD_FILECOPY-1.pdf,extracted_text\02-25-00166-CV_MEM OPINION ISSD_OPINION ISSD_FILECOPY-1.txt,yes,2016-02-25,2016,02,25,,,1,1642,1604,533,ok
case,CASE DOCS\02-25-00171-CV MANDAMUS RECORD-1.pdf,extracted_text\02-25-00171-CV MANDAMUS RECORD-1.txt,yes,2017-02-25,2017,02,25,02-25-00171-CV,mandamus;record,244,328902,316406,102113,ok
case,CASE DOCS\02-25-00171-CV_25171CV-1.pdf,extracted_text\02-25-00171-CV_25171CV-1.txt,yes,2017-02-25,2017,02,25,,,2,702,603,199,ok
case,CASE DOCS\02-25-00171-CV_MT REHEAR DISP ORIG PROC CV_FILECOPY-1.pdf,extracted_text\02-25-00171-CV_MT REHEAR DISP ORIG PROC CV_FILECOPY-1.txt,yes,2017-02-25,2017,02,25,,,1,668,676,240,ok
case,CASE DOCS\02-25-00582-CV_25582CV-1.pdf,extracted_text\02-25-00582-CV_25582CV-1.txt,yes,2058-02-25,2058,02,25,,,2,646,544,183,ok
case,CASE DOCS\02-25-00582-CV_PET MAND FLD_FILECOPY-1.pdf,extracted_text\02-25-00582-CV_PET MAND FLD_FILECOPY-1.txt,yes,2058-02-25,2058,02,25,,,2,1590,1534,525,ok
case,CASE DOCS\02.01.24 - Agreed Order to Consolidation-1.pdf,extracted_text\02.01.24 - Agreed Order to Consolidation-1.txt,yes,2024-02-01,2024,02,01,,order,3,3218,3131,1035,ok
case,CASE DOCS\02.01.24 - AJ Report-1.pdf,extracted_text\02.01.24 - AJ Report-1.txt,yes,2024-02-01,2024,02,01,,report,6,8407,8048,2782,ok
case,CASE DOCS\02.01.24 - AJ's Report-1.pdf,extracted_text\02.01.24 - AJ's Report-1.txt,yes,2024-02-01,2024,02,01,,report,3,2517,1858,766,ok
case,CASE DOCS\02.01.24 - AJR-1.pdf,extracted_text\02.01.24 - AJR-1.txt,yes,2024-02-01,2024,02,01,,,6,9243,8520,2949,ok
case,CASE DOCS\02.01.24 - Defendant's Answer-1.pdf,extracted_text\02.01.24 - Defendant's Answer-1.txt,yes,2024-02-01,2024,02,01,,,4,748,7358,1375,ok
case,CASE DOCS\02.05.2024_NOTICE OF TERMINATION OF LEGAL COUNSEL -BACALIS-1.pdf,extracted_text\02.05.2024_NOTICE OF TERMINATION OF LEGAL COUNSEL -BACALIS-1.txt,yes,2024-02-05,2024,02,05,,notice,3,2531,2377,829,ok
case,CASE DOCS\02.05.24 - NOTICE OF TERMINATION OF LEGAL COUNSEL-1.pdf,extracted_text\02.05.24 - NOTICE OF TERMINATION OF LEGAL COUNSEL-1.txt,yes,2024-02-05,2024,02,05,,notice,3,3114,3026,1017,ok
case,CASE DOCS\02.06.2024_AGREED MOTION FOR WITHDRAWAL OF ATTY BACALIS-1.pdf,extracted_text\02.06.2024_AGREED MOTION FOR WITHDRAWAL OF ATTY BACALIS-1.txt,yes,2024-02-06,2024,02,06,,motion,5,4595,4230,1487,ok
case,CASE DOCS\02.06.24 - Agreed Motion for Withdraw-1.pdf,extracted_text\02.06.24 - Agreed Motion for Withdraw-1.txt,yes,2024-02-06,2024,02,06,,motion,4,1513,4268,927,ok
case,CASE DOCS\02.06.24 - Agreed Motion for Withdrawal of Attorney-1.pdf,extracted_text\02.06.24 - Agreed Motion for Withdrawal of Attorney-1.txt,yes,2024-02-06,2024,02,06,,motion,4,949,3745,777,ok
case,CASE DOCS\02.06.24 - Agreed Motion for Withdrawal of Attorney_2694B50A-1.pdf,extracted_text\02.06.24 - Agreed Motion for Withdrawal of Attorney_2694B50A-1.txt,yes,2024-02-06,2024,02,06,,motion,4,949,3745,777,ok
case,CASE DOCS\02.08.2024_AGREED AJS REPORT FOR TEMP ORDS-1.pdf,extracted_text\02.08.2024_AGREED AJS REPORT FOR TEMP ORDS-1.txt,yes,2024-02-08,2024,02,08,,report,7,9541,8094,2971,ok
case,CASE DOCS\02.08.2024_AGREED ORDER FOR CONSOLIDATION SIGNED 2124-1.pdf,extracted_text\02.08.2024_AGREED ORDER FOR CONSOLIDATION SIGNED 2124-1.txt,yes,2024-02-08,2024,02,08,,order,4,3416,2956,1081,ok
case,CASE DOCS\02.08.24 - Agreed Motion to Consolidate-1.pdf,extracted_text\02.08.24 - Agreed Motion to Consolidate-1.txt,yes,2024-02-08,2024,02,08,,motion,3,2799,2818,941,ok
case,CASE DOCS\02.08.24 - Agreed Order for Consolidation-1-1.pdf,extracted_text\02.08.24 - Agreed Order for Consolidation-1-1.txt,yes,2024-02-08,2024,02,08,,order,3,2799,2818,941,ok
case,CASE DOCS\02.08.24 - Associate Judge's Report-1-1.pdf,extracted_text\02.08.24 - Associate Judge's Report-1-1.txt,yes,2024-02-08,2024,02,08,,report,6,8407,8048,2782,ok
case,CASE DOCS\02.08.24 - ASSOCIATE JUDGE'S REPORT-1.pdf,extracted_text\02.08.24 - ASSOCIATE JUDGE'S REPORT-1.txt,yes,2024-02-08,2024,02,08,,report,6,8407,8048,2782,ok
case,CASE DOCS\02.09-1.pdf,extracted_text\02.09-1.txt,yes,,,,,,,13,28199,22166,7412,ok
case,CASE DOCS\02.09.2024_EXHIBIT A1 - TEXT RECORDS AND VISUALIZATIONS-1.pdf,extracted_text\02.09.2024_EXHIBIT A1 - TEXT RECORDS AND VISUALIZATIONS-1.txt,yes,2024-02-09,2024,02,09,,exhibit;record,462,1076021,1080757,444414,ok
case,CASE DOCS\02.09.2024_EXHIBIT A5 - EVICTION NOTICE TORN-1.pdf,extracted_text\02.09.2024_EXHIBIT A5 - EVICTION NOTICE TORN-1.txt,yes,2024-02-09,2024,02,09,,notice;exhibit,4,4484,3840,1449,ok
case,CASE DOCS\02.09.2024_MTN FOR RECONSIDERATION  TO VACATETEMPORARY ORDS-1.pdf,extracted_text\02.09.2024_MTN FOR RECONSIDERATION  TO VACATETEMPORARY ORDS-1.txt,yes,2024-02-09,2024,02,09,,,14,27224,21626,7370,ok
case,CASE DOCS\02.09.24 -  Exhibit A.5 EVICTION NOTICE-1.pdf,extracted_text\02.09.24 -  Exhibit A.5 EVICTION NOTICE-1.txt,yes,2024-02-09,2024,02,09,,notice;exhibit,4,114,3664,655,ok
case,CASE DOCS\02.09.24 - EMERGENCY MOTION - EXHIBIT A.3-1.pdf,extracted_text\02.09.24 - EMERGENCY MOTION - EXHIBIT A.3-1.txt,yes,2024-02-09,2024,02,09,,motion;emergency;exhibit,2,26,1731,325,ok
case,CASE DOCS\02.09.24 - EMERGENCY MOTION TO RECONSIDER EVIDENCE AND VACATE TEMPORARY ORDERS-1.pdf,extracted_text\02.09.24 - EMERGENCY MOTION TO RECONSIDER EVIDENCE AND VACATE TEMPORARY ORDERS-1.txt,yes,2024-02-09,2024,02,09,,motion;order;emergency,13,26540,17593,6472,ok
case,CASE DOCS\02.09.24 - EMERGENCY MOTION TO RECONSIDER-1.pdf,extracted_text\02.09.24 - EMERGENCY MOTION TO RECONSIDER-1.txt,yes,2024-02-09,2024,02,09,,motion;emergency,13,26540,20738,6989,ok
case,CASE DOCS\02.09.24 - EMERGENCY MOTION TO VACATE.pdf,extracted_text\02.09.24 - EMERGENCY MOTION TO VACATE.txt,yes,2024-02-09,2024,02,09,,motion;emergency,4,3793,3072,1098,ok
case,CASE DOCS\02.09.24 - EMERGENCY MOTION.pdf,extracted_text\02.09.24 - EMERGENCY MOTION.txt,yes,2024-02-09,2024,02,09,,motion;emergency,13,26540,20738,6989,ok
case,CASE DOCS\02.09.24 - Exhibit A.2 Text to Papaw-1.pdf,extracted_text\02.09.24 - Exhibit A.2 Text to Papaw-1.txt,yes,2024-02-09,2024,02,09,,exhibit,6,618,4665,1077,ok
case,CASE DOCS\02.09.24 - Exhibit A.3 Financial Transaction-1.pdf,extracted_text\02.09.24 - Exhibit A.3 Financial Transaction-1.txt,yes,2024-02-09,2024,02,09,,exhibit,3,2134,2013,767,ok
case,CASE DOCS\02.09.24 - Exhibit A.4 BANK OVERDRAFT AND BUSINESS ADS-1.pdf,extracted_text\02.09.24 - Exhibit A.4 BANK OVERDRAFT AND BUSINESS ADS-1.txt,yes,2024-02-09,2024,02,09,,exhibit,7,180,3558,705,ok
case,CASE DOCS\02.09.24 - Exhibit A.4 Overdrawn Account-1.pdf,extracted_text\02.09.24 - Exhibit A.4 Overdrawn Account-1.txt,yes,2024-02-09,2024,02,09,,exhibit,8,1631,3744,1034,ok
case,CASE DOCS\02.09.24 - Exhibit B.1 ORIGINAL PETITION FOR DIVORCE-1.pdf,extracted_text\02.09.24 - Exhibit B.1 ORIGINAL PETITION FOR DIVORCE-1.txt,yes,2024-02-09,2024,02,09,,petition;exhibit,13,312,22414,3956,ok
case,CASE DOCS\02.09.24 - Exhibit B.2 Dismissed Eviction-1.pdf,extracted_text\02.09.24 - Exhibit B.2 Dismissed Eviction-1.txt,yes,2024-02-09,2024,02,09,,exhibit,2,1332,1245,434,ok
case,CASE DOCS\02.09.24 - Exhibit C.1 DEFENDANT'S ORIGINAL ANSWER-1.pdf,extracted_text\02.09.24 - Exhibit C.1 DEFENDANT'S ORIGINAL ANSWER-1.txt,yes,2024-02-09,2024,02,09,,exhibit,18,3206,22367,4255,ok
case,CASE DOCS\02.09.24 - EXHIBIT D - PROPOSED PARENTING PLAN-1.pdf,extracted_text\02.09.24 - EXHIBIT D - PROPOSED PARENTING PLAN-1.txt,yes,2024-02-09,2024,02,09,,exhibit,4,136,3543,549,ok
case,CASE DOCS\02.09.25 - Exhibit A.1 TEXTS AND VIZUALIZATIONS-1.pdf,extracted_text\02.09.25 - Exhibit A.1 TEXTS AND VIZUALIZATIONS-1.txt,yes,2025-02-09,2025,02,09,,exhibit,458,1058307,1066958,434944,ok
case,CASE DOCS\02.09.25 - Exhibit A.2 TEXT TO PAPAW-1.pdf,extracted_text\02.09.25 - Exhibit A.2 TEXT TO PAPAW-1.txt,yes,2025-02-09,2025,02,09,,exhibit,5,136,4465,920,ok
case,CASE DOCS\02.09.25 - Exhibit A.3 FINANCIAL TRANSACTIONS-1.pdf,extracted_text\02.09.25 - Exhibit A.3 FINANCIAL TRANSACTIONS-1.txt,yes,2025-02-09,2025,02,09,,exhibit,2,70,1777,341,ok
case,CASE DOCS\02.09.25 - Exhibit B.2 EVICTION DISMISSAL-1.pdf,extracted_text\02.09.25 - Exhibit B.2 EVICTION DISMISSAL-1.txt,yes,2025-02-09,2025,02,09,,exhibit,2,1049,1190,379,ok
case,CASE DOCS\02.09.25 - Exhibit B.3 MUNFORD ILLEGAL ORDER-1.pdf,extracted_text\02.09.25 - Exhibit B.3 MUNFORD ILLEGAL ORDER-1.txt,yes,2025-02-09,2025,02,09,,order;exhibit,2,1031,1048,364,ok
case,CASE DOCS\02.10.25 - EMERGENCY EX-PARTE ORDER-1.pdf,extracted_text\02.10.25 - EMERGENCY EX-PARTE ORDER-1.txt,yes,2025-02-10,2025,02,10,,order;emergency,109,200396,175420,60994,ok
case,CASE DOCS\02.12.24 - ORDER FOR WD OF ATTORNEY-1.pdf,extracted_text\02.12.24 - ORDER FOR WD OF ATTORNEY-1.txt,yes,2024-02-12,2024,02,12,,order,3,3423,3322,1133,ok
case,CASE DOCS\02.12.24 - Order of Withdraw (BACALIS)-1.pdf,extracted_text\02.12.24 - Order of Withdraw (BACALIS)-1.txt,yes,2024-02-12,2024,02,12,,order,19,24335,19242,6587,ok
case,CASE DOCS\02.13.24 - Correspondence Cooper Carter-1.pdf,extracted_text\02.13.24 - Correspondence Cooper Carter-1.txt,yes,2024-02-13,2024,02,13,,,3,3349,3340,1119,ok
case,CASE DOCS\02.14.24 - First COOPER COMMUNICATIONS-1.pdf,extracted_text\02.14.24 - First COOPER COMMUNICATIONS-1.txt,yes,2024-02-14,2024,02,14,,,3,0,3629,621,ok
case,CASE DOCS\02.14.24 - RESPONDENT'S ANSWER TO PETITIONERS DIVORCE PETITION-1.pdf,extracted_text\02.14.24 - RESPONDENT'S ANSWER TO PETITIONERS DIVORCE PETITION-1.txt,yes,2024-02-14,2024,02,14,,petition,8,12583,12134,3762,ok
case,CASE DOCS\02.20.25 - MOTION TO SIGN-1-1.pdf,extracted_text\02.20.25 - MOTION TO SIGN-1-1.txt,yes,2025-02-20,2025,02,20,,motion,20,26153,26309,8314,ok
case,CASE DOCS\02.20.25 - MOTION TO SIGN-1.pdf,extracted_text\02.20.25 - MOTION TO SIGN-1.txt,yes,2025-02-20,2025,02,20,,motion,19,25286,25471,8021,ok
case,CASE DOCS\02.22.2024_PROP ORDER ON MOTION FOR PRETRIAL SUMMARYJUDGMENT-1.pdf,extracted_text\02.22.2024_PROP ORDER ON MOTION FOR PRETRIAL SUMMARYJUDGMENT-1.txt,yes,2024-02-22,2024,02,22,,motion;order,2,1864,662,268,ok
case,CASE DOCS\02.22.24 - Partial Summary Judgment-1.pdf,extracted_text\02.22.24 - Partial Summary Judgment-1.txt,yes,2024-02-22,2024,02,22,,summary_judgment,10,20058,19003,5928,ok
case,CASE DOCS\02.22.24 - PROPOSED ORDER ON MOTION FOR SUMMARY JUDGMENT-1.pdf,extracted_text\02.22.24 - PROPOSED ORDER ON MOTION FOR SUMMARY JUDGMENT-1.txt,yes,2024-02-22,2024,02,22,,motion;order;summary_judgment,2,2739,1479,520,ok
case,CASE DOCS\02.22.24 - SUMM JUDGEMENT NOTICE OF HEARING-1.pdf,extracted_text\02.22.24 - SUMM JUDGEMENT NOTICE OF HEARING-1.txt,yes,2024-02-22,2024,02,22,,notice;hearing,4,7306,3115,1168,ok
case,CASE DOCS\02.22.24 - SUMMARY JUDGMENT BRIEF-1.pdf,extracted_text\02.22.24 - SUMMARY JUDGMENT BRIEF-1.txt,yes,2024-02-22,2024,02,22,,brief;summary_judgment,10,21425,20167,6282,ok
case,CASE DOCS\02.22.24 Order on Motion for Summary Judgment-1.pdf,extracted_text\02.22.24 Order on Motion for Summary Judgment-1.txt,yes,2024-02-22,2024,02,22,,motion;order;summary_judgment,2,3021,1701,583,ok
case,CASE DOCS\02.24.24 - MOTION FOR SUMMARY JUDGMENT - BRIEF-1.pdf,extracted_text\02.24.24 - MOTION FOR SUMMARY JUDGMENT - BRIEF-1.txt,yes,2024-02-24,2024,02,24,,motion;brief;summary_judgment,10,20058,19003,5928,ok
case,CASE DOCS\02.24.25 - OBJECTION AND REQUEST FOR JUDICIAL NOTICE-1.pdf,extracted_text\02.24.25 - OBJECTION AND REQUEST FOR JUDICIAL NOTICE-1.txt,yes,2025-02-24,2025,02,24,,notice;objection,19,20954,20210,6473,ok
case,CASE DOCS\02.25.2025_MOTION TO SIGN-1.pdf,extracted_text\02.25.2025_MOTION TO SIGN-1.txt,yes,2025-02-25,2025,02,25,,motion,21,26606,26183,8527,ok
case,CASE DOCS\02.25.2025_OBJECTION AND REQUEST FOR JUDICIAL NOTICE-1.pdf,extracted_text\02.25.2025_OBJECTION AND REQUEST FOR JUDICIAL NOTICE-1.txt,yes,2025-02-25,2025,02,25,,notice;objection,19,20666,19907,6556,ok
case,CASE DOCS\02.25.24 Notice of Termination of Legal Counsel-1.pdf,extracted_text\02.25.24 Notice of Termination of Legal Counsel-1.txt,yes,2024-02-25,2024,02,25,,notice,2,2323,2244,734,ok
case,CASE DOCS\02.25.25 - Notice Loss of Employmnet-1.pdf,extracted_text\02.25.25 - Notice Loss of Employmnet-1.txt,yes,2025-02-25,2025,02,25,,notice,6,2708,2727,954,ok
case,CASE DOCS\02.25.25 - Proposed Order on Motion to Sign-1.pdf,extracted_text\02.25.25 - Proposed Order on Motion to Sign-1.txt,yes,2025-02-25,2025,02,25,,motion;order,2,1783,732,306,ok
case,CASE DOCS\02.26.25 - UNOPPOSED MOTIONS-1.pdf,extracted_text\02.26.25 - UNOPPOSED MOTIONS-1.txt,yes,2025-02-26,2025,02,26,,motion,3,7104,7166,2523,ok
case,CASE DOCS\02.27.2024_NOTICE OF HEARING 31424  9AM-1.pdf,extracted_text\02.27.2024_NOTICE OF HEARING 31424  9AM-1.txt,yes,2024-02-27,2024,02,27,,notice;hearing,6,4127,3218,1296,ok
case,CASE DOCS\02.28.2025_REQUEST FOR RULING-1.pdf,extracted_text\02.28.2025_REQUEST FOR RULING-1.txt,yes,2025-02-28,2025,02,28,,,8,9726,9406,3240,ok
case,CASE DOCS\02.28.25 - REQUEST FOR RULING-1.pdf,extracted_text\02.28.25 - REQUEST FOR RULING-1.txt,yes,2025-02-28,2025,02,28,,,8,10298,10088,3379,ok
case,CASE DOCS\03.03.24 Notice and Unsworn Declaration-1.pdf,extracted_text\03.03.24 Notice and Unsworn Declaration-1.txt,yes,2024-03-03,2024,03,03,,notice;declaration,4,5974,5685,1829,ok
case,CASE DOCS\03.04.2024_NOTICE  UNSWORN DECLARATION-1.pdf,extracted_text\03.04.2024_NOTICE  UNSWORN DECLARATION-1.txt,yes,2024-03-04,2024,03,04,,notice;declaration,5,6211,5657,1912,ok
case,CASE DOCS\03.04.2024_REQUIRED INITIAL DISCLOSURES-1.pdf,extracted_text\03.04.2024_REQUIRED INITIAL DISCLOSURES-1.txt,yes,2024-03-04,2024,03,04,,,7,7341,6878,2273,ok
case,CASE DOCS\03.05.2025 NOTICE - WATAUGA POLICE DEPT.-1.pdf,extracted_text\03.05.2025 NOTICE - WATAUGA POLICE DEPT.-1.txt,yes,2025-03-05,2025,03,05,,notice,8,10471,10256,3286,ok
case,CASE DOCS\03.06.2025_PROPOSED ORDER ON UNOPPOSED MOTION TO DISMISS FOR LACK OF JURISDICTION-1.pdf,extracted_text\03.06.2025_PROPOSED ORDER ON UNOPPOSED MOTION TO DISMISS FOR LACK OF JURISDICTION-1.txt,yes,2025-03-06,2025,03,06,,motion;order,2,1554,611,258,ok
case,CASE DOCS\03.06.2025_UNOPPOSED MOTION TO DISMISS FOR LACK OF JURISDICTION-1.pdf,extracted_text\03.06.2025_UNOPPOSED MOTION TO DISMISS FOR LACK OF JURISDICTION-1.txt,yes,2025-03-06,2025,03,06,,motion,5,4482,4300,1444,ok
case,CASE DOCS\03.06.24 - LOCKOUT NOTICE-1.pdf,extracted_text\03.06.24 - LOCKOUT NOTICE-1.txt,yes,2024-03-06,2024,03,06,,notice,1,0,32,7,ok
case,CASE DOCS\03.06.25 - UNOPPOSED MOTION FOR LACK OF JURIS-1.pdf,extracted_text\03.06.25 - UNOPPOSED MOTION FOR LACK OF JURIS-1.txt,yes,2025-03-06,2025,03,06,,motion,4,4277,4152,1338,ok
case,CASE DOCS\03.08.2025_EXHIBIT - SETTLEMENT OFFER - DAN BRANTHOOVER-1.pdf,extracted_text\03.08.2025_EXHIBIT - SETTLEMENT OFFER - DAN BRANTHOOVER-1.txt,yes,2025-03-08,2025,03,08,,exhibit,4,9977,9898,3506,ok
case,CASE DOCS\03.09.2025_EXHIBIT - SETTLEMENT OFFER - MARGIE WILSON-1.pdf,extracted_text\03.09.2025_EXHIBIT - SETTLEMENT OFFER - MARGIE WILSON-1.txt,yes,2025-03-09,2025,03,09,,exhibit,4,9972,9902,3509,ok
case,CASE DOCS\03.09.24 - JOHN VARELA AFFIDAVIT-1.pdf,extracted_text\03.09.24 - JOHN VARELA AFFIDAVIT-1.txt,yes,2024-03-09,2024,03,09,,affidavit,2,336,1692,327,ok
case,CASE DOCS\03.10.24 - BRIANA GALBO-1.pdf,extracted_text\03.10.24 - BRIANA GALBO-1.txt,yes,2024-03-10,2024,03,10,,,3,496,3546,641,ok
case,CASE DOCS\03.10.24 - CHRISTIAN VROOM AFFIDAVIT-1.pdf,extracted_text\03.10.24 - CHRISTIAN VROOM AFFIDAVIT-1.txt,yes,2024-03-10,2024,03,10,,affidavit,2,334,2910,564,ok
case,CASE DOCS\03.11.2025_NOTICE OF CONTINUED OBSTRUCTION-1.pdf,extracted_text\03.11.2025_NOTICE OF CONTINUED OBSTRUCTION-1.txt,yes,2025-03-11,2025,03,11,,notice,14,14267,13866,4763,ok
case,CASE DOCS\03.11.24 - AARON WATSON-1.pdf,extracted_text\03.11.24 - AARON WATSON-1.txt,yes,2024-03-11,2024,03,11,,,2,313,3569,598,ok
case,CASE DOCS\03.11.24 - DANNY SLADE-1.pdf,extracted_text\03.11.24 - DANNY SLADE-1.txt,yes,2024-03-11,2024,03,11,,,2,334,2396,431,ok
case,CASE DOCS\03.11.25 - NOTICE OF CONTINUED OBSTRUCTION-1.pdf,extracted_text\03.11.25 - NOTICE OF CONTINUED OBSTRUCTION-1.txt,yes,2025-03-11,2025,03,11,,notice,12,12676,12568,4169,ok
case,CASE DOCS\03.12.25 - NOTICE OF CONTINUED OBSTRUCTION-1.pdf,extracted_text\03.12.25 - NOTICE OF CONTINUED OBSTRUCTION-1.txt,yes,2025-03-12,2025,03,12,,notice,13,13619,13496,4489,ok
case,CASE DOCS\03.12.25 - REQUEST TO SET UN-OPPOSED SUMMARY JUDGMENT AND UN-OPPOSED RULE 12 MOTIONS FOR SUBMISSION-1.pdf,extracted_text\03.12.25 - REQUEST TO SET UN-OPPOSED SUMMARY JUDGMENT AND UN-OPPOSED RULE 12 MOTIONS FOR SUBMISSION-1.txt,yes,2025-03-12,2025,03,12,,motion;summary_judgment,30,44017,37714,12255,ok
case,CASE DOCS\03.13.20 OAG PAY SCHEDULE-1.pdf,extracted_text\03.13.20 OAG PAY SCHEDULE-1.txt,yes,2020-03-13,2020,03,13,,,13,55850,15124,7381,ok
case,CASE DOCS\03.13.24 - LUZ OBLE-1.pdf,extracted_text\03.13.24 - LUZ OBLE-1.txt,yes,2024-03-13,2024,03,13,,,2,336,2741,474,ok
case,CASE DOCS\03.13.24 - NICHOLAS MORVAN-1.pdf,extracted_text\03.13.24 - NICHOLAS MORVAN-1.txt,yes,2024-03-13,2024,03,13,,,3,109,2762,490,ok
case,CASE DOCS\03.13.24 - QUICKSILVER STATEMENT-1.pdf,extracted_text\03.13.24 - QUICKSILVER STATEMENT-1.txt,yes,2024-03-13,2024,03,13,,,4,14445,14216,5001,ok
case,CASE DOCS\03.14.2024_ASSOCIATE JUDGE REPORT-1.pdf,extracted_text\03.14.2024_ASSOCIATE JUDGE REPORT-1.txt,yes,2024-03-14,2024,03,14,,report,3,1945,2008,724,ok
case,CASE DOCS\03.14.2025_NOTICE OF SUBMISSION-1.pdf,extracted_text\03.14.2025_NOTICE OF SUBMISSION-1.txt,yes,2025-03-14,2025,03,14,,notice,13,16974,14702,5423,ok
case,CASE DOCS\03.14.24 - AJ Rep-1.pdf,extracted_text\03.14.24 - AJ Rep-1.txt,yes,2024-03-14,2024,03,14,,,133,187284,176952,60009,ok
case,CASE DOCS\03.14.24 - AJR-1.pdf,extracted_text\03.14.24 - AJR-1.txt,yes,2024-03-14,2024,03,14,,,1,176,722,151,ok
case,CASE DOCS\03.14.24 - APPEARANCE Charles Dustin Myers-1.pdf,extracted_text\03.14.24 - APPEARANCE Charles Dustin Myers-1.txt,yes,2024-03-14,2024,03,14,,,1,132,126,56,ok
case,CASE DOCS\03.14.24 - ASSOCIATE JUDGE REPORT-1.pdf,extracted_text\03.14.24 - ASSOCIATE JUDGE REPORT-1.txt,yes,2024-03-14,2024,03,14,,report,1,14,813,155,ok
case,CASE DOCS\03.14.24 - Associate Judge's Report-1.pdf,extracted_text\03.14.24 - Associate Judge's Report-1.txt,yes,2024-03-14,2024,03,14,,report,1,36,828,157,ok
case,CASE DOCS\03.14.24 - TEMP ORDERS REDACTED-1.pdf,extracted_text\03.14.24 - TEMP ORDERS REDACTED-1.txt,yes,2024-03-14,2024,03,14,,order,40,80201,77950,26288,ok
case,CASE DOCS\03.14.24 - Temporary Orders-1.pdf,extracted_text\03.14.24 - Temporary Orders-1.txt,yes,2024-03-14,2024,03,14,,order,38,0,71829,12055,ok
case,CASE DOCS\03.14.25 - BAKER JUDGE REINSTATEMENTS-1.pdf,extracted_text\03.14.25 - BAKER JUDGE REINSTATEMENTS-1.txt,yes,2025-03-14,2025,03,14,,,5,13089,13202,4425,ok
case,CASE DOCS\03.14.25 - Notice of UNOPPOSED DWOP-1.pdf,extracted_text\03.14.25 - Notice of UNOPPOSED DWOP-1.txt,yes,2025-03-14,2025,03,14,,notice,8,6314,6740,2084,ok
case,CASE DOCS\03.14.25 - SUMMARY JUDGEMENT EMAIL BAKER-1.pdf,extracted_text\03.14.25 - SUMMARY JUDGEMENT EMAIL BAKER-1.txt,yes,2025-03-14,2025,03,14,,,5,13089,13202,4425,ok
case,CASE DOCS\03.17.25 - NOTICE OF SUBMISSION-1.pdf,extracted_text\03.17.25 - NOTICE OF SUBMISSION-1.txt,yes,2025-03-17,2025,03,17,,notice,12,7957,14246,3703,ok
case,CASE DOCS\03.18.2025_233-765358-25 - COVER LETTER - SAPCR-1.pdf,extracted_text\03.18.2025_233-765358-25 - COVER LETTER - SAPCR-1.txt,yes,2025-03-18,2025,03,18,,,19,34036,33372,11126,ok
case,CASE DOCS\03.18.2025_233-765358-25 - ORIGINAL SAPCR-1.pdf,extracted_text\03.18.2025_233-765358-25 - ORIGINAL SAPCR-1.txt,yes,2025-03-18,2025,03,18,,,12,29715,23889,6103,ok
case,CASE DOCS\03.18.25 - APPLICATION FOR EMERGENCY TRO-1.pdf,extracted_text\03.18.25 - APPLICATION FOR EMERGENCY TRO-1.txt,yes,2025-03-18,2025,03,18,,emergency,119,183376,177718,59310,ok
case,CASE DOCS\03.18.25 - IFP Statement-1.pdf,extracted_text\03.18.25 - IFP Statement-1.txt,yes,2025-03-18,2025,03,18,,,12,13656,15997,4191,ok
case,CASE DOCS\03.18.25 - ORIGINAL SAPCR-1.pdf,extracted_text\03.18.25 - ORIGINAL SAPCR-1.txt,yes,2025-03-18,2025,03,18,,,10,28641,22740,7933,ok
case,CASE DOCS\03.18.25 - SAPCR  COVER-1.pdf,extracted_text\03.18.25 - SAPCR  COVER-1.txt,yes,2025-03-18,2025,03,18,,,49,83632,84635,27779,ok
case,CASE DOCS\03.18.25 - SAPCR COVER LETTER-1-1.pdf,extracted_text\03.18.25 - SAPCR COVER LETTER-1-1.txt,yes,2025-03-18,2025,03,18,,,17,32277,31990,10446,ok
case,CASE DOCS\03.18.25 - SAPCR COVER LETTER-1.pdf,extracted_text\03.18.25 - SAPCR COVER LETTER-1.txt,yes,2025-03-18,2025,03,18,,,17,32277,31990,10446,ok
case,CASE DOCS\03.18.25 - SAPCR PETITION-1.pdf,extracted_text\03.18.25 - SAPCR PETITION-1.txt,yes,2025-03-18,2025,03,18,,petition,11,29521,23592,8224,ok
case,CASE DOCS\03.20.2025_233-765358-25 - MOTION TO CONSOLIDATE-1.pdf,extracted_text\03.20.2025_233-765358-25 - MOTION TO CONSOLIDATE-1.txt,yes,2025-03-20,2025,03,20,,motion,4,3042,2791,979,ok
case,CASE DOCS\03.20.2025_233-765358-25 - RESPONDENTS ORIGINAL ANSWER-1.pdf,extracted_text\03.20.2025_233-765358-25 - RESPONDENTS ORIGINAL ANSWER-1.txt,yes,2025-03-20,2025,03,20,,,5,4396,4132,1410,ok
case,CASE DOCS\03.20.2025_233-765358-25 EMERGENCY EX-PARTE MOTION TODECLARE JUDGMENT VOID AB INITIO AND FOR IMMEDIATE RE-ENTRY-1.pdf,extracted_text\03.20.2025_233-765358-25 EMERGENCY EX-PARTE MOTION TODECLARE JUDGMENT VOID AB INITIO AND FOR IMMEDIATE RE-ENTRY-1.txt,yes,2025-03-20,2025,03,20,,motion;emergency,9,12936,12366,4314,ok
case,CASE DOCS\03.20.2025_233-765358-25 MOTION TO STRIKE RESPONDENTS ANSWER AND MOTION TO CONSOLIDATE-1.pdf,extracted_text\03.20.2025_233-765358-25 MOTION TO STRIKE RESPONDENTS ANSWER AND MOTION TO CONSOLIDATE-1.txt,yes,2025-03-20,2025,03,20,,motion,10,9131,8951,2970,ok
case,CASE DOCS\03.20.25 - MOTION TO CONSOL-1.pdf,extracted_text\03.20.25 - MOTION TO CONSOL-1.txt,yes,2025-03-20,2025,03,20,,motion,3,2875,2683,883,ok
case,CASE DOCS\03.20.25 - Motion to Strike Carter's Answer and Consolidation-1.pdf,extracted_text\03.20.25 - Motion to Strike Carter's Answer and Consolidation-1.txt,yes,2025-03-20,2025,03,20,,motion,331,415928,393732,129527,ok
case,CASE DOCS\03.20.25 - MOTION TO STRIKE-1.pdf,extracted_text\03.20.25 - MOTION TO STRIKE-1.txt,yes,2025-03-20,2025,03,20,,motion,9,8673,8601,2744,ok
case,CASE DOCS\03.20.25 - orginal answer-1.pdf,extracted_text\03.20.25 - orginal answer-1.txt,yes,2025-03-20,2025,03,20,,,4,4173,3984,1295,ok
case,CASE DOCS\03.20.25 - PROP. ORDER ON CONSOL-1.pdf,extracted_text\03.20.25 - PROP. ORDER ON CONSOL-1.txt,yes,2025-03-20,2025,03,20,,order,2,1872,1696,560,ok
case,CASE DOCS\03.20.25 - REQUEST TO AMEND CASE CAPTION-1.pdf,extracted_text\03.20.25 - REQUEST TO AMEND CASE CAPTION-1.txt,yes,2025-03-20,2025,03,20,,,3,2718,2605,869,ok
case,CASE DOCS\03.20.25 - RESPONDENT'S ORIGINAL ANSWER redacted-1.pdf,extracted_text\03.20.25 - RESPONDENT'S ORIGINAL ANSWER redacted-1.txt,yes,2025-03-20,2025,03,20,,,3,2966,2855,922,ok
case,CASE DOCS\03.20.25 - RESPONDENT'S ORIGINAL ANSWER-1.pdf,extracted_text\03.20.25 - RESPONDENT'S ORIGINAL ANSWER-1.txt,yes,2025-03-20,2025,03,20,,,3,2966,2872,921,ok
case,CASE DOCS\03.20.25 EMERGENCY EX-PARTE MOTION TO-1.pdf,extracted_text\03.20.25 EMERGENCY EX-PARTE MOTION TO-1.txt,yes,2025-03-20,2025,03,20,,motion;emergency,47,91707,89499,29933,ok
case,CASE DOCS\03.21.25 - 233rd Rule 12 Motion-1.pdf,extracted_text\03.21.25 - 233rd Rule 12 Motion-1.txt,yes,2025-03-21,2025,03,21,,motion,10,14964,14863,4822,ok
case,CASE DOCS\03.21.25 - Gmail - Notice of Temporary EX-Parte TRO-1.pdf,extracted_text\03.21.25 - Gmail - Notice of Temporary EX-Parte TRO-1.txt,yes,2025-03-21,2025,03,21,,notice,1,3854,3911,1274,ok
case,CASE DOCS\03.21.25 - information to OPPOSING PARTY-1.pdf,extracted_text\03.21.25 - information to OPPOSING PARTY-1.txt,yes,2025-03-21,2025,03,21,,,4,19845,19917,6561,ok
case,CASE DOCS\03.21.25 - PETITIONER'S RULE 12 MOTION TO SHOW AUTHORITY-1.pdf,extracted_text\03.21.25 - PETITIONER'S RULE 12 MOTION TO SHOW AUTHORITY-1.txt,yes,2025-03-21,2025,03,21,,motion;petition,10,14676,14389,4701,ok
case,CASE DOCS\03.21.25 - PROP RULE 12 ORD-1.pdf,extracted_text\03.21.25 - PROP RULE 12 ORD-1.txt,yes,2025-03-21,2025,03,21,,,2,2509,1483,541,ok
case,CASE DOCS\03.21.25 - Rule 12 Motion (233)-1.pdf,extracted_text\03.21.25 - Rule 12 Motion (233)-1.txt,yes,2025-03-21,2025,03,21,,motion,14,20908,17269,5887,ok
case,CASE DOCS\03.21.25 -RULE 12-1.pdf,extracted_text\03.21.25 -RULE 12-1.txt,yes,2025-03-21,2025,03,21,,,23,30117,26663,8818,ok
case,CASE DOCS\03.24.2025_233-765358-25 EMERGENCY TRO AND ORDER SETTING HEARING-1.pdf,extracted_text\03.24.2025_233-765358-25 EMERGENCY TRO AND ORDER SETTING HEARING-1.txt,yes,2025-03-24,2025,03,24,,order;hearing;emergency,65,98954,95844,32139,ok
case,CASE DOCS\03.24.25 - 233 REQUEST TO SET EMERGENCY HEARING ON SUBMISSION-1.pdf,extracted_text\03.24.25 - 233 REQUEST TO SET EMERGENCY HEARING ON SUBMISSION-1.txt,yes,2025-03-24,2025,03,24,,hearing;emergency,2,1942,1876,620,ok
case,CASE DOCS\03.24.25 - Cooper Carter Trying to Set Consolidation Motion-1.pdf,extracted_text\03.24.25 - Cooper Carter Trying to Set Consolidation Motion-1.txt,yes,2025-03-24,2025,03,24,,motion,3,4650,4703,1538,ok
case,CASE DOCS\03.24.25 - EMERGENCY EX-PARTE TRO-1.pdf,extracted_text\03.24.25 - EMERGENCY EX-PARTE TRO-1.txt,yes,2025-03-24,2025,03,24,,emergency,25,33698,33247,10677,ok
case,CASE DOCS\03.24.25 - Gmail - What's the point_-1.pdf,extracted_text\03.24.25 - Gmail - What's the point_-1.txt,yes,2025-03-24,2025,03,24,,,1,2361,2394,855,ok
case,CASE DOCS\03.24.25 - NO HEARING REQUIRED COORDINATOR-1.pdf,extracted_text\03.24.25 - NO HEARING REQUIRED COORDINATOR-1.txt,yes,2025-03-24,2025,03,24,,hearing,2,1731,1748,581,ok
case,CASE DOCS\03.24.25 - OBJ TO MANDATORY HEARING-1.pdf,extracted_text\03.24.25 - OBJ TO MANDATORY HEARING-1.txt,yes,2025-03-24,2025,03,24,,hearing,1,1531,1553,500,ok
case,CASE DOCS\03.24.25 - Petitioner's Objection to Consolidation (233)-1.pdf,extracted_text\03.24.25 - Petitioner's Objection to Consolidation (233)-1.txt,yes,2025-03-24,2025,03,24,,petition;objection,9,11742,11376,3955,ok
case,CASE DOCS\03.24.25 - PETS OBJ TO CONSOL-1.pdf,extracted_text\03.24.25 - PETS OBJ TO CONSOL-1.txt,yes,2025-03-24,2025,03,24,,,8,11299,11143,3775,ok
case,CASE DOCS\03.24.25 - PROPOSED ORDER TRO-1.pdf,extracted_text\03.24.25 - PROPOSED ORDER TRO-1.txt,yes,2025-03-24,2025,03,24,,order,5,10492,8257,2832,ok
case,CASE DOCS\03.25.25 - REFUSAL EXHIBITS - TRO INITIAL-1.pdf,extracted_text\03.25.25 - REFUSAL EXHIBITS - TRO INITIAL-1.txt,yes,2025-03-25,2025,03,25,,exhibit,2,2317,2427,804,ok
case,CASE DOCS\03.26.2024_ATTACH AARON WATSON AFFIDAVIT-1.pdf,extracted_text\03.26.2024_ATTACH AARON WATSON AFFIDAVIT-1.txt,yes,2024-03-26,2024,03,26,,affidavit,3,3984,3594,1214,ok
case,CASE DOCS\03.26.2024_ATTACH ASSOCIATE JUDGE REPORT-1.pdf,extracted_text\03.26.2024_ATTACH ASSOCIATE JUDGE REPORT-1.txt,yes,2024-03-26,2024,03,26,,report,3,2011,2105,755,ok
case,CASE DOCS\03.26.2024_ATTACH BRIANNA GALBO AFFIDAVIT-1.pdf,extracted_text\03.26.2024_ATTACH BRIANNA GALBO AFFIDAVIT-1.txt,yes,2024-03-26,2024,03,26,,affidavit,4,3904,3658,1248,ok
case,CASE DOCS\03.26.2024_ATTACH CHRISTIAN VROOM AFFIDAVIT-1.pdf,extracted_text\03.26.2024_ATTACH CHRISTIAN VROOM AFFIDAVIT-1.txt,yes,2024-03-26,2024,03,26,,affidavit,3,3559,2970,1154,ok
case,CASE DOCS\03.26.2024_ATTACH DANNY SLADE BURT AFFIDAVIT-1.pdf,extracted_text\03.26.2024_ATTACH DANNY SLADE BURT AFFIDAVIT-1.txt,yes,2024-03-26,2024,03,26,,affidavit,3,2807,2451,892,ok
case,CASE DOCS\03.26.2024_ATTACH JOHN VALERA AFFIDAVIT-1.pdf,extracted_text\03.26.2024_ATTACH JOHN VALERA AFFIDAVIT-1.txt,yes,2024-03-26,2024,03,26,,affidavit,3,2244,1508,704,ok
case,CASE DOCS\03.26.2024_REQUEST FOR CLERK TO PREPARE RECORD-1.pdf,extracted_text\03.26.2024_REQUEST FOR CLERK TO PREPARE RECORD-1.txt,yes,2024-03-26,2024,03,26,,record,9,7621,6824,2329,ok
case,CASE DOCS\03.26.2024_REQUEST FOR FINDINGS OF FACT  CONCLUSIONSOF LAW-1.pdf,extracted_text\03.26.2024_REQUEST FOR FINDINGS OF FACT  CONCLUSIONSOF LAW-1.txt,yes,2024-03-26,2024,03,26,,,5,3734,3428,1200,ok
case,CASE DOCS\03.26.2024_TEMPORARY ORDERS-1.pdf,extracted_text\03.26.2024_TEMPORARY ORDERS-1.txt,yes,2024-03-26,2024,03,26,,order,40,81678,78074,26783,ok
case,CASE DOCS\03.26.24 - 2nd Amended Preparatory Notice-1.pdf,extracted_text\03.26.24 - 2nd Amended Preparatory Notice-1.txt,yes,2024-03-26,2024,03,26,,notice,50,67166,64661,20934,ok
case,CASE DOCS\03.26.24 - AJREP-1.pdf,extracted_text\03.26.24 - AJREP-1.txt,yes,2024-03-26,2024,03,26,,,2,1925,1752,641,ok
case,CASE DOCS\03.26.24 - DENIAL OF RECONSIDERATION-1.pdf,extracted_text\03.26.24 - DENIAL OF RECONSIDERATION-1.txt,yes,2024-03-26,2024,03,26,,,2,1925,1752,641,ok
case,CASE DOCS\03.26.24 - Luz Oble Affidavit-1.pdf,extracted_text\03.26.24 - Luz Oble Affidavit-1.txt,yes,2024-03-26,2024,03,26,,affidavit,3,3153,2752,946,ok
case,CASE DOCS\03.26.24 - Morvan Affidavit-1.pdf,extracted_text\03.26.24 - Morvan Affidavit-1.txt,yes,2024-03-26,2024,03,26,,affidavit,4,3478,2919,1126,ok
case,CASE DOCS\03.26.24 - REQUEST FOR FINDINGS OF FACT AND CONCLUSIONS OF LAW-1.pdf,extracted_text\03.26.24 - REQUEST FOR FINDINGS OF FACT AND CONCLUSIONS OF LAW-1.txt,yes,2024-03-26,2024,03,26,,,4,3568,3330,1080,ok
case,CASE DOCS\03.26.24 - Second Amended Prepatory Notice for Judicial Review-1.pdf,extracted_text\03.26.24 - Second Amended Prepatory Notice for Judicial Review-1.txt,yes,2024-03-26,2024,03,26,,notice,49,65975,63834,20045,ok
case,CASE DOCS\03.26.24 - SECOND PREPARATORY NOTICE FOR JUDICIAL REVIEW-1.pdf,extracted_text\03.26.24 - SECOND PREPARATORY NOTICE FOR JUDICIAL REVIEW-1.txt,yes,2024-03-26,2024,03,26,,notice,49,59066,59268,18446,ok
case,CASE DOCS\03.26.24 - TEMPORARY ORDERS (ILLEGAL)-1.pdf,extracted_text\03.26.24 - TEMPORARY ORDERS (ILLEGAL)-1.txt,yes,2024-03-26,2024,03,26,,order,39,80399,78448,26198,ok
case,CASE DOCS\03.26.24 - TEMPORARY ORDERS-1.pdf,extracted_text\03.26.24 - TEMPORARY ORDERS-1.txt,yes,2024-03-26,2024,03,26,,order,39,80399,78448,26198,ok
case,CASE DOCS\03.26.25 - 233-765358-25 EX-PARTE TRO COMMUNICATION-1.pdf,extracted_text\03.26.25 - 233-765358-25 EX-PARTE TRO COMMUNICATION-1.txt,yes,2025-03-26,2025,03,26,233-765358-25,,5,5477,5581,1882,ok
case,CASE DOCS\03.26.25 - EMAIL REGARDING EMERGENCY TRO PRESENTATION-1.pdf,extracted_text\03.26.25 - EMAIL REGARDING EMERGENCY TRO PRESENTATION-1.txt,yes,2025-03-26,2025,03,26,,emergency,5,5472,5576,1882,ok
case,CASE DOCS\03.26.25 - NOTIFYING OTHER PARTY OF TRO-1.pdf,extracted_text\03.26.25 - NOTIFYING OTHER PARTY OF TRO-1.txt,yes,2025-03-26,2025,03,26,,,2,3388,3428,1166,ok
case,CASE DOCS\03.26.25 - TRO INFORMATION PROVIDED-1.pdf,extracted_text\03.26.25 - TRO INFORMATION PROVIDED-1.txt,yes,2025-03-26,2025,03,26,,,2,3388,3428,1166,ok
case,CASE DOCS\03.27.25 - 233rd COOPER INFLUENCE-1.pdf,extracted_text\03.27.25 - 233rd COOPER INFLUENCE-1.txt,yes,2025-03-27,2025,03,27,,,7,13831,13963,4605,ok
case,CASE DOCS\03.27.25 - Cooper Carter Forward Looking Statement-1.pdf,extracted_text\03.27.25 - Cooper Carter Forward Looking Statement-1.txt,yes,2025-03-27,2025,03,27,,,7,13824,13956,4605,ok
case,CASE DOCS\03.27.25 - EMAIL - SERVICE OF TRO TO OPPOSITION-1.pdf,extracted_text\03.27.25 - EMAIL - SERVICE OF TRO TO OPPOSITION-1.txt,yes,2025-03-27,2025,03,27,,,1,705,743,230,ok
case,CASE DOCS\03.27.25 - EMAIL INFORMING COOPER OF TIME TO PRESENT-1.pdf,extracted_text\03.27.25 - EMAIL INFORMING COOPER OF TIME TO PRESENT-1.txt,yes,2025-03-27,2025,03,27,,,1,869,894,301,ok
case,CASE DOCS\03.27.25 - Serving OC the TRO materials-1.pdf,extracted_text\03.27.25 - Serving OC the TRO materials-1.txt,yes,2025-03-27,2025,03,27,,,1,705,743,230,ok
case,CASE DOCS\03.28.25 - 233RD HEARING DATES-1.pdf,extracted_text\03.28.25 - 233RD HEARING DATES-1.txt,yes,2025-03-28,2025,03,28,,hearing,4,4727,4790,1623,ok
case,CASE DOCS\03.28.25 - Notice of Legal Clarification-1.pdf,extracted_text\03.28.25 - Notice of Legal Clarification-1.txt,yes,2025-03-28,2025,03,28,,notice,12,20116,19839,6668,ok
case,CASE DOCS\03.31.25 - PET'S STATEMENT-1.pdf,extracted_text\03.31.25 - PET'S STATEMENT-1.txt,yes,2025-03-31,2025,03,31,,,7,10692,10470,3537,ok
case,CASE DOCS\03.31.25 - PETITIONER'S REQUEST FOR DECLARATORY JUDGMENT (2)-1.pdf,extracted_text\03.31.25 - PETITIONER'S REQUEST FOR DECLARATORY JUDGMENT (2)-1.txt,yes,2025-03-31,2025,03,31,,petition,6,7264,7085,2377,ok
case,CASE DOCS\03.31.25 - PETITIONER'S STATEMENT-1.pdf,extracted_text\03.31.25 - PETITIONER'S STATEMENT-1.txt,yes,2025-03-31,2025,03,31,,petition,34,34615,34441,11486,ok
case,CASE DOCS\03.31.25 - Petitioners Statement-1.pdf,extracted_text\03.31.25 - Petitioners Statement-1.txt,yes,2025-03-31,2025,03,31,,petition,8,11613,11374,3843,ok
case,CASE DOCS\03.31.25 - REQUEST FOR DECLARATORY JUDGEMENT-1.pdf,extracted_text\03.31.25 - REQUEST FOR DECLARATORY JUDGEMENT-1.txt,yes,2025-03-31,2025,03,31,,,6,7264,7085,2377,ok
case,CASE DOCS\03.31.25 - Respondent's Statement-1.pdf,extracted_text\03.31.25 - Respondent's Statement-1.txt,yes,2025-03-31,2025,03,31,,,6,5333,8503,2062,ok
case,CASE DOCS\03.31.35 - PRE-OBJ. TO CONSOL-1.pdf,extracted_text\03.31.35 - PRE-OBJ. TO CONSOL-1.txt,yes,2035-03-31,2035,03,31,,,25,38847,38110,12323,ok
case,CASE DOCS\04.01.2025_233-765358-25 PETITIONERS STATEMENT-1.pdf,extracted_text\04.01.2025_233-765358-25 PETITIONERS STATEMENT-1.txt,yes,2025-04-01,2025,04,01,,petition,9,11987,11679,4039,ok
case,CASE DOCS\04.01.2025_RESPONDENTS PRE-OBJECTION TO CONSOLIDATION-1.pdf,extracted_text\04.01.2025_RESPONDENTS PRE-OBJECTION TO CONSOLIDATION-1.txt,yes,2025-04-01,2025,04,01,,objection,27,41011,39929,13216,ok
case,CASE DOCS\04.01.2025_RESPONDENTS STATEMENT-1.pdf,extracted_text\04.01.2025_RESPONDENTS STATEMENT-1.txt,yes,2025-04-01,2025,04,01,,,4,5904,5610,1808,ok
case,CASE DOCS\04.01.25 - OBJ. TO CONSOL-1.pdf,extracted_text\04.01.25 - OBJ. TO CONSOL-1.txt,yes,2025-04-01,2025,04,01,,,26,39789,39036,12644,ok
case,CASE DOCS\04.01.25 - Petitioner's Statement (233)-1.pdf,extracted_text\04.01.25 - Petitioner's Statement (233)-1.txt,yes,2025-04-01,2025,04,01,,petition,75,88072,83870,29001,ok
case,CASE DOCS\04.01.25 - RESPONDENT'S STATEMENT-1.pdf,extracted_text\04.01.25 - RESPONDENT'S STATEMENT-1.txt,yes,2025-04-01,2025,04,01,,,7,6270,9425,2380,ok
case,CASE DOCS\04.01.25 - RETURNED BECAUSE OF EXHIBITS-1.pdf,extracted_text\04.01.25 - RETURNED BECAUSE OF EXHIBITS-1.txt,yes,2025-04-01,2025,04,01,,exhibit,1,2210,2063,718,ok
case,CASE DOCS\04.02.2025 - petitioner's notice-1.pdf,extracted_text\04.02.2025 - petitioner's notice-1.txt,yes,2025-04-02,2025,04,02,,notice;petition,8,10604,9899,3058,ok
case,CASE DOCS\04.02.2025_233-765358-25 - PETITIONERS NOTICE-1.pdf,extracted_text\04.02.2025_233-765358-25 - PETITIONERS NOTICE-1.txt,yes,2025-04-02,2025,04,02,,notice;petition,10,11980,9683,3336,ok
case,CASE DOCS\04.02.25 - Petitioner's Notice (233)-1.pdf,extracted_text\04.02.25 - Petitioner's Notice (233)-1.txt,yes,2025-04-02,2025,04,02,,notice;petition,371,490946,463222,152777,ok
case,CASE DOCS\04.02.25 - PETITIONER'S notice-1.pdf,extracted_text\04.02.25 - PETITIONER'S notice-1.txt,yes,2025-04-02,2025,04,02,,notice;petition,9,11517,10807,3374,ok
case,CASE DOCS\04.03.2024_NOTICE OF FILING ORIGINAL PROCEEDINGMOTIONFOR TEMP RELIEF-1.pdf,extracted_text\04.03.2024_NOTICE OF FILING ORIGINAL PROCEEDINGMOTIONFOR TEMP RELIEF-1.txt,yes,2024-04-03,2024,04,03,,motion;notice,4,2591,2479,861,ok
case,CASE DOCS\04.03.2025_MOTION TO CONSOLIDATE 322-1.pdf,extracted_text\04.03.2025_MOTION TO CONSOLIDATE 322-1.txt,yes,2025-04-03,2025,04,03,,motion,26,32491,31722,10805,ok
case,CASE DOCS\04.03.24 - EMERGENCY RELIEF - STAY_Redacted_3966607E-1.pdf,extracted_text\04.03.24 - EMERGENCY RELIEF - STAY_Redacted_3966607E-1.txt,yes,2024-04-03,2024,04,03,,emergency,260,287479,376138,109169,ok
case,CASE DOCS\04.03.24 - MOTION FOR EMERGENCY STAY-1.pdf,extracted_text\04.03.24 - MOTION FOR EMERGENCY STAY-1.txt,yes,2024-04-03,2024,04,03,,motion;emergency,260,281602,373668,107639,ok
case,CASE DOCS\04.03.24 - Notice of filing Original Proceeding-1.pdf,extracted_text\04.03.24 - Notice of filing Original Proceeding-1.txt,yes,2024-04-03,2024,04,03,,notice,52,56040,53658,17557,ok
case,CASE DOCS\04.03.25 - COOPER TRYING TO UNILATERALLY GET A RULING-1.pdf,extracted_text\04.03.25 - COOPER TRYING TO UNILATERALLY GET A RULING-1.txt,yes,2025-04-03,2025,04,03,,,2,3226,3274,1113,ok
case,CASE DOCS\04.03.25 - OBJECTION TO CONSOLIDATION FILED BY UNNAMED PARTY-1.pdf,extracted_text\04.03.25 - OBJECTION TO CONSOLIDATION FILED BY UNNAMED PARTY-1.txt,yes,2025-04-03,2025,04,03,,objection,3,2498,2339,786,ok
case,CASE DOCS\04.03.25 - RESPONDETN'S COMPREHENSIVE LEGAL ANALYSIS IN FAVOR OF DISMISSAL-1.pdf,extracted_text\04.03.25 - RESPONDETN'S COMPREHENSIVE LEGAL ANALYSIS IN FAVOR OF DISMISSAL-1.txt,yes,2025-04-03,2025,04,03,,,18,20990,20761,6781,ok
case,CASE DOCS\04.04.2025_233-765358-25 PETITIONERS PRE-OBJECTION TO TRANSFER-1.pdf,extracted_text\04.04.2025_233-765358-25 PETITIONERS PRE-OBJECTION TO TRANSFER-1.txt,yes,2025-04-04,2025,04,04,,petition;objection;transfer,4,3858,3615,1263,ok
case,CASE DOCS\04.04.2025_COMPREHENSIVE LEGAL ANALYSIS IN SUPPORT OF DISMISSAL-1.pdf,extracted_text\04.04.2025_COMPREHENSIVE LEGAL ANALYSIS IN SUPPORT OF DISMISSAL-1.txt,yes,2025-04-04,2025,04,04,,,20,22777,22306,7492,ok
case,CASE DOCS\04.04.2025_RESPONDENTS NOTICE OF NEW INFORMATION-1.pdf,extracted_text\04.04.2025_RESPONDENTS NOTICE OF NEW INFORMATION-1.txt,yes,2025-04-04,2025,04,04,,notice,6,5286,5030,1725,ok
case,CASE DOCS\04.04.24 - 00149 MANDAMUS-1.pdf,extracted_text\04.04.24 - 00149 MANDAMUS-1.txt,yes,2024-04-04,2024,04,04,,mandamus,78,79836,76787,25595,ok
case,CASE DOCS\04.04.24 NOTICE OF FILING ORIGINAL PROCEEDING-1.pdf,extracted_text\04.04.24 NOTICE OF FILING ORIGINAL PROCEEDING-1.txt,yes,2024-04-04,2024,04,04,,notice,332,391994,480299,143290,ok
case,CASE DOCS\04.04.24 NOTICE OF FILING ORIGINAL PROCEEDING_compressed-1.pdf,extracted_text\04.04.24 NOTICE OF FILING ORIGINAL PROCEEDING_compressed-1.txt,yes,2024-04-04,2024,04,04,,notice,332,391994,480774,143379,ok
case,CASE DOCS\04.04.25 - EMERGENCY NOTICE-1.pdf,extracted_text\04.04.25 - EMERGENCY NOTICE-1.txt,yes,2025-04-04,2025,04,04,,notice;emergency,5,5015,4792,1629,ok
case,CASE DOCS\04.04.25 - frustrated with cooper-1.pdf,extracted_text\04.04.25 - frustrated with cooper-1.txt,yes,2025-04-04,2025,04,04,,,2,3914,3964,1407,ok
case,CASE DOCS\04.04.25 - GHOSTED BY CLERK-1.pdf,extracted_text\04.04.25 - GHOSTED BY CLERK-1.txt,yes,2025-04-04,2025,04,04,,,1,975,1002,328,ok
case,CASE DOCS\04.04.25 - IGNORED REGARDING COOPER-1.pdf,extracted_text\04.04.25 - IGNORED REGARDING COOPER-1.txt,yes,2025-04-04,2025,04,04,,,1,1293,1322,427,ok
case,CASE DOCS\04.04.25 - Legal Analysis (Dismissal)-1.pdf,extracted_text\04.04.25 - Legal Analysis (Dismissal)-1.txt,yes,2025-04-04,2025,04,04,,,90,123314,112269,35788,ok
case,CASE DOCS\04.04.25 - lindsey cooper SETTING IMPROPER HEARING-1.pdf,extracted_text\04.04.25 - lindsey cooper SETTING IMPROPER HEARING-1.txt,yes,2025-04-04,2025,04,04,,hearing,5,8186,8252,2810,ok
case,CASE DOCS\04.04.25 - LINDSEY GETS ANGRY-1.pdf,extracted_text\04.04.25 - LINDSEY GETS ANGRY-1.txt,yes,2025-04-04,2025,04,04,,,5,7748,7832,2726,ok
case,CASE DOCS\04.04.25 - Motion to Consol Set-1.pdf,extracted_text\04.04.25 - Motion to Consol Set-1.txt,yes,2025-04-04,2025,04,04,,motion,5,8191,8257,2810,ok
case,CASE DOCS\04.04.25 - NOTICE OF NEW INFO-1.pdf,extracted_text\04.04.25 - NOTICE OF NEW INFO-1.txt,yes,2025-04-04,2025,04,04,,notice,5,4970,4807,1588,ok
case,CASE DOCS\04.04.25 - PRE-OBJECTION TO TRANSFER-1.pdf,extracted_text\04.04.25 - PRE-OBJECTION TO TRANSFER-1.txt,yes,2025-04-04,2025,04,04,,objection;transfer,2,2695,2545,848,ok
case,CASE DOCS\04.04.25 - PRE-OBJECTION TO TRANSFER-e62ddee6-1.pdf,extracted_text\04.04.25 - PRE-OBJECTION TO TRANSFER-e62ddee6-1.txt,yes,2025-04-04,2025,04,04,,objection;transfer,3,3626,3470,1170,ok
case,CASE DOCS\04.04.25 - SCJC DENIAL 25-0586-1.pdf,extracted_text\04.04.25 - SCJC DENIAL 25-0586-1.txt,yes,2025-04-04,2025,04,04,25-0586,,2,4211,3926,1220,ok
case,CASE DOCS\04.06.25 - LET'S USE OUR BRAINS-1.pdf,extracted_text\04.06.25 - LET'S USE OUR BRAINS-1.txt,yes,2025-04-06,2025,04,06,,,2,5256,5296,1892,ok
case,CASE DOCS\04.07.2025_233-765358-25 PETITIONERS NOTICE OF INTENT TO FILE MANDAMUS-1.pdf,extracted_text\04.07.2025_233-765358-25 PETITIONERS NOTICE OF INTENT TO FILE MANDAMUS-1.txt,yes,2025-04-07,2025,04,07,,mandamus;notice;petition,19,25440,24752,8482,ok
case,CASE DOCS\04.07.2025_RESPONDENTS NOTICE OF INTENT TO FILE PROHIBITION-1.pdf,extracted_text\04.07.2025_RESPONDENTS NOTICE OF INTENT TO FILE PROHIBITION-1.txt,yes,2025-04-07,2025,04,07,,notice,14,20486,20055,6881,ok
case,CASE DOCS\04.07.25 - MOTION TO VACATE-1.pdf,extracted_text\04.07.25 - MOTION TO VACATE-1.txt,yes,2025-04-07,2025,04,07,,motion,28,52547,50563,16530,ok
case,CASE DOCS\04.07.25 - NOTICE - INTENT TO FILE MANDAMUS-1.pdf,extracted_text\04.07.25 - NOTICE - INTENT TO FILE MANDAMUS-1.txt,yes,2025-04-07,2025,04,07,,mandamus;notice,17,23658,23189,7754,ok
case,CASE DOCS\04.07.25 - NOTICE OF INTENT TO FILE WRIT OF PROHIBITION-1.pdf,extracted_text\04.07.25 - NOTICE OF INTENT TO FILE WRIT OF PROHIBITION-1.txt,yes,2025-04-07,2025,04,07,,notice,13,19866,19551,6576,ok
case,CASE DOCS\04.07.25 - Respondent's Notice of Intent to File Prohibition-1.pdf,extracted_text\04.07.25 - Respondent's Notice of Intent to File Prohibition-1.txt,yes,2025-04-07,2025,04,07,,notice,96,130984,121429,38877,ok
case,CASE DOCS\04.08.24 - 02-24-00149-CV EMERGENCY MOTION TO STAY-1.pdf,extracted_text\04.08.24 - 02-24-00149-CV EMERGENCY MOTION TO STAY-1.txt,yes,2024-04-08,2024,04,08,02-24-00149-CV,motion;emergency,260,287479,376138,109169,ok
case,CASE DOCS\04.08.24 - 02-24-00149-CV EMERGENCY MOTION TO STAY_compressed-1.pdf,extracted_text\04.08.24 - 02-24-00149-CV EMERGENCY MOTION TO STAY_compressed-1.txt,yes,2024-04-08,2024,04,08,02-24-00149-CV,motion;emergency,260,287479,376290,109203,ok
case,CASE DOCS\04.08.24 - 02-24-00149-CV MANDAMUS-1.pdf,extracted_text\04.08.24 - 02-24-00149-CV MANDAMUS-1.txt,yes,2024-04-08,2024,04,08,02-24-00149-CV,mandamus,319,376192,463819,138555,ok
case,CASE DOCS\04.08.24 - 02-24-00149-CV MOTION FOR EMERGENCY STAY-1.pdf,extracted_text\04.08.24 - 02-24-00149-CV MOTION FOR EMERGENCY STAY-1.txt,yes,2024-04-08,2024,04,08,02-24-00149-CV,motion;emergency,260,287479,376138,109169,ok
case,CASE DOCS\04.08.24 - 2ND COA MANDAMUS-1.pdf,extracted_text\04.08.24 - 2ND COA MANDAMUS-1.txt,yes,2024-04-08,2024,04,08,,mandamus,319,376192,463819,138555,ok
case,CASE DOCS\04.08.24 - Emergency Stay-1.pdf,extracted_text\04.08.24 - Emergency Stay-1.txt,yes,2024-04-08,2024,04,08,,emergency,13,26540,20738,6989,ok
case,CASE DOCS\04.08.24 - Mandamus Filed-1.pdf,extracted_text\04.08.24 - Mandamus Filed-1.txt,yes,2024-04-08,2024,04,08,,mandamus,2,1403,1341,492,ok
case,CASE DOCS\04.08.24 - MANDAMUS RECEIPT-1.pdf,extracted_text\04.08.24 - MANDAMUS RECEIPT-1.txt,yes,2024-04-08,2024,04,08,,mandamus,1,1235,1189,413,ok
case,CASE DOCS\04.08.24 - Mandamus-1.pdf,extracted_text\04.08.24 - Mandamus-1.txt,yes,2024-04-08,2024,04,08,,mandamus,52,47406,46571,14876,ok
case,CASE DOCS\04.08.25 - ANGIE COORDINATOR DISTRICT JUDGE-1.pdf,extracted_text\04.08.25 - ANGIE COORDINATOR DISTRICT JUDGE-1.txt,yes,2025-04-08,2025,04,08,,,3,4301,4364,1473,ok
case,CASE DOCS\04.08.25 - FIRST AMENDED MOTION TO RECUSE-1.pdf,extracted_text\04.08.25 - FIRST AMENDED MOTION TO RECUSE-1.txt,yes,2025-04-08,2025,04,08,,motion,121,213320,211990,65653,ok
case,CASE DOCS\04.08.25 - NOTICE OF INCLUSION-1.pdf,extracted_text\04.08.25 - NOTICE OF INCLUSION-1.txt,yes,2025-04-08,2025,04,08,,notice,27,31604,32634,10668,ok
case,CASE DOCS\04.09.25 - Clerk Refuses Exhibits-1.pdf,extracted_text\04.09.25 - Clerk Refuses Exhibits-1.txt,yes,2025-04-09,2025,04,09,,exhibit,2,2522,2587,829,ok
case,CASE DOCS\04.09.25 - EMAIL - REJECTION OF EXHIBITS REASONS-1.pdf,extracted_text\04.09.25 - EMAIL - REJECTION OF EXHIBITS REASONS-1.txt,yes,2025-04-09,2025,04,09,,exhibit,2,2518,2583,829,ok
case,CASE DOCS\04.09.25 - FILING RETURNED - NOTICE OF INCLUSION-1.pdf,extracted_text\04.09.25 - FILING RETURNED - NOTICE OF INCLUSION-1.txt,yes,2025-04-09,2025,04,09,,notice,1,2206,2062,718,ok
case,CASE DOCS\04.09.25 - REJECTION OF EXHIBITS FROM CLERK-1.pdf,extracted_text\04.09.25 - REJECTION OF EXHIBITS FROM CLERK-1.txt,yes,2025-04-09,2025,04,09,,exhibit,1,1399,1431,476,ok
case,CASE DOCS\04.10.24 - MANDAMUS DENIAL-1.pdf,extracted_text\04.10.24 - MANDAMUS DENIAL-1.txt,yes,2024-04-10,2024,04,10,,mandamus,2,735,633,213,ok
case,CASE DOCS\04.10.24 - Mandamus Denied (2nd CoA)-1.pdf,extracted_text\04.10.24 - Mandamus Denied (2nd CoA)-1.txt,yes,2024-04-10,2024,04,10,,mandamus,2,1643,1583,566,ok
case,CASE DOCS\04.10.25 - 02-25-00164-CV MANDAMUS RECORD-1.pdf,extracted_text\04.10.25 - 02-25-00164-CV MANDAMUS RECORD-1.txt,yes,2025-04-10,2025,04,10,02-25-00164-CV,mandamus;record,160,224135,218324,71680,ok
case,CASE DOCS\04.10.25 - 02-25-00164-CV MANDAMUS-1.pdf,extracted_text\04.10.25 - 02-25-00164-CV MANDAMUS-1.txt,yes,2025-04-10,2025,04,10,02-25-00164-CV,mandamus,84,128980,126639,41598,ok
case,CASE DOCS\04.10.25 - 02-25-00164-CV MOTION FOR REHEARING-1.pdf,extracted_text\04.10.25 - 02-25-00164-CV MOTION FOR REHEARING-1.txt,yes,2025-04-10,2025,04,10,02-25-00164-CV,motion;hearing,9,7653,7381,2397,ok
case,CASE DOCS\04.10.25 - 02-25-00164-CV SUPPLEMENTAL MANDAMUS RECORD-1.pdf,extracted_text\04.10.25 - 02-25-00164-CV SUPPLEMENTAL MANDAMUS RECORD-1.txt,yes,2025-04-10,2025,04,10,02-25-00164-CV,mandamus;record,48,50017,51022,16667,ok
case,CASE DOCS\04.10.25 - Mandamus-1.pdf,extracted_text\04.10.25 - Mandamus-1.txt,yes,2025-04-10,2025,04,10,,mandamus,367,485685,460176,151640,ok
case,CASE DOCS\04.10.25 - ORDER GRANTING CONSOL-1.pdf,extracted_text\04.10.25 - ORDER GRANTING CONSOL-1.txt,yes,2025-04-10,2025,04,10,,order,2,1813,1695,572,ok
case,CASE DOCS\04.10.25 - ORDER ON MOTION TO CONSOLIDATE (233)-1.pdf,extracted_text\04.10.25 - ORDER ON MOTION TO CONSOLIDATE (233)-1.txt,yes,2025-04-10,2025,04,10,,motion;order,1,725,710,235,ok
case,CASE DOCS\04.10.25 233rd ORDER ON CONSOLIDATION-1.pdf,extracted_text\04.10.25 233rd ORDER ON CONSOLIDATION-1.txt,yes,2025-04-10,2025,04,10,,order,2,1813,1695,572,ok
case,CASE DOCS\04.11.2025_233-765358-25 - ORDER ON MOTION TO CONSOLIDATE-1.pdf,extracted_text\04.11.2025_233-765358-25 - ORDER ON MOTION TO CONSOLIDATE-1.txt,yes,2025-04-11,2025,04,11,,motion;order,4,2731,2600,910,ok
case,CASE DOCS\04.11.25 - DENIAL MANDAMUS NOTICE-1.pdf,extracted_text\04.11.25 - DENIAL MANDAMUS NOTICE-1.txt,yes,2025-04-11,2025,04,11,,mandamus;notice,1,1523,1481,493,ok
case,CASE DOCS\04.11.25 - NOTICE AND LEGAL ANALYSIS-1.pdf,extracted_text\04.11.25 - NOTICE AND LEGAL ANALYSIS-1.txt,yes,2025-04-11,2025,04,11,,notice,12,20178,19833,6556,ok
case,"CASE DOCS\04.11.25 - Validity of the February 1 and March 14 Reports and the March 26, 2024 Temporary Orders-1.pdf","extracted_text\04.11.25 - Validity of the February 1 and March 14 Reports and the March 26, 2024 Temporary Orders-1.txt",yes,2025-04-11,2025,04,11,,order;report,10,54603,54786,18508,ok
case,CASE DOCS\04.12.25 - MARCH 26 ORDERS ANALYSIS-1.pdf,extracted_text\04.12.25 - MARCH 26 ORDERS ANALYSIS-1.txt,yes,2025-04-12,2025,04,12,,order,30,52200,51202,16396,ok
case,CASE DOCS\04.14.25 - 02-25-00166-CV MANDAMUS RECORD-1.pdf,extracted_text\04.14.25 - 02-25-00166-CV MANDAMUS RECORD-1.txt,yes,2025-04-14,2025,04,14,02-25-00166-CV,mandamus;record,171,262217,242146,84180,ok
case,CASE DOCS\04.14.25 - 02-25-00166-CV MANDAMUS-1.pdf,extracted_text\04.14.25 - 02-25-00166-CV MANDAMUS-1.txt,yes,2025-04-14,2025,04,14,02-25-00166-CV,mandamus,109,146132,142694,47482,ok
case,CASE DOCS\04.15.2025_02-25-00166-CV EMERGENCY STAY-1.pdf,extracted_text\04.15.2025_02-25-00166-CV EMERGENCY STAY-1.txt,yes,2025-04-15,2025,04,15,,emergency,49,52681,50814,17030,ok
case,CASE DOCS\04.15.2025_02-25-00166-CV MANDAMUS VOID ORDER-1.pdf,extracted_text\04.15.2025_02-25-00166-CV MANDAMUS VOID ORDER-1.txt,yes,2025-04-15,2025,04,15,,mandamus;order,52,50901,48690,16327,ok
case,CASE DOCS\04.15.2025_DOMINANT JURISDICTION ANALYSIS-1.pdf,extracted_text\04.15.2025_DOMINANT JURISDICTION ANALYSIS-1.txt,yes,2025-04-15,2025,04,15,,,13,13129,12782,4172,ok
case,CASE DOCS\04.15.2025_PROCEDURAL IRREGULARITIES WITH TEMPORARY ORDERS-1.pdf,extracted_text\04.15.2025_PROCEDURAL IRREGULARITIES WITH TEMPORARY ORDERS-1.txt,yes,2025-04-15,2025,04,15,,order,31,55058,52798,17593,ok
case,CASE DOCS\04.15.21 - COOPER CARTER APPEARANCE-1.pdf,extracted_text\04.15.21 - COOPER CARTER APPEARANCE-1.txt,yes,2021-04-15,2021,04,15,,,2,460,1288,278,ok
case,CASE DOCS\04.15.25 - ORIGINAL SAPCR COVER LETTER-1.pdf,extracted_text\04.15.25 - ORIGINAL SAPCR COVER LETTER-1.txt,yes,2025-04-15,2025,04,15,,,50,84578,85571,28101,ok
case,CASE DOCS\04.16.2025_02-25-00171-CV - MANDAMUS CONSOLIDATION-1.pdf,extracted_text\04.16.2025_02-25-00171-CV - MANDAMUS CONSOLIDATION-1.txt,yes,2025-04-16,2025,04,16,,mandamus,31,33713,32465,10719,ok
case,CASE DOCS\04.16.2025_02-25-00171-CV - MANDAMUS RECORD-1.pdf,extracted_text\04.16.2025_02-25-00171-CV - MANDAMUS RECORD-1.txt,yes,2025-04-16,2025,04,16,,mandamus;record,5,3792,3352,1052,ok
case,CASE DOCS\04.18.24 - 02-24-00149-CV MOTION FOR REHEARING-1.pdf,extracted_text\04.18.24 - 02-24-00149-CV MOTION FOR REHEARING-1.txt,yes,2024-04-18,2024,04,18,02-24-00149-CV,motion;hearing,255,314742,339813,106612,ok
case,CASE DOCS\04.18.24 - 2ND COA REHEARING-1.pdf,extracted_text\04.18.24 - 2ND COA REHEARING-1.txt,yes,2024-04-18,2024,04,18,,hearing,17,12019,11727,3799,ok
case,CASE DOCS\04.21.2025_02-25-00166-CV - EN BANC VOID ORDER-1.pdf,extracted_text\04.21.2025_02-25-00166-CV - EN BANC VOID ORDER-1.txt,yes,2025-04-21,2025,04,21,,order,20,20763,19766,6489,ok
case,CASE DOCS\04.22.2025_02-25-00164-CV EN BANC SAPCR-1.pdf,extracted_text\04.22.2025_02-25-00164-CV EN BANC SAPCR-1.txt,yes,2025-04-22,2025,04,22,,,17,16145,15272,5001,ok
case,CASE DOCS\04.22.2025_02-25-00171-CV - EN BANC CONSOLIDATION-1.pdf,extracted_text\04.22.2025_02-25-00171-CV - EN BANC CONSOLIDATION-1.txt,yes,2025-04-22,2025,04,22,,,15,17116,16389,5095,ok
case,CASE DOCS\04.22.25 - EMERGENCY TRO APPLICATION-1.pdf,extracted_text\04.22.25 - EMERGENCY TRO APPLICATION-1.txt,yes,2025-04-22,2025,04,22,,emergency,69,48541,83870,21411,ok
case,CASE DOCS\04.22.25 - NOTICE SETTING A COURT PROCEEDING-1.pdf,extracted_text\04.22.25 - NOTICE SETTING A COURT PROCEEDING-1.txt,yes,2025-04-22,2025,04,22,,notice,1,1095,1060,355,ok
case,CASE DOCS\04.22.25 - OAG APPEARANCE-1.pdf,extracted_text\04.22.25 - OAG APPEARANCE-1.txt,yes,2025-04-22,2025,04,22,,,3,3426,3211,1112,ok
case,CASE DOCS\04.23.2025_NOTICE OF TRIAL SETTING-1.pdf,extracted_text\04.23.2025_NOTICE OF TRIAL SETTING-1.txt,yes,2025-04-23,2025,04,23,,notice,3,2025,1857,665,ok
case,CASE DOCS\04.23.2025_OBJECTION TO TRIAL SETTING AND REQUEST TO STAY PROCEEDINGS-1.pdf,extracted_text\04.23.2025_OBJECTION TO TRIAL SETTING AND REQUEST TO STAY PROCEEDINGS-1.txt,yes,2025-04-23,2025,04,23,,objection,5,4919,4699,1558,ok
case,CASE DOCS\04.23.24 - 02-24-00149-CV SUPPLEMENTAL APPENDIX-1.pdf,extracted_text\04.23.24 - 02-24-00149-CV SUPPLEMENTAL APPENDIX-1.txt,yes,2024-04-23,2024,04,23,02-24-00149-CV,,3,2133,2130,673,ok
case,CASE DOCS\04.23.24 - COA SUPPLEMENTAL APPENDIX-1.pdf,extracted_text\04.23.24 - COA SUPPLEMENTAL APPENDIX-1.txt,yes,2024-04-23,2024,04,23,,,3,2079,2117,661,ok
case,CASE DOCS\04.23.25 - 02-25-001166-CV LETTER TO SUPREME COURT-1.pdf,extracted_text\04.23.25 - 02-25-001166-CV LETTER TO SUPREME COURT-1.txt,yes,2025-04-23,2025,04,23,,,1,1414,1357,428,ok
case,CASE DOCS\04.23.25 - APRIL 23 LETTER-1.pdf,extracted_text\04.23.25 - APRIL 23 LETTER-1.txt,yes,2025-04-23,2025,04,23,,,2,2595,2424,813,ok
case,CASE DOCS\04.23.25 - NOCP MYERS-1.pdf,extracted_text\04.23.25 - NOCP MYERS-1.txt,yes,2025-04-23,2025,04,23,,,2,1874,1796,609,ok
case,CASE DOCS\04.23.25 - Notice of Trial Setting-1.pdf,extracted_text\04.23.25 - Notice of Trial Setting-1.txt,yes,2025-04-23,2025,04,23,,notice,446,570490,541522,178870,ok
case,CASE DOCS\04.23.25 - NOTICE OF TRIAL SETTING-f712d07f-1.pdf,extracted_text\04.23.25 - NOTICE OF TRIAL SETTING-f712d07f-1.txt,yes,2025-04-23,2025,04,23,,notice,2,1874,1800,613,ok
case,CASE DOCS\04.23.25 - Objection to Trial Setting and Request for Stay of Proceedings-1.pdf,extracted_text\04.23.25 - Objection to Trial Setting and Request for Stay of Proceedings-1.txt,yes,2025-04-23,2025,04,23,,objection,3,3857,3715,1166,ok
case,CASE DOCS\04.23.25 - Objection to Trial Setting and Request for Stay of Proceedings-d657c201-1.pdf,extracted_text\04.23.25 - Objection to Trial Setting and Request for Stay of Proceedings-d657c201-1.txt,yes,2025-04-23,2025,04,23,,objection,4,4666,4494,1432,ok
case,CASE DOCS\04.24.2024_MOTION FOR PRETRIAL CONFERENCE-1.pdf,extracted_text\04.24.2024_MOTION FOR PRETRIAL CONFERENCE-1.txt,yes,2024-04-24,2024,04,24,,motion,4,2793,2374,835,ok
case,CASE DOCS\04.24.2025 - PLEA TO THE JURISDICTION-1.pdf,extracted_text\04.24.2025 - PLEA TO THE JURISDICTION-1.txt,yes,2025-04-24,2025,04,24,,,104,182136,167074,55621,ok
case,CASE DOCS\04.24.2025_PLEA TO THE JURISDICTION-1.pdf,extracted_text\04.24.2025_PLEA TO THE JURISDICTION-1.txt,yes,2025-04-24,2025,04,24,,,12,17810,17419,5852,ok
case,CASE DOCS\04.24.24 - MOTION FOR PT CONFERENCE-1-1.pdf,extracted_text\04.24.24 - MOTION FOR PT CONFERENCE-1-1.txt,yes,2024-04-24,2024,04,24,,motion,3,2538,2204,724,ok
case,CASE DOCS\04.24.24 - MOTION FOR PT CONFERENCE-1.pdf,extracted_text\04.24.24 - MOTION FOR PT CONFERENCE-1.txt,yes,2024-04-24,2024,04,24,,motion,3,2538,2204,724,ok
case,CASE DOCS\04.24.24 - OBJECTION TO MOTION FOR PRE-TRIAL-1.pdf,extracted_text\04.24.24 - OBJECTION TO MOTION FOR PRE-TRIAL-1.txt,yes,2024-04-24,2024,04,24,,motion;objection,11,6263,6251,2027,ok
case,CASE DOCS\04.24.24 - OBJECTION TO MOTION FOR PRETRIAL CONFERENCE-1.pdf,extracted_text\04.24.24 - OBJECTION TO MOTION FOR PRETRIAL CONFERENCE-1.txt,yes,2024-04-24,2024,04,24,,motion;objection,11,6263,6251,2027,ok
case,CASE DOCS\04.24.24 - Objection to Pretrial Conference-1.pdf,extracted_text\04.24.24 - Objection to Pretrial Conference-1.txt,yes,2024-04-24,2024,04,24,,objection,7,4630,4264,1511,ok
case,CASE DOCS\04.24.24 Motion for Pretrial Conference-1.pdf,extracted_text\04.24.24 Motion for Pretrial Conference-1.txt,yes,2024-04-24,2024,04,24,,motion,3,2472,2135,700,ok
case,CASE DOCS\04.24.25 - DENIAL OF MANDAMUS EN BANC-1.pdf,extracted_text\04.24.25 - DENIAL OF MANDAMUS EN BANC-1.txt,yes,2025-04-24,2025,04,24,,mandamus,1,620,627,222,ok
case,CASE DOCS\04.24.25 - PLEA TO JURISDICTION-1.pdf,extracted_text\04.24.25 - PLEA TO JURISDICTION-1.txt,yes,2025-04-24,2025,04,24,,,11,17252,17058,5603,ok
case,CASE DOCS\04.25.2024_CORRECTED CT APPEALS ORIG PROC PETMAND DENIED-1.pdf,extracted_text\04.25.2024_CORRECTED CT APPEALS ORIG PROC PETMAND DENIED-1.txt,yes,2024-04-25,2024,04,25,,appeal,3,1905,1801,661,ok
case,CASE DOCS\04.25.2025_EMERGENCY NOTICE TO THE COURT-1.pdf,extracted_text\04.25.2025_EMERGENCY NOTICE TO THE COURT-1.txt,yes,2025-04-25,2025,04,25,,notice;emergency,6,3981,3745,1338,ok
case,CASE DOCS\04.25.2025_MOTION TO RECUSE-1.pdf,extracted_text\04.25.2025_MOTION TO RECUSE-1.txt,yes,2025-04-25,2025,04,25,,motion,93,117526,113205,36711,ok
case,CASE DOCS\04.25.24 - 2nd COA Corrected Opinion-1.pdf,extracted_text\04.25.24 - 2nd COA Corrected Opinion-1.txt,yes,2024-04-25,2024,04,25,,,2,1663,1625,561,ok
case,CASE DOCS\04.25.24 - COA ORDER REHEARING-1.pdf,extracted_text\04.25.24 - COA ORDER REHEARING-1.txt,yes,2024-04-25,2024,04,25,,order;hearing,1,668,676,240,ok
case,CASE DOCS\04.25.24 - MANDAMUS RECEIPT CORRECTION-1.pdf,extracted_text\04.25.24 - MANDAMUS RECEIPT CORRECTION-1.txt,yes,2024-04-25,2024,04,25,,mandamus,2,1619,1598,545,ok
case,CASE DOCS\04.25.24 - Rehearing Denied (2nd COA)-1.pdf,extracted_text\04.25.24 - Rehearing Denied (2nd COA)-1.txt,yes,2024-04-25,2024,04,25,,hearing,19,13594,12941,4304,ok
case,CASE DOCS\04.25.25 - 2ND COA EMERGENCY LETTER-1.pdf,extracted_text\04.25.25 - 2ND COA EMERGENCY LETTER-1.txt,yes,2025-04-25,2025,04,25,,emergency,4,1790,2169,651,ok
case,CASE DOCS\04.25.25 - EMERGENCY NOTICE TO THE COURT-1.pdf,extracted_text\04.25.25 - EMERGENCY NOTICE TO THE COURT-1.txt,yes,2025-04-25,2025,04,25,,notice;emergency,5,3255,3544,1126,ok
case,CASE DOCS\04.25.25 - FIRST AMENDED EMERGENCY NOTRICE-1.pdf,extracted_text\04.25.25 - FIRST AMENDED EMERGENCY NOTRICE-1.txt,yes,2025-04-25,2025,04,25,,emergency,6,4023,4324,1394,ok
case,CASE DOCS\04.25.25 - MOTION TO RECUSE-1.pdf,extracted_text\04.25.25 - MOTION TO RECUSE-1.txt,yes,2025-04-25,2025,04,25,,motion,72,93942,92665,28991,ok
case,CASE DOCS\04.25.25 - RECUSAL-1.pdf,extracted_text\04.25.25 - RECUSAL-1.txt,yes,2025-04-25,2025,04,25,,recusal,73,94736,93432,29256,ok
case,CASE DOCS\04.26.2024 - 2ND COA APPENDIX-1.pdf,extracted_text\04.26.2024 - 2ND COA APPENDIX-1.txt,yes,2024-04-26,2024,04,26,,,397,474926,505774,159596,ok
case,CASE DOCS\04.26.24 - 02-24-00149-CV APPENDIX-1.pdf,extracted_text\04.26.24 - 02-24-00149-CV APPENDIX-1.txt,yes,2024-04-26,2024,04,26,02-24-00149-CV,,397,466312,497108,156540,ok
case,CASE DOCS\04.26.24 - 02-24-00149-CV MOTION FOR EN BANC-1.pdf,extracted_text\04.26.24 - 02-24-00149-CV MOTION FOR EN BANC-1.txt,yes,2024-04-26,2024,04,26,02-24-00149-CV,motion,15,12891,12805,4158,ok
case,CASE DOCS\04.26.24 - MOTION FOR EN BANC-1.pdf,extracted_text\04.26.24 - MOTION FOR EN BANC-1.txt,yes,2024-04-26,2024,04,26,,motion,15,13101,13067,4241,ok
case,CASE DOCS\04.27.25 - NOTCE OF INTENT PROHIBITION-1.pdf,extracted_text\04.27.25 - NOTCE OF INTENT PROHIBITION-1.txt,yes,2025-04-27,2025,04,27,,,12,18916,18616,6247,ok
case,CASE DOCS\04.28.2025_FIRST AMENDED MOTION TO RECUSE-1.pdf,extracted_text\04.28.2025_FIRST AMENDED MOTION TO RECUSE-1.txt,yes,2025-04-28,2025,04,28,,motion,122,218781,215119,68049,ok
case,CASE DOCS\04.28.2025_NOTICE OF NON-APPEARANCE AND OBJ TO TRIAL SETTING-1.pdf,extracted_text\04.28.2025_NOTICE OF NON-APPEARANCE AND OBJ TO TRIAL SETTING-1.txt,yes,2025-04-28,2025,04,28,,notice,7,6422,6164,1975,ok
case,CASE DOCS\04.28.24 - MOTION FOR REHEARING WITH APPENDIX-1.pdf,extracted_text\04.28.24 - MOTION FOR REHEARING WITH APPENDIX-1.txt,yes,2024-04-28,2024,04,28,,motion;hearing,17,12019,11727,3799,ok
case,CASE DOCS\04.28.25 - FIRST AMENDED RECUSE-1.pdf,extracted_text\04.28.25 - FIRST AMENDED RECUSE-1.txt,yes,2025-04-28,2025,04,28,,,122,214411,213178,66024,ok
case,CASE DOCS\04.28.25 - NOTICE AND OBJECTION-1.pdf,extracted_text\04.28.25 - NOTICE AND OBJECTION-1.txt,yes,2025-04-28,2025,04,28,,notice;objection,5,5217,5112,1533,ok
case,CASE DOCS\04.28.25 - NOTICE AND OBJECTION-a9ed2d2a-1.pdf,extracted_text\04.28.25 - NOTICE AND OBJECTION-a9ed2d2a-1.txt,yes,2025-04-28,2025,04,28,,notice;objection,6,6047,5913,1807,ok
case,CASE DOCS\04.29.2025_JM LETTER - ORDER OF REFERRAL-1.pdf,extracted_text\04.29.2025_JM LETTER - ORDER OF REFERRAL-1.txt,yes,2025-04-29,2025,04,29,,order,5,3865,3696,1282,ok
case,CASE DOCS\04.29.25 - 322 JM LETTER-1.pdf,extracted_text\04.29.25 - 322 JM LETTER-1.txt,yes,2025-04-29,2025,04,29,,,4,3622,3569,1173,ok
case,CASE DOCS\04.29.25 - Erroneous Kaitcer Referral-1.pdf,extracted_text\04.29.25 - Erroneous Kaitcer Referral-1.txt,yes,2025-04-29,2025,04,29,,,1,0,1046,183,ok
case,CASE DOCS\04.29.25 - OBJECTION RECUSAL HANDLING-1.pdf,extracted_text\04.29.25 - OBJECTION RECUSAL HANDLING-1.txt,yes,2025-04-29,2025,04,29,,recusal;objection,5,6850,6760,2039,ok
case,CASE DOCS\04.29.25 - Objection to Recusal Handling-1.pdf,extracted_text\04.29.25 - Objection to Recusal Handling-1.txt,yes,2025-04-29,2025,04,29,,recusal;objection,7,8089,7866,2490,ok
case,CASE DOCS\04.29.25 - Order of Referral (Kaitcer)-1.pdf,extracted_text\04.29.25 - Order of Referral (Kaitcer)-1.txt,yes,2025-04-29,2025,04,29,,order,5,3920,3761,1302,ok
case,CASE DOCS\04.29.25 - Order of Referral Munford-1.pdf,extracted_text\04.29.25 - Order of Referral Munford-1.txt,yes,2025-04-29,2025,04,29,,order,1,0,1021,176,ok
case,CASE DOCS\04.29.25 322 744263 23 JK LETTER-1.pdf,extracted_text\04.29.25 322 744263 23 JK LETTER-1.txt,yes,2025-04-29,2025,04,29,,,4,3658,3577,1177,ok
case,CASE DOCS\04.29.25 322 744263 23 JK ORDER-1.pdf,extracted_text\04.29.25 322 744263 23 JK ORDER-1.txt,yes,2025-04-29,2025,04,29,,order,2,1953,1878,651,ok
case,CASE DOCS\04.29.25 322 744263 23 JM ORDER-1.pdf,extracted_text\04.29.25 322 744263 23 JM ORDER-1.txt,yes,2025-04-29,2025,04,29,,order,2,1884,1877,633,ok
case,CASE DOCS\04.30.2024_NOTICE OF COMPLETION - CHARLES MYERS-1.pdf,extracted_text\04.30.2024_NOTICE OF COMPLETION - CHARLES MYERS-1.txt,yes,2024-04-30,2024,04,30,,notice,5,3319,3149,1098,ok
case,CASE DOCS\04.30.24 - Notice of Completion-1-1.pdf,extracted_text\04.30.24 - Notice of Completion-1-1.txt,yes,2024-04-30,2024,04,30,,notice,1,776,856,268,ok
case,CASE DOCS\04.30.24 - NOTICE OF COMPLETION-1.pdf,extracted_text\04.30.24 - NOTICE OF COMPLETION-1.txt,yes,2024-04-30,2024,04,30,,notice,5,4043,4008,1313,ok
case,CASE DOCS\04.30.24 - Notice of Completion-e077c7fc-1.pdf,extracted_text\04.30.24 - Notice of Completion-e077c7fc-1.txt,yes,2024-04-30,2024,04,30,,notice,5,4043,4008,1313,ok
case,CASE DOCS\05-04-2023-Agreed_Motion-1.pdf-1.pdf,extracted_text\05-04-2023-Agreed_Motion-1.pdf-1.txt,yes,2023-05-04,2023,05,04,04-2023,motion,61,95023,92306,31075,ok
case,CASE DOCS\05.01.2025_25-0361 HON KAITCER MANDAMUS-1.pdf,extracted_text\05.01.2025_25-0361 HON KAITCER MANDAMUS-1.txt,yes,2025-05-01,2025,05,01,,mandamus,73,111194,105245,36230,ok
case,CASE DOCS\05.01.24 - BANK STATEMENT-1.pdf,extracted_text\05.01.24 - BANK STATEMENT-1.txt,yes,2024-05-01,2024,05,01,,,3,2390,2430,889,ok
case,CASE DOCS\05.01.25  -En Banc Denial (Newell)-1.pdf,extracted_text\05.01.25  -En Banc Denial (Newell)-1.txt,yes,2025-05-01,2025,05,01,,,2,791,777,299,ok
case,CASE DOCS\05.01.25 - 25-0361 EMERGENCY MOTION FOR TEMPORARY RELIEF-1.pdf,extracted_text\05.01.25 - 25-0361 EMERGENCY MOTION FOR TEMPORARY RELIEF-1.txt,yes,2025-05-01,2025,05,01,25-0361,motion;emergency,7,7464,7138,2339,ok
case,CASE DOCS\05.01.25 - 25-0361 MANDAMUS RECORD-1.pdf,extracted_text\05.01.25 - 25-0361 MANDAMUS RECORD-1.txt,yes,2025-05-01,2025,05,01,25-0361,mandamus;record,171,261881,241815,84071,ok
case,CASE DOCS\05.01.25 - 25-0361 MANDAMUS-1.pdf,extracted_text\05.01.25 - 25-0361 MANDAMUS-1.txt,yes,2025-05-01,2025,05,01,25-0361,mandamus,72,107548,104179,34901,ok
case,CASE DOCS\05.01.25 - FEE REQUEST-1.pdf,extracted_text\05.01.25 - FEE REQUEST-1.txt,yes,2025-05-01,2025,05,01,,,1,1184,1186,420,ok
case,CASE DOCS\05.01.25 - Kaitcer Mandamus Record-1.pdf,extracted_text\05.01.25 - Kaitcer Mandamus Record-1.txt,yes,2025-05-01,2025,05,01,,mandamus;record,172,267304,241311,86130,ok
case,CASE DOCS\05.02.2024_2ND COA ORD ORIG PROC MTNREHEARING DENIED-1.pdf,extracted_text\05.02.2024_2ND COA ORD ORIG PROC MTNREHEARING DENIED-1.txt,yes,2024-05-02,2024,05,02,,hearing,17,14561,14329,4855,ok
case,CASE DOCS\05.02.24 - En Banc Denial-1.pdf,extracted_text\05.02.24 - En Banc Denial-1.txt,yes,2024-05-02,2024,05,02,,,1,637,646,234,ok
case,CASE DOCS\05.02.25 - 25-0367 MANDAMUS-1.pdf,extracted_text\05.02.25 - 25-0367 MANDAMUS-1.txt,yes,2025-05-02,2025,05,02,25-0367,mandamus,81,122482,120262,39136,ok
case,CASE DOCS\05.02.25 - Mandamus Record (STONE)-1.pdf,extracted_text\05.02.25 - Mandamus Record (STONE)-1.txt,yes,2025-05-02,2025,05,02,,mandamus;record,162,231574,222420,74816,ok
case,CASE DOCS\05.02.25 - Stone Mandamus-1.pdf,extracted_text\05.02.25 - Stone Mandamus-1.txt,yes,2025-05-02,2025,05,02,,mandamus,82,126083,121679,40617,ok
case,CASE DOCS\05.05.2025_25-0361 HON KAITCER EMERGENCY MOTION FOR TEMPORARY RELIEF-1.pdf,extracted_text\05.05.2025_25-0361 HON KAITCER EMERGENCY MOTION FOR TEMPORARY RELIEF-1.txt,yes,2025-05-05,2025,05,05,,motion;emergency,7,7214,6852,2302,ok
case,CASE DOCS\05.05.25 - Motion to Disqualify (CARTER)-1.pdf,extracted_text\05.05.25 - Motion to Disqualify (CARTER)-1.txt,yes,2025-05-05,2025,05,05,,motion,22,31583,31297,10455,ok
case,CASE DOCS\05.06.2025_ORDER OF ASSIGNMENT BY HON EVANS-1.pdf,extracted_text\05.06.2025_ORDER OF ASSIGNMENT BY HON EVANS-1.txt,yes,2025-05-06,2025,05,06,,order,3,3001,2927,1026,ok
case,CASE DOCS\05.06.24 - ORDER OF ASSIGNMENT-1.pdf,extracted_text\05.06.24 - ORDER OF ASSIGNMENT-1.txt,yes,2024-05-06,2024,05,06,,order,1,0,1960,328,ok
case,CASE DOCS\05.06.25 - OBJECTION TO ORDER OF ASSIGNMENT-1.pdf,extracted_text\05.06.25 - OBJECTION TO ORDER OF ASSIGNMENT-1.txt,yes,2025-05-06,2025,05,06,,order;objection,14,17815,17275,5409,ok
case,CASE DOCS\05.06.25 - ORDER OF ASSIGNMENT-1.pdf,extracted_text\05.06.25 - ORDER OF ASSIGNMENT-1.txt,yes,2025-05-06,2025,05,06,,order,1,1971,1958,656,ok
case,CASE DOCS\05.07.2025_OBJECTION TO ORDER OF ASSIGNMENT-1.pdf,extracted_text\05.07.2025_OBJECTION TO ORDER OF ASSIGNMENT-1.txt,yes,2025-05-07,2025,05,07,,order;objection,16,19434,18672,6054,ok
case,CASE DOCS\05.07.25 - 25-0378 MANDAMUS-1.pdf,extracted_text\05.07.25 - 25-0378 MANDAMUS-1.txt,yes,2025-05-07,2025,05,07,25-0378,mandamus,34,36021,34809,10908,ok
case,CASE DOCS\05.07.25 - Newell Mandamus Record-1.pdf,extracted_text\05.07.25 - Newell Mandamus Record-1.txt,yes,2025-05-07,2025,05,07,,mandamus;record,245,339020,321599,106353,ok
case,CASE DOCS\05.07.25 - Newell Mandamus-1.pdf,extracted_text\05.07.25 - Newell Mandamus-1.txt,yes,2025-05-07,2025,05,07,,mandamus,35,37529,36089,11631,ok
case,CASE DOCS\05.08.2025_FIRST AMENDED MOTION TO CONSOLIDATE CAUSE NUMBERS 25-0361 25-0367 and 25-0378-1.pdf,extracted_text\05.08.2025_FIRST AMENDED MOTION TO CONSOLIDATE CAUSE NUMBERS 25-0361 25-0367 and 25-0378-1.txt,yes,2025-05-08,2025,05,08,25-0361;25-0367;25-0378,motion,41,58235,57132,18803,ok
case,CASE DOCS\05.08.25 - 25-0361 FIRST AMENDED MOTION TO CONSOLIDATE-1.pdf,extracted_text\05.08.25 - 25-0361 FIRST AMENDED MOTION TO CONSOLIDATE-1.txt,yes,2025-05-08,2025,05,08,25-0361,motion,2788,4026910,3893186,1369858,ok
case,CASE DOCS\05.08.25 - 25-0367 MOTION TO CONSOLIDATE-1.pdf,extracted_text\05.08.25 - 25-0367 MOTION TO CONSOLIDATE-1.txt,yes,2025-05-08,2025,05,08,25-0367,motion,2788,4026594,3892554,1369706,ok
case,CASE DOCS\05.09.24 Defective IWO-1.pdf,extracted_text\05.09.24 Defective IWO-1.txt,yes,2024-05-09,2024,05,09,,,4,13808,11926,3878,ok
case,CASE DOCS\05.12.2025_AFFIDAVIT OF CHARLES DUSTIN MYERS-1.pdf,extracted_text\05.12.2025_AFFIDAVIT OF CHARLES DUSTIN MYERS-1.txt,yes,2025-05-12,2025,05,12,,affidavit,13,13487,13237,4562,ok
case,CASE DOCS\05.12.25 - 25-0361 AFFIDAVIT OF CHARLES DUSTIN MYERS-1.pdf,extracted_text\05.12.25 - 25-0361 AFFIDAVIT OF CHARLES DUSTIN MYERS-1.txt,yes,2025-05-12,2025,05,12,25-0361,affidavit,11,11943,11840,3946,ok
case,CASE DOCS\05.13.2024_POST CARD SUPCT PETMAND FILED-1.pdf,extracted_text\05.13.2024_POST CARD SUPCT PETMAND FILED-1.txt,yes,2024-05-13,2024,05,13,,,6,1977,1884,779,ok
case,CASE DOCS\05.13.24 - 24-0395 MANDAMUS FILED POSTCARD-1.pdf,extracted_text\05.13.24 - 24-0395 MANDAMUS FILED POSTCARD-1.txt,yes,2024-05-13,2024,05,13,24-0395,mandamus,5,1627,1649,632,ok
case,CASE DOCS\05.13.24 - PETITION MANDAMUS RECEIVED-1.pdf,extracted_text\05.13.24 - PETITION MANDAMUS RECEIVED-1.txt,yes,2024-05-13,2024,05,13,,mandamus;petition,5,1627,1649,632,ok
case,CASE DOCS\05.14.24 Notice of Clarification-1.pdf,extracted_text\05.14.24 Notice of Clarification-1.txt,yes,2024-05-14,2024,05,14,,notice,7,5874,5832,1908,ok
case,CASE DOCS\05.15.25 - ORDER DENYING OBJECTION TO ORDER OF ASSIGNMENT-1.pdf,extracted_text\05.15.25 - ORDER DENYING OBJECTION TO ORDER OF ASSIGNMENT-1.txt,yes,2025-05-15,2025,05,15,,order;objection,3,2595,2592,833,ok
case,CASE DOCS\05.15.25 - ORDER OVERRULING OBJECTION-1.pdf,extracted_text\05.15.25 - ORDER OVERRULING OBJECTION-1.txt,yes,2025-05-15,2025,05,15,,order;objection,3,2056,2039,662,ok
case,CASE DOCS\05.15.25 Order Denying Objection to Order of Referral-1.pdf,extracted_text\05.15.25 Order Denying Objection to Order of Referral-1.txt,yes,2025-05-15,2025,05,15,,order;objection,2,0,2001,329,ok
case,CASE DOCS\05.16.2025_EMERGENCY NOTICE-1.pdf,extracted_text\05.16.2025_EMERGENCY NOTICE-1.txt,yes,2025-05-16,2025,05,16,,notice;emergency,5,3207,3077,1086,ok
case,CASE DOCS\05.16.25 - NOTICE OF INTENT TO FILE MANDAMUS-1.pdf,extracted_text\05.16.25 - NOTICE OF INTENT TO FILE MANDAMUS-1.txt,yes,2025-05-16,2025,05,16,,mandamus;notice,10,9586,9766,2899,ok
case,CASE DOCS\05.19.2025_CASE MEMORANDUM-1.pdf,extracted_text\05.19.2025_CASE MEMORANDUM-1.txt,yes,2025-05-19,2025,05,19,,memorandum,40,52054,50082,16102,ok
case,CASE DOCS\05.19.24 - EXHIBIT - DEFECTIVE IWO-1.pdf,extracted_text\05.19.24 - EXHIBIT - DEFECTIVE IWO-1.txt,yes,2024-05-19,2024,05,19,,exhibit,8,16665,14844,4876,ok
case,CASE DOCS\05.19.25 - 0426 MANDAMUS-1.pdf,extracted_text\05.19.25 - 0426 MANDAMUS-1.txt,yes,2025-05-19,2025,05,19,,mandamus,51,51400,49734,16658,ok
case,CASE DOCS\05.19.25 - 25-0426 CASE MEMORANDUM-1.pdf,extracted_text\05.19.25 - 25-0426 CASE MEMORANDUM-1.txt,yes,2025-05-19,2025,05,19,25-0426,memorandum,39,50341,49371,15299,ok
case,CASE DOCS\05.19.25 - 25-0426 MANDAMUS-1.pdf,extracted_text\05.19.25 - 25-0426 MANDAMUS-1.txt,yes,2025-05-19,2025,05,19,25-0426,mandamus,50,49221,48009,15654,ok
case,CASE DOCS\05.19.25 - Evans Mandamus-1.pdf,extracted_text\05.19.25 - Evans Mandamus-1.txt,yes,2025-05-19,2025,05,19,,mandamus,277,388013,382588,123211,ok
case,CASE DOCS\05.19.25 - MANDAMUS RECORD.pdf,extracted_text\05.19.25 - MANDAMUS RECORD.txt,yes,2025-05-19,2025,05,19,,mandamus;record,276,382407,382397,120400,ok
case,CASE DOCS\05.19.25 - ORDER TERMINATING ASSIGNMENT REDACTED-1.pdf,extracted_text\05.19.25 - ORDER TERMINATING ASSIGNMENT REDACTED-1.txt,yes,2025-05-19,2025,05,19,,order,1,841,834,268,ok
case,CASE DOCS\05.19.25 - ORDER TERMINATING ASSIGNMENT-1.pdf,extracted_text\05.19.25 - ORDER TERMINATING ASSIGNMENT-1.txt,yes,2025-05-19,2025,05,19,,order,1,841,846,268,ok
case,CASE DOCS\05.20.25 - 0426 Emergency Stay-1.pdf,extracted_text\05.20.25 - 0426 Emergency Stay-1.txt,yes,2025-05-20,2025,05,20,,emergency,20,21454,20808,7192,ok
case,CASE DOCS\05.20.25 - 25-0426 EMERGENCY STAY-1.pdf,extracted_text\05.20.25 - 25-0426 EMERGENCY STAY-1.txt,yes,2025-05-20,2025,05,20,25-0426,emergency,19,20572,20128,6778,ok
case,CASE DOCS\05.20.25 - Order Summarily Denying Recusal (Kaitcer)-1.pdf,extracted_text\05.20.25 - Order Summarily Denying Recusal (Kaitcer)-1.txt,yes,2025-05-20,2025,05,20,,order;recusal,4,3104,3003,1072,ok
case,CASE DOCS\05.20.25 - Order Summarily Denying Recusal-1.pdf,extracted_text\05.20.25 - Order Summarily Denying Recusal-1.txt,yes,2025-05-20,2025,05,20,,order;recusal,4,3231,3049,1108,ok
case,CASE DOCS\05.21.2025_NOTICE OF INTENT TO FILE MANDAMUS-1.pdf,extracted_text\05.21.2025_NOTICE OF INTENT TO FILE MANDAMUS-1.txt,yes,2025-05-21,2025,05,21,,mandamus;notice,10,10517,10515,3566,ok
case,CASE DOCS\05.21.25 - NOTICE OF INTENT TO FILE MANDAMUS-1.pdf,extracted_text\05.21.25 - NOTICE OF INTENT TO FILE MANDAMUS-1.txt,yes,2025-05-21,2025,05,21,,mandamus;notice,9,10085,10160,3341,ok
case,CASE DOCS\05.22.2025_MOTION TO STRIKE OAG-1.pdf,extracted_text\05.22.2025_MOTION TO STRIKE OAG-1.txt,yes,2025-05-22,2025,05,22,,motion,39,53978,50961,17352,ok
case,CASE DOCS\05.22.2025_PROPOSED ORDER ON MOTION TO STRIKE OAG-1.pdf,extracted_text\05.22.2025_PROPOSED ORDER ON MOTION TO STRIKE OAG-1.txt,yes,2025-05-22,2025,05,22,,motion;order,4,3552,2457,911,ok
case,CASE DOCS\05.22.25 - MOTION TO STRIKE INTERVENTION OF THE OAG-1.pdf,extracted_text\05.22.25 - MOTION TO STRIKE INTERVENTION OF THE OAG-1.txt,yes,2025-05-22,2025,05,22,,motion,5,7041,6877,2341,ok
case,CASE DOCS\05.23.25 - Second Amended Motion for Consolidation-1.pdf,extracted_text\05.23.25 - Second Amended Motion for Consolidation-1.txt,yes,2025-05-23,2025,05,23,,motion,39,54356,53621,17411,ok
case,CASE DOCS\05.27.25 - COVER LETTER_D0948D0F.pdf,extracted_text\05.27.25 - COVER LETTER_D0948D0F.txt,yes,2025-05-27,2025,05,27,,,4,5321,5243,1660,ok
case,CASE DOCS\05.27.25 - IFP STATEMENT.pdf,extracted_text\05.27.25 - IFP STATEMENT.txt,yes,2025-05-27,2025,05,27,,,12,13735,15611,4212,ok
case,CASE DOCS\05.27.25 - MANDAMUS CAYCE_5ACD0433.pdf,extracted_text\05.27.25 - MANDAMUS CAYCE_5ACD0433.txt,yes,2025-05-27,2025,05,27,,mandamus,35,39690,38332,12344,ok
case,CASE DOCS\05.27.25 - MCRED CAYCE.pdf,extracted_text\05.27.25 - MCRED CAYCE.txt,no,2025-05-27,2025,05,27,,,0,0,0,99636,error
case,CASE DOCS\05.29.25 - 25-0361 THIRD AMENDED MOTION TO CONSOLIDATE-1.pdf,extracted_text\05.29.25 - 25-0361 THIRD AMENDED MOTION TO CONSOLIDATE-1.txt,yes,2025-05-29,2025,05,29,25-0361,motion,49,65112,64575,20335,ok
case,CASE DOCS\05.30.25 - UNOPPOSED MOTION TO STAY.pdf,extracted_text\05.30.25 - UNOPPOSED MOTION TO STAY.txt,yes,2025-05-30,2025,05,30,,motion,9,10166,10043,3345,ok
case,CASE DOCS\06.02.25 - BRANTHOOVER ORDER.pdf,extracted_text\06.02.25 - BRANTHOOVER ORDER.txt,yes,2025-06-02,2025,06,02,,order,5,4503,4326,1408,ok
case,CASE DOCS\06.03.24 - Heartfelt email to MARGIE-1.pdf,extracted_text\06.03.24 - Heartfelt email to MARGIE-1.txt,yes,2024-06-03,2024,06,03,,,2,5100,5151,1775,ok
case,CASE DOCS\06.05.25 - REQUEST FOR HEARING ON DWOP-1.pdf,extracted_text\06.05.25 - REQUEST FOR HEARING ON DWOP-1.txt,yes,2025-06-05,2025,06,05,,hearing,17,27965,27596,9223,ok
case,CASE DOCS\06.10.25 - Notice of Related Federal RICO Litigation-1.pdf,extracted_text\06.10.25 - Notice of Related Federal RICO Litigation-1.txt,yes,2025-06-10,2025,06,10,,notice;federal,8,10655,10524,3257,ok
case,CASE DOCS\06.20.24 Motion to Sign-1.pdf,extracted_text\06.20.24 Motion to Sign-1.txt,yes,2024-06-20,2024,06,20,,motion,55,56290,39734,17019,ok
case,CASE DOCS\06.20.24 Motion to Signx2-1.pdf,extracted_text\06.20.24 Motion to Signx2-1.txt,yes,2024-06-20,2024,06,20,,motion,4,5075,4978,1660,ok
case,CASE DOCS\06.23.24 - MOTION FOR JOINDER-1.pdf,extracted_text\06.23.24 - MOTION FOR JOINDER-1.txt,yes,2024-06-23,2024,06,23,,motion,15,19665,19256,6354,ok
case,CASE DOCS\06.23.24 Motion for Joinder-1.pdf,extracted_text\06.23.24 Motion for Joinder-1.txt,yes,2024-06-23,2024,06,23,,motion,29,21445,32703,8963,ok
case,CASE DOCS\06.23.24 Objection to Title IV-1.pdf,extracted_text\06.23.24 Objection to Title IV-1.txt,yes,2024-06-23,2024,06,23,,objection,23,33447,32060,10496,ok
case,CASE DOCS\06.24.24 - Motion for Joinder-1-1.pdf,extracted_text\06.24.24 - Motion for Joinder-1-1.txt,yes,2024-06-24,2024,06,24,,motion,24,24883,23913,8376,ok
case,CASE DOCS\06.24.24 - MOTION FOR JOINDER-1.pdf,extracted_text\06.24.24 - MOTION FOR JOINDER-1.txt,yes,2024-06-24,2024,06,24,,motion,31,23464,34630,9631,ok
case,CASE DOCS\06.27.25 - CERT OF SERVICE (DAN)-1.pdf,extracted_text\06.27.25 - CERT OF SERVICE (DAN)-1.txt,yes,2025-06-27,2025,06,27,,,1,0,572,89,ok
case,CASE DOCS\06.28.2024_IV-D INTERVENTION-1.pdf,extracted_text\06.28.2024_IV-D INTERVENTION-1.txt,yes,2024-06-28,2024,06,28,,,7,9516,9064,3141,ok
case,CASE DOCS\06.28.24 - EXHIBIT -  INTERVENTION PLEADING-1.pdf,extracted_text\06.28.24 - EXHIBIT -  INTERVENTION PLEADING-1.txt,yes,2024-06-28,2024,06,28,,exhibit,7,9104,8793,2963,ok
case,CASE DOCS\06.28.24 - INTERVENTION PLEADING-1.pdf,extracted_text\06.28.24 - INTERVENTION PLEADING-1.txt,yes,2024-06-28,2024,06,28,,,6,9065,8753,2951,ok
case,CASE DOCS\06.30.24 - OBJECTION TO TITLE IV INTERVENTION-1.pdf,extracted_text\06.30.24 - OBJECTION TO TITLE IV INTERVENTION-1.txt,yes,2024-06-30,2024,06,30,,objection,24,35135,33666,11049,ok
case,CASE DOCS\07.01.24 - BANK STATEMENT-1.pdf,extracted_text\07.01.24 - BANK STATEMENT-1.txt,yes,2024-07-01,2024,07,01,,,3,2928,3026,1081,ok
case,CASE DOCS\07.01.24 - OBJECTION TO TITLE-IV INTERVENTION-1.pdf,extracted_text\07.01.24 - OBJECTION TO TITLE-IV INTERVENTION-1.txt,yes,2024-07-01,2024,07,01,,objection,24,35135,33666,11049,ok
case,CASE DOCS\07.03.2024_FATHERS COMMUNICATIONS WITH AIRBNB HOST DURING JULY 2024-1.pdf,extracted_text\07.03.2024_FATHERS COMMUNICATIONS WITH AIRBNB HOST DURING JULY 2024-1.txt,yes,2024-07-03,2024,07,03,,,11,8620,8148,3149,ok
case,CASE DOCS\07.04.24 Statement-1.pdf,extracted_text\07.04.24 Statement-1.txt,yes,2024-07-04,2024,07,04,,,4,16278,15889,5628,ok
case,CASE DOCS\07.05.24 - SECOND AMENDED COUNTERPETITION FOR DIVORCE (2)-1.pdf,extracted_text\07.05.24 - SECOND AMENDED COUNTERPETITION FOR DIVORCE (2)-1.txt,yes,2024-07-05,2024,07,05,,petition,12,15848,15426,4883,ok
case,CASE DOCS\07.11.25 - 25-0361 Denial (Motions)-1.pdf,extracted_text\07.11.25 - 25-0361 Denial (Motions)-1.txt,yes,2025-07-11,2025,07,11,25-0361,motion,1,518,545,189,ok
case,CASE DOCS\07.11.25 - 25-0361 Denial-1.pdf,extracted_text\07.11.25 - 25-0361 Denial-1.txt,yes,2025-07-11,2025,07,11,25-0361,,1,420,423,152,ok
case,CASE DOCS\07.11.25 - 25-0367 Rehearing Denial-1.pdf,extracted_text\07.11.25 - 25-0367 Rehearing Denial-1.txt,yes,2025-07-11,2025,07,11,25-0367,hearing,1,418,434,153,ok
case,CASE DOCS\07.11.25 - 25-0367 Rehearing Receipt-1.pdf,extracted_text\07.11.25 - 25-0367 Rehearing Receipt-1.txt,yes,2025-07-11,2025,07,11,25-0367,hearing,1,420,423,152,ok
case,CASE DOCS\07.11.25 - 25-0378 Denial-1.pdf,extracted_text\07.11.25 - 25-0378 Denial-1.txt,yes,2025-07-11,2025,07,11,25-0378,,1,451,453,162,ok
case,CASE DOCS\07.11.25 - 25-0378 Rehearing Receipt-1.pdf,extracted_text\07.11.25 - 25-0378 Rehearing Receipt-1.txt,yes,2025-07-11,2025,07,11,25-0378,hearing,1,420,423,152,ok
case,CASE DOCS\07.11.25 - 25-0378 Rehearing-1.pdf,extracted_text\07.11.25 - 25-0378 Rehearing-1.txt,yes,2025-07-11,2025,07,11,25-0378,hearing,17,20989,20421,6516,ok
case,CASE DOCS\07.11.25 - 25-0426 Denial-1.pdf,extracted_text\07.11.25 - 25-0426 Denial-1.txt,yes,2025-07-11,2025,07,11,25-0426,,1,490,491,172,ok
case,CASE DOCS\07.11.25 - 25-0426 Rehearing Receipt-1.pdf,extracted_text\07.11.25 - 25-0426 Rehearing Receipt-1.txt,yes,2025-07-11,2025,07,11,25-0426,hearing,1,406,409,144,ok
case,CASE DOCS\07.11.25 - 25-0458 Denial-1.pdf,extracted_text\07.11.25 - 25-0458 Denial-1.txt,yes,2025-07-11,2025,07,11,25-0458,,1,481,479,168,ok
case,CASE DOCS\07.11.25 - 25-0458 Rehearing Receipt-1.pdf,extracted_text\07.11.25 - 25-0458 Rehearing Receipt-1.txt,yes,2025-07-11,2025,07,11,25-0458,hearing,1,406,409,144,ok
case,CASE DOCS\07.11.25 - RELATOR'S STATEMENT.pdf,extracted_text\07.11.25 - RELATOR'S STATEMENT.txt,yes,2025-07-11,2025,07,11,,,15,19745,19436,5885,ok
case,CASE DOCS\07.15.25 - 25-0367 Denial-1.pdf,extracted_text\07.15.25 - 25-0367 Denial-1.txt,yes,2025-07-15,2025,07,15,25-0367,,1,451,453,162,ok
case,CASE DOCS\07.28.25 - MOTION FOR REHEARING.pdf,extracted_text\07.28.25 - MOTION FOR REHEARING.txt,yes,2025-07-28,2025,07,28,,motion;hearing,19,25771,25385,8243,ok
case,CASE DOCS\07.28.25 - NOTICE OF RICO UPDATE-1.pdf,extracted_text\07.28.25 - NOTICE OF RICO UPDATE-1.txt,yes,2025-07-28,2025,07,28,,notice,6,9499,9291,3115,ok
case,CASE DOCS\07.30.25 - first amended MOTION REHEARING.pdf,extracted_text\07.30.25 - first amended MOTION REHEARING.txt,yes,2025-07-30,2025,07,30,,motion;hearing,16,18838,18418,5873,ok
case,CASE DOCS\08.01.24 - BANK STATEMENT-1.pdf,extracted_text\08.01.24 - BANK STATEMENT-1.txt,yes,2024-08-01,2024,08,01,,,3,2506,2529,930,ok
case,CASE DOCS\08.15.25 - 25-0361 Rehearing Denial-1.pdf,extracted_text\08.15.25 - 25-0361 Rehearing Denial-1.txt,yes,2025-08-15,2025,08,15,25-0361,hearing,1,418,434,153,ok
case,CASE DOCS\08.15.25 - 25-0426 Rehearing Denial-1.pdf,extracted_text\08.15.25 - 25-0426 Rehearing Denial-1.txt,yes,2025-08-15,2025,08,15,25-0426,hearing,1,404,418,145,ok
case,CASE DOCS\08.16.21_Schema_Changes_to_Exisiting_Phase_2c_Events (1)-1.pdf,extracted_text\08.16.21_Schema_Changes_to_Exisiting_Phase_2c_Events (1)-1.txt,no,2021-08-16,2021,08,16,,,0,0,0,0,error
case,CASE DOCS\08.20.25 - Objection to Final Trial Setting-1.pdf,extracted_text\08.20.25 - Objection to Final Trial Setting-1.txt,yes,2025-08-20,2025,08,20,,objection,9,15661,15202,4773,ok
case,CASE DOCS\08.20.25 - OBJECTION TO NOTICE SETTING A COURT PROCEEDING-1.pdf,extracted_text\08.20.25 - OBJECTION TO NOTICE SETTING A COURT PROCEEDING-1.txt,no,2025-08-20,2025,08,20,,notice;objection,0,0,0,0,error
case,CASE DOCS\08.21.25 - SECOND AMENDED MOTION FOR REHEARING.pdf,extracted_text\08.21.25 - SECOND AMENDED MOTION FOR REHEARING.txt,yes,2025-08-21,2025,08,21,,motion;hearing,14,15696,15382,5190,ok
case,CASE DOCS\08.27.25 - NOTICE OF INTENT TO FILE RECUSAL-1.pdf,extracted_text\08.27.25 - NOTICE OF INTENT TO FILE RECUSAL-1.txt,yes,2025-08-27,2025,08,27,,notice;recusal,13,15600,15118,4717,ok
case,CASE DOCS\08.27.25 -ORDER OF REFERRAL MUNFORD-1.pdf,extracted_text\08.27.25 -ORDER OF REFERRAL MUNFORD-1.txt,yes,2025-08-27,2025,08,27,,order,1,687,729,227,ok
case,CASE DOCS\08.29.2025 OBJECTION TO ORDER OF REFERRAL-1.pdf,extracted_text\08.29.2025 OBJECTION TO ORDER OF REFERRAL-1.txt,no,2025-08-29,2025,08,29,,order;objection,0,0,0,0,error
case,CASE DOCS\08.29.25 - 25-0458 Rehearing Denial-1.pdf,extracted_text\08.29.25 - 25-0458 Rehearing Denial-1.txt,yes,2025-08-29,2025,08,29,25-0458,hearing,1,404,418,145,ok
case,CASE DOCS\08.29.25 - NOTICE OF INTENT TO COMMENCE FEDERAL ACTION-1-1.pdf,extracted_text\08.29.25 - NOTICE OF INTENT TO COMMENCE FEDERAL ACTION-1-1.txt,no,2025-08-29,2025,08,29,,notice;federal,0,0,0,0,error
case,CASE DOCS\08.29.25 - NOTICE OF INTENT TO COMMENCE FEDERAL ACTION-1.pdf,extracted_text\08.29.25 - NOTICE OF INTENT TO COMMENCE FEDERAL ACTION-1.txt,yes,2025-08-29,2025,08,29,,notice;federal,11,13669,13250,4130,ok
case,CASE DOCS\08.29.25 - OBJECTION TO ORDER OF REFERRAL-1.pdf,extracted_text\08.29.25 - OBJECTION TO ORDER OF REFERRAL-1.txt,yes,2025-08-29,2025,08,29,,order;objection,6,7563,7198,2353,ok
case,CASE DOCS\08.29.25 Notice of Intent to Commence Federal Action-1.pdf,extracted_text\08.29.25 Notice of Intent to Commence Federal Action-1.txt,no,2025-08-29,2025,08,29,,notice;federal,0,0,0,0,error
case,CASE DOCS\08.29.25 Objection to Order of Referral-1.pdf,extracted_text\08.29.25 Objection to Order of Referral-1.txt,no,2025-08-29,2025,08,29,,order;objection,0,0,0,0,error
case,CASE DOCS\08.30.2024_POST CARD SUPCT PETMAND DENIED-1.pdf,extracted_text\08.30.2024_POST CARD SUPCT PETMAND DENIED-1.txt,yes,2024-08-30,2024,08,30,,,6,1759,1762,696,ok
case,CASE DOCS\08.30.24 - SP. CT DENIAL POSTCARD-1.pdf,extracted_text\08.30.24 - SP. CT DENIAL POSTCARD-1.txt,yes,2024-08-30,2024,08,30,,,5,1548,1570,605,ok
case,CASE DOCS\08.31.21 - AGREED ORDER COOPER CARTER-1.pdf,extracted_text\08.31.21 - AGREED ORDER COOPER CARTER-1.txt,yes,2021-08-31,2021,08,31,,order,4,4070,3966,1323,ok
case,CASE DOCS\09.03.25 - FIRST AMENDED REQUEST FOR EMERGENCY STAY AND INJUNCTIVE RELIEF-1.pdf,extracted_text\09.03.25 - FIRST AMENDED REQUEST FOR EMERGENCY STAY AND INJUNCTIVE RELIEF-1.txt,yes,2025-09-03,2025,09,03,,emergency,63,93144,91136,28668,ok
case,CASE DOCS\09.04.25 - NOTICE OF RICO COMPLAINT-1.pdf,extracted_text\09.04.25 - NOTICE OF RICO COMPLAINT-1.txt,yes,2025-09-04,2025,09,04,,notice;complaint,15,24581,23782,7730,ok
case,CASE DOCS\09.05.25 - Motion to Recuse (Tieritary)-1.pdf,extracted_text\09.05.25 - Motion to Recuse (Tieritary)-1.txt,no,2025-09-05,2025,09,05,,motion,0,0,0,0,error
case,CASE DOCS\09.05.25 - MOTION TO RECUSE JAMES MUNFORD-1.pdf,extracted_text\09.05.25 - MOTION TO RECUSE JAMES MUNFORD-1.txt,yes,2025-09-05,2025,09,05,,motion,12,19643,19225,6271,ok
case,CASE DOCS\09.08.25 - NOTICE TO DAVID L. EVANS-1.pdf,extracted_text\09.08.25 - NOTICE TO DAVID L. EVANS-1.txt,yes,2025-09-08,2025,09,08,,notice,8,11815,11381,3523,ok
case,CASE DOCS\09.08.25 - NOTICE TO THE HONORABLE DAVID EVANS-1.pdf,extracted_text\09.08.25 - NOTICE TO THE HONORABLE DAVID EVANS-1.txt,no,2025-09-08,2025,09,08,,notice,0,0,0,0,error
case,CASE DOCS\09.09.25 - ORDER OF REFERRAL MUNFORD-1.pdf,extracted_text\09.09.25 - ORDER OF REFERRAL MUNFORD-1.txt,yes,2025-09-09,2025,09,09,,order,13,20176,19900,6498,ok
case,CASE DOCS\09.10.2024_POST CARD SUP CT REHEARING PETMAND FILED-1.pdf,extracted_text\09.10.2024_POST CARD SUP CT REHEARING PETMAND FILED-1.txt,no,2024-09-10,2024,09,10,,hearing,0,0,0,0,error
case,CASE DOCS\09.10.24 - 24-0395 MANDAMUS REHEARING-1.pdf,extracted_text\09.10.24 - 24-0395 MANDAMUS REHEARING-1.txt,yes,2024-09-10,2024,09,10,24-0395,mandamus;hearing,83,60464,131147,30530,ok
case,CASE DOCS\09.10.24 - 24-0395 REHEARING FILED POSTCARD-1.pdf,extracted_text\09.10.24 - 24-0395 REHEARING FILED POSTCARD-1.txt,yes,2024-09-10,2024,09,10,24-0395,hearing,5,1727,1795,667,ok
case,CASE DOCS\09.11.25 - MOTION TO RECUSE THE REGIONAL JUDGE-1.pdf,extracted_text\09.11.25 - MOTION TO RECUSE THE REGIONAL JUDGE-1.txt,yes,2025-09-11,2025,09,11,,motion,15,22419,21720,6859,ok
case,CASE DOCS\09.11.25 - NOTICE-1.pdf,extracted_text\09.11.25 - NOTICE-1.txt,yes,2025-09-11,2025,09,11,,notice,13,16249,17177,5681,ok
case,CASE DOCS\09.11.25 - PROPOSED ORDER ON MOTION TO RECUSE THE REGIONAL JUDGE-1.pdf,extracted_text\09.11.25 - PROPOSED ORDER ON MOTION TO RECUSE THE REGIONAL JUDGE-1.txt,yes,2025-09-11,2025,09,11,,motion;order,2,2571,1451,549,ok
case,CASE DOCS\09.12.24 24-0395 Rehearing-1.pdf,extracted_text\09.12.24 24-0395 Rehearing-1.txt,yes,2024-09-12,2024,09,12,24-0395,hearing,83,62290,132757,31143,ok
case,CASE DOCS\09.12.25 -  NOTICE-1.pdf,extracted_text\09.12.25 -  NOTICE-1.txt,no,2025-09-12,2025,09,12,,notice,0,0,0,0,error
case,CASE DOCS\09.12.25 - FIRST AMENDED MOTION TO RECUSE THE REGIONAL JUDGE-1.pdf,extracted_text\09.12.25 - FIRST AMENDED MOTION TO RECUSE THE REGIONAL JUDGE-1.txt,yes,2025-09-12,2025,09,12,,motion,16,23358,23019,7293,ok
case,CASE DOCS\09.13.24 Statement-1.pdf,extracted_text\09.13.24 Statement-1.txt,yes,2024-09-13,2024,09,13,,,4,16973,16486,5900,ok
case,CASE DOCS\09.14.25 - MOTION FOR RECONSIDERATION-1.pdf,extracted_text\09.14.25 - MOTION FOR RECONSIDERATION-1.txt,yes,2025-09-14,2025,09,14,,motion,10,14618,14370,4721,ok
case,CASE DOCS\09.16.2024_24-0395 REHEARING - SUPREME COURT MANDAMUS-1.pdf,extracted_text\09.16.2024_24-0395 REHEARING - SUPREME COURT MANDAMUS-1.txt,yes,2024-09-16,2024,09,16,,mandamus;hearing,11,22073,20159,7349,ok
case,CASE DOCS\09.16.24 - 0395 First Amended Rehearing-1.pdf,extracted_text\09.16.24 - 0395 First Amended Rehearing-1.txt,no,2024-09-16,2024,09,16,,hearing,0,0,0,0,error
case,CASE DOCS\09.16.24 - 24-0395 First Amended Motion for Rehearing-1.pdf,extracted_text\09.16.24 - 24-0395 First Amended Motion for Rehearing-1.txt,yes,2024-09-16,2024,09,16,24-0395,motion;hearing,89,68341,139495,33340,ok
case,CASE DOCS\09.16.24 - CHASE STATEMENT-1.pdf,extracted_text\09.16.24 - CHASE STATEMENT-1.txt,yes,2024-09-16,2024,09,16,,,4,17374,16994,6031,ok
case,CASE DOCS\09.16.24 - FIRST AMENDED MANDAMUS-1.pdf,extracted_text\09.16.24 - FIRST AMENDED MANDAMUS-1.txt,no,2024-09-16,2024,09,16,,mandamus,0,0,0,0,error
case,CASE DOCS\09.17.25 - OBJ TO LR 1.06B2-1.pdf,extracted_text\09.17.25 - OBJ TO LR 1.06B2-1.txt,yes,2025-09-17,2025,09,17,,,9,14088,13915,4310,ok
case,CASE DOCS\09.19.24 - REQUEST FOR DISCOVERY-1.pdf,extracted_text\09.19.24 - REQUEST FOR DISCOVERY-1.txt,yes,2024-09-19,2024,09,19,,discovery,9,10865,10270,3365,ok
case,CASE DOCS\09.20.24 - Proposed Order on Rule 12-1.pdf,extracted_text\09.20.24 - Proposed Order on Rule 12-1.txt,no,2024-09-20,2024,09,20,,order,0,0,0,0,error
case,CASE DOCS\09.20.24 - rule 12 motion order_DA9BD973-1.pdf,extracted_text\09.20.24 - rule 12 motion order_DA9BD973-1.txt,yes,2024-09-20,2024,09,20,,motion;order,2,2524,1505,538,ok
case,CASE DOCS\09.20.24 - RULE 12 MOTION-1.pdf,extracted_text\09.20.24 - RULE 12 MOTION-1.txt,yes,2024-09-20,2024,09,20,,motion,7,7628,7544,2473,ok
case,CASE DOCS\09.20.24 - Rule 12 Order-1.pdf,extracted_text\09.20.24 - Rule 12 Order-1.txt,yes,2024-09-20,2024,09,20,,order,2,2525,1505,538,ok
case,CASE DOCS\09.20.24 - Rule 12 Show Authority-1.pdf,extracted_text\09.20.24 - Rule 12 Show Authority-1.txt,no,2024-09-20,2024,09,20,,,0,0,0,0,error
case,CASE DOCS\09.20.24 Rule 12 Motion-1.pdf,extracted_text\09.20.24 Rule 12 Motion-1.txt,no,2024-09-20,2024,09,20,,motion,0,0,0,0,error
case,CASE DOCS\09.22.25 - NOTICE-1-1.pdf,extracted_text\09.22.25 - NOTICE-1-1.txt,yes,2025-09-22,2025,09,22,,notice,6,8212,7605,2463,ok
case,CASE DOCS\09.22.25 - NOTICE-1.pdf,extracted_text\09.22.25 - NOTICE-1.txt,no,2025-09-22,2025,09,22,,notice,0,0,0,0,error
case,CASE DOCS\09.25.25 - AFFIDAVIT OF CHARLES DUSTIN MYERS.pdf,extracted_text\09.25.25 - AFFIDAVIT OF CHARLES DUSTIN MYERS.txt,yes,2025-09-25,2025,09,25,,affidavit,6,9756,9430,3253,ok
case,CASE DOCS\09.25.25 - LETTER TO CLERK 25-0861-1.pdf,extracted_text\09.25.25 - LETTER TO CLERK 25-0861-1.txt,yes,2025-09-25,2025,09,25,25-0861,,5,8772,8578,2930,ok
case,CASE DOCS\09.25.25 - MANDAMUS 0861.pdf,extracted_text\09.25.25 - MANDAMUS 0861.txt,yes,2025-09-25,2025,09,25,,mandamus,29,36090,34723,11269,ok
case,CASE DOCS\09.25.25 - MANDAMUS RECORD.pdf,extracted_text\09.25.25 - MANDAMUS RECORD.txt,yes,2025-09-25,2025,09,25,,mandamus;record,22,27452,27207,8786,ok
case,CASE DOCS\09.26.2024_PROPOSED ORDER ON MOTION FOR TEMPORARY ORDERS-1.pdf,extracted_text\09.26.2024_PROPOSED ORDER ON MOTION FOR TEMPORARY ORDERS-1.txt,yes,2024-09-26,2024,09,26,,motion;order,2,1561,626,258,ok
case,CASE DOCS\09.26.24 - Emergency Motion for Temp Orders-1.pdf,extracted_text\09.26.24 - Emergency Motion for Temp Orders-1.txt,yes,2024-09-26,2024,09,26,,motion;order;emergency,19,14786,20955,5548,ok
case,CASE DOCS\09.26.25 - ORDER SUMMARILY DENYING KAITCER-1.pdf,extracted_text\09.26.25 - ORDER SUMMARILY DENYING KAITCER-1.txt,yes,2025-09-26,2025,09,26,,order,3,4212,4150,1445,ok
case,CASE DOCS\09.26.25 - ORDER SUMMARILY DENYING MUNFORD-1.pdf,extracted_text\09.26.25 - ORDER SUMMARILY DENYING MUNFORD-1.txt,yes,2025-09-26,2025,09,26,,order,3,4176,4105,1437,ok
case,CASE DOCS\09.27.2024_1ST AMENDED MOTION FOR TEMPORARY ORDERS-1.pdf,extracted_text\09.27.2024_1ST AMENDED MOTION FOR TEMPORARY ORDERS-1.txt,no,2024-09-27,2024,09,27,,motion;order,0,0,0,0,error
case,CASE DOCS\09.27.24 - FIRST AMENDED MOTION FOR TEMPORARY ORDERS-1.pdf,extracted_text\09.27.24 - FIRST AMENDED MOTION FOR TEMPORARY ORDERS-1.txt,yes,2024-09-27,2024,09,27,,motion;order,37,17723,41464,9345,ok
case,CASE DOCS\09.29.25 - MOTION TO DISMISS 0861.pdf,extracted_text\09.29.25 - MOTION TO DISMISS 0861.txt,yes,2025-09-29,2025,09,29,,motion,23,27826,27483,8803,ok
case,CASE DOCS\10.02.25 - Attorney's Fees Request-1.pdf,extracted_text\10.02.25 - Attorney's Fees Request-1.txt,yes,2025-10-02,2025,10,02,,,2,1770,1552,525,ok
case,CASE DOCS\10.02.25 - MOTION FOR SANCTIONS AND REQUEST FOR ATTORNEY'S FEES-1.pdf,extracted_text\10.02.25 - MOTION FOR SANCTIONS AND REQUEST FOR ATTORNEY'S FEES-1.txt,yes,2025-10-02,2025,10,02,,motion;sanctions,2,1770,1561,525,ok
case,CASE DOCS\10.07.2024_JOINT MOTION TO RECUSE-1.pdf,extracted_text\10.07.2024_JOINT MOTION TO RECUSE-1.txt,no,2024-10-07,2024,10,07,,motion,0,0,0,0,error
case,CASE DOCS\10.07.24 - JOINT MOTION TO RECUSE (2)_compressed-1.pdf,extracted_text\10.07.24 - JOINT MOTION TO RECUSE (2)_compressed-1.txt,yes,2024-10-07,2024,10,07,,motion,150,210555,219777,69689,ok
case,CASE DOCS\10.07.24 - JOINT MOTION TO RECUSE-1.pdf,extracted_text\10.07.24 - JOINT MOTION TO RECUSE-1.txt,no,2024-10-07,2024,10,07,,motion,0,0,0,0,error
case,CASE DOCS\10.07.24 - JOINT MOTION TO RECUSE-61cebd80-1.pdf,extracted_text\10.07.24 - JOINT MOTION TO RECUSE-61cebd80-1.txt,no,2024-10-07,2024,10,07,,motion,0,0,0,0,error
case,CASE DOCS\10.07.24 JOINT MOTION TO RECUSE-1.pdf,extracted_text\10.07.24 JOINT MOTION TO RECUSE-1.txt,no,2024-10-07,2024,10,07,,motion,0,0,0,0,error
case,CASE DOCS\10.08.2024_JUDGES RULING LETTER-1.pdf,extracted_text\10.08.2024_JUDGES RULING LETTER-1.txt,no,2024-10-08,2024,10,08,,,0,0,0,0,error
case,CASE DOCS\10.08.2024_ORDER OF REFERRAL-1.pdf,extracted_text\10.08.2024_ORDER OF REFERRAL-1.txt,no,2024-10-08,2024,10,08,,order,0,0,0,0,error
case,CASE DOCS\10.08.24 - JUDGE'S RULING LETTER MUNFORD-1.pdf,extracted_text\10.08.24 - JUDGE'S RULING LETTER MUNFORD-1.txt,yes,2024-10-08,2024,10,08,,,3,1988,1950,651,ok
case,CASE DOCS\10.08.24 Order of Referral Munford-1.pdf,extracted_text\10.08.24 Order of Referral Munford-1.txt,yes,2024-10-08,2024,10,08,,order,21,0,29141,4718,ok
case,CASE DOCS\10.09.2024_NOTICE-1.pdf,extracted_text\10.09.2024_NOTICE-1.txt,no,2024-10-09,2024,10,09,,notice,0,0,0,0,error
case,CASE DOCS\10.09.24 - AMENDED ORD. REFERRAL-1.pdf,extracted_text\10.09.24 - AMENDED ORD. REFERRAL-1.txt,yes,2024-10-09,2024,10,09,,,152,237207,221879,75220,ok
case,CASE DOCS\10.09.24 - Amended Order of Referral-1.pdf,extracted_text\10.09.24 - Amended Order of Referral-1.txt,no,2024-10-09,2024,10,09,,order,0,0,0,0,error
case,CASE DOCS\10.09.24 - NOTICE-1.pdf,extracted_text\10.09.24 - NOTICE-1.txt,yes,2024-10-09,2024,10,09,,notice,31,30179,29703,9983,ok
case,CASE DOCS\10.09.24 - ORDER OF REFERRAL MUNFORD-1.pdf,extracted_text\10.09.24 - ORDER OF REFERRAL MUNFORD-1.txt,yes,2024-10-09,2024,10,09,,order,22,34491,33055,10717,ok
case,CASE DOCS\10.09.25 - JOINT MOTION TO VACATE-1.pdf,extracted_text\10.09.25 - JOINT MOTION TO VACATE-1.txt,yes,2025-10-09,2025,10,09,,motion,48,64685,63021,20935,ok
case,CASE DOCS\10.10.2024_AMENDED JUDGES RULING LETTER-1.pdf,extracted_text\10.10.2024_AMENDED JUDGES RULING LETTER-1.txt,yes,2024-10-10,2024,10,10,,,3,2202,1964,718,ok
case,CASE DOCS\10.10.2024_OBJECTION-1.pdf,extracted_text\10.10.2024_OBJECTION-1.txt,yes,2024-10-10,2024,10,10,,objection,13,13334,12945,4496,ok
case,CASE DOCS\10.10.24 - AMENDED ORDER OF REFERRAL (CERTIFIED)-1.pdf,extracted_text\10.10.24 - AMENDED ORDER OF REFERRAL (CERTIFIED)-1.txt,yes,2024-10-10,2024,10,10,,order,152,261983,216304,77009,ok
case,CASE DOCS\10.10.24 - JUDGE'S RULING LETTER MUNFORD-1.pdf,extracted_text\10.10.24 - JUDGE'S RULING LETTER MUNFORD-1.txt,yes,2024-10-10,2024,10,10,,,4,3793,3637,1239,ok
case,CASE DOCS\10.10.24 - Kaitcer Correspondence RECUSAL-1.pdf,extracted_text\10.10.24 - Kaitcer Correspondence RECUSAL-1.txt,yes,2024-10-10,2024,10,10,,recusal,1,0,1042,177,ok
case,CASE DOCS\10.10.24 - OBJECTION AND REQUEST-1.pdf,extracted_text\10.10.24 - OBJECTION AND REQUEST-1.txt,no,2024-10-10,2024,10,10,,objection,0,0,0,0,error
case,CASE DOCS\10.10.24 - OBJECTION-1.pdf,extracted_text\10.10.24 - OBJECTION-1.txt,yes,2024-10-10,2024,10,10,,objection,11,11545,11566,3878,ok
case,CASE DOCS\10.10.24 - ORDER OF REFERRAL KAITCER-1.pdf,extracted_text\10.10.24 - ORDER OF REFERRAL KAITCER-1.txt,yes,2024-10-10,2024,10,10,,order,151,236128,221583,75004,ok
case,CASE DOCS\10.10.25 - Response in Opposition to Petitioner's Motion for Sanctions-1.pdf,extracted_text\10.10.25 - Response in Opposition to Petitioner's Motion for Sanctions-1.txt,yes,2025-10-10,2025,10,10,,motion;petition;response;sanctions,28,33232,31313,10263,ok
case,CASE DOCS\10.11.24 - LETTER RULING KAITCER-1.pdf,extracted_text\10.11.24 - LETTER RULING KAITCER-1.txt,yes,2024-10-11,2024,10,11,,,4,3361,3246,1092,ok
case,CASE DOCS\10.11.24 - Order of Referral (Kaitcer)-1.pdf,extracted_text\10.11.24 - Order of Referral (Kaitcer)-1.txt,yes,2024-10-11,2024,10,11,,order,8,5882,5479,1952,ok
case,CASE DOCS\10.15.25 - INVENTORY AND APPRASALS.pdf,extracted_text\10.15.25 - INVENTORY AND APPRASALS.txt,yes,2025-10-15,2025,10,15,,,28,15264,28375,6813,ok
case,CASE DOCS\10.18.24 - Rehearing Denied (24-0395)-1.pdf,extracted_text\10.18.24 - Rehearing Denied (24-0395)-1.txt,yes,2024-10-18,2024,10,18,24-0395,hearing,6,2092,1995,795,ok
case,CASE DOCS\10.18.24 - SUP. CT REHEARING DENIAL-1.pdf,extracted_text\10.18.24 - SUP. CT REHEARING DENIAL-1.txt,yes,2024-10-18,2024,10,18,,hearing,5,1733,1737,646,ok
case,CASE DOCS\10.19.24 - HOLLY HAYES-1.pdf,extracted_text\10.19.24 - HOLLY HAYES-1.txt,no,2024-10-19,2024,10,19,,,0,0,0,0,error
case,CASE DOCS\10.21.2024_ORDER SET VIDEO CONF HEARING-1.pdf,extracted_text\10.21.2024_ORDER SET VIDEO CONF HEARING-1.txt,no,2024-10-21,2024,10,21,,order;hearing,0,0,0,0,error
case,CASE DOCS\10.21.24 - ORDER SETTING VIDEOCONFERENCE HEARING-1.pdf,extracted_text\10.21.24 - ORDER SETTING VIDEOCONFERENCE HEARING-1.txt,yes,2024-10-21,2024,10,21,,order;hearing,1,1411,1178,386,ok
case,CASE DOCS\10.22.24 Order Setting Video Hearing-1.pdf,extracted_text\10.22.24 Order Setting Video Hearing-1.txt,yes,2024-10-22,2024,10,22,,order;hearing,1,1752,1823,664,ok
case,CASE DOCS\10.23.24 - Baker Adds OAG to email chain-1.pdf,extracted_text\10.23.24 - Baker Adds OAG to email chain-1.txt,yes,2024-10-23,2024,10,23,,,1,1608,1669,592,ok
case,CASE DOCS\10.23.24 - Baker Defers to District Clerk-1.pdf,extracted_text\10.23.24 - Baker Defers to District Clerk-1.txt,yes,2024-10-23,2024,10,23,,,6,10560,10862,2756,ok
case,CASE DOCS\10.23.24 - Docketing COncerns-1.pdf,extracted_text\10.23.24 - Docketing COncerns-1.txt,yes,2024-10-23,2024,10,23,,,3,5752,5923,1648,ok
case,CASE DOCS\10.23.24 - Kaitcer order of Referral-1.pdf,extracted_text\10.23.24 - Kaitcer order of Referral-1.txt,yes,2024-10-23,2024,10,23,,order,2,1410,1460,484,ok
case,CASE DOCS\10.23.24 - Recuasl Procedural Errors-1.pdf,extracted_text\10.23.24 - Recuasl Procedural Errors-1.txt,yes,2024-10-23,2024,10,23,,,1,1981,2035,824,ok
case,CASE DOCS\10.24.2024_EXHIBIT 6 - Affidavit of Steve Myers for recusal proceedings-1.pdf,extracted_text\10.24.2024_EXHIBIT 6 - Affidavit of Steve Myers for recusal proceedings-1.txt,yes,2024-10-24,2024,10,24,,affidavit;recusal;exhibit,3,3644,2701,1145,ok
case,CASE DOCS\10.24.24 - baker ignores AFFIDAVIt-1.pdf,extracted_text\10.24.24 - baker ignores AFFIDAVIt-1.txt,yes,2024-10-24,2024,10,24,,affidavit,1,832,862,280,ok
