corpus,source_pdf,source_txt,date,case_numbers,signal_total,federal,district_court,removal,remand,civil_rights_1983,rico,due_process,jurisdiction,abstention,injunction,mandamus
case,CASE DOCS\05.08.25 - 25-0361 FIRST AMENDED MOTION TO CONSOLIDATE-1.pdf,extracted_text\05.08.25 - 25-0361 FIRST AMENDED MOTION TO CONSOLIDATE-1.txt,2025-05-08,25-0361,4410,415,940,232,113,32,0,598,871,56,227,926
case,CASE DOCS\05.08.25 - 25-0367 MOTION TO CONSOLIDATE-1.pdf,extracted_text\05.08.25 - 25-0367 MOTION TO CONSOLIDATE-1.txt,2025-05-08,25-0367,4410,415,940,232,113,32,0,598,871,56,227,926
case,CASE DOCS\04.23.25 - Notice of Trial Setting-1.pdf,extracted_text\04.23.25 - Notice of Trial Setting-1.txt,2025-04-23,,1280,28,314,15,43,12,0,182,318,0,16,352
case,CASE DOCS\04.10.25 - Mandamus-1.pdf,extracted_text\04.10.25 - Mandamus-1.txt,2025-04-10,,1064,8,271,8,18,0,0,94,231,0,35,399
case,CASE DOCS\04.02.25 - Petitioner's Notice (233)-1.pdf,extracted_text\04.02.25 - Petitioner's Notice (233)-1.txt,2025-04-02,,1056,10,265,12,18,0,0,96,235,0,35,385
research,RESEARCH\vLex-Vincent-TABLE-OF-CONTENTS-I--JURISDICTION-AND-VENUE-II--PARTIES-III--RECORD-REFERENCES-https---search-txcour (9)-1.pdf,extracted_research\vLex-Vincent-TABLE-OF-CONTENTS-I--JURISDICTION-AND-VENUE-II--PARTIES-III--RECORD-REFERENCES-https---search-txcour (9)-1.txt,,,1054,93,31,3,0,0,894,4,6,11,2,10
case,CASE DOCS\03.20.25 - Motion to Strike Carter's Answer and Consolidation-1.pdf,extracted_text\03.20.25 - Motion to Strike Carter's Answer and Consolidation-1.txt,2025-03-20,,1041,16,255,8,24,12,0,92,231,0,22,381
research,RESEARCH\vLex-Vincent-IN-THE-UNITED-STATES-DISTRICT-COURT-FOR-THE-WESTERN-DISTRICT-OF-OKLAHOMA-CHARLES-DUSTIN-MYERS--Plain (1)-1.pdf,extracted_research\vLex-Vincent-IN-THE-UNITED-STATES-DISTRICT-COURT-FOR-THE-WESTERN-DISTRICT-OF-OKLAHOMA-CHARLES-DUSTIN-MYERS--Plain (1)-1.txt,,,1028,204,31,6,0,0,775,1,11,0,0,0
research,RESEARCH\vLex-Vincent-IN-THE-UNITED-STATES-DISTRICT-COURT-FOR-THE-WESTERN-DISTRICT-OF-OKLAHOMA-CHARLES-DUSTIN-MYERS--Plain-1.pdf,extracted_research\vLex-Vincent-IN-THE-UNITED-STATES-DISTRICT-COURT-FOR-THE-WESTERN-DISTRICT-OF-OKLAHOMA-CHARLES-DUSTIN-MYERS--Plain-1.txt,,,1028,204,31,6,0,0,775,1,11,0,0,0
research,RESEARCH\vLex-Vincent-IN-THE-UNITED-STATES-DISTRICT-COURT-FOR-THE-WESTERN-DISTRICT-OF-OKLAHOMA-CHARLES-DUSTIN-MYERS--Plain-86b6a49f-1.pdf,extracted_research\vLex-Vincent-IN-THE-UNITED-STATES-DISTRICT-COURT-FOR-THE-WESTERN-DISTRICT-OF-OKLAHOMA-CHARLES-DUSTIN-MYERS--Plain-86b6a49f-1.txt,,,1028,204,31,6,0,0,775,1,11,0,0,0
research,RESEARCH\vLex-Vincent-TIMELINE-OF-EVENTS-BACKGROUND-Morgan-Michelle-Myers----Myers---and-Charles-Dustin-Myers----Plaintiff-902c4461-1.pdf,extracted_research\vLex-Vincent-TIMELINE-OF-EVENTS-BACKGROUND-Morgan-Michelle-Myers----Myers---and-Charles-Dustin-Myers----Plaintiff-902c4461-1.txt,,,953,115,13,4,0,0,793,7,14,0,0,7
research,RESEARCH\vLex-Vincent-Draft-a-civil-RICO-complaint-based-on-the-provided-facts--establishing-the-existence-of-an-enterpris-1.pdf,extracted_research\vLex-Vincent-Draft-a-civil-RICO-complaint-based-on-the-provided-facts--establishing-the-existence-of-an-enterpris-1.txt,,,931,146,18,0,0,4,741,2,7,2,11,0
research,RESEARCH\vLex-Vincent-Draft-a-civil-RICO-complaint-based-on-the-provided-facts--establishing-the-existence-of-an-enterpris-e95e2036-1.pdf,extracted_research\vLex-Vincent-Draft-a-civil-RICO-complaint-based-on-the-provided-facts--establishing-the-existence-of-an-enterpris-e95e2036-1.txt,,,931,146,18,0,0,4,741,2,7,2,11,0
research,RESEARCH\vLex-Vincent-42-U-S-C----1983-Complaint-for-Injunctive-and-Declaratory-Relief-Introduction-Plaintiff-Charles-Dust-1.pdf,extracted_research\vLex-Vincent-42-U-S-C----1983-Complaint-for-Injunctive-and-Declaratory-Relief-Introduction-Plaintiff-Charles-Dust-1.txt,,,905,207,6,1,0,94,0,230,283,15,50,19
research,RESEARCH\vLex-Vincent-TABLE-OF-CONTENTS-I--JURISDICTION-AND-VENUE-II--PARTIES-III--RECORD-REFERENCES-https---search-txcour (6)-1.pdf,extracted_research\vLex-Vincent-TABLE-OF-CONTENTS-I--JURISDICTION-AND-VENUE-II--PARTIES-III--RECORD-REFERENCES-https---search-txcour (6)-1.txt,,,900,95,21,3,0,2,742,4,8,11,2,12
research,RESEARCH\vLex-Vincent-Evaluate-the-viability-of-the-complaint-filed-by-Charles-Dustin-Myers-under-the-Racketeer-Influenced-1.pdf,extracted_research\vLex-Vincent-Evaluate-the-viability-of-the-complaint-filed-by-Charles-Dustin-Myers-under-the-Racketeer-Influenced-1.txt,,,892,172,29,0,0,1,642,3,45,0,0,0
research,RESEARCH\vLex-Vincent-Answer-Short-response-While-the-plaintiff-s-allegations--if-proven--could-potentially-satisfy-the-el-1.pdf,extracted_research\vLex-Vincent-Answer-Short-response-While-the-plaintiff-s-allegations--if-proven--could-potentially-satisfy-the-el-1.txt,,,872,88,22,8,0,3,705,7,33,0,3,3
research,RESEARCH\vLex-Vincent-Defendants-engaged-in-at-least-two-predicate-acts--wire-fraud--money-laundering--obstruction--etc----1.pdf,extracted_research\vLex-Vincent-Defendants-engaged-in-at-least-two-predicate-acts--wire-fraud--money-laundering--obstruction--etc----1.txt,,,868,111,5,0,0,1,751,0,0,0,0,0
research,RESEARCH\vLex-Vincent-What-are-the-elements-of-RICO--Racketeer-Influenced-and-Corrupt-Organizations-Act--that-must-be-sati-1.pdf,extracted_research\vLex-Vincent-What-are-the-elements-of-RICO--Racketeer-Influenced-and-Corrupt-Organizations-Act--that-must-be-sati-1.txt,,,842,113,20,0,0,3,701,2,3,0,0,0
research,RESEARCH\vLex-Vincent-IN-THE-UNITED-STATES-DISTRICT-COURT-FOR-THE-WESTERN-DISTRICT-OF-OKLAHOMA--CHARLES-DUSTIN-MYERS------ (1)-1.pdf,extracted_research\vLex-Vincent-IN-THE-UNITED-STATES-DISTRICT-COURT-FOR-THE-WESTERN-DISTRICT-OF-OKLAHOMA--CHARLES-DUSTIN-MYERS------ (1)-1.txt,,,825,155,22,7,0,4,620,0,17,0,0,0
research,RESEARCH\vLex-Vincent-TABLE-OF-CONTENTS-I--JURISDICTION-AND-VENUE-II--PARTIES-III--RECORD-REFERENCES-https---search-txcour (5)-1.pdf,extracted_research\vLex-Vincent-TABLE-OF-CONTENTS-I--JURISDICTION-AND-VENUE-II--PARTIES-III--RECORD-REFERENCES-https---search-txcour (5)-1.txt,,,809,119,31,3,0,0,621,4,7,11,2,11
research,RESEARCH\vLex-Vincent-TABLE-OF-CONTENTS-I--JURISDICTION-AND-VENUE-II--PARTIES-III--RECORD-REFERENCES-https---search-txcour (4)-1.pdf,extracted_research\vLex-Vincent-TABLE-OF-CONTENTS-I--JURISDICTION-AND-VENUE-II--PARTIES-III--RECORD-REFERENCES-https---search-txcour (4)-1.txt,,,801,133,16,3,0,1,611,4,9,11,2,11
research,RESEARCH\vLex-Vincent-TABLE-OF-CONTENTS-I--JURISDICTION-AND-VENUE-II--PARTIES-III--RECORD-REFERENCES-https---search-txcour (1)-1.pdf,extracted_research\vLex-Vincent-TABLE-OF-CONTENTS-I--JURISDICTION-AND-VENUE-II--PARTIES-III--RECORD-REFERENCES-https---search-txcour (1)-1.txt,,,777,90,28,3,0,0,603,4,14,11,13,11
research,RESEARCH\vLex-Vincent-What-are-the-legal-standards-1.pdf,extracted_research\vLex-Vincent-What-are-the-legal-standards-1.txt,,,765,307,33,0,0,148,0,147,109,6,15,0
research,RESEARCH\vLex-Vincent-What-are-the-legal-standards-140066f6-1.pdf,extracted_research\vLex-Vincent-What-are-the-legal-standards-140066f6-1.txt,,,765,307,33,0,0,148,0,147,109,6,15,0
research,RESEARCH\vLex-Vincent-What-are-the-legal-standards-c14a9987-1.pdf,extracted_research\vLex-Vincent-What-are-the-legal-standards-c14a9987-1.txt,,,765,307,33,0,0,148,0,147,109,6,15,0
research,RESEARCH\vLex-Vincent-The-mother--with-the-assistance-of-her-stepfather--engaged-in-a-series-of-coordinated-actions--inclu-1.pdf,extracted_research\vLex-Vincent-The-mother--with-the-assistance-of-her-stepfather--engaged-in-a-series-of-coordinated-actions--inclu-1.txt,,,762,86,10,0,0,0,665,0,1,0,0,0
research,RESEARCH\vLex-Vincent-What-constitutes-an-enterprise-under-RICO-in-the-10th-Circuit--1.pdf,extracted_research\vLex-Vincent-What-constitutes-an-enterprise-under-RICO-in-the-10th-Circuit--1.txt,,,734,85,17,0,0,0,626,1,5,0,0,0
case,CASE DOCS\05.19.25 - Evans Mandamus-1.pdf,extracted_text\05.19.25 - Evans Mandamus-1.txt,2025-05-19,,721,44,59,85,17,0,0,220,194,0,10,92
research,RESEARCH\vLex-Vincent-If-someone-in-oklahoma-invites-someone-to-his-house-and-that-person-lives-in-Texas--and-their-whole--1.pdf,extracted_research\vLex-Vincent-If-someone-in-oklahoma-invites-someone-to-his-house-and-that-person-lives-in-Texas--and-their-whole--1.txt,,,721,389,23,3,1,1,71,3,230,0,0,0
research,RESEARCH\vLex-Vincent-The-wife-and-stepfather-engaged-in-multiple-acts--including-defrauding-the-husband-of-his-home--empt-1.pdf,extracted_research\vLex-Vincent-The-wife-and-stepfather-engaged-in-multiple-acts--including-defrauding-the-husband-of-his-home--empt-1.txt,,,721,179,12,0,0,1,529,0,0,0,0,0
research,RESEARCH\vLex-Vincent-The-wife-and-stepfather-engaged-in-multiple-acts--including-defrauding-the-husband-of-his-home--empt-6a4a8b2c-1.pdf,extracted_research\vLex-Vincent-The-wife-and-stepfather-engaged-in-multiple-acts--including-defrauding-the-husband-of-his-home--empt-6a4a8b2c-1.txt,,,721,179,12,0,0,1,529,0,0,0,0,0
case,CASE DOCS\05.19.25 - MANDAMUS RECORD.pdf,extracted_text\05.19.25 - MANDAMUS RECORD.txt,2025-05-19,,720,44,59,85,18,0,0,220,194,0,10,90
research,RESEARCH\vLex-Vincent-The-Defendants--Morgan-Michelle-Myers--Daniel-Kenneth-Branthoover--and-Margie-Evonne-Wilson--coordin-1.pdf,extracted_research\vLex-Vincent-The-Defendants--Morgan-Michelle-Myers--Daniel-Kenneth-Branthoover--and-Margie-Evonne-Wilson--coordin-1.txt,,,714,156,12,0,0,0,546,0,0,0,0,0
research,RESEARCH\vLex-Vincent-TABLE-OF-CONTENTS-I--JURISDICTION-AND-VENUE-II--PARTIES-III--RECORD-REFERENCES-https---search-txcour (10)-1.pdf,extracted_research\vLex-Vincent-TABLE-OF-CONTENTS-I--JURISDICTION-AND-VENUE-II--PARTIES-III--RECORD-REFERENCES-https---search-txcour (10)-1.txt,,,708,178,27,3,0,0,285,4,182,17,1,11
research,RESEARCH\vLex-Vincent--The-Plaintiff-described-an--association-in-fact-enterprise--with-defined-roles--ongoing-coordinatio-1.pdf,extracted_research\vLex-Vincent--The-Plaintiff-described-an--association-in-fact-enterprise--with-defined-roles--ongoing-coordinatio-1.txt,,,690,96,16,0,0,0,578,0,0,0,0,0
research,RESEARCH\vLex-Vincent--The-Plaintiff-described-an--association-in-fact-enterprise--with-defined-roles--ongoing-coordinatio-b067d643-1.pdf,extracted_research\vLex-Vincent--The-Plaintiff-described-an--association-in-fact-enterprise--with-defined-roles--ongoing-coordinatio-b067d643-1.txt,,,690,96,16,0,0,0,578,0,0,0,0,0
research,RESEARCH\vLex-Vincent--The-Plaintiff-described-an--association-in-fact-enterprise--with-defined-roles--ongoing-coordinatio-f9a6529d-1.pdf,extracted_research\vLex-Vincent--The-Plaintiff-described-an--association-in-fact-enterprise--with-defined-roles--ongoing-coordinatio-f9a6529d-1.txt,,,690,96,16,0,0,0,578,0,0,0,0,0
research,RESEARCH\vLex-Vincent-The-mother-and-stepfather-engaged-in-multiple-acts--including-wire-fraud--via-PayPal-transactions-an (1)-1.pdf,extracted_research\vLex-Vincent-The-mother-and-stepfather-engaged-in-multiple-acts--including-wire-fraud--via-PayPal-transactions-an (1)-1.txt,,,689,177,10,0,0,0,502,0,0,0,0,0
research,RESEARCH\vLex-Vincent-The-mother-and-stepfather-engaged-in-multiple-acts--including-wire-fraud--via-PayPal-transactions-an-1.pdf,extracted_research\vLex-Vincent-The-mother-and-stepfather-engaged-in-multiple-acts--including-wire-fraud--via-PayPal-transactions-an-1.txt,,,689,177,10,0,0,0,502,0,0,0,0,0
research,RESEARCH\vLex-Vincent-1-UNITED-STATES-DISTRICT-COURT-WESTERN-DISTRICT-OF-OKLAHOMA-CHARLES-DUSTIN-MYERS------Plaintiff----- (2)-1.pdf,extracted_research\vLex-Vincent-1-UNITED-STATES-DISTRICT-COURT-WESTERN-DISTRICT-OF-OKLAHOMA-CHARLES-DUSTIN-MYERS------Plaintiff----- (2)-1.txt,,,688,47,29,17,0,0,595,0,0,0,0,0
research,RESEARCH\vLex-Vincent-1-UNITED-STATES-DISTRICT-COURT-WESTERN-DISTRICT-OF-OKLAHOMA-CHARLES-DUSTIN-MYERS------Plaintiff----- (3)-1.pdf,extracted_research\vLex-Vincent-1-UNITED-STATES-DISTRICT-COURT-WESTERN-DISTRICT-OF-OKLAHOMA-CHARLES-DUSTIN-MYERS------Plaintiff----- (3)-1.txt,,,688,47,29,17,0,0,595,0,0,0,0,0
research,RESEARCH\vLex-Vincent-1-UNITED-STATES-DISTRICT-COURT-WESTERN-DISTRICT-OF-OKLAHOMA-CHARLES-DUSTIN-MYERS------Plaintiff------2192e234-1.pdf,extracted_research\vLex-Vincent-1-UNITED-STATES-DISTRICT-COURT-WESTERN-DISTRICT-OF-OKLAHOMA-CHARLES-DUSTIN-MYERS------Plaintiff------2192e234-1.txt,,,688,47,29,17,0,0,595,0,0,0,0,0
research,RESEARCH\vLex-Vincent-The-complaint-alleges-that-Defendants-knowingly-agreed-to-participate-in-the-racketeering-enterprise-1.pdf,extracted_research\vLex-Vincent-The-complaint-alleges-that-Defendants-knowingly-agreed-to-participate-in-the-racketeering-enterprise-1.txt,,,684,105,9,0,0,0,570,0,0,0,0,0
research,RESEARCH\vLex-Vincent-The-complaint-alleges-an-association-in-fact-enterprise-among-Myers--Branthoover--and-Wilson--with-a-1.pdf,extracted_research\vLex-Vincent-The-complaint-alleges-an-association-in-fact-enterprise-among-Myers--Branthoover--and-Wilson--with-a-1.txt,,,671,71,14,0,0,0,586,0,0,0,0,0
research,RESEARCH\vLex-Vincent--Case-5-24-cv-01311-R-Document-16-Filed-06-24-25-Page-1-of-45-IN-THE-UNITED-STATES-DISTRICT-COURT-FO-1.pdf,extracted_research\vLex-Vincent--Case-5-24-cv-01311-R-Document-16-Filed-06-24-25-Page-1-of-45-IN-THE-UNITED-STATES-DISTRICT-COURT-FO-1.txt,2025-06-24,24-cv-01311-R;5-24-cv-01311,670,125,30,5,0,1,500,0,8,0,1,0
research,RESEARCH\vLex-Vincent--Case-5-24-cv-01311-R-Document-16-Filed-06-24-25-Page-1-of-45-IN-THE-UNITED-STATES-DISTRICT-COURT-FO-6becab34-1.pdf,extracted_research\vLex-Vincent--Case-5-24-cv-01311-R-Document-16-Filed-06-24-25-Page-1-of-45-IN-THE-UNITED-STATES-DISTRICT-COURT-FO-6becab34-1.txt,2025-06-24,24-cv-01311-R;5-24-cv-01311,670,125,30,5,0,1,500,0,8,0,1,0
research,RESEARCH\vLex-Vincent--Case-5-24-cv-01311-R-Document-16-Filed-06-24-25-Page-1-of-45-IN-THE-UNITED-STATES-DISTRICT-COURT-FO-733220e3-1.pdf,extracted_research\vLex-Vincent--Case-5-24-cv-01311-R-Document-16-Filed-06-24-25-Page-1-of-45-IN-THE-UNITED-STATES-DISTRICT-COURT-FO-733220e3-1.txt,2025-06-24,24-cv-01311-R;5-24-cv-01311,670,125,30,5,0,1,500,0,8,0,1,0
research,RESEARCH\vLex-Vincent--Case-5-24-cv-01311-R-Document-16-Filed-06-24-25-Page-1-of-45-IN-THE-UNITED-STATES-DISTRICT-COURT-FO-f0372367-1.pdf,extracted_research\vLex-Vincent--Case-5-24-cv-01311-R-Document-16-Filed-06-24-25-Page-1-of-45-IN-THE-UNITED-STATES-DISTRICT-COURT-FO-f0372367-1.txt,2025-06-24,24-cv-01311-R;5-24-cv-01311,670,125,30,5,0,1,500,0,8,0,1,0
research,RESEARCH\vLex-Vincent-Morgan-Michelle-Myers-and-Daniel-Kenneth-Branthoover-collaborated-over-a-17-month-period-with-the-co-1.pdf,extracted_research\vLex-Vincent-Morgan-Michelle-Myers-and-Daniel-Kenneth-Branthoover-collaborated-over-a-17-month-period-with-the-co-1.txt,,,668,87,19,0,0,1,561,0,0,0,0,0
research,RESEARCH\vLex-Vincent-IN-THE-UNITED-STATES-DISTRICT-COURT-FOR-THE-WESTERN-DISTRICT-OF-OKLAHOMA--CHARLES-DUSTIN-MYERS-------1.pdf,extracted_research\vLex-Vincent-IN-THE-UNITED-STATES-DISTRICT-COURT-FOR-THE-WESTERN-DISTRICT-OF-OKLAHOMA--CHARLES-DUSTIN-MYERS-------1.txt,,,664,110,30,0,0,4,508,0,12,0,0,0
research,RESEARCH\vLex-Vincent-NO--322-744263-23---NO--322-744538-23-ITMOMO-Morgan-Michelle-Myers-v-Charles-Dustin-Myers-MOTION-TO--1.pdf,extracted_research\vLex-Vincent-NO--322-744263-23---NO--322-744538-23-ITMOMO-Morgan-Michelle-Myers-v-Charles-Dustin-Myers-MOTION-TO--1.txt,,322-744263-23;322-744538-23,663,207,37,17,6,19,0,149,74,35,6,113
research,RESEARCH\vLex-Vincent-Defendants-Myers-and-Branthoover-coordinated-and-planned-the-fraudulent-acts--including-wire-fraud---1.pdf,extracted_research\vLex-Vincent-Defendants-Myers-and-Branthoover-coordinated-and-planned-the-fraudulent-acts--including-wire-fraud---1.txt,,,655,230,8,0,0,0,417,0,0,0,0,0
research,RESEARCH\vLex-Vincent-Defendants-Myers-and-Branthoover-agreed-to-work-together-to-defraud-Plaintiff-and-deprive-him-of-his-1.pdf,extracted_research\vLex-Vincent-Defendants-Myers-and-Branthoover-agreed-to-work-together-to-defraud-Plaintiff-and-deprive-him-of-his-1.txt,,,654,122,8,0,0,0,524,0,0,0,0,0
research,RESEARCH\vLex-Vincent-TABLE-OF-CONTENTS-I--JURISDICTION-AND-VENUE-II--PARTIES-III--RECORD-REFERENCES-https---search-txcour (7)-1.pdf,extracted_research\vLex-Vincent-TABLE-OF-CONTENTS-I--JURISDICTION-AND-VENUE-II--PARTIES-III--RECORD-REFERENCES-https---search-txcour (7)-1.txt,,,654,93,27,3,0,2,486,4,21,7,1,10
research,RESEARCH\vLex-Vincent-What-are-the-legal-grounds-1.pdf,extracted_research\vLex-Vincent-What-are-the-legal-grounds-1.txt,,,653,224,26,0,0,65,0,118,97,94,29,0
research,RESEARCH\vLex-Vincent-What-are-the-legal-grounds-305e6555-1.pdf,extracted_research\vLex-Vincent-What-are-the-legal-grounds-305e6555-1.txt,,,653,224,26,0,0,65,0,118,97,94,29,0
research,RESEARCH\vLex-Vincent-What-are-the-legal-grounds-ad40072c-1.pdf,extracted_research\vLex-Vincent-What-are-the-legal-grounds-ad40072c-1.txt,,,653,224,26,0,0,65,0,118,97,94,29,0
research,RESEARCH\vLex-Vincent-Under-what-statutes-should-a-father-seek-relief-for-wire-fraud-in-a-RICO-suit-against-his-spouse--hi-1.pdf,extracted_research\vLex-Vincent-Under-what-statutes-should-a-father-seek-relief-for-wire-fraud-in-a-RICO-suit-against-his-spouse--hi-1.txt,,,639,209,14,0,0,0,416,0,0,0,0,0
research,RESEARCH\vLex-Vincent-The-complaint-identifies-multiple-predicate-acts--including-wire-fraud--mail-fraud--and-obstruction--1.pdf,extracted_research\vLex-Vincent-The-complaint-identifies-multiple-predicate-acts--including-wire-fraud--mail-fraud--and-obstruction--1.txt,,,638,129,11,0,0,2,496,0,0,0,0,0
research,RESEARCH\vLex-Vincent-How-does-the-10th-Circuit-distinguish-between-the-person-and-the-enterprise-under-RICO--1.pdf,extracted_research\vLex-Vincent-How-does-the-10th-Circuit-distinguish-between-the-person-and-the-enterprise-under-RICO--1.txt,,,621,61,13,0,0,0,547,0,0,0,0,0
research,RESEARCH\vLex-Vincent-IN-THE-UNITED-STATES-DISTRJCT-COURT-FOR-THE-WESTERN-DISTRJCT-OF-OKLAHOMA-CHARLES-DUSTIN-MYERS--Plain (2)-1.pdf,extracted_research\vLex-Vincent-IN-THE-UNITED-STATES-DISTRJCT-COURT-FOR-THE-WESTERN-DISTRJCT-OF-OKLAHOMA-CHARLES-DUSTIN-MYERS--Plain (2)-1.txt,,,603,170,10,5,0,0,393,1,23,0,1,0
case,CASE DOCS\09.03.25 - FIRST AMENDED REQUEST FOR EMERGENCY STAY AND INJUNCTIVE RELIEF-1.pdf,extracted_text\09.03.25 - FIRST AMENDED REQUEST FOR EMERGENCY STAY AND INJUNCTIVE RELIEF-1.txt,2025-09-03,,602,190,10,16,0,0,352,0,20,0,12,2
research,RESEARCH\vLex-Vincent-IN-THE-UNITED-STATES-DISTRJCT-COURT-FOR-THE-WESTERN-DISTRJCT-OF-OKLAHOMA-CHARLES-DUSTIN-MYERS--Plain-1.pdf,extracted_research\vLex-Vincent-IN-THE-UNITED-STATES-DISTRJCT-COURT-FOR-THE-WESTERN-DISTRJCT-OF-OKLAHOMA-CHARLES-DUSTIN-MYERS--Plain-1.txt,,,600,161,23,5,0,0,386,1,23,0,1,0
research,RESEARCH\vLex-Vincent-Based-on-the-above--Defendants-Myers-and-Branthoover-have-committed-multiple-RICO-predicate-acts-wir-1.pdf,extracted_research\vLex-Vincent-Based-on-the-above--Defendants-Myers-and-Branthoover-have-committed-multiple-RICO-predicate-acts-wir-1.txt,,,599,115,15,0,0,0,469,0,0,0,0,0
research,RESEARCH\vLex-Vincent-Case-5-24-cv-01311-R-Document-16-Filed-06-24-25-Page-1-of-45-IN-THE-UNITED-STATES-DISTRICT-COURT-FOR-1.pdf,extracted_research\vLex-Vincent-Case-5-24-cv-01311-R-Document-16-Filed-06-24-25-Page-1-of-45-IN-THE-UNITED-STATES-DISTRICT-COURT-FOR-1.txt,2025-06-24,24-cv-01311-R;5-24-cv-01311,595,95,30,7,0,0,453,0,9,0,1,0
research,RESEARCH\vLex-Vincent-Case-5-24-cv-01311-R-Document-18-Filed-06-30-25-Page-1-of-5-FILED-JUN-3-D-2025-IN-THE-UNITED-STATES--389ccc19-1.pdf,extracted_research\vLex-Vincent-Case-5-24-cv-01311-R-Document-18-Filed-06-30-25-Page-1-of-5-FILED-JUN-3-D-2025-IN-THE-UNITED-STATES--389ccc19-1.txt,2025-06-30,24-cv-01311-R;5-24-cv-01311,593,111,30,0,0,1,450,0,1,0,0,0
research,RESEARCH\vLex-Vincent-Under-what-statutes-should-a-father-seek-relief-for-mail-fraud-in-a-RICO-suit-against-his-spouse--hi-1.pdf,extracted_research\vLex-Vincent-Under-what-statutes-should-a-father-seek-relief-for-mail-fraud-in-a-RICO-suit-against-his-spouse--hi-1.txt,,,582,203,11,0,0,1,360,0,5,2,0,0
case,CASE DOCS\05.27.25 - MCRED CAYCE.pdf,extracted_text\05.27.25 - MCRED CAYCE.txt,2025-05-27,,580,36,57,76,8,0,0,106,141,0,6,150
research,RESEARCH\vLex-Vincent-Under-what-circumstances-could-a-RICO-claim-arise-from-a-scheme-involving-a-wife--a-third-party--and-01d79fe1-1.pdf,extracted_research\vLex-Vincent-Under-what-circumstances-could-a-RICO-claim-arise-from-a-scheme-involving-a-wife--a-third-party--and-01d79fe1-1.txt,,,577,84,13,0,0,0,480,0,0,0,0,0
research,RESEARCH\vLex-Vincent-Under-what-circumstances-could-a-RICO-claim-arise-from-a-scheme-involving-a-wife--a-third-party--and-1.pdf,extracted_research\vLex-Vincent-Under-what-circumstances-could-a-RICO-claim-arise-from-a-scheme-involving-a-wife--a-third-party--and-1.txt,,,577,84,13,0,0,0,480,0,0,0,0,0
research,RESEARCH\vLex-Vincent-IV--INTRODUCTION--1--This-matter-highlights-an-egregious-and-malicious-series-of-actions-taken-by-th-1.pdf,extracted_research\vLex-Vincent-IV--INTRODUCTION--1--This-matter-highlights-an-egregious-and-malicious-series-of-actions-taken-by-th-1.txt,,,568,94,19,0,0,0,454,0,1,0,0,0
research,RESEARCH\vLex-Vincent-Morgan-Michelle-Myers-and-Daniel-Branthoover-collaborated-to-devise-a-scheme-involving-the-preparati-1.pdf,extracted_research\vLex-Vincent-Morgan-Michelle-Myers-and-Daniel-Branthoover-collaborated-to-devise-a-scheme-involving-the-preparati-1.txt,,,564,88,13,0,0,0,463,0,0,0,0,0
research,RESEARCH\vLex-Vincent-Morgan-and-Daniel-engaged-in-multiple-acts--including-the-preparation-of-false-court-documents-and-t-1.pdf,extracted_research\vLex-Vincent-Morgan-and-Daniel-engaged-in-multiple-acts--including-the-preparation-of-false-court-documents-and-t-1.txt,,,558,191,11,0,0,0,356,0,0,0,0,0
research,RESEARCH\vLex-Vincent-The-complaint-assigns-distinct-roles-to-each-defendant--Myers-as-drafter-and-beneficiary-of-false-do-1.pdf,extracted_research\vLex-Vincent-The-complaint-assigns-distinct-roles-to-each-defendant--Myers-as-drafter-and-beneficiary-of-false-do-1.txt,,,558,78,6,0,0,1,473,0,0,0,0,0
research,RESEARCH\vLex-Vincent-IN-THE-UNITED-STATES-DISTRICT-COURT-FOR-THE-WESTERN-DISTRICT-OF-OKLAHOMA-CHARLES-DUSTIN-MYERS--Plain-03d92fa3-1.pdf,extracted_research\vLex-Vincent-IN-THE-UNITED-STATES-DISTRICT-COURT-FOR-THE-WESTERN-DISTRICT-OF-OKLAHOMA-CHARLES-DUSTIN-MYERS--Plain-03d92fa3-1.txt,,,556,194,21,2,0,1,55,18,15,246,1,3
research,RESEARCH\vLex-Vincent-eXPLAIN-how-judges-and-attorneys-in-a-divorce-suit-can-be-implicated-in-a-rico-conspiracy-started-by-1.pdf,extracted_research\vLex-Vincent-eXPLAIN-how-judges-and-attorneys-in-a-divorce-suit-can-be-implicated-in-a-rico-conspiracy-started-by-1.txt,,,546,59,5,0,0,2,480,0,0,0,0,0
research,RESEARCH\vLex-Vincent-Under-what-statutes-should-a-father-seek-relief-for-obstruction-of-justice-for-filing-fraudulent-ple-1.pdf,extracted_research\vLex-Vincent-Under-what-statutes-should-a-father-seek-relief-for-obstruction-of-justice-for-filing-fraudulent-ple-1.txt,,,528,180,20,0,0,0,325,0,3,0,0,0
research,RESEARCH\vLex-Vincent-Myers--Branthoover--and-Wilson-collaborated-in-a-coordinated-manner-to-achieve-a-common-goal--to-unl-1.pdf,extracted_research\vLex-Vincent-Myers--Branthoover--and-Wilson-collaborated-in-a-coordinated-manner-to-achieve-a-common-goal--to-unl-1.txt,,,525,64,5,0,0,0,456,0,0,0,0,0
research,RESEARCH\vLex-Vincent-TABLE-OF-CONTENTS-I--JURISDICTION-AND-VENUE-II--PARTIES-III--RECORD-REFERENCES-https---search-txcour-1.pdf,extracted_research\vLex-Vincent-TABLE-OF-CONTENTS-I--JURISDICTION-AND-VENUE-II--PARTIES-III--RECORD-REFERENCES-https---search-txcour-1.txt,,,517,64,21,3,1,0,400,5,5,7,1,10
research,RESEARCH\vLex-Vincent-1-IN-THE-UNITED-STATES-DISTRICT-COURT-FOR-THE-WESTERN-DISTRICT-OF-OKLAHOMA-CHARLES-DUSTIN-MYERS--Pla-1.pdf,extracted_research\vLex-Vincent-1-IN-THE-UNITED-STATES-DISTRICT-COURT-FOR-THE-WESTERN-DISTRICT-OF-OKLAHOMA-CHARLES-DUSTIN-MYERS--Pla-1.txt,,,506,145,8,10,0,0,324,0,16,0,3,0
research,RESEARCH\vLex-Vincent-Morgan-Michelle-Myers-and-Daniel-Kenneth-Branthoover-engaged-in-multiple-acts--including-preparing-f-1.pdf,extracted_research\vLex-Vincent-Morgan-Michelle-Myers-and-Daniel-Kenneth-Branthoover-engaged-in-multiple-acts--including-preparing-f-1.txt,,,505,155,8,0,0,0,341,0,1,0,0,0
research,RESEARCH\vLex-Vincent-The-mother-transferred--1-576-from-the-marital-bank-account-using-deceptive-means--including-PayPal--1.pdf,extracted_research\vLex-Vincent-The-mother-transferred--1-576-from-the-marital-bank-account-using-deceptive-means--including-PayPal--1.txt,,,497,100,10,0,0,0,387,0,0,0,0,0
research,RESEARCH\vLex-Vincent-What-must-a-plaintiff-show-in-the-10th-Circuit-to-obtain-summary-judgment-on-a-RICO-claim--1.pdf,extracted_research\vLex-Vincent-What-must-a-plaintiff-show-in-the-10th-Circuit-to-obtain-summary-judgment-on-a-RICO-claim--1.txt,,,489,48,14,0,0,0,420,2,5,0,0,0
research,RESEARCH\vLex-Vincent-Answer-Short-response-The-factual-allegations--if-proven--describe-a-coordinated-and-ongoing-scheme--1.pdf,extracted_research\vLex-Vincent-Answer-Short-response-The-factual-allegations--if-proven--describe-a-coordinated-and-ongoing-scheme--1.txt,,,482,45,19,2,0,0,405,1,3,0,0,7
research,RESEARCH\vLex-Vincent-1-IN-THE-UNITED-STATES-DISTRICT-COURT-FOR-THE-WESTERN-DISTRICT-OF-OKLAHOMA-CHARLES-DUSTIN-MYERS--Pla (1)-1.pdf,extracted_research\vLex-Vincent-1-IN-THE-UNITED-STATES-DISTRICT-COURT-FOR-THE-WESTERN-DISTRICT-OF-OKLAHOMA-CHARLES-DUSTIN-MYERS--Pla (1)-1.txt,,,478,143,8,10,0,0,298,0,17,0,2,0
research,RESEARCH\vLex-Vincent-UNITED-STATES-DISTRICT-COURT-WESTERN-DISTRICT-OF-OKLAHOMA-CHARLES-DUSTIN-MYERS------Plaintiff------v-1.pdf,extracted_research\vLex-Vincent-UNITED-STATES-DISTRICT-COURT-WESTERN-DISTRICT-OF-OKLAHOMA-CHARLES-DUSTIN-MYERS------Plaintiff------v-1.txt,,,472,29,61,4,0,0,378,0,0,0,0,0
research,RESEARCH\vLex-Vincent-Myers--Branthoover--and-Wilson-engaged-in-multiple-predicate-acts--including--1--Mail-fraud--using-t-1.pdf,extracted_research\vLex-Vincent-Myers--Branthoover--and-Wilson-engaged-in-multiple-predicate-acts--including--1--Mail-fraud--using-t-1.txt,,,459,92,6,0,0,0,361,0,0,0,0,0
research,RESEARCH\vLex-Vincent-TABLE-OF-CONTENTS-I--JURISDICTION-AND-VENUE-II--PARTIES-III--RECORD-REFERENCES-https---search-txcour (3)-1.pdf,extracted_research\vLex-Vincent-TABLE-OF-CONTENTS-I--JURISDICTION-AND-VENUE-II--PARTIES-III--RECORD-REFERENCES-https---search-txcour (3)-1.txt,,,456,82,13,3,0,1,216,6,37,87,1,10
research,RESEARCH\vLex-Vincent----A-woman--the-Petitioner--opened-a-private-bank-account--transferred--1-576-from-the-marital-estat-1.pdf,extracted_research\vLex-Vincent----A-woman--the-Petitioner--opened-a-private-bank-account--transferred--1-576-from-the-marital-estat-1.txt,,,453,91,9,0,0,3,338,0,12,0,0,0
research,RESEARCH\vLex-Vincent-What-are-the-differences-between-subsections--a----b----c---and--d--of-the-RICO-statute-in-the-10th--1.pdf,extracted_research\vLex-Vincent-What-are-the-differences-between-subsections--a----b----c---and--d--of-the-RICO-statute-in-the-10th--1.txt,,,452,35,9,0,0,0,400,0,8,0,0,0
research,RESEARCH\vLex-Vincent-Morgan-Michelle-Myers-actively-transferred-funds--prepared-fraudulent-documents--and-lied-to-the-cou-1.pdf,extracted_research\vLex-Vincent-Morgan-Michelle-Myers-actively-transferred-funds--prepared-fraudulent-documents--and-lied-to-the-cou-1.txt,,,451,28,3,0,0,2,418,0,0,0,0,0
research,RESEARCH\vLex-Vincent-The-fraudulent-scheme-devised-by-Morgan-and-Daniel-was-carried-out-through-their-coordinated-actions-1.pdf,extracted_research\vLex-Vincent-The-fraudulent-scheme-devised-by-Morgan-and-Daniel-was-carried-out-through-their-coordinated-actions-1.txt,,,446,54,9,0,0,0,383,0,0,0,0,0
research,RESEARCH\vLex-Vincent-Is-a-direct-petition-for-1.pdf,extracted_research\vLex-Vincent-Is-a-direct-petition-for-1.txt,,,444,0,8,0,0,0,0,6,207,0,0,223
research,RESEARCH\vLex-Vincent-The-complaint-details-a-series-of-alleged-criminal-acts-wire-fraud--interstate-transportation-of-fra-1.pdf,extracted_research\vLex-Vincent-The-complaint-details-a-series-of-alleged-criminal-acts-wire-fraud--interstate-transportation-of-fra-1.txt,,,439,188,7,0,0,0,132,0,96,11,5,0
research,RESEARCH\vLex-Vincent-What-can-be-done-when-in-texas-the-state-courts-in-texas-were-submitted-fraudulent-documents-orchest-1.pdf,extracted_research\vLex-Vincent-What-can-be-done-when-in-texas-the-state-courts-in-texas-were-submitted-fraudulent-documents-orchest-1.txt,,,438,93,22,0,0,0,315,0,3,5,0,0
research,RESEARCH\vLex-Vincent-What-can-be-done-when-in-texas-the-state-courts-in-texas-were-submitted-fraudulent-documents-orchest-4e7e6121-1.pdf,extracted_research\vLex-Vincent-What-can-be-done-when-in-texas-the-state-courts-in-texas-were-submitted-fraudulent-documents-orchest-4e7e6121-1.txt,,,438,93,22,0,0,0,315,0,3,5,0,0
research,RESEARCH\vLex-Vincent--1-UNITED-STATES-DISTRICT-COURT-WESTERN-DISTRICT-OF-OKLAHOMA-CHARLES-DUSTIN-MYERS------Plaintiff---- (1)-1.pdf,extracted_research\vLex-Vincent--1-UNITED-STATES-DISTRICT-COURT-WESTERN-DISTRICT-OF-OKLAHOMA-CHARLES-DUSTIN-MYERS------Plaintiff---- (1)-1.txt,,,433,76,14,8,1,0,325,0,8,0,1,0
research,RESEARCH\vLex-Vincent--1-UNITED-STATES-DISTRICT-COURT-WESTERN-DISTRICT-OF-OKLAHOMA-CHARLES-DUSTIN-MYERS------Plaintiff-----1.pdf,extracted_research\vLex-Vincent--1-UNITED-STATES-DISTRICT-COURT-WESTERN-DISTRICT-OF-OKLAHOMA-CHARLES-DUSTIN-MYERS------Plaintiff-----1.txt,,,433,76,14,8,1,0,325,0,8,0,1,0
research,RESEARCH\vLex-Vincent--1-UNITED-STATES-DISTRICT-COURT-WESTERN-DISTRICT-OF-OKLAHOMA-CHARLES-DUSTIN-MYERS------Plaintiff-----64654e0d-1.pdf,extracted_research\vLex-Vincent--1-UNITED-STATES-DISTRICT-COURT-WESTERN-DISTRICT-OF-OKLAHOMA-CHARLES-DUSTIN-MYERS------Plaintiff-----64654e0d-1.txt,,,433,76,14,8,1,0,325,0,8,0,1,0
research,RESEARCH\vLex-Vincent--1-UNITED-STATES-DISTRICT-COURT-WESTERN-DISTRICT-OF-OKLAHOMA-CHARLES-DUSTIN-MYERS------Plaintiff-----ba356809-1.pdf,extracted_research\vLex-Vincent--1-UNITED-STATES-DISTRICT-COURT-WESTERN-DISTRICT-OF-OKLAHOMA-CHARLES-DUSTIN-MYERS------Plaintiff-----ba356809-1.txt,,,433,76,14,8,1,0,325,0,8,0,1,0
research,RESEARCH\vLex-Vincent--1-UNITED-STATES-DISTRICT-COURT-WESTERN-DISTRICT-OF-OKLAHOMA-CHARLES-DUSTIN-MYERS------Plaintiff-----d0cd80b7-1.pdf,extracted_research\vLex-Vincent--1-UNITED-STATES-DISTRICT-COURT-WESTERN-DISTRICT-OF-OKLAHOMA-CHARLES-DUSTIN-MYERS------Plaintiff-----d0cd80b7-1.txt,,,433,76,14,8,1,0,325,0,8,0,1,0
research,RESEARCH\vLex-Vincent-1-UNITED-STATES-DISTRICT-COURT-WESTERN-DISTRICT-OF-OKLAHOMA-CHARLES-DUSTIN-MYERS------Plaintiff------1.pdf,extracted_research\vLex-Vincent-1-UNITED-STATES-DISTRICT-COURT-WESTERN-DISTRICT-OF-OKLAHOMA-CHARLES-DUSTIN-MYERS------Plaintiff------1.txt,,,428,82,14,7,0,0,316,0,8,0,1,0
research,RESEARCH\vLex-Vincent-1-UNITED-STATES-DISTRICT-COURT-WESTERN-DISTRICT-OF-OKLAHOMA-CHARLES-DUSTIN-MYERS------Plaintiff------31205c87-1.pdf,extracted_research\vLex-Vincent-1-UNITED-STATES-DISTRICT-COURT-WESTERN-DISTRICT-OF-OKLAHOMA-CHARLES-DUSTIN-MYERS------Plaintiff------31205c87-1.txt,,,428,82,14,7,0,0,316,0,8,0,1,0
research,RESEARCH\vLex-Vincent-1-UNITED-STATES-DISTRICT-COURT-WESTERN-DISTRICT-OF-OKLAHOMA-CHARLES-DUSTIN-MYERS------Plaintiff------7e776484-1.pdf,extracted_research\vLex-Vincent-1-UNITED-STATES-DISTRICT-COURT-WESTERN-DISTRICT-OF-OKLAHOMA-CHARLES-DUSTIN-MYERS------Plaintiff------7e776484-1.txt,,,428,82,14,7,0,0,316,0,8,0,1,0
research,RESEARCH\vLex-Vincent-1-UNITED-STATES-DISTRICT-COURT-WESTERN-DISTRICT-OF-OKLAHOMA-CHARLES-DUSTIN-MYERS------Plaintiff------ba249a81-1.pdf,extracted_research\vLex-Vincent-1-UNITED-STATES-DISTRICT-COURT-WESTERN-DISTRICT-OF-OKLAHOMA-CHARLES-DUSTIN-MYERS------Plaintiff------ba249a81-1.txt,,,428,82,14,7,0,0,316,0,8,0,1,0
research,RESEARCH\vLex-Vincent-The-individuals-submitted-false-documents-to-Texas-courts--which-were-prepared-in-Oklahoma--and-requ-1.pdf,extracted_research\vLex-Vincent-The-individuals-submitted-false-documents-to-Texas-courts--which-were-prepared-in-Oklahoma--and-requ-1.txt,,,428,157,12,1,0,0,257,0,1,0,0,0
research,RESEARCH\vLex-Vincent-The-individuals-submitted-false-documents-to-Texas-courts--which-were-prepared-in-Oklahoma--and-requ-47a60d68-1.pdf,extracted_research\vLex-Vincent-The-individuals-submitted-false-documents-to-Texas-courts--which-were-prepared-in-Oklahoma--and-requ-47a60d68-1.txt,,,428,157,12,1,0,0,257,0,1,0,0,0
research,RESEARCH\vLex-Vincent-The-complaint-asserts-that-the-alleged-racketeering-activities-occurred-across-state-lines--Texas-an-1.pdf,extracted_research\vLex-Vincent-The-complaint-asserts-that-the-alleged-racketeering-activities-occurred-across-state-lines--Texas-an-1.txt,,,426,142,13,0,0,0,193,0,78,0,0,0
research,RESEARCH\vLex-Vincent-MANDAMUS-1--JUDGE-KAITCER--1-NO--25-_____-IN-THE-SUPREME-COURT-OF-TEXAS-IN-RE--CHARLES-DUSTIN-MYERS--1.pdf,extracted_research\vLex-Vincent-MANDAMUS-1--JUDGE-KAITCER--1-NO--25-_____-IN-THE-SUPREME-COURT-OF-TEXAS-IN-RE--CHARLES-DUSTIN-MYERS--1.txt,,,425,30,59,1,0,0,0,40,52,0,9,234
research,RESEARCH\vLex-Vincent-Morgan-Michelle-Myers--Margie-Evonne-Wilson--and-Danielle-Kenneth-Branthoover-each-played-a-role-in--1.pdf,extracted_research\vLex-Vincent-Morgan-Michelle-Myers--Margie-Evonne-Wilson--and-Danielle-Kenneth-Branthoover-each-played-a-role-in--1.txt,,,425,23,8,0,0,5,387,0,2,0,0,0
research,RESEARCH\vLex-Vincent-The-mother--stepfather--Dan-Branthoover---and-grandparents-acted-in-concert-to-achieve-a-common-purp-1.pdf,extracted_research\vLex-Vincent-The-mother--stepfather--Dan-Branthoover---and-grandparents-acted-in-concert-to-achieve-a-common-purp-1.txt,,,424,37,6,0,0,2,379,0,0,0,0,0
case,CASE DOCS\05.07.25 - Newell Mandamus Record-1.pdf,extracted_text\05.07.25 - Newell Mandamus Record-1.txt,2025-05-07,,420,14,135,22,28,0,1,10,104,0,58,48
research,RESEARCH\vLex-Vincent-The-mother-and-stepfather-acted-with-the-intent-to-deceive-and-gain-an-unfair-advantage-in-divorce-p-1.pdf,extracted_research\vLex-Vincent-The-mother-and-stepfather-acted-with-the-intent-to-deceive-and-gain-an-unfair-advantage-in-divorce-p-1.txt,,,419,160,14,0,0,4,240,0,1,0,0,0
research,RESEARCH\vLex-Vincent-Morgan-Michelle-Myers--Margie-Evonne-Wilson--and-Danielle-Kenneth-Branthoover-acted-together-with-a--1.pdf,extracted_research\vLex-Vincent-Morgan-Michelle-Myers--Margie-Evonne-Wilson--and-Danielle-Kenneth-Branthoover-acted-together-with-a--1.txt,,,417,35,11,0,0,0,370,0,1,0,0,0
case,CASE DOCS\04.08.25 - FIRST AMENDED MOTION TO RECUSE-1.pdf,extracted_text\04.08.25 - FIRST AMENDED MOTION TO RECUSE-1.txt,2025-04-08,,412,36,8,76,8,0,0,88,122,0,6,68
case,CASE DOCS\04.28.2025_FIRST AMENDED MOTION TO RECUSE-1.pdf,extracted_text\04.28.2025_FIRST AMENDED MOTION TO RECUSE-1.txt,2025-04-28,,412,36,8,76,8,0,0,88,122,0,6,68
case,CASE DOCS\04.28.25 - FIRST AMENDED RECUSE-1.pdf,extracted_text\04.28.25 - FIRST AMENDED RECUSE-1.txt,2025-04-28,,412,36,8,76,8,0,0,88,122,0,6,68
research,RESEARCH\vLex-Vincent-If-a-party-in-Texas-1.pdf,extracted_research\vLex-Vincent-If-a-party-in-Texas-1.txt,,,411,2,2,0,0,0,0,3,396,0,0,8
case,CASE DOCS\02-25-00171-CV MANDAMUS RECORD-1.pdf,extracted_text\02-25-00171-CV MANDAMUS RECORD-1.txt,2017-02-25,02-25-00171-CV,410,14,135,22,28,0,0,10,104,0,57,40
research,RESEARCH\vLex-Vincent-OR-THE-WESTERN-DISTRICT-OF-OKLAHOMA--CHARLES-DUSTIN-MYERS--v---Plaintiff---DANIEL-KENNETH-BRANTHOOVE-1.pdf,extracted_research\vLex-Vincent-OR-THE-WESTERN-DISTRICT-OF-OKLAHOMA--CHARLES-DUSTIN-MYERS--v---Plaintiff---DANIEL-KENNETH-BRANTHOOVE-1.txt,,,409,109,12,5,0,0,267,0,15,0,1,0
case,CASE DOCS\04.26.24 - 02-24-00149-CV APPENDIX-1.pdf,extracted_text\04.26.24 - 02-24-00149-CV APPENDIX-1.txt,2024-04-26,02-24-00149-CV,403,59,89,25,0,0,0,47,52,0,52,79
case,CASE DOCS\04.26.2024 - 2ND COA APPENDIX-1.pdf,extracted_text\04.26.2024 - 2ND COA APPENDIX-1.txt,2024-04-26,,402,59,88,25,0,0,0,47,52,0,52,79
research,RESEARCH\vLex-Vincent----The-mother-s-attorney-prepared-the-fraudulent-agreement-and-participated-in-the-scheme-to-deprive-1.pdf,extracted_research\vLex-Vincent----The-mother-s-attorney-prepared-the-fraudulent-agreement-and-participated-in-the-scheme-to-deprive-1.txt,,,394,41,5,0,0,2,346,0,0,0,0,0
research,RESEARCH\vLex-Vincent--Plaintiff-alleges-a-coordinated-scheme-involving-multiple-defendants--Myers--Branthoover--Carter--B-1.pdf,extracted_research\vLex-Vincent--Plaintiff-alleges-a-coordinated-scheme-involving-multiple-defendants--Myers--Branthoover--Carter--B-1.txt,,,394,63,3,0,0,0,314,0,14,0,0,0
research,RESEARCH\vLex-Vincent--TABLE-OF-CONTENTS-I--JURISDICTION-AND-VENUE-II--PARTIES-III--RECORD-REFERENCES-https---search-txcou-1.pdf,extracted_research\vLex-Vincent--TABLE-OF-CONTENTS-I--JURISDICTION-AND-VENUE-II--PARTIES-III--RECORD-REFERENCES-https---search-txcou-1.txt,,,390,64,23,3,0,0,250,4,5,7,24,10
research,RESEARCH\vLex-Vincent-A-court-in-Texas-has-1.pdf,extracted_research\vLex-Vincent-A-court-in-Texas-has-1.txt,,,388,0,0,0,1,0,0,4,383,0,0,0
research,RESEARCH\vLex-Vincent-A-court-in-Texas-has-62781b1a-1.pdf,extracted_research\vLex-Vincent-A-court-in-Texas-has-62781b1a-1.txt,,,388,0,0,0,1,0,0,4,383,0,0,0
research,RESEARCH\vLex-Vincent-A-court-in-Texas-has-8d6258c6-1.pdf,extracted_research\vLex-Vincent-A-court-in-Texas-has-8d6258c6-1.txt,,,388,0,0,0,1,0,0,4,383,0,0,0
research,RESEARCH\vLex-Vincent-A-court-in-Texas-has-91a35624-1.pdf,extracted_research\vLex-Vincent-A-court-in-Texas-has-91a35624-1.txt,,,388,0,0,0,1,0,0,4,383,0,0,0
research,RESEARCH\vLex-Vincent-What-are-the-legal-standards-for-RICO-civil-claims-in-the-10th-Circuit--including-the-requirements-f-1.pdf,extracted_research\vLex-Vincent-What-are-the-legal-standards-for-RICO-civil-claims-in-the-10th-Circuit--including-the-requirements-f-1.txt,,,388,32,9,0,0,0,346,0,1,0,0,0
research,RESEARCH\vLex-Vincent-The-wife-and-stepfather-s-actions-were-not-isolated-but-part-of-an-ongoing-scheme-to-defraud-the-hus-1.pdf,extracted_research\vLex-Vincent-The-wife-and-stepfather-s-actions-were-not-isolated-but-part-of-an-ongoing-scheme-to-defraud-the-hus-1.txt,,,384,47,12,0,0,0,325,0,0,0,0,0
research,RESEARCH\vLex-Vincent-The-wife-and-stepfather-s-actions-were-not-isolated-but-part-of-an-ongoing-scheme-to-defraud-the-hus-38a788ff-1.pdf,extracted_research\vLex-Vincent-The-wife-and-stepfather-s-actions-were-not-isolated-but-part-of-an-ongoing-scheme-to-defraud-the-hus-38a788ff-1.txt,,,384,47,12,0,0,0,325,0,0,0,0,0
research,RESEARCH\vLex-Vincent-1-UNITED-STATES-DISTRICT-COURT-WESTERN-DISTRICT-OF-OKLAHOMA-CHARLES-DUSTIN-MYERS------Plaintiff----- (1)-1-1.pdf,extracted_research\vLex-Vincent-1-UNITED-STATES-DISTRICT-COURT-WESTERN-DISTRICT-OF-OKLAHOMA-CHARLES-DUSTIN-MYERS------Plaintiff----- (1)-1-1.txt,,,383,72,12,5,0,0,285,0,8,0,1,0
research,RESEARCH\vLex-Vincent-1-UNITED-STATES-DISTRICT-COURT-WESTERN-DISTRICT-OF-OKLAHOMA-CHARLES-DUSTIN-MYERS------Plaintiff----- (1)-1.pdf,extracted_research\vLex-Vincent-1-UNITED-STATES-DISTRICT-COURT-WESTERN-DISTRICT-OF-OKLAHOMA-CHARLES-DUSTIN-MYERS------Plaintiff----- (1)-1.txt,,,383,72,12,5,0,0,285,0,8,0,1,0
research,RESEARCH\vLex-Vincent-1-UNITED-STATES-DISTRICT-COURT-WESTERN-DISTRICT-OF-OKLAHOMA-CHARLES-DUSTIN-MYERS------Plaintiff----- (1)-701fe545-1.pdf,extracted_research\vLex-Vincent-1-UNITED-STATES-DISTRICT-COURT-WESTERN-DISTRICT-OF-OKLAHOMA-CHARLES-DUSTIN-MYERS------Plaintiff----- (1)-701fe545-1.txt,,,383,72,12,5,0,0,285,0,8,0,1,0
research,RESEARCH\vLex-Vincent-1-UNITED-STATES-DISTRICT-COURT-WESTERN-DISTRICT-OF-OKLAHOMA-CHARLES-DUSTIN-MYERS------Plaintiff----- (1)-7a378085-1.pdf,extracted_research\vLex-Vincent-1-UNITED-STATES-DISTRICT-COURT-WESTERN-DISTRICT-OF-OKLAHOMA-CHARLES-DUSTIN-MYERS------Plaintiff----- (1)-7a378085-1.txt,,,383,72,12,5,0,0,285,0,8,0,1,0
research,RESEARCH\vLex-Vincent-1-UNITED-STATES-DISTRICT-COURT-WESTERN-DISTRICT-OF-OKLAHOMA-CHARLES-DUSTIN-MYERS------Plaintiff----- (1)-99bc8171-1.pdf,extracted_research\vLex-Vincent-1-UNITED-STATES-DISTRICT-COURT-WESTERN-DISTRICT-OF-OKLAHOMA-CHARLES-DUSTIN-MYERS------Plaintiff----- (1)-99bc8171-1.txt,,,383,72,12,5,0,0,285,0,8,0,1,0
research,RESEARCH\vLex-Vincent-The-wife-and-stepfather-may-argue-that-their-actions-were-part-of-a-domestic-dispute-rather-than-a-c (1)-1.pdf,extracted_research\vLex-Vincent-The-wife-and-stepfather-may-argue-that-their-actions-were-part-of-a-domestic-dispute-rather-than-a-c (1)-1.txt,,,382,25,9,0,0,1,342,1,4,0,0,0
research,RESEARCH\vLex-Vincent-The-wife-and-stepfather-may-argue-that-their-actions-were-part-of-a-domestic-dispute-rather-than-a-c (1)-3853df88-1.pdf,extracted_research\vLex-Vincent-The-wife-and-stepfather-may-argue-that-their-actions-were-part-of-a-domestic-dispute-rather-than-a-c (1)-3853df88-1.txt,,,382,25,9,0,0,1,342,1,4,0,0,0
research,RESEARCH\vLex-Vincent-The-wife-and-stepfather-may-argue-that-their-actions-were-part-of-a-domestic-dispute-rather-than-a-c-1.pdf,extracted_research\vLex-Vincent-The-wife-and-stepfather-may-argue-that-their-actions-were-part-of-a-domestic-dispute-rather-than-a-c-1.txt,,,382,25,9,0,0,1,342,1,4,0,0,0
research,RESEARCH\vLex-Vincent-The-wife-and-stepfather-may-argue-that-their-actions-were-part-of-a-domestic-dispute-rather-than-a-c-661709d0-1.pdf,extracted_research\vLex-Vincent-The-wife-and-stepfather-may-argue-that-their-actions-were-part-of-a-domestic-dispute-rather-than-a-c-661709d0-1.txt,,,382,25,9,0,0,1,342,1,4,0,0,0
research,RESEARCH\vLex-Vincent-TABLE-OF-CONTENTS-I--JURISDICTION-AND-VENUE-II--PARTIES-III--RECORD-REFERENCES-https---search-txcour (2)-1.pdf,extracted_research\vLex-Vincent-TABLE-OF-CONTENTS-I--JURISDICTION-AND-VENUE-II--PARTIES-III--RECORD-REFERENCES-https---search-txcour (2)-1.txt,,,377,122,31,4,0,0,183,4,10,11,2,10
research,RESEARCH\vLex-Vincent-If-a-defendant-in-oklahoma-conspires-with-someone-s-wife-in-texas-to-defraud-the-husband-of-his-prop-f835fe0b-1.pdf,extracted_research\vLex-Vincent-If-a-defendant-in-oklahoma-conspires-with-someone-s-wife-in-texas-to-defraud-the-husband-of-his-prop-f835fe0b-1.txt,,,375,82,10,2,0,0,281,0,0,0,0,0
research,RESEARCH\vLex-Vincent-If-a-defendant-in-oklahoma-conspires-with-someone-s-wife-in-texas-to-defraud-the-husband-of-his-prop-1.pdf,extracted_research\vLex-Vincent-If-a-defendant-in-oklahoma-conspires-with-someone-s-wife-in-texas-to-defraud-the-husband-of-his-prop-1.txt,,,368,87,10,0,0,0,271,0,0,0,0,0
research,RESEARCH\vLex-Vincent-V--STATEMENT-OF-FACTS--28--Plaintiff-realleges-and-incorporates-by-reference-the-allegations-contain-1.pdf,extracted_research\vLex-Vincent-V--STATEMENT-OF-FACTS--28--Plaintiff-realleges-and-incorporates-by-reference-the-allegations-contain-1.txt,,,366,109,3,0,0,0,254,0,0,0,0,0
research,RESEARCH\vLex-Vincent-TABLE-OF-CONTENTS-I--JURISDICTION-AND-VENUE-II--PARTIES-III--RECORD-REFERENCES-https---search-txcour (8)-1.pdf,extracted_research\vLex-Vincent-TABLE-OF-CONTENTS-I--JURISDICTION-AND-VENUE-II--PARTIES-III--RECORD-REFERENCES-https---search-txcour (8)-1.txt,,,363,105,43,3,0,0,158,4,31,7,1,11
research,RESEARCH\vLex-Vincent-IN-THE-UNITED-STATES-DISTRJCT-COURT-FOR-THE-WESTERN-DISTRJCT-OF-OKLAHOMA-CHARLES-DUSTIN-MYERS--Plain (1)-1.pdf,extracted_research\vLex-Vincent-IN-THE-UNITED-STATES-DISTRJCT-COURT-FOR-THE-WESTERN-DISTRJCT-OF-OKLAHOMA-CHARLES-DUSTIN-MYERS--Plain (1)-1.txt,,,356,105,9,5,0,0,228,0,8,0,1,0
case,CASE DOCS\04.04.24 NOTICE OF FILING ORIGINAL PROCEEDING-1.pdf,extracted_text\04.04.24 NOTICE OF FILING ORIGINAL PROCEEDING-1.txt,2024-04-04,,354,80,89,25,0,0,0,34,44,0,18,64
case,CASE DOCS\04.04.24 NOTICE OF FILING ORIGINAL PROCEEDING_compressed-1.pdf,extracted_text\04.04.24 NOTICE OF FILING ORIGINAL PROCEEDING_compressed-1.txt,2024-04-04,,354,80,89,25,0,0,0,34,44,0,18,64
research,RESEARCH\vLex-Vincent-The-Plaintiff-alleges-that-he-suffered-concrete-financial-harm--including-the-loss-of-his-home-and-b-1.pdf,extracted_research\vLex-Vincent-The-Plaintiff-alleges-that-he-suffered-concrete-financial-harm--including-the-loss-of-his-home-and-b-1.txt,,,353,45,13,0,0,0,295,0,0,0,0,0
research,RESEARCH\vLex-Vincent-What-claims-can-be-made-in-federal-court-under-diversity-jurisdiction-if-a-victim-sues-a-perpetrator-1.pdf,extracted_research\vLex-Vincent-What-claims-can-be-made-in-federal-court-under-diversity-jurisdiction-if-a-victim-sues-a-perpetrator-1.txt,,,353,113,13,1,0,1,0,0,225,0,0,0
research,RESEARCH\vLex-Vincent-What-claims-can-be-made-in-federal-court-under-diversity-jurisdiction-if-a-victim-sues-a-perpetrator-35ffda1e-1.pdf,extracted_research\vLex-Vincent-What-claims-can-be-made-in-federal-court-under-diversity-jurisdiction-if-a-victim-sues-a-perpetrator-35ffda1e-1.txt,,,353,113,13,1,0,1,0,0,225,0,0,0
research,RESEARCH\vLex-Vincent-IV--INTRODUCTION-14--This-civil-action-is-brought-under-the-Racketeer-Influenced-and-Corrupt-Organiz-1.pdf,extracted_research\vLex-Vincent-IV--INTRODUCTION-14--This-civil-action-is-brought-under-the-Racketeer-Influenced-and-Corrupt-Organiz-1.txt,,,342,90,9,0,0,0,241,0,2,0,0,0
research,RESEARCH\vLex-Vincent-Morgan-Michelle-Myers-transferred--1-576-across-state-lines-via-PayPal-from-Oklahoma-to-Daniel-Kenne-1.pdf,extracted_research\vLex-Vincent-Morgan-Michelle-Myers-transferred--1-576-across-state-lines-via-PayPal-from-Oklahoma-to-Daniel-Kenne-1.txt,,,340,51,6,0,0,0,266,0,17,0,0,0
research,RESEARCH\vLex-Vincent-Defendants-engaged-in-a-series-of-related-acts--wire-fraud--interstate-travel--perjury--threats--and (1)-1.pdf,extracted_research\vLex-Vincent-Defendants-engaged-in-a-series-of-related-acts--wire-fraud--interstate-travel--perjury--threats--and (1)-1.txt,,,338,30,8,0,0,0,300,0,0,0,0,0
research,RESEARCH\vLex-Vincent-Defendants-engaged-in-a-series-of-related-acts--wire-fraud--interstate-travel--perjury--threats--and-1.pdf,extracted_research\vLex-Vincent-Defendants-engaged-in-a-series-of-related-acts--wire-fraud--interstate-travel--perjury--threats--and-1.txt,,,338,30,8,0,0,0,300,0,0,0,0,0
research,RESEARCH\vLex-Vincent-Plaintiff-alleged-multiple-predicate-acts--wire-fraud--Travel-Act-violations--perjury-subornation-of-1.pdf,extracted_research\vLex-Vincent-Plaintiff-alleged-multiple-predicate-acts--wire-fraud--Travel-Act-violations--perjury-subornation-of-1.txt,,,331,48,37,0,0,0,245,0,1,0,0,0
research,RESEARCH\vLex-Vincent-The-wife-has-not-responded-to-or-defended-against-the-husband-s-claims-in-the-divorce-proceedings--a-1.pdf,extracted_research\vLex-Vincent-The-wife-has-not-responded-to-or-defended-against-the-husband-s-claims-in-the-divorce-proceedings--a-1.txt,,,324,47,22,0,0,0,253,0,0,0,0,2
research,RESEARCH\vLex-Vincent-What-is-the-relationship-test-under-RICO-in-the-10th-Circuit--1.pdf,extracted_research\vLex-Vincent-What-is-the-relationship-test-under-RICO-in-the-10th-Circuit--1.txt,,,312,17,10,0,0,1,281,0,3,0,0,0
research,RESEARCH\vLex-Vincent-------------------------II--TIMELINE-OF-EVENTS-BACKGROUND--Morgan-Michelle-Myers----Myers---and-Char-1.pdf,extracted_research\vLex-Vincent-------------------------II--TIMELINE-OF-EVENTS-BACKGROUND--Morgan-Michelle-Myers----Myers---and-Char-1.txt,,,311,43,16,4,0,0,230,4,4,3,0,7
case,CASE DOCS\04.08.24 - 02-24-00149-CV MANDAMUS-1.pdf,extracted_text\04.08.24 - 02-24-00149-CV MANDAMUS-1.txt,2024-04-08,02-24-00149-CV,310,80,76,25,0,0,1,42,41,0,12,33
case,CASE DOCS\04.08.24 - 2ND COA MANDAMUS-1.pdf,extracted_text\04.08.24 - 2ND COA MANDAMUS-1.txt,2024-04-08,,310,80,76,25,0,0,1,42,41,0,12,33
research,RESEARCH\vLex-Vincent-Plaintiff-alleged-that-after-the-initial-acts--wire-fraud--Travel-Act-violation---Defendants-continu-1.pdf,extracted_research\vLex-Vincent-Plaintiff-alleged-that-after-the-initial-acts--wire-fraud--Travel-Act-violation---Defendants-continu-1.txt,,,306,14,35,0,0,0,257,0,0,0,0,0
research,RESEARCH\vLex-Vincent-Is-it-proper-for-a-Texas-resident-to-sue-his-Oklahoma-step-father-in-law-in-federal-court-under-dive (1)-1.pdf,extracted_research\vLex-Vincent-Is-it-proper-for-a-Texas-resident-to-sue-his-Oklahoma-step-father-in-law-in-federal-court-under-dive (1)-1.txt,,,295,105,9,0,0,0,0,0,179,2,0,0
research,RESEARCH\vLex-Vincent-Is-it-proper-for-a-Texas-resident-to-sue-his-Oklahoma-step-father-in-law-in-federal-court-under-dive (1)-90a9fb65-1.pdf,extracted_research\vLex-Vincent-Is-it-proper-for-a-Texas-resident-to-sue-his-Oklahoma-step-father-in-law-in-federal-court-under-dive (1)-90a9fb65-1.txt,,,295,105,9,0,0,0,0,0,179,2,0,0
research,RESEARCH\vLex-Vincent-Is-it-proper-for-a-Texas-resident-to-sue-his-Oklahoma-step-father-in-law-in-federal-court-under-dive (1)-b5b7dca3-1.pdf,extracted_research\vLex-Vincent-Is-it-proper-for-a-Texas-resident-to-sue-his-Oklahoma-step-father-in-law-in-federal-court-under-dive (1)-b5b7dca3-1.txt,,,295,105,9,0,0,0,0,0,179,2,0,0
research,RESEARCH\vLex-Vincent-Is-it-proper-for-a-Texas-resident-to-sue-his-Oklahoma-step-father-in-law-in-federal-court-under-dive-1.pdf,extracted_research\vLex-Vincent-Is-it-proper-for-a-Texas-resident-to-sue-his-Oklahoma-step-father-in-law-in-federal-court-under-dive-1.txt,,,295,105,9,0,0,0,0,0,179,2,0,0
research,RESEARCH\vLex-Vincent-Is-it-proper-for-a-Texas-resident-to-sue-his-Oklahoma-step-father-in-law-in-federal-court-under-dive-53f71b49-1.pdf,extracted_research\vLex-Vincent-Is-it-proper-for-a-Texas-resident-to-sue-his-Oklahoma-step-father-in-law-in-federal-court-under-dive-53f71b49-1.txt,,,295,105,9,0,0,0,0,0,179,2,0,0
research,RESEARCH\vLex-Vincent-Is-it-proper-for-a-Texas-resident-to-sue-his-Oklahoma-step-father-in-law-in-federal-court-under-dive-68da3fc5-1.pdf,extracted_research\vLex-Vincent-Is-it-proper-for-a-Texas-resident-to-sue-his-Oklahoma-step-father-in-law-in-federal-court-under-dive-68da3fc5-1.txt,,,295,105,9,0,0,0,0,0,179,2,0,0
research,RESEARCH\vLex-Vincent-Morgan-was-in-Texas--and-Daniel-was-in-Oklahoma--and-their-scheme-involved-actions-across-state-line-1.pdf,extracted_research\vLex-Vincent-Morgan-was-in-Texas--and-Daniel-was-in-Oklahoma--and-their-scheme-involved-actions-across-state-line-1.txt,,,287,68,4,0,0,0,212,0,3,0,0,0
case,CASE DOCS\04.07.25 - Respondent's Notice of Intent to File Prohibition-1.pdf,extracted_text\04.07.25 - Respondent's Notice of Intent to File Prohibition-1.txt,2025-04-07,,282,2,83,0,0,0,0,6,115,0,6,70
research,RESEARCH\vLex-Vincent-Does-traveling-to-Oklahoma-to-prepare-fraudulent-documents-for-submission-in-Texas-state-courts-cons-1.pdf,extracted_research\vLex-Vincent-Does-traveling-to-Oklahoma-to-prepare-fraudulent-documents-for-submission-in-Texas-state-courts-cons-1.txt,,,276,80,5,0,0,0,190,0,1,0,0,0
research,RESEARCH\vLex-Vincent-The-complaint-details-a-coordinated-scheme-by-Myers--Branthoover--and-Wilson--including-specific-dat-1.pdf,extracted_research\vLex-Vincent-The-complaint-details-a-coordinated-scheme-by-Myers--Branthoover--and-Wilson--including-specific-dat-1.txt,,,276,44,13,0,0,2,217,0,0,0,0,0
case,CASE DOCS\05.02.25 - Mandamus Record (STONE)-1.pdf,extracted_text\05.02.25 - Mandamus Record (STONE)-1.txt,2025-05-02,,272,34,96,4,10,0,0,6,42,0,18,62
case,CASE DOCS\04.10.25 - 02-25-00164-CV MANDAMUS RECORD-1.pdf,extracted_text\04.10.25 - 02-25-00164-CV MANDAMUS RECORD-1.txt,2025-04-10,02-25-00164-CV,268,34,96,4,10,0,0,6,42,0,18,58
research,RESEARCH\vLex-Vincent--1-NO--25-0367-IN-THE-SUPREME-COURT-OF-TEXAS-IN-RE--CHARLES-DUSTIN-MYERS----------MOTION-FOR-REHEARI-1.pdf,extracted_research\vLex-Vincent--1-NO--25-0367-IN-THE-SUPREME-COURT-OF-TEXAS-IN-RE--CHARLES-DUSTIN-MYERS----------MOTION-FOR-REHEARI-1.txt,,25-0367,268,20,18,0,0,0,0,42,19,0,0,169
research,RESEARCH\vLex-Vincent-For-a-civil-RICO-claim-to-prevail--is-it-a-requirement-to-have-multiple-victims--or-are-there-except-1.pdf,extracted_research\vLex-Vincent-For-a-civil-RICO-claim-to-prevail--is-it-a-requirement-to-have-multiple-victims--or-are-there-except-1.txt,,,266,25,7,0,0,0,232,0,2,0,0,0
research,RESEARCH\vLex-Vincent-The-husband-lost-his-home--which-he-used-as-a-place-of-business--as-a-result-of-the-fraudulent-schem-1.pdf,extracted_research\vLex-Vincent-The-husband-lost-his-home--which-he-used-as-a-place-of-business--as-a-result-of-the-fraudulent-schem-1.txt,,,266,56,12,0,0,0,198,0,0,0,0,0
research,RESEARCH\vLex-Vincent-The-husband-lost-his-home--which-he-used-as-a-place-of-business--as-a-result-of-the-fraudulent-schem-a30115cd-1.pdf,extracted_research\vLex-Vincent-The-husband-lost-his-home--which-he-used-as-a-place-of-business--as-a-result-of-the-fraudulent-schem-a30115cd-1.txt,,,266,56,12,0,0,0,198,0,0,0,0,0
research,RESEARCH\vLex-Vincent-What-are-the-grounds-and-1.pdf,extracted_research\vLex-Vincent-What-are-the-grounds-and-1.txt,,,257,0,0,0,0,0,0,0,257,0,0,0
research,RESEARCH\vLex-Vincent-What-are-the-grounds-and-9c80da34-1.pdf,extracted_research\vLex-Vincent-What-are-the-grounds-and-9c80da34-1.txt,,,257,0,0,0,0,0,0,0,257,0,0,0
research,RESEARCH\vLex-Vincent-What-are-the-grounds-and-b36f34d8-1.pdf,extracted_research\vLex-Vincent-What-are-the-grounds-and-b36f34d8-1.txt,,,257,0,0,0,0,0,0,0,257,0,0,0
research,RESEARCH\vLex-Vincent-What-are-the-grounds-and-bbe16642-1.pdf,extracted_research\vLex-Vincent-What-are-the-grounds-and-bbe16642-1.txt,,,257,0,0,0,0,0,0,0,257,0,0,0
research,RESEARCH\vLex-Vincent-Defendants-made-ongoing-threats-to-Plaintiff--including-threats-of-future-criminal-activity--demonst-1.pdf,extracted_research\vLex-Vincent-Defendants-made-ongoing-threats-to-Plaintiff--including-threats-of-future-criminal-activity--demonst-1.txt,,,256,15,8,0,0,0,232,0,1,0,0,0
research,RESEARCH\vLex-Vincent-------------------------II--TIMELINE-OF-EVENTS-BACKGROUND--Morgan-Michelle-Myers----Myers---and-Char (2)-1.pdf,extracted_research\vLex-Vincent-------------------------II--TIMELINE-OF-EVENTS-BACKGROUND--Morgan-Michelle-Myers----Myers---and-Char (2)-1.txt,,,254,29,9,7,0,0,191,4,4,3,0,7
research,RESEARCH\vLex-Vincent-Myers-and-Branthoover-communicated-across-state-lines--Texas-and-Oklahoma--via-text-messages-and-pho-1.pdf,extracted_research\vLex-Vincent-Myers-and-Branthoover-communicated-across-state-lines--Texas-and-Oklahoma--via-text-messages-and-pho-1.txt,,,253,33,2,0,0,3,206,0,9,0,0,0
research,RESEARCH\vLex-Vincent-How-does-a-party-file-1.pdf,extracted_research\vLex-Vincent-How-does-a-party-file-1.txt,,,252,0,1,1,0,0,0,0,232,0,6,12
research,RESEARCH\vLex-Vincent-Charles-was-evicted-from-his-home-and-divested-of-custody-of-his-children-as-a-result-of-the-coordin-1.pdf,extracted_research\vLex-Vincent-Charles-was-evicted-from-his-home-and-divested-of-custody-of-his-children-as-a-result-of-the-coordin-1.txt,,,251,32,12,0,0,0,207,0,0,0,0,0
case,CASE DOCS\04.03.24 - EMERGENCY RELIEF - STAY_Redacted_3966607E-1.pdf,extracted_text\04.03.24 - EMERGENCY RELIEF - STAY_Redacted_3966607E-1.txt,2024-04-03,,250,50,68,15,0,0,1,32,32,0,12,40
case,CASE DOCS\04.03.24 - MOTION FOR EMERGENCY STAY-1.pdf,extracted_text\04.03.24 - MOTION FOR EMERGENCY STAY-1.txt,2024-04-03,,250,50,68,15,0,0,1,32,32,0,12,40
case,CASE DOCS\04.08.24 - 02-24-00149-CV EMERGENCY MOTION TO STAY-1.pdf,extracted_text\04.08.24 - 02-24-00149-CV EMERGENCY MOTION TO STAY-1.txt,2024-04-08,02-24-00149-CV,250,50,68,15,0,0,1,32,32,0,12,40
case,CASE DOCS\04.08.24 - 02-24-00149-CV MOTION FOR EMERGENCY STAY-1.pdf,extracted_text\04.08.24 - 02-24-00149-CV MOTION FOR EMERGENCY STAY-1.txt,2024-04-08,02-24-00149-CV,250,50,68,15,0,0,1,32,32,0,12,40
research,RESEARCH\vLex-Vincent-Charles-was-evicted-from-his-home--deprived-of-marital-funds--and-removed-from-his-business-as-a-dir-1.pdf,extracted_research\vLex-Vincent-Charles-was-evicted-from-his-home--deprived-of-marital-funds--and-removed-from-his-business-as-a-dir-1.txt,,,250,22,7,37,0,0,184,0,0,0,0,0
research,RESEARCH\vLex-Vincent-Charles-was-evicted-from-his-home--deprived-of-marital-funds--and-removed-from-his-business-as-a-dir-58e676f9-1.pdf,extracted_research\vLex-Vincent-Charles-was-evicted-from-his-home--deprived-of-marital-funds--and-removed-from-his-business-as-a-dir-58e676f9-1.txt,,,250,22,7,37,0,0,184,0,0,0,0,0
case,CASE DOCS\04.04.25 - Legal Analysis (Dismissal)-1.pdf,extracted_text\04.04.25 - Legal Analysis (Dismissal)-1.txt,2025-04-04,,248,8,77,4,12,10,0,4,75,0,4,54
case,CASE DOCS\04.08.24 - 02-24-00149-CV EMERGENCY MOTION TO STAY_compressed-1.pdf,extracted_text\04.08.24 - 02-24-00149-CV EMERGENCY MOTION TO STAY_compressed-1.txt,2024-04-08,02-24-00149-CV,248,50,67,15,0,0,0,32,32,0,12,40
case,CASE DOCS\04.24.2025 - PLEA TO THE JURISDICTION-1.pdf,extracted_text\04.24.2025 - PLEA TO THE JURISDICTION-1.txt,2025-04-24,,244,40,32,10,0,0,0,102,54,0,6,0
research,RESEARCH\vLex-Vincent-Plaintiff-was-unlawfully-removed-from-his-residence--which-he-relied-on-to-earn-a-living-for-his-fam-1.pdf,extracted_research\vLex-Vincent-Plaintiff-was-unlawfully-removed-from-his-residence--which-he-relied-on-to-earn-a-living-for-his-fam-1.txt,,,242,33,6,3,0,0,200,0,0,0,0,0
research,RESEARCH\vLex-Vincent-Plaintiff-s-allegations-describe-a-scheme-with-multiple-steps--ongoing-coordination--and-repeated-ac-1.pdf,extracted_research\vLex-Vincent-Plaintiff-s-allegations-describe-a-scheme-with-multiple-steps--ongoing-coordination--and-repeated-ac-1.txt,,,241,13,25,0,0,0,203,0,0,0,0,0
research,RESEARCH\vLex-Vincent-Defendants-Myers-and-Branthoover-exchanged-numerous-interstate-text-messages-and-emails--and-submitt-1.pdf,extracted_research\vLex-Vincent-Defendants-Myers-and-Branthoover-exchanged-numerous-interstate-text-messages-and-emails--and-submitt-1.txt,,,240,124,5,0,0,0,107,0,4,0,0,0
case,CASE DOCS\05.29.25 - 25-0361 THIRD AMENDED MOTION TO CONSOLIDATE-1.pdf,extracted_text\05.29.25 - 25-0361 THIRD AMENDED MOTION TO CONSOLIDATE-1.txt,2025-05-29,25-0361,236,16,44,10,4,0,0,40,16,0,0,106
research,RESEARCH\vLex-Vincent--The-Plaintiff-alleged-a-series-of-acts-spanning-from-December-2023-through-May-2025--including-wire-1.pdf,extracted_research\vLex-Vincent--The-Plaintiff-alleged-a-series-of-acts-spanning-from-December-2023-through-May-2025--including-wire-1.txt,,,236,15,7,0,0,1,213,0,0,0,0,0
research,RESEARCH\vLex-Vincent--The-Plaintiff-alleged-a-series-of-acts-spanning-from-December-2023-through-May-2025--including-wire-4318e941-1.pdf,extracted_research\vLex-Vincent--The-Plaintiff-alleged-a-series-of-acts-spanning-from-December-2023-through-May-2025--including-wire-4318e941-1.txt,,,236,15,7,0,0,1,213,0,0,0,0,0
research,RESEARCH\vLex-Vincent--The-Plaintiff-alleged-a-series-of-acts-spanning-from-December-2023-through-May-2025--including-wire-f8ac5d57-1.pdf,extracted_research\vLex-Vincent--The-Plaintiff-alleged-a-series-of-acts-spanning-from-December-2023-through-May-2025--including-wire-f8ac5d57-1.txt,,,236,15,7,0,0,1,213,0,0,0,0,0
research,RESEARCH\vLex-Vincent-A-mother-is-in-contact-with-her-stepfather-who-lives-in-oklahoma--he-helps-her-attempt-to-get-a-frau-1.pdf,extracted_research\vLex-Vincent-A-mother-is-in-contact-with-her-stepfather-who-lives-in-oklahoma--he-helps-her-attempt-to-get-a-frau-1.txt,,,235,99,8,1,0,0,23,1,103,0,0,0
research,RESEARCH\vLex-Vincent-The-complaint-alleges-racketeering-acts-and-threats-spanning-from-December-2023-through-at-least-May-1.pdf,extracted_research\vLex-Vincent-The-complaint-alleges-racketeering-acts-and-threats-spanning-from-December-2023-through-at-least-May-1.txt,,,234,9,16,0,0,0,207,0,2,0,0,0
research,RESEARCH\vLex-Vincent-The-state-court-judge-s-authority-was-strictly-limited-by-statute-or-rule--and-the-judge-acted-outsi-1.pdf,extracted_research\vLex-Vincent-The-state-court-judge-s-authority-was-strictly-limited-by-statute-or-rule--and-the-judge-acted-outsi-1.txt,,,233,0,15,0,0,2,0,0,216,0,0,0
case,CASE DOCS\05.19.25 - 25-0426 CASE MEMORANDUM-1.pdf,extracted_text\05.19.25 - 25-0426 CASE MEMORANDUM-1.txt,2025-05-19,25-0426,231,17,8,4,0,4,0,72,0,0,0,126
research,RESEARCH\vLex-Vincent-TIMELINE-OF-EVENTS-BACKGROUND-Morgan-Michelle-Myers----Myers---and-Charles-Dustin-Myers----Plaintiff-1.pdf,extracted_research\vLex-Vincent-TIMELINE-OF-EVENTS-BACKGROUND-Morgan-Michelle-Myers----Myers---and-Charles-Dustin-Myers----Plaintiff-1.txt,,,229,20,10,2,0,0,184,3,3,0,0,7
case,CASE DOCS\05.19.2025_CASE MEMORANDUM-1.pdf,extracted_text\05.19.2025_CASE MEMORANDUM-1.txt,2025-05-19,,228,17,8,4,0,3,0,72,0,0,0,124
research,RESEARCH\vLex-Vincent-IN-THE-MATTER-OF-THE-MARRIAGE-OF-MORGAN-MICHELLE-MYERS-AND-CHARLES-DUSTIN-MYERS-AND-IN-THE-INTEREST--1.pdf,extracted_research\vLex-Vincent-IN-THE-MATTER-OF-THE-MARRIAGE-OF-MORGAN-MICHELLE-MYERS-AND-CHARLES-DUSTIN-MYERS-AND-IN-THE-INTEREST--1.txt,,,228,33,27,0,0,0,18,52,32,0,0,66
case,CASE DOCS\04.18.24 - 02-24-00149-CV MOTION FOR REHEARING-1.pdf,extracted_text\04.18.24 - 02-24-00149-CV MOTION FOR REHEARING-1.txt,2024-04-18,02-24-00149-CV,227,50,65,12,0,0,0,21,33,0,4,42
research,RESEARCH\vLex-Vincent-Case-5-24-cv-01311-R-Document-18-Filed-06-30-25-Page-1-of-5-FILED-JUN-3-D-2025-IN-THE-UNITED-STATES--1.pdf,extracted_research\vLex-Vincent-Case-5-24-cv-01311-R-Document-18-Filed-06-30-25-Page-1-of-5-FILED-JUN-3-D-2025-IN-THE-UNITED-STATES--1.txt,2025-06-30,24-cv-01311-R;5-24-cv-01311,221,65,5,0,0,0,148,0,3,0,0,0
research,RESEARCH\vLex-Vincent-Case-5-24-cv-01311-R-Document-18-Filed-06-30-25-Page-1-of-5-FILED-JUN-3-D-2025-IN-THE-UNITED-STATES--13ed95c2-1.pdf,extracted_research\vLex-Vincent-Case-5-24-cv-01311-R-Document-18-Filed-06-30-25-Page-1-of-5-FILED-JUN-3-D-2025-IN-THE-UNITED-STATES--13ed95c2-1.txt,2025-06-30,24-cv-01311-R;5-24-cv-01311,221,65,5,0,0,0,148,0,3,0,0,0
research,RESEARCH\vLex-Vincent-In-a-civil-or-criminal-RICO-claim-under-U-S--federal-law--under-what-circumstances-can-perjury-serve-1.pdf,extracted_research\vLex-Vincent-In-a-civil-or-criminal-RICO-claim-under-U-S--federal-law--under-what-circumstances-can-perjury-serve-1.txt,,,218,85,5,0,0,0,128,0,0,0,0,0
case,CASE DOCS\04.25.2025_MOTION TO RECUSE-1.pdf,extracted_text\04.25.2025_MOTION TO RECUSE-1.txt,2025-04-25,,212,6,29,5,9,0,0,82,48,0,4,29
case,CASE DOCS\04.15.2025_02-25-00166-CV EMERGENCY STAY-1.pdf,extracted_text\04.15.2025_02-25-00166-CV EMERGENCY STAY-1.txt,2025-04-15,,211,0,44,2,0,0,0,16,47,0,4,98
research,RESEARCH\vLex-Vincent-II--JUDGE-KAITCER--ATTORNEY-COOPER-L--CARTER--AND-PETITONER-MORGAN-MICHELLE-MYERS---EXTORTION-AND-CO-1.pdf,extracted_research\vLex-Vincent-II--JUDGE-KAITCER--ATTORNEY-COOPER-L--CARTER--AND-PETITONER-MORGAN-MICHELLE-MYERS---EXTORTION-AND-CO-1.txt,,,206,11,1,4,1,0,29,2,154,0,1,3
case,CASE DOCS\05-04-2023-Agreed_Motion-1.pdf-1.pdf,extracted_text\05-04-2023-Agreed_Motion-1.pdf-1.txt,2023-05-04,04-2023,204,8,72,0,10,0,0,0,112,0,0,2
research,RESEARCH\vLex-Vincent-In-a-scenario-where-an-individual-travels-from-Texas-to-Oklahoma-to-prepare-fraudulent-divorce-paper-1.pdf,extracted_research\vLex-Vincent-In-a-scenario-where-an-individual-travels-from-Texas-to-Oklahoma-to-prepare-fraudulent-divorce-paper-1.txt,,,201,161,4,0,0,0,34,0,2,0,0,0
research,RESEARCH\vLex-Vincent-The-relevant-statute-or-local-rule-limits-the-authority-of-associate-judges-to-conduct-initial-heari-1.pdf,extracted_research\vLex-Vincent-The-relevant-statute-or-local-rule-limits-the-authority-of-associate-judges-to-conduct-initial-heari-1.txt,,,195,90,42,0,1,13,0,27,20,0,2,0
research,RESEARCH\vLex-Vincent-The-father-has-exhausted-all-available-state-remedies--including-six-mandamus-petitions--and-has-bee-1.pdf,extracted_research\vLex-Vincent-The-father-has-exhausted-all-available-state-remedies--including-six-mandamus-petitions--and-has-bee-1.txt,,,194,94,5,0,0,33,0,24,3,26,3,6
research,RESEARCH\vLex-Vincent-Does-traveling-to-Oklahoma-to-prepare-fraudulent-documents-for-submission-in-Texas-state-courts-sati-1.pdf,extracted_research\vLex-Vincent-Does-traveling-to-Oklahoma-to-prepare-fraudulent-documents-for-submission-in-Texas-state-courts-sati-1.txt,,,191,44,1,0,0,0,140,0,6,0,0,0
research,RESEARCH\vLex-Vincent--The-Plaintiff-alleged-that-after-the-initial-acts-in-December-2023-January-2024--the-Defendants-con-1.pdf,extracted_research\vLex-Vincent--The-Plaintiff-alleged-that-after-the-initial-acts-in-December-2023-January-2024--the-Defendants-con-1.txt,,,190,9,11,0,0,0,170,0,0,0,0,0
research,RESEARCH\vLex-Vincent--The-Plaintiff-alleged-that-after-the-initial-acts-in-December-2023-January-2024--the-Defendants-con-3a39b669-1.pdf,extracted_research\vLex-Vincent--The-Plaintiff-alleged-that-after-the-initial-acts-in-December-2023-January-2024--the-Defendants-con-3a39b669-1.txt,,,190,9,11,0,0,0,170,0,0,0,0,0
research,RESEARCH\vLex-Vincent--The-Plaintiff-alleged-that-after-the-initial-acts-in-December-2023-January-2024--the-Defendants-con-8b67d142-1.pdf,extracted_research\vLex-Vincent--The-Plaintiff-alleged-that-after-the-initial-acts-in-December-2023-January-2024--the-Defendants-con-8b67d142-1.txt,,,190,9,11,0,0,0,170,0,0,0,0,0
research,RESEARCH\vLex-Vincent-Defendants--fraudulent-actions-led-to-Plaintiff-being-evicted-from-his-home--which-also-served-as-hi-1.pdf,extracted_research\vLex-Vincent-Defendants--fraudulent-actions-led-to-Plaintiff-being-evicted-from-his-home--which-also-served-as-hi-1.txt,,,188,18,5,0,0,0,165,0,0,0,0,0
research,RESEARCH\vLex-Vincent-If-a-judge-in-Texas-deprived-a-litigant-of-their-home-and-property-without-a-hearing--issued-an-orde-1.pdf,extracted_research\vLex-Vincent-If-a-judge-in-Texas-deprived-a-litigant-of-their-home-and-property-without-a-hearing--issued-an-orde-1.txt,,,188,10,0,4,0,0,0,174,0,0,0,0
research,RESEARCH\vLex-Vincent-If-a-judge-in-Texas-deprived-a-litigant-of-their-home-and-property-without-a-hearing--issued-an-orde-a63d3a48-1.pdf,extracted_research\vLex-Vincent-If-a-judge-in-Texas-deprived-a-litigant-of-their-home-and-property-without-a-hearing--issued-an-orde-a63d3a48-1.txt,,,188,10,0,4,0,0,0,174,0,0,0,0
case,CASE DOCS\12.02.2024_NOTICE OF REMOVAL TO THE ND OF TEXAS-1.pdf,extracted_text\12.02.2024_NOTICE OF REMOVAL TO THE ND OF TEXAS-1.txt,2024-12-02,,186,59,13,16,4,0,0,34,27,30,2,1
research,RESEARCH\vLex-Vincent-What-elements-must-be-pled-to-establish-a-violation-of-the-Travel-Act--18-U-S-C----1952--as-a-predic-1.pdf,extracted_research\vLex-Vincent-What-elements-must-be-pled-to-establish-a-violation-of-the-Travel-Act--18-U-S-C----1952--as-a-predic-1.txt,,,185,86,5,0,0,2,92,0,0,0,0,0
research,RESEARCH\vLex-Vincent-What-elements-must-be-pled-to-establish-a-violation-of-the-Travel-Act--18-U-S-C----1952--as-a-predic-276509d5-1.pdf,extracted_research\vLex-Vincent-What-elements-must-be-pled-to-establish-a-violation-of-the-Travel-Act--18-U-S-C----1952--as-a-predic-276509d5-1.txt,,,185,86,5,0,0,2,92,0,0,0,0,0
case,CASE DOCS\12.02.24 - NOTICE OF REMOVAL NORTHERN TEXAS.pdf,extracted_text\12.02.24 - NOTICE OF REMOVAL NORTHERN TEXAS.txt,2024-12-02,,184,59,13,14,4,0,0,34,27,30,2,1
case,CASE DOCS\05.08.2025_FIRST AMENDED MOTION TO CONSOLIDATE CAUSE NUMBERS 25-0361 25-0367 and 25-0378-1.pdf,extracted_text\05.08.2025_FIRST AMENDED MOTION TO CONSOLIDATE CAUSE NUMBERS 25-0361 25-0367 and 25-0378-1.txt,2025-05-08,25-0361;25-0367;25-0378,182,16,54,12,2,0,0,4,18,0,4,72
research,RESEARCH\vLex-Vincent-The-respondent-was-removed-from-his-home-and-deprived-of-property-without-a-protective-order-being-r-1.pdf,extracted_research\vLex-Vincent-The-respondent-was-removed-from-his-home-and-deprived-of-property-without-a-protective-order-being-r-1.txt,,,182,17,0,21,0,5,0,138,1,0,0,0
research,RESEARCH\vLex-Vincent-Judicial-immunity-is-intended-to-protect-independent-judicial-decision-making--not-to-shield-judges--1.pdf,extracted_research\vLex-Vincent-Judicial-immunity-is-intended-to-protect-independent-judicial-decision-making--not-to-shield-judges--1.txt,,,180,11,22,0,0,7,0,0,140,0,0,0
research,RESEARCH\vLex-Vincent-------------------------II--TIMELINE-OF-EVENTS-BACKGROUND--Morgan-Michelle-Myers----Myers---and-Char (1)-1.pdf,extracted_research\vLex-Vincent-------------------------II--TIMELINE-OF-EVENTS-BACKGROUND--Morgan-Michelle-Myers----Myers---and-Char (1)-1.txt,,,178,24,8,2,0,0,126,4,4,3,0,7
research,RESEARCH\vLex-Vincent-The-complainant-was-denied-the-opportunity-to-be-heard-on-an-emergency-matter-affecting-the-safety-a-1.pdf,extracted_research\vLex-Vincent-The-complainant-was-denied-the-opportunity-to-be-heard-on-an-emergency-matter-affecting-the-safety-a-1.txt,,,177,18,1,6,0,0,0,145,6,0,0,1
research,RESEARCH\vLex-Vincent-The-complainant-was-denied-the-opportunity-to-be-heard-on-an-emergency-matter-affecting-the-safety-a-48577571-1.pdf,extracted_research\vLex-Vincent-The-complainant-was-denied-the-opportunity-to-be-heard-on-an-emergency-matter-affecting-the-safety-a-48577571-1.txt,,,177,18,1,6,0,0,0,145,6,0,0,1
research,RESEARCH\vLex-Vincent-The-complainant-was-denied-the-opportunity-to-be-heard-on-an-emergency-matter-affecting-the-safety-a-c1386140-1.pdf,extracted_research\vLex-Vincent-The-complainant-was-denied-the-opportunity-to-be-heard-on-an-emergency-matter-affecting-the-safety-a-c1386140-1.txt,,,177,18,1,6,0,0,0,145,6,0,0,1
case,CASE DOCS\04.14.25 - 02-25-00166-CV MANDAMUS-1.pdf,extracted_text\04.14.25 - 02-25-00166-CV MANDAMUS-1.txt,2025-04-14,02-25-00166-CV,173,40,42,2,0,0,0,22,17,0,8,42
case,CASE DOCS\04.01.25 - Petitioner's Statement (233)-1.pdf,extracted_text\04.01.25 - Petitioner's Statement (233)-1.txt,2025-04-01,,171,8,67,2,22,12,0,8,42,0,0,10
case,CASE DOCS\04.10.25 - 02-25-00164-CV MANDAMUS-1.pdf,extracted_text\04.10.25 - 02-25-00164-CV MANDAMUS-1.txt,2025-04-10,02-25-00164-CV,171,30,36,2,0,0,0,2,45,0,10,46
case,CASE DOCS\05.02.25 - Stone Mandamus-1.pdf,extracted_text\05.02.25 - Stone Mandamus-1.txt,2025-05-02,,171,30,18,2,0,0,0,28,31,0,8,54
research,RESEARCH\vLex-Vincent--1--From-December-2023-through-at-least-August-2025--a-group-of-individuals-Morgan-Michelle-Myers--D-1.pdf,extracted_research\vLex-Vincent--1--From-December-2023-through-at-least-August-2025--a-group-of-individuals-Morgan-Michelle-Myers--D-1.txt,,,171,24,10,2,0,0,120,5,3,0,0,7
case,CASE DOCS\05.02.25 - 25-0367 MANDAMUS-1.pdf,extracted_text\05.02.25 - 25-0367 MANDAMUS-1.txt,2025-05-02,25-0367,169,30,18,2,0,0,0,28,31,0,8,52
research,RESEARCH\vLex-Vincent-Research-case-law-on-void-1.pdf,extracted_research\vLex-Vincent-Research-case-law-on-void-1.txt,,,169,1,1,0,0,1,0,23,130,0,4,9
research,RESEARCH\vLex-Vincent-Research-case-law-on-void-2c66ca00-1.pdf,extracted_research\vLex-Vincent-Research-case-law-on-void-2c66ca00-1.txt,,,169,1,1,0,0,1,0,23,130,0,4,9
research,RESEARCH\vLex-Vincent-Research-case-law-on-void-2f60df0a-1.pdf,extracted_research\vLex-Vincent-Research-case-law-on-void-2f60df0a-1.txt,,,169,1,1,0,0,1,0,23,130,0,4,9
case,CASE DOCS\12.02.24 - NOTICE OF REMOVAL-1.pdf,extracted_text\12.02.24 - NOTICE OF REMOVAL-1.txt,2024-12-02,,168,50,10,14,4,0,0,34,24,30,2,0
research,RESEARCH\vLex-Vincent--The-court-s-order-did-not-fully-address-the-ongoing-nature-of-the-enterprise--the-risk-of-further-p-1.pdf,extracted_research\vLex-Vincent--The-court-s-order-did-not-fully-address-the-ongoing-nature-of-the-enterprise--the-risk-of-further-p-1.txt,,,168,3,11,0,0,0,153,0,1,0,0,0
case,CASE DOCS\05.23.25 - Second Amended Motion for Consolidation-1.pdf,extracted_text\05.23.25 - Second Amended Motion for Consolidation-1.txt,2025-05-23,,166,16,44,10,4,0,0,12,14,0,0,66
research,RESEARCH\vLex-Vincent-If-requesting-service-by-U-S--Marshals-and-filing-in-Oklahoma-federal-court--how-can-service-be-effe-1.pdf,extracted_research\vLex-Vincent-If-requesting-service-by-U-S--Marshals-and-filing-in-Oklahoma-federal-court--how-can-service-be-effe-1.txt,,,166,144,10,0,0,0,0,2,10,0,0,0
research,RESEARCH\vLex-Vincent-Is-the-plaintiff-required-to-1.pdf,extracted_research\vLex-Vincent-Is-the-plaintiff-required-to-1.txt,,,165,67,6,13,67,0,0,0,12,0,0,0
research,RESEARCH\vLex-Vincent-Is-the-plaintiff-required-to-6cb460aa-1.pdf,extracted_research\vLex-Vincent-Is-the-plaintiff-required-to-6cb460aa-1.txt,,,165,67,6,13,67,0,0,0,12,0,0,0
research,RESEARCH\vLex-Vincent-Is-the-plaintiff-required-to-bfcb2f2b-1.pdf,extracted_research\vLex-Vincent-Is-the-plaintiff-required-to-bfcb2f2b-1.txt,,,165,67,6,13,67,0,0,0,12,0,0,0
case,CASE DOCS\12.04.2024 Notice of Removal-1.pdf,extracted_text\12.04.2024 Notice of Removal-1.txt,2024-12-04,,164,48,8,16,2,0,0,36,22,30,2,0
research,RESEARCH\vLex-Vincent--The-First-Amended-Complaint--FAC--alleges-that-the-alleged-RICO-enterprise-s-broader-objective-frau-1.pdf,extracted_research\vLex-Vincent--The-First-Amended-Complaint--FAC--alleges-that-the-alleged-RICO-enterprise-s-broader-objective-frau-1.txt,,,161,7,8,3,0,0,143,0,0,0,0,0
research,RESEARCH\vLex-Vincent-If-an-objection-is-overruled-1.pdf,extracted_research\vLex-Vincent-If-an-objection-is-overruled-1.txt,,,161,0,0,0,0,0,0,0,2,0,0,159
research,RESEARCH\vLex-Vincent--Plaintiff-has-requested-leave-to-amend-to-add-new-facts--including-additional-threats-and-predicate-1.pdf,extracted_research\vLex-Vincent--Plaintiff-has-requested-leave-to-amend-to-add-new-facts--including-additional-threats-and-predicate-1.txt,,,160,95,35,0,1,1,27,0,1,0,0,0
case,CASE DOCS\05.07.25 - Newell Mandamus-1.pdf,extracted_text\05.07.25 - Newell Mandamus-1.txt,2025-05-07,,159,0,44,0,0,0,0,24,7,0,2,82
research,RESEARCH\vLex-Vincent--The-FAC-alleges-an-ongoing-enterprise--an-unfulfilled-objective--and-a-real-risk-of-further-predica-1.pdf,extracted_research\vLex-Vincent--The-FAC-alleges-an-ongoing-enterprise--an-unfulfilled-objective--and-a-real-risk-of-further-predica-1.txt,,,158,2,19,0,0,0,137,0,0,0,0,0
case,CASE DOCS\04.25.25 - MOTION TO RECUSE-1.pdf,extracted_text\04.25.25 - MOTION TO RECUSE-1.txt,2025-04-25,,156,6,21,5,10,0,0,68,36,0,4,6
case,CASE DOCS\04.25.25 - RECUSAL-1.pdf,extracted_text\04.25.25 - RECUSAL-1.txt,2025-04-25,,156,6,21,5,10,0,0,68,36,0,4,6
case,CASE DOCS\05.07.25 - 25-0378 MANDAMUS-1.pdf,extracted_text\05.07.25 - 25-0378 MANDAMUS-1.txt,2025-05-07,25-0378,156,0,44,0,0,0,0,23,7,0,2,80
case,CASE DOCS\05.01.25 - Kaitcer Mandamus Record-1.pdf,extracted_text\05.01.25 - Kaitcer Mandamus Record-1.txt,2025-05-01,,154,32,60,12,0,0,0,4,18,0,6,22
research,RESEARCH\vLex-Vincent-The-respondent-alleges-that-all-state-appellate-remedies--including-multiple-mandamus-petitions-and--1.pdf,extracted_research\vLex-Vincent-The-respondent-alleges-that-all-state-appellate-remedies--including-multiple-mandamus-petitions-and--1.txt,,,154,51,1,0,0,2,0,17,3,76,2,2
case,CASE DOCS\05.01.25 - 25-0361 MANDAMUS RECORD-1.pdf,extracted_text\05.01.25 - 25-0361 MANDAMUS RECORD-1.txt,2025-05-01,25-0361,151,32,59,12,0,0,0,4,18,0,6,20
research,RESEARCH\vLex-Vincent-A-litigant-walks-into-a-court-room-on-a-day-it-was-closed-due-to-inclement-weather--because-he-didnt-1.pdf,extracted_research\vLex-Vincent-A-litigant-walks-into-a-court-room-on-a-day-it-was-closed-due-to-inclement-weather--because-he-didnt-1.txt,,,146,24,1,2,1,0,0,112,0,0,0,6
research,RESEARCH\vLex-Vincent-In-Oklahoma-federal-court--can-a-victim-in-Texas-sue-for-deceit--conversion--intentional-infliction- (1)-1.pdf,extracted_research\vLex-Vincent-In-Oklahoma-federal-court--can-a-victim-in-Texas-sue-for-deceit--conversion--intentional-infliction- (1)-1.txt,,,146,65,0,0,0,0,0,0,81,0,0,0
research,RESEARCH\vLex-Vincent-In-Oklahoma-federal-court--can-a-victim-in-Texas-sue-for-deceit--conversion--intentional-infliction--1.pdf,extracted_research\vLex-Vincent-In-Oklahoma-federal-court--can-a-victim-in-Texas-sue-for-deceit--conversion--intentional-infliction--1.txt,,,146,65,0,0,0,0,0,0,81,0,0,0
research,RESEARCH\vLex-Vincent-I--Introduction-Within-the-last-23-days--four-mandamus-petitions-have-been-docketed-involving-the-sa-1.pdf,extracted_research\vLex-Vincent-I--Introduction-Within-the-last-23-days--four-mandamus-petitions-have-been-docketed-involving-the-sa-1.txt,,,145,8,17,5,2,0,0,2,9,0,0,102
case,CASE DOCS\04.14.25 - 02-25-00166-CV MANDAMUS RECORD-1.pdf,extracted_text\04.14.25 - 02-25-00166-CV MANDAMUS RECORD-1.txt,2025-04-14,02-25-00166-CV,143,32,59,12,0,0,0,4,18,0,6,12
research,RESEARCH\THEORETICAL PATHWAY TO FEDERAL RELEIEF.pdf,extracted_research\THEORETICAL PATHWAY TO FEDERAL RELEIEF.txt,,,143,69,3,0,0,2,0,35,18,5,11,0
case,CASE DOCS\08.29.25 - NOTICE OF INTENT TO COMMENCE FEDERAL ACTION-1.pdf,extracted_text\08.29.25 - NOTICE OF INTENT TO COMMENCE FEDERAL ACTION-1.txt,2025-08-29,,140,66,2,12,0,4,10,30,2,0,10,4
case,CASE DOCS\10.10.24 - ORDER OF REFERRAL KAITCER-1.pdf,extracted_text\10.10.24 - ORDER OF REFERRAL KAITCER-1.txt,2024-10-10,,139,32,59,2,0,0,0,16,16,0,10,4
research,RESEARCH\vLex-Vincent-The-court-ordered-the-user-02df880d-1.pdf,extracted_research\vLex-Vincent-The-court-ordered-the-user-02df880d-1.txt,,,139,14,0,0,1,0,0,122,0,0,1,1
research,RESEARCH\vLex-Vincent-The-court-ordered-the-user-1.pdf,extracted_research\vLex-Vincent-The-court-ordered-the-user-1.txt,,,139,14,0,0,1,0,0,122,0,0,1,1
research,RESEARCH\vLex-Vincent-The-court-ordered-the-user-5748fae8-1.pdf,extracted_research\vLex-Vincent-The-court-ordered-the-user-5748fae8-1.txt,,,139,14,0,0,1,0,0,122,0,0,1,1
research,RESEARCH\vLex-Vincent-The-court-ordered-the-user-dfef6451-1.pdf,extracted_research\vLex-Vincent-The-court-ordered-the-user-dfef6451-1.txt,,,139,14,0,0,1,0,0,122,0,0,1,1
research,RESEARCH\vLex-Vincent-Treat-the-following--and--tags-as-the-operative-record--Use-them-to-research-applicable-precedent-an (1)-1.pdf,extracted_research\vLex-Vincent-Treat-the-following--and--tags-as-the-operative-record--Use-them-to-research-applicable-precedent-an (1)-1.txt,,,139,1,5,3,1,0,0,7,30,0,0,92
research,RESEARCH\vLex-Vincent-Treat-the-following--and--tags-as-the-operative-record--Use-them-to-research-applicable-precedent-an (1)-810ef3c5-1.pdf,extracted_research\vLex-Vincent-Treat-the-following--and--tags-as-the-operative-record--Use-them-to-research-applicable-precedent-an (1)-810ef3c5-1.txt,,,139,1,5,3,1,0,0,7,30,0,0,92
research,RESEARCH\vLex-Vincent-Treat-the-following--and--tags-as-the-operative-record--Use-them-to-research-applicable-precedent-an-1.pdf,extracted_research\vLex-Vincent-Treat-the-following--and--tags-as-the-operative-record--Use-them-to-research-applicable-precedent-an-1.txt,,,139,1,5,3,1,0,0,7,30,0,0,92
research,RESEARCH\vLex-Vincent-Treat-the-following--and--tags-as-the-operative-record--Use-them-to-research-applicable-precedent-an-28802d1f-1.pdf,extracted_research\vLex-Vincent-Treat-the-following--and--tags-as-the-operative-record--Use-them-to-research-applicable-precedent-an-28802d1f-1.txt,,,139,1,5,3,1,0,0,7,30,0,0,92
case,CASE DOCS\06.10.25 - Notice of Related Federal RICO Litigation-1.pdf,extracted_text\06.10.25 - Notice of Related Federal RICO Litigation-1.txt,2025-06-10,,138,42,4,4,0,0,78,0,10,0,0,0
case,CASE DOCS\10.09.24 - AMENDED ORD. REFERRAL-1.pdf,extracted_text\10.09.24 - AMENDED ORD. REFERRAL-1.txt,2024-10-09,,138,32,58,2,0,0,0,16,16,0,10,4
case,CASE DOCS\10.10.24 - AMENDED ORDER OF REFERRAL (CERTIFIED)-1.pdf,extracted_text\10.10.24 - AMENDED ORDER OF REFERRAL (CERTIFIED)-1.txt,2024-10-10,,138,32,58,2,0,0,0,16,16,0,10,4
case,CASE DOCS\05.01.2025_25-0361 HON KAITCER MANDAMUS-1.pdf,extracted_text\05.01.2025_25-0361 HON KAITCER MANDAMUS-1.txt,2025-05-01,,137,30,30,0,0,0,0,0,25,0,4,48
research,RESEARCH\REFUSAL TO HEAR TRO.pdf,extracted_research\REFUSAL TO HEAR TRO.txt,,,134,12,2,0,0,0,0,66,1,0,14,39
research,RESEARCH\vLex-Vincent-322-744263-23-IN-THE-322ND-DISTRICT-COURT--OF-TARRANT-COUNTY--TEXAS--Morgan-Michelle-Myers-----------1.pdf,extracted_research\vLex-Vincent-322-744263-23-IN-THE-322ND-DISTRICT-COURT--OF-TARRANT-COUNTY--TEXAS--Morgan-Michelle-Myers-----------1.txt,,322-744263-23,134,15,1,1,0,0,9,0,107,0,0,1
case,CASE DOCS\05.01.25 - 25-0361 MANDAMUS-1.pdf,extracted_text\05.01.25 - 25-0361 MANDAMUS-1.txt,2025-05-01,25-0361,133,30,28,0,0,0,0,0,25,0,4,46
case,"CASE DOCS\04.11.25 - Validity of the February 1 and March 14 Reports and the March 26, 2024 Temporary Orders-1.pdf","extracted_text\04.11.25 - Validity of the February 1 and March 14 Reports and the March 26, 2024 Temporary Orders-1.txt",2025-04-11,,132,0,12,0,0,2,0,50,14,0,2,52
research,RESEARCH\vLex-Vincent-1-322-744263-23-IN-THE-322ND-DISTRICT-COURT-OF-TARRANT-COUNTY--TEXAS-ITMOMO--Morgan-Michelle-Myers-P-1-1.pdf,extracted_research\vLex-Vincent-1-322-744263-23-IN-THE-322ND-DISTRICT-COURT-OF-TARRANT-COUNTY--TEXAS-ITMOMO--Morgan-Michelle-Myers-P-1-1.txt,,322-744263-23,131,1,7,0,0,0,0,65,18,0,11,29
research,RESEARCH\vLex-Vincent-1-322-744263-23-IN-THE-322ND-DISTRICT-COURT-OF-TARRANT-COUNTY--TEXAS-ITMOMO--Morgan-Michelle-Myers-P-1.pdf,extracted_research\vLex-Vincent-1-322-744263-23-IN-THE-322ND-DISTRICT-COURT-OF-TARRANT-COUNTY--TEXAS-ITMOMO--Morgan-Michelle-Myers-P-1.txt,,322-744263-23,131,1,7,0,0,0,0,65,18,0,11,29
research,RESEARCH\vLex-Vincent-1-322-744263-23-IN-THE-322ND-DISTRICT-COURT-OF-TARRANT-COUNTY--TEXAS-ITMOMO--Morgan-Michelle-Myers-P-231dcef5-1.pdf,extracted_research\vLex-Vincent-1-322-744263-23-IN-THE-322ND-DISTRICT-COURT-OF-TARRANT-COUNTY--TEXAS-ITMOMO--Morgan-Michelle-Myers-P-231dcef5-1.txt,,322-744263-23,131,1,7,0,0,0,0,65,18,0,11,29
research,RESEARCH\vLex-Vincent-A-man-named-dan-branthoover--who-has-violated-protective-orders-in-the-past-and-falsified-government-1.pdf,extracted_research\vLex-Vincent-A-man-named-dan-branthoover--who-has-violated-protective-orders-in-the-past-and-falsified-government-1.txt,,,131,75,5,0,0,0,35,0,15,0,1,0
case,CASE DOCS\03.18.25 - APPLICATION FOR EMERGENCY TRO-1.pdf,extracted_text\03.18.25 - APPLICATION FOR EMERGENCY TRO-1.txt,2025-03-18,,129,30,15,14,0,0,0,0,30,0,40,0
case,CASE DOCS\10.07.24 - JOINT MOTION TO RECUSE (2)_compressed-1.pdf,extracted_text\10.07.24 - JOINT MOTION TO RECUSE (2)_compressed-1.txt,2024-10-07,,128,32,48,2,0,0,0,16,16,0,10,4
research,RESEARCH\vLex-Vincent--The-initial-removal-from-the-home-was-done-without-any-evidentiary-hearing--findings-of-fact--or-op-1.pdf,extracted_research\vLex-Vincent--The-initial-removal-from-the-home-was-done-without-any-evidentiary-hearing--findings-of-fact--or-op-1.txt,,,128,13,1,37,2,2,0,59,6,0,0,8
research,RESEARCH\vLex-Vincent--The-initial-removal-from-the-home-was-done-without-any-evidentiary-hearing--findings-of-fact--or-op-90921434-1.pdf,extracted_research\vLex-Vincent--The-initial-removal-from-the-home-was-done-without-any-evidentiary-hearing--findings-of-fact--or-op-90921434-1.txt,,,128,13,1,37,2,2,0,59,6,0,0,8
research,RESEARCH\vLex-Vincent--The-initial-removal-from-the-home-was-done-without-any-evidentiary-hearing--findings-of-fact--or-op-d70bd90a-1.pdf,extracted_research\vLex-Vincent--The-initial-removal-from-the-home-was-done-without-any-evidentiary-hearing--findings-of-fact--or-op-d70bd90a-1.txt,,,128,13,1,37,2,2,0,59,6,0,0,8
research,RESEARCH\vLex-Vincent-Answer-Short-response-The-litigant-has-a-strong-ultra-vires-claim-because-the-court-and-its-officers-1.pdf,extracted_research\vLex-Vincent-Answer-Short-response-The-litigant-has-a-strong-ultra-vires-claim-because-the-court-and-its-officers-1.txt,,,128,2,3,0,0,0,0,73,11,1,31,7
research,RESEARCH\vLex-Vincent-Answer-Short-response-The-litigant-has-a-strong-ultra-vires-claim-because-the-court-and-its-officers-7e477a31-1.pdf,extracted_research\vLex-Vincent-Answer-Short-response-The-litigant-has-a-strong-ultra-vires-claim-because-the-court-and-its-officers-7e477a31-1.txt,,,128,2,3,0,0,0,0,73,11,1,31,7
research,RESEARCH\vLex-Vincent-Answer-Short-response-The-local-rule-requiring-all-briefs--proposed-orders--and-judgments-to-be-pres-1.pdf,extracted_research\vLex-Vincent-Answer-Short-response-The-local-rule-requiring-all-briefs--proposed-orders--and-judgments-to-be-pres-1.txt,,,128,4,13,0,0,0,0,13,49,0,5,44
research,RESEARCH\vLex-Vincent-Answer-Short-response-The-local-rule-requiring-all-briefs--proposed-orders--and-judgments-to-be-pres-b93e1178-1.pdf,extracted_research\vLex-Vincent-Answer-Short-response-The-local-rule-requiring-all-briefs--proposed-orders--and-judgments-to-be-pres-b93e1178-1.txt,,,128,4,13,0,0,0,0,13,49,0,5,44
research,RESEARCH\vLex-Vincent-1-NO--25-_____-IN-THE-SUPREME-COURT-OF-TEXAS-IN-RE--CHARLES-DUSTIN-MYERS--RELATOR--On-Petition-for-W (1)-1.pdf,extracted_research\vLex-Vincent-1-NO--25-_____-IN-THE-SUPREME-COURT-OF-TEXAS-IN-RE--CHARLES-DUSTIN-MYERS--RELATOR--On-Petition-for-W (1)-1.txt,,,127,0,22,0,0,0,0,27,4,0,1,73
research,RESEARCH\vLex-Vincent-1-NO--25-_____-IN-THE-SUPREME-COURT-OF-TEXAS-IN-RE--CHARLES-DUSTIN-MYERS--RELATOR--On-Petition-for-W (1)-bd4f9e1a-1.pdf,extracted_research\vLex-Vincent-1-NO--25-_____-IN-THE-SUPREME-COURT-OF-TEXAS-IN-RE--CHARLES-DUSTIN-MYERS--RELATOR--On-Petition-for-W (1)-bd4f9e1a-1.txt,,,127,0,22,0,0,0,0,27,4,0,1,73
research,RESEARCH\vLex-Vincent-An-associate-judge-presided-over-a-motion-that-was-filed-as-a-de-novo-request-following-a-prior-hear-1.pdf,extracted_research\vLex-Vincent-An-associate-judge-presided-over-a-motion-that-was-filed-as-a-de-novo-request-following-a-prior-hear-1.txt,,,126,45,35,0,3,0,0,24,19,0,0,0
case,CASE DOCS\10.30.25 - PETITION FOR WRIT OF MANDAMUS AND APPENDIX.pdf,extracted_text\10.30.25 - PETITION FOR WRIT OF MANDAMUS AND APPENDIX.txt,2025-10-30,,125,30,36,0,4,0,0,6,17,0,4,28
case,CASE DOCS\04.15.2025_PROCEDURAL IRREGULARITIES WITH TEMPORARY ORDERS-1.pdf,extracted_text\04.15.2025_PROCEDURAL IRREGULARITIES WITH TEMPORARY ORDERS-1.txt,2025-04-15,,122,0,18,0,0,0,0,46,14,0,2,42
case,CASE DOCS\04.07.25 - MOTION TO VACATE-1.pdf,extracted_text\04.07.25 - MOTION TO VACATE-1.txt,2025-04-07,,120,0,16,0,0,0,0,46,14,0,2,42
case,CASE DOCS\04.16.2025_02-25-00171-CV - MANDAMUS CONSOLIDATION-1.pdf,extracted_text\04.16.2025_02-25-00171-CV - MANDAMUS CONSOLIDATION-1.txt,2025-04-16,,119,0,28,2,0,0,0,12,11,0,4,62
research,RESEARCH\vLex-Vincent-Does-a-defendant's-prior-answer-1.pdf,extracted_research\vLex-Vincent-Does-a-defendant's-prior-answer-1.txt,,,119,17,6,18,50,0,0,0,28,0,0,0
research,RESEARCH\vLex-Vincent-Does-a-defendant's-prior-answer-3794fd11-1.pdf,extracted_research\vLex-Vincent-Does-a-defendant's-prior-answer-3794fd11-1.txt,,,119,17,6,18,50,0,0,0,28,0,0,0
research,RESEARCH\vLex-Vincent-Does-a-defendant's-prior-answer-9442652a-1.pdf,extracted_research\vLex-Vincent-Does-a-defendant's-prior-answer-9442652a-1.txt,,,119,17,6,18,50,0,0,0,28,0,0,0
case,CASE DOCS\11.12.24 - NOTICE OF INTENT TO REMOVE-1.pdf,extracted_text\11.12.24 - NOTICE OF INTENT TO REMOVE-1.txt,2024-11-12,,118,40,8,18,0,0,0,24,8,20,0,0
case,CASE DOCS\11.13.24 - NOTICE OF INTENT TO REMOVE-1.pdf,extracted_text\11.13.24 - NOTICE OF INTENT TO REMOVE-1.txt,2024-11-13,,118,40,8,18,0,0,0,24,8,20,0,0
research,RESEARCH\vLex-Vincent-On-January-16--2024--the-Respondent-was-ordered-to-vacate-his-home-and-business-premises-based-on-cl-1.pdf,extracted_research\vLex-Vincent-On-January-16--2024--the-Respondent-was-ordered-to-vacate-his-home-and-business-premises-based-on-cl-1.txt,,,118,21,2,0,0,10,0,37,41,0,6,1
case,CASE DOCS\03.14.24 - AJ Rep-1.pdf,extracted_text\03.14.24 - AJ Rep-1.txt,2024-03-14,,117,44,28,10,0,0,0,16,12,0,4,3
case,CASE DOCS\04.12.25 - MARCH 26 ORDERS ANALYSIS-1.pdf,extracted_text\04.12.25 - MARCH 26 ORDERS ANALYSIS-1.txt,2025-04-12,,116,0,14,0,0,0,0,44,14,0,2,42
case,CASE DOCS\11.13.2024_NOTICE OF INTENT TO REMOVE-1.pdf,extracted_text\11.13.2024_NOTICE OF INTENT TO REMOVE-1.txt,2024-11-13,,116,40,6,18,0,0,0,24,8,20,0,0
research,RESEARCH\vLex-Vincent-1-NO--25-_____-IN-THE-SUPREME-COURT-OF-TEXAS-IN-RE--CHARLES-DUSTIN-MYERS--RELATOR--On-Petition-for-W (2)-1.pdf,extracted_research\vLex-Vincent-1-NO--25-_____-IN-THE-SUPREME-COURT-OF-TEXAS-IN-RE--CHARLES-DUSTIN-MYERS--RELATOR--On-Petition-for-W (2)-1.txt,,,116,16,8,1,0,0,0,39,9,0,4,39
research,RESEARCH\vLex-Vincent-1-NO--25-_____-IN-THE-SUPREME-COURT-OF-TEXAS-IN-RE--CHARLES-DUSTIN-MYERS--RELATOR--On-Petition-for-W (2)-a44b26f2-1.pdf,extracted_research\vLex-Vincent-1-NO--25-_____-IN-THE-SUPREME-COURT-OF-TEXAS-IN-RE--CHARLES-DUSTIN-MYERS--RELATOR--On-Petition-for-W (2)-a44b26f2-1.txt,,,116,16,8,1,0,0,0,39,9,0,4,39
research,RESEARCH\vLex-Vincent-1-NO--25-_____-IN-THE-SUPREME-COURT-OF-TEXAS-IN-RE--CHARLES-DUSTIN-MYERS--RELATOR--On-Petition-for-W-1.pdf,extracted_research\vLex-Vincent-1-NO--25-_____-IN-THE-SUPREME-COURT-OF-TEXAS-IN-RE--CHARLES-DUSTIN-MYERS--RELATOR--On-Petition-for-W-1.txt,,,116,16,8,1,0,0,0,39,9,0,4,39
research,RESEARCH\vLex-Vincent-1-NO--25-_____-IN-THE-SUPREME-COURT-OF-TEXAS-IN-RE--CHARLES-DUSTIN-MYERS--RELATOR--On-Petition-for-W-60b47d43-1.pdf,extracted_research\vLex-Vincent-1-NO--25-_____-IN-THE-SUPREME-COURT-OF-TEXAS-IN-RE--CHARLES-DUSTIN-MYERS--RELATOR--On-Petition-for-W-60b47d43-1.txt,,,116,16,8,1,0,0,0,39,9,0,4,39
research,RESEARCH\vLex-Vincent-Charles-Dustin-Myers (1)-1.pdf,extracted_research\vLex-Vincent-Charles-Dustin-Myers (1)-1.txt,,,115,5,6,8,2,0,0,1,15,0,0,78
case,CASE DOCS\04.04.24 - 00149 MANDAMUS-1.pdf,extracted_text\04.04.24 - 00149 MANDAMUS-1.txt,2024-04-04,,114,0,24,0,0,0,0,2,12,0,2,74
research,RESEARCH\vLex-Vincent--I--Introduction-Within-the-last-23-days--four-mandamus-petitions-have-been-docketed-involving-the-s-1.pdf,extracted_research\vLex-Vincent--I--Introduction-Within-the-last-23-days--four-mandamus-petitions-have-been-docketed-involving-the-s-1.txt,,,114,8,16,5,2,1,0,17,16,0,0,49
case,CASE DOCS\03.24.2025_233-765358-25 EMERGENCY TRO AND ORDER SETTING HEARING-1.pdf,extracted_text\03.24.2025_233-765358-25 EMERGENCY TRO AND ORDER SETTING HEARING-1.txt,2025-03-24,,113,0,38,4,6,0,0,4,38,0,13,10
case,CASE DOCS\04.15.2025_02-25-00166-CV MANDAMUS VOID ORDER-1.pdf,extracted_text\04.15.2025_02-25-00166-CV MANDAMUS VOID ORDER-1.txt,2025-04-15,,113,10,20,2,0,0,0,22,11,0,4,44
research,RESEARCH\vLex-Vincent--The-divorce-litigation-is-ongoing--the-final-trial-is-still-pending--and-the-FAC-alleges-a-real-ris-1.pdf,extracted_research\vLex-Vincent--The-divorce-litigation-is-ongoing--the-final-trial-is-still-pending--and-the-FAC-alleges-a-real-ris-1.txt,,,113,3,3,0,0,0,106,0,1,0,0,0
research,RESEARCH\vLex-Vincent-Answer-Short-response-The-unprecedented-treatment-described-in-the-provided-record-including-apparen-1.pdf,extracted_research\vLex-Vincent-Answer-Short-response-The-unprecedented-treatment-described-in-the-provided-record-including-apparen-1.txt,,,113,4,0,11,0,0,0,87,7,0,2,2
research,RESEARCH\vLex-Vincent-Answer-Short-response-The-unprecedented-treatment-described-in-the-provided-record-including-apparen-68d59124-1.pdf,extracted_research\vLex-Vincent-Answer-Short-response-The-unprecedented-treatment-described-in-the-provided-record-including-apparen-68d59124-1.txt,,,113,4,0,11,0,0,0,87,7,0,2,2
research,RESEARCH\vLex-Vincent-The-Petitioner-and-her-attorney-allegedly-secured-temporary-orders-through-fraudulent-misrepresentat-1.pdf,extracted_research\vLex-Vincent-The-Petitioner-and-her-attorney-allegedly-secured-temporary-orders-through-fraudulent-misrepresentat-1.txt,,,113,22,2,0,0,10,0,23,53,0,2,1
research,RESEARCH\vLex-Vincent-I--Introduction-Within-the-last-23-days--four-mandamus-petitions-have-been-docketed-involving-the-sa (1)-1.pdf,extracted_research\vLex-Vincent-I--Introduction-Within-the-last-23-days--four-mandamus-petitions-have-been-docketed-involving-the-sa (1)-1.txt,,,110,8,17,6,3,1,0,26,8,0,0,41
research,RESEARCH\vLex-Vincent-What-potential-federal-legal-violations-could-arise-if--prior-to-filing-for-divorce--a-wife-transfer-1.pdf,extracted_research\vLex-Vincent-What-potential-federal-legal-violations-could-arise-if--prior-to-filing-for-divorce--a-wife-transfer-1.txt,,,110,108,1,0,0,0,0,0,1,0,0,0
research,RESEARCH\vLex-Vincent-What-potential-federal-legal-violations-could-arise-if--prior-to-filing-for-divorce--a-wife-transfer-feb18ee2-1.pdf,extracted_research\vLex-Vincent-What-potential-federal-legal-violations-could-arise-if--prior-to-filing-for-divorce--a-wife-transfer-feb18ee2-1.txt,,,110,108,1,0,0,0,0,0,1,0,0,0
research,RESEARCH\vLex-Vincent-Myers-transferred--1-576-from-a-joint-marital-account-to-Branthoover-s-PayPal-account--and-used-thos-1.pdf,extracted_research\vLex-Vincent-Myers-transferred--1-576-from-a-joint-marital-account-to-Branthoover-s-PayPal-account--and-used-thos-1.txt,,,109,94,6,0,0,0,9,0,0,0,0,0
research,RESEARCH\vLex-Vincent-The-Respondent-s-mandamus-petition-was-denied-without-explanation--and-the-Texas-Supreme-Court-denie-1.pdf,extracted_research\vLex-Vincent-The-Respondent-s-mandamus-petition-was-denied-without-explanation--and-the-Texas-Supreme-Court-denie-1.txt,,,109,27,2,0,0,13,0,20,40,0,3,4
case,CASE DOCS\03.31.25 - PETITIONER'S STATEMENT-1.pdf,extracted_text\03.31.25 - PETITIONER'S STATEMENT-1.txt,2025-03-31,,105,30,32,6,15,0,0,6,16,0,0,0
case,CASE DOCS\04.11.25 - NOTICE AND LEGAL ANALYSIS-1.pdf,extracted_text\04.11.25 - NOTICE AND LEGAL ANALYSIS-1.txt,2025-04-11,,104,0,10,0,0,0,0,16,34,0,2,42
research,RESEARCH\vLex-Vincent-The-goal-of-the-scheme-was-to-deceive-the-Texas-courts-and-remove-Morgan-s-husband-from-the-family-h-1.pdf,extracted_research\vLex-Vincent-The-goal-of-the-scheme-was-to-deceive-the-Texas-courts-and-remove-Morgan-s-husband-from-the-family-h-1.txt,,,102,47,4,0,0,0,51,0,0,0,0,0
case,CASE DOCS\05.19.25 - 0426 MANDAMUS-1.pdf,extracted_text\05.19.25 - 0426 MANDAMUS-1.txt,2025-05-19,,100,0,23,0,0,0,0,2,19,0,0,56
case,CASE DOCS\09.04.25 - NOTICE OF RICO COMPLAINT-1.pdf,extracted_text\09.04.25 - NOTICE OF RICO COMPLAINT-1.txt,2025-09-04,,100,14,2,0,0,0,54,0,28,0,0,2
case,CASE DOCS\05.27.25 - MANDAMUS CAYCE_5ACD0433.pdf,extracted_text\05.27.25 - MANDAMUS CAYCE_5ACD0433.txt,2025-05-27,,99,0,20,0,0,0,0,2,11,0,0,66
research,RESEARCH\vLex-Vincent-The-judge-issued-orders-on-a-day-the-court-was-publicly-closed--without-a-hearing--and-without-juris-1.pdf,extracted_research\vLex-Vincent-The-judge-issued-orders-on-a-day-the-court-was-publicly-closed--without-a-hearing--and-without-juris-1.txt,,,99,4,1,0,0,1,0,7,70,0,0,16
case,CASE DOCS\05.19.25 - 25-0426 MANDAMUS-1.pdf,extracted_text\05.19.25 - 25-0426 MANDAMUS-1.txt,2025-05-19,25-0426,98,0,23,0,0,0,0,2,19,0,0,54
research,RESEARCH\vLex-Vincent--The-FAC-specifically-pleads-ongoing-communications--threats--and-a-continuing-enterprise-with-a-ris-1.pdf,extracted_research\vLex-Vincent--The-FAC-specifically-pleads-ongoing-communications--threats--and-a-continuing-enterprise-with-a-ris-1.txt,,,98,5,12,0,0,0,79,0,2,0,0,0
research,RESEARCH\vLex-Vincent-Plaintiff-s-complaint-contains-detailed-factual-allegations-regarding-the-timing--nature--and-purpos-1.pdf,extracted_research\vLex-Vincent-Plaintiff-s-complaint-contains-detailed-factual-allegations-regarding-the-timing--nature--and-purpos-1.txt,,,98,11,40,0,0,0,46,0,1,0,0,0
research,RESEARCH\vLex-Vincent-The-Respondent-s-motion-to-recuse-was-altered-by-court-staff-before-being-forwarded-to-the-regional--1.pdf,extracted_research\vLex-Vincent-The-Respondent-s-motion-to-recuse-was-altered-by-court-staff-before-being-forwarded-to-the-regional--1.txt,,,98,17,2,1,0,14,0,34,22,0,7,1
research,RESEARCH\vLex-Vincent-There-is-no-final-divorce-decree-or-valid-court-order-in-place--the-orders-issued-are-facially-void--1.pdf,extracted_research\vLex-Vincent-There-is-no-final-divorce-decree-or-valid-court-order-in-place--the-orders-issued-are-facially-void--1.txt,,,98,0,1,0,0,0,0,0,97,0,0,0
case,CASE DOCS\07.28.25 - MOTION FOR REHEARING.pdf,extracted_text\07.28.25 - MOTION FOR REHEARING.txt,2025-07-28,,96,4,0,0,2,0,0,6,6,0,0,78
case,CASE DOCS\10.30.25 - CERTIFIED MANDAMUS RECORD.pdf,extracted_text\10.30.25 - CERTIFIED MANDAMUS RECORD.txt,2025-10-30,,96,30,40,4,0,0,0,4,10,0,4,4
research,RESEARCH\vLex-Vincent-You-filed-a-separate-SAPCR (1)-1.pdf,extracted_research\vLex-Vincent-You-filed-a-separate-SAPCR (1)-1.txt,,,95,0,5,0,0,0,0,57,33,0,0,0
research,RESEARCH\vLex-Vincent-You-filed-a-separate-SAPCR-1.pdf,extracted_research\vLex-Vincent-You-filed-a-separate-SAPCR-1.txt,,,95,0,5,0,0,0,0,57,33,0,0,0
research,RESEARCH\vLex-Vincent-You-filed-a-separate-SAPCR-4b67aeb3-1.pdf,extracted_research\vLex-Vincent-You-filed-a-separate-SAPCR-4b67aeb3-1.txt,,,95,0,5,0,0,0,0,57,33,0,0,0
research,RESEARCH\vLex-Vincent-You-filed-a-separate-SAPCR-682c97de-1.pdf,extracted_research\vLex-Vincent-You-filed-a-separate-SAPCR-682c97de-1.txt,,,95,0,5,0,0,0,0,57,33,0,0,0
research,RESEARCH\Vlex - Parental Rights-1.pdf,extracted_research\Vlex - Parental Rights-1.txt,,,94,0,4,7,0,0,0,15,57,0,2,9
case,CASE DOCS\04.08.24 - Mandamus-1.pdf,extracted_text\04.08.24 - Mandamus-1.txt,2024-04-08,,93,0,14,16,0,0,0,12,7,0,2,42
case,CASE DOCS\09.10.24 - 24-0395 MANDAMUS REHEARING-1.pdf,extracted_text\09.10.24 - 24-0395 MANDAMUS REHEARING-1.txt,2024-09-10,24-0395,93,15,17,2,2,4,0,16,7,0,24,6
case,CASE DOCS\09.12.24 24-0395 Rehearing-1.pdf,extracted_text\09.12.24 24-0395 Rehearing-1.txt,2024-09-12,24-0395,93,15,17,2,2,4,0,16,7,0,24,6
case,CASE DOCS\03.18.25 - SAPCR  COVER-1.pdf,extracted_text\03.18.25 - SAPCR  COVER-1.txt,2025-03-18,,92,8,18,0,16,0,0,4,36,0,6,4
case,CASE DOCS\04.15.25 - ORIGINAL SAPCR COVER LETTER-1.pdf,extracted_text\04.15.25 - ORIGINAL SAPCR COVER LETTER-1.txt,2025-04-15,,92,8,18,0,16,0,0,4,36,0,6,4
research,RESEARCH\vLex-Vincent---1--The-Respondent--Charles-Dustin-Myers--filed-a-motion-to-recuse-the-Regional-Presiding-Judge--Da-1.pdf,extracted_research\vLex-Vincent---1--The-Respondent--Charles-Dustin-Myers--filed-a-motion-to-recuse-the-Regional-Presiding-Judge--Da-1.txt,,,92,0,4,2,0,0,9,2,2,0,0,73
research,RESEARCH\vLex-Vincent-The-associate-judge-in-the-Texas-family-law-case-acted-without-a-valid-order-of-referral--as-require-1.pdf,extracted_research\vLex-Vincent-The-associate-judge-in-the-Texas-family-law-case-acted-without-a-valid-order-of-referral--as-require-1.txt,,,92,19,4,0,0,0,0,24,25,18,0,2
case,CASE DOCS\09.16.24 - 24-0395 First Amended Motion for Rehearing-1.pdf,extracted_text\09.16.24 - 24-0395 First Amended Motion for Rehearing-1.txt,2024-09-16,24-0395,91,17,19,2,2,4,0,14,5,0,24,4
research,RESEARCH\vLex-Vincent-Is-Rule-237a-of-the-03bc31d4-1.pdf,extracted_research\vLex-Vincent-Is-Rule-237a-of-the-03bc31d4-1.txt,,,90,32,2,12,31,0,0,3,10,0,0,0
research,RESEARCH\vLex-Vincent-Is-Rule-237a-of-the-1.pdf,extracted_research\vLex-Vincent-Is-Rule-237a-of-the-1.txt,,,90,32,2,12,31,0,0,3,10,0,0,0
research,RESEARCH\vLex-Vincent-Is-Rule-237a-of-the-16481ff7-1.pdf,extracted_research\vLex-Vincent-Is-Rule-237a-of-the-16481ff7-1.txt,,,90,32,2,12,31,0,0,3,10,0,0,0
research,RESEARCH\vLex-Vincent-Under-what-circumstances-does-judicial-or-quasi-judicial-immunity-not-apply-to-judges-or-court-staff-1.pdf,extracted_research\vLex-Vincent-Under-what-circumstances-does-judicial-or-quasi-judicial-immunity-not-apply-to-judges-or-court-staff-1.txt,,,90,4,0,6,0,2,20,3,52,0,3,0
research,RESEARCH\vLex-Vincent-Funds-exceeding--5-000-were-transferred-from-Texas-to-Oklahoma-via-PayPal-as-part-of-the-fraudulent--1.pdf,extracted_research\vLex-Vincent-Funds-exceeding--5-000-were-transferred-from-Texas-to-Oklahoma-via-PayPal-as-part-of-the-fraudulent--1.txt,,,89,44,2,0,0,0,42,0,1,0,0,0
case,CASE DOCS\09.14.25 - MOTION FOR RECONSIDERATION-1.pdf,extracted_text\09.14.25 - MOTION FOR RECONSIDERATION-1.txt,2025-09-14,,88,4,4,4,0,0,76,0,0,0,0,0
research,RESEARCH\vLex-Vincent-If-a-district-judge-takes-up-a-case--makes-an-order--without-a-hearing-or-hearing-evidence--and-depr (1)-1.pdf,extracted_research\vLex-Vincent-If-a-district-judge-takes-up-a-case--makes-an-order--without-a-hearing-or-hearing-evidence--and-depr (1)-1.txt,,,87,0,1,0,0,0,0,0,85,0,1,0
case,CASE DOCS\04.04.2025_COMPREHENSIVE LEGAL ANALYSIS IN SUPPORT OF DISMISSAL-1.pdf,extracted_text\04.04.2025_COMPREHENSIVE LEGAL ANALYSIS IN SUPPORT OF DISMISSAL-1.txt,2025-04-04,,84,6,26,0,12,10,0,0,26,0,0,4
case,CASE DOCS\04.24.2025_PLEA TO THE JURISDICTION-1.pdf,extracted_text\04.24.2025_PLEA TO THE JURISDICTION-1.txt,2025-04-24,,84,2,2,4,0,0,0,46,30,0,0,0
case,CASE DOCS\07.11.25 - 25-0378 Rehearing-1.pdf,extracted_text\07.11.25 - 25-0378 Rehearing-1.txt,2025-07-11,25-0378,84,0,8,0,0,0,0,18,0,0,0,58
research,RESEARCH\vLex-Vincent--Plaintiff-s-complaint-alleges-a-series-of-related-acts-over-an-extended-period--with-ongoing-threat-1.pdf,extracted_research\vLex-Vincent--Plaintiff-s-complaint-alleges-a-series-of-related-acts-over-an-extended-period--with-ongoing-threat-1.txt,,,84,2,6,0,0,0,76,0,0,0,0,0
research,RESEARCH\vLex-Vincent--Plaintiff-s-complaint-alleges-a-series-of-related-acts-over-an-extended-period--with-ongoing-threat-28de3a65-1.pdf,extracted_research\vLex-Vincent--Plaintiff-s-complaint-alleges-a-series-of-related-acts-over-an-extended-period--with-ongoing-threat-28de3a65-1.txt,,,84,2,6,0,0,0,76,0,0,0,0,0
research,RESEARCH\vLex-Vincent--Plaintiff-s-complaint-alleges-a-series-of-related-acts-over-an-extended-period--with-ongoing-threat-7de9d406-1.pdf,extracted_research\vLex-Vincent--Plaintiff-s-complaint-alleges-a-series-of-related-acts-over-an-extended-period--with-ongoing-threat-7de9d406-1.txt,,,84,2,6,0,0,0,76,0,0,0,0,0
research,RESEARCH\vLex-Vincent-If-a-litigant-is-filing-suit-in-federal-court-and-has-active-mandamus-petitions-containing-evidence--1.pdf,extracted_research\vLex-Vincent-If-a-litigant-is-filing-suit-in-federal-court-and-has-active-mandamus-petitions-containing-evidence--1.txt,,,84,46,1,0,0,0,0,1,0,0,0,36
research,RESEARCH\vLex-Vincent-The-respondent-alleges-that-the-petitioner-and-her-attorney-engaged-in-fraudulent-conduct--misrepres-1.pdf,extracted_research\vLex-Vincent-The-respondent-alleges-that-the-petitioner-and-her-attorney-engaged-in-fraudulent-conduct--misrepres-1.txt,,,84,37,0,0,0,2,0,8,1,36,0,0
research,RESEARCH\vLex-Vincent-What-are-the-broader-implications-1.pdf,extracted_research\vLex-Vincent-What-are-the-broader-implications-1.txt,,,83,0,2,16,1,0,0,0,42,1,0,21
case,CASE DOCS\04.24.25 - PLEA TO JURISDICTION-1.pdf,extracted_text\04.24.25 - PLEA TO JURISDICTION-1.txt,2025-04-24,,82,2,2,4,0,0,0,46,28,0,0,0
case,CASE DOCS\03.31.35 - PRE-OBJ. TO CONSOL-1.pdf,extracted_text\03.31.35 - PRE-OBJ. TO CONSOL-1.txt,2035-03-31,,80,6,30,0,8,0,0,8,28,0,0,0
case,CASE DOCS\04.01.2025_RESPONDENTS PRE-OBJECTION TO CONSOLIDATION-1.pdf,extracted_text\04.01.2025_RESPONDENTS PRE-OBJECTION TO CONSOLIDATION-1.txt,2025-04-01,,80,6,30,0,8,0,0,8,28,0,0,0
case,CASE DOCS\04.01.25 - OBJ. TO CONSOL-1.pdf,extracted_text\04.01.25 - OBJ. TO CONSOL-1.txt,2025-04-01,,80,6,30,0,8,0,0,8,28,0,0,0
case,CASE DOCS\10.09.25 - JOINT MOTION TO VACATE-1.pdf,extracted_text\10.09.25 - JOINT MOTION TO VACATE-1.txt,2025-10-09,,80,28,14,0,0,0,24,14,0,0,0,0
research,RESEARCH\vLex-Vincent-Charles-Dustin-Myers-1.pdf,extracted_research\vLex-Vincent-Charles-Dustin-Myers-1.txt,,,80,4,9,11,3,0,0,0,10,0,0,43
research,RESEARCH\vLex-Vincent-Defendant-Myers-traveled-from-Texas-to-Oklahoma-to-meet-with-Branthoover--where-they-prepared-fraudu-1.pdf,extracted_research\vLex-Vincent-Defendant-Myers-traveled-from-Texas-to-Oklahoma-to-meet-with-Branthoover--where-they-prepared-fraudu-1.txt,,,80,49,1,0,0,2,25,0,3,0,0,0
case,CASE DOCS\04.10.25 - 02-25-00164-CV SUPPLEMENTAL MANDAMUS RECORD-1.pdf,extracted_text\04.10.25 - 02-25-00164-CV SUPPLEMENTAL MANDAMUS RECORD-1.txt,2025-04-10,02-25-00164-CV,77,0,24,0,8,0,0,4,6,0,1,34
research,RESEARCH\vLex-Vincent-Charles-Dustin-Myers-95f6ea7e-1.pdf,extracted_research\vLex-Vincent-Charles-Dustin-Myers-95f6ea7e-1.txt,,,77,11,7,6,2,0,0,0,16,0,0,35
case,CASE DOCS\02.10.25 - EMERGENCY EX-PARTE ORDER-1.pdf,extracted_text\02.10.25 - EMERGENCY EX-PARTE ORDER-1.txt,2025-02-10,,76,30,17,4,0,0,0,4,14,0,5,2
case,CASE DOCS\09.08.25 - NOTICE TO DAVID L. EVANS-1.pdf,extracted_text\09.08.25 - NOTICE TO DAVID L. EVANS-1.txt,2025-09-08,,76,8,2,4,0,0,58,0,4,0,0,0
case,CASE DOCS\11.26.25 - Response in Support of Granting No-Evidence Summary Judgment on Submission.pdf,extracted_text\11.26.25 - Response in Support of Granting No-Evidence Summary Judgment on Submission.txt,2025-11-26,,76,6,2,4,2,0,6,8,14,0,6,28
case,CASE DOCS\09.25.25 - MANDAMUS 0861.pdf,extracted_text\09.25.25 - MANDAMUS 0861.txt,2025-09-25,,75,0,8,2,0,0,0,2,9,0,0,54
research,RESEARCH\vLex-Vincent-If-a-litigant-files-a-tieritary-recusal--and-the-opposing-party-doesn-t-respond--can-the-regional-ju-1.pdf,extracted_research\vLex-Vincent-If-a-litigant-files-a-tieritary-recusal--and-the-opposing-party-doesn-t-respond--can-the-regional-ju-1.txt,,,75,8,4,0,0,0,0,59,0,0,0,4
research,RESEARCH\vLex-Vincent-When-a-litigant-is-illegally-removed-from-his-home-by-a-judge--and-is-forced-to-live-under-a-fraudul-1.pdf,extracted_research\vLex-Vincent-When-a-litigant-is-illegally-removed-from-his-home-by-a-judge--and-is-forced-to-live-under-a-fraudul-1.txt,,,75,33,7,2,0,0,11,13,2,3,2,2
research,RESEARCH\vLex-Vincent-Does-a-district-judge-in-1.pdf,extracted_research\vLex-Vincent-Does-a-district-judge-in-1.txt,,,74,0,10,0,0,0,0,7,57,0,0,0
research,RESEARCH\vLex-Vincent-What-is-the-caselaw-related-1.pdf,extracted_research\vLex-Vincent-What-is-the-caselaw-related-1.txt,,,74,9,23,0,0,1,0,1,31,0,9,0
research,RESEARCH\vLex-Vincent-What-is-the-caselaw-related-102fd013-1.pdf,extracted_research\vLex-Vincent-What-is-the-caselaw-related-102fd013-1.txt,,,74,9,23,0,0,1,0,1,31,0,9,0
case,CASE DOCS\04.03.25 - RESPONDETN'S COMPREHENSIVE LEGAL ANALYSIS IN FAVOR OF DISMISSAL-1.pdf,extracted_text\04.03.25 - RESPONDETN'S COMPREHENSIVE LEGAL ANALYSIS IN FAVOR OF DISMISSAL-1.txt,2025-04-03,,72,6,24,0,12,0,0,0,26,0,0,4
case,CASE DOCS\08.20.25 - Objection to Final Trial Setting-1.pdf,extracted_text\08.20.25 - Objection to Final Trial Setting-1.txt,2025-08-20,,72,4,8,0,0,0,0,34,2,0,2,22
research,RESEARCH\vLex-Vincent-Does-a-defendant's-attempt-to-1.pdf,extracted_research\vLex-Vincent-Does-a-defendant's-attempt-to-1.txt,,,72,9,0,5,52,0,0,0,6,0,0,0
research,RESEARCH\vLex-Vincent-Does-a-defendant's-attempt-to-d3981fb9-1.pdf,extracted_research\vLex-Vincent-Does-a-defendant's-attempt-to-d3981fb9-1.txt,,,72,9,0,5,52,0,0,0,6,0,0,0
research,RESEARCH\vLex-Vincent-Does-a-defendant's-attempt-to-d46836ca-1.pdf,extracted_research\vLex-Vincent-Does-a-defendant's-attempt-to-d46836ca-1.txt,,,72,9,0,5,52,0,0,0,6,0,0,0
research,RESEARCH\vLex-Vincent-The-regional-presiding-judge-has-1.pdf,extracted_research\vLex-Vincent-The-regional-presiding-judge-has-1.txt,,,71,0,1,1,0,0,0,0,3,0,0,66
research,RESEARCH\vLex-Vincent--Plaintiff-alleged-that-after-the-initial-acts-in-December-2023-and-January-2024--Defendants-continu-05419b6b-1.pdf,extracted_research\vLex-Vincent--Plaintiff-alleged-that-after-the-initial-acts-in-December-2023-and-January-2024--Defendants-continu-05419b6b-1.txt,,,69,1,8,0,0,0,60,0,0,0,0,0
research,RESEARCH\vLex-Vincent--Plaintiff-alleged-that-after-the-initial-acts-in-December-2023-and-January-2024--Defendants-continu-1.pdf,extracted_research\vLex-Vincent--Plaintiff-alleged-that-after-the-initial-acts-in-December-2023-and-January-2024--Defendants-continu-1.txt,,,69,1,8,0,0,0,60,0,0,0,0,0
research,RESEARCH\vLex-Vincent--Plaintiff-alleged-that-after-the-initial-acts-in-December-2023-and-January-2024--Defendants-continu-d5f07e01-1.pdf,extracted_research\vLex-Vincent--Plaintiff-alleged-that-after-the-initial-acts-in-December-2023-and-January-2024--Defendants-continu-d5f07e01-1.txt,,,69,1,8,0,0,0,60,0,0,0,0,0
case,CASE DOCS\04.03.24 - Notice of filing Original Proceeding-1.pdf,extracted_text\04.03.24 - Notice of filing Original Proceeding-1.txt,2024-04-03,,68,0,22,0,0,0,0,2,8,0,2,34
case,CASE DOCS\11.03.25 - MOTION FOR LEAVE TO SUPPLEMENT.pdf,extracted_text\11.03.25 - MOTION FOR LEAVE TO SUPPLEMENT.txt,2025-11-03,,68,6,2,2,2,0,6,0,14,0,6,30
case,CASE DOCS\04.22.2025_02-25-00164-CV EN BANC SAPCR-1.pdf,extracted_text\04.22.2025_02-25-00164-CV EN BANC SAPCR-1.txt,2025-04-22,,64,0,16,0,2,0,0,2,0,0,0,44
research,RESEARCH\VLEX EVANS-1.pdf,extracted_research\VLEX EVANS-1.txt,,,63,0,8,1,0,1,0,5,10,0,0,38
case,CASE DOCS\04.03.2025_MOTION TO CONSOLIDATE 322-1.pdf,extracted_text\04.03.2025_MOTION TO CONSOLIDATE 322-1.txt,2025-04-03,,62,0,24,0,0,0,0,0,20,0,2,16
case,CASE DOCS\12.08.25 - THIRD AMENDED COUNTERPETITION FOR DIVORCE.pdf,extracted_text\12.08.25 - THIRD AMENDED COUNTERPETITION FOR DIVORCE.txt,2025-12-08,,62,4,2,6,0,0,0,2,16,0,6,26
research,RESEARCH\EMAILS FROM BAKER ANALYSIS.pdf,extracted_research\EMAILS FROM BAKER ANALYSIS.txt,,,62,5,11,1,10,0,11,5,11,0,0,8
case,CASE DOCS\08.27.25 - NOTICE OF INTENT TO FILE RECUSAL-1.pdf,extracted_text\08.27.25 - NOTICE OF INTENT TO FILE RECUSAL-1.txt,2025-08-27,,60,4,12,2,0,0,0,32,0,2,4,4
research,RESEARCH\vLex-Vincent-Morgan-Michelle-Myers-1.pdf,extracted_research\vLex-Vincent-Morgan-Michelle-Myers-1.txt,,,59,3,6,8,3,0,0,0,8,0,0,31
case,CASE DOCS\03.20.25 EMERGENCY EX-PARTE MOTION TO-1.pdf,extracted_text\03.20.25 EMERGENCY EX-PARTE MOTION TO-1.txt,2025-03-20,,58,30,6,0,0,2,0,0,14,0,4,2
case,CASE DOCS\04.15.2025_DOMINANT JURISDICTION ANALYSIS-1.pdf,extracted_text\04.15.2025_DOMINANT JURISDICTION ANALYSIS-1.txt,2025-04-15,,58,0,10,0,0,0,0,0,44,0,0,4
case,CASE DOCS\09.22.25 - NOTICE-1-1.pdf,extracted_text\09.22.25 - NOTICE-1-1.txt,2025-09-22,,58,2,4,0,0,0,48,0,0,0,0,4
research,RESEARCH\vLex-Vincent--STATE-COMMISSION-ON-JUDICIAL-CONDUCT-HON--KENNETH-NEWELL--DISTRICT-JUDGE-OF-THE-233rd-DISTRICT-COUR-1.pdf,extracted_research\vLex-Vincent--STATE-COMMISSION-ON-JUDICIAL-CONDUCT-HON--KENNETH-NEWELL--DISTRICT-JUDGE-OF-THE-233rd-DISTRICT-COUR-1.txt,,,58,0,7,11,0,0,0,25,2,0,0,13
research,RESEARCH\vLex-Vincent--STATE-COMMISSION-ON-JUDICIAL-CONDUCT-HON--KENNETH-NEWELL--DISTRICT-JUDGE-OF-THE-233rd-DISTRICT-COUR-6337074f-1.pdf,extracted_research\vLex-Vincent--STATE-COMMISSION-ON-JUDICIAL-CONDUCT-HON--KENNETH-NEWELL--DISTRICT-JUDGE-OF-THE-233rd-DISTRICT-COUR-6337074f-1.txt,,,58,0,7,11,0,0,0,25,2,0,0,13
research,RESEARCH\vLex-Vincent--STATE-COMMISSION-ON-JUDICIAL-CONDUCT-HON--KENNETH-NEWELL--DISTRICT-JUDGE-OF-THE-233rd-DISTRICT-COUR-791191ec-1.pdf,extracted_research\vLex-Vincent--STATE-COMMISSION-ON-JUDICIAL-CONDUCT-HON--KENNETH-NEWELL--DISTRICT-JUDGE-OF-THE-233rd-DISTRICT-COUR-791191ec-1.txt,,,58,0,7,11,0,0,0,25,2,0,0,13
case,CASE DOCS\04.21.2025_02-25-00166-CV - EN BANC VOID ORDER-1.pdf,extracted_text\04.21.2025_02-25-00166-CV - EN BANC VOID ORDER-1.txt,2025-04-21,,57,0,8,0,0,0,0,14,12,0,0,23
research,RESEARCH\vLex-Vincent-Question-1-No-25-_____-IN-THE-SUPREME-COURT-OF-TEXAS-IN-RE--CHARLES-DUSTIN-MYERS--RELATOR--On-Petiti-1.pdf,extracted_research\vLex-Vincent-Question-1-No-25-_____-IN-THE-SUPREME-COURT-OF-TEXAS-IN-RE--CHARLES-DUSTIN-MYERS--RELATOR--On-Petiti-1.txt,,,57,0,7,13,0,0,0,4,9,0,0,24
research,RESEARCH\vLex-Vincent-Question-1-No-25-_____-IN-THE-SUPREME-COURT-OF-TEXAS-IN-RE--CHARLES-DUSTIN-MYERS--RELATOR--On-Petiti-14ace95a-1.pdf,extracted_research\vLex-Vincent-Question-1-No-25-_____-IN-THE-SUPREME-COURT-OF-TEXAS-IN-RE--CHARLES-DUSTIN-MYERS--RELATOR--On-Petiti-14ace95a-1.txt,,,57,0,7,13,0,0,0,4,9,0,0,24
research,RESEARCH\vLex-Vincent-The-regional-judge-s-actions-are-part-of-a-broader-pattern-of-procedural-irregularities--including-t-1.pdf,extracted_research\vLex-Vincent-The-regional-judge-s-actions-are-part-of-a-broader-pattern-of-procedural-irregularities--including-t-1.txt,,,57,1,0,0,1,2,0,39,0,0,0,14
case,CASE DOCS\04.07.2025_233-765358-25 PETITIONERS NOTICE OF INTENT TO FILE MANDAMUS-1.pdf,extracted_text\04.07.2025_233-765358-25 PETITIONERS NOTICE OF INTENT TO FILE MANDAMUS-1.txt,2025-04-07,,56,0,18,0,0,0,0,0,20,0,2,16
research,RESEARCH\vLex-Vincent-What-Texas-case-law-supports-1.pdf,extracted_research\vLex-Vincent-What-Texas-case-law-supports-1.txt,,,56,1,0,0,0,0,0,54,1,0,0,0
research,RESEARCH\vLex-Vincent-Does-a-Texas-court-have-1.pdf,extracted_research\vLex-Vincent-Does-a-Texas-court-have-1.txt,,,55,0,7,0,0,0,0,0,48,0,0,0
research,RESEARCH\vLex-Vincent-Does-a-Texas-court-have-90bae863-1.pdf,extracted_research\vLex-Vincent-Does-a-Texas-court-have-90bae863-1.txt,,,55,0,7,0,0,0,0,0,48,0,0,0
research,RESEARCH\vLex-Vincent-Does-a-Texas-court-have-c0d046b3-1.pdf,extracted_research\vLex-Vincent-Does-a-Texas-court-have-c0d046b3-1.txt,,,55,0,7,0,0,0,0,0,48,0,0,0
research,RESEARCH\vLex-Vincent-Does-a-Texas-court-have-da0fb395-1.pdf,extracted_research\vLex-Vincent-Does-a-Texas-court-have-da0fb395-1.txt,,,55,0,7,0,0,0,0,0,48,0,0,0
case,CASE DOCS\12.08.25 - RESPONDENT'S ANSWER TO PETITIONER'S SECOND AMENDED PETITION.pdf,extracted_text\12.08.25 - RESPONDENT'S ANSWER TO PETITIONER'S SECOND AMENDED PETITION.txt,2025-12-08,,54,0,4,4,0,0,0,6,0,0,0,40
research,"RESEARCH\vLex-Vincent-In-Texas,-if-a-party (1)-1.pdf","extracted_research\vLex-Vincent-In-Texas,-if-a-party (1)-1.txt",,,53,0,2,0,0,0,0,1,50,0,0,0
research,"RESEARCH\vLex-Vincent-In-Texas,-if-a-party (1)-46729ad3-1.pdf","extracted_research\vLex-Vincent-In-Texas,-if-a-party (1)-46729ad3-1.txt",,,53,0,2,0,0,0,0,1,50,0,0,0
research,"RESEARCH\vLex-Vincent-In-Texas,-if-a-party (1)-5ae5b6a7-1.pdf","extracted_research\vLex-Vincent-In-Texas,-if-a-party (1)-5ae5b6a7-1.txt",,,53,0,2,0,0,0,0,1,50,0,0,0
research,"RESEARCH\vLex-Vincent-In-Texas,-if-a-party-1.pdf","extracted_research\vLex-Vincent-In-Texas,-if-a-party-1.txt",,,53,0,2,0,0,0,0,1,50,0,0,0
research,"RESEARCH\vLex-Vincent-In-Texas,-if-a-party-1f0744bc-1.pdf","extracted_research\vLex-Vincent-In-Texas,-if-a-party-1f0744bc-1.txt",,,53,0,2,0,0,0,0,1,50,0,0,0
research,"RESEARCH\vLex-Vincent-In-Texas,-if-a-party-c832e5fb-1.pdf","extracted_research\vLex-Vincent-In-Texas,-if-a-party-c832e5fb-1.txt",,,53,0,2,0,0,0,0,1,50,0,0,0
case,CASE DOCS\03.26.24 - 2nd Amended Preparatory Notice-1.pdf,extracted_text\03.26.24 - 2nd Amended Preparatory Notice-1.txt,2024-03-26,,52,14,6,10,0,0,0,16,6,0,0,0
case,CASE DOCS\03.26.24 - SECOND PREPARATORY NOTICE FOR JUDICIAL REVIEW-1.pdf,extracted_text\03.26.24 - SECOND PREPARATORY NOTICE FOR JUDICIAL REVIEW-1.txt,2024-03-26,,52,14,6,10,0,0,0,16,6,0,0,0
case,CASE DOCS\04.07.25 - NOTICE - INTENT TO FILE MANDAMUS-1.pdf,extracted_text\04.07.25 - NOTICE - INTENT TO FILE MANDAMUS-1.txt,2025-04-07,,52,0,18,0,0,0,0,0,20,0,2,12
case,CASE DOCS\05.22.2025_MOTION TO STRIKE OAG-1.pdf,extracted_text\05.22.2025_MOTION TO STRIKE OAG-1.txt,2025-05-22,,52,28,12,0,0,0,0,4,8,0,0,0
research,RESEARCH\vLex-Vincent-Does-a-district-judge-in-6670bc4d-1.pdf,extracted_research\vLex-Vincent-Does-a-district-judge-in-6670bc4d-1.txt,,,52,0,0,11,0,0,0,5,33,0,3,0
research,RESEARCH\TRIAL BY AMBUSH.pdf,extracted_research\TRIAL BY AMBUSH.txt,,,51,0,1,0,0,0,0,30,16,0,4,0
research,RESEARCH\vLex-Vincent-Extortion-Under-Color-of-Official-Right--Extortion-under-color-of-official-right-does-not-require-pr-1.pdf,extracted_research\vLex-Vincent-Extortion-Under-Color-of-Official-Right--Extortion-under-color-of-official-right-does-not-require-pr-1.txt,,,51,47,3,0,0,1,0,0,0,0,0,0
case,CASE DOCS\02.20.25 - MOTION TO SIGN-1-1.pdf,extracted_text\02.20.25 - MOTION TO SIGN-1-1.txt,2025-02-20,,50,4,4,0,18,0,0,0,2,0,22,0
case,CASE DOCS\02.20.25 - MOTION TO SIGN-1.pdf,extracted_text\02.20.25 - MOTION TO SIGN-1.txt,2025-02-20,,50,4,4,0,18,0,0,0,2,0,22,0
case,CASE DOCS\02.25.2025_MOTION TO SIGN-1.pdf,extracted_text\02.25.2025_MOTION TO SIGN-1.txt,2025-02-25,,50,4,4,0,18,0,0,0,2,0,22,0
case,CASE DOCS\03.26.24 - Second Amended Prepatory Notice for Judicial Review-1.pdf,extracted_text\03.26.24 - Second Amended Prepatory Notice for Judicial Review-1.txt,2024-03-26,,50,13,6,9,0,0,0,16,6,0,0,0
case,CASE DOCS\03.28.25 - Notice of Legal Clarification-1.pdf,extracted_text\03.28.25 - Notice of Legal Clarification-1.txt,2025-03-28,,50,6,12,10,12,0,0,4,6,0,0,0
case,CASE DOCS\09.29.25 - MOTION TO DISMISS 0861.pdf,extracted_text\09.29.25 - MOTION TO DISMISS 0861.txt,2025-09-29,,50,0,8,0,0,0,18,2,4,0,0,18
case,CASE DOCS\12.13.24 - Notice of Related Case-1.pdf,extracted_text\12.13.24 - Notice of Related Case-1.txt,2024-12-13,,50,26,8,6,0,0,0,0,8,0,0,2
research,RESEARCH\vLex-Vincent----The-judge-and-court-coordinator-allegedly-altered-and-selectively-transmitted-recusal-motions-and-1.pdf,extracted_research\vLex-Vincent----The-judge-and-court-coordinator-allegedly-altered-and-selectively-transmitted-recusal-motions-and-1.txt,,,49,2,1,0,0,5,20,0,21,0,0,0
research,RESEARCH\vLex-Vincent-1-No-25-_____-IN-THE-SUPREME-COURT-OF-TEXAS-IN-RE--CHARLES-DUSTIN-MYERS--RELATOR--On-Petition-for-Wr-1.pdf,extracted_research\vLex-Vincent-1-No-25-_____-IN-THE-SUPREME-COURT-OF-TEXAS-IN-RE--CHARLES-DUSTIN-MYERS--RELATOR--On-Petition-for-Wr-1.txt,,,49,0,8,1,0,0,0,2,10,0,0,28
research,RESEARCH\vLex-Vincent-1-No-25-_____-IN-THE-SUPREME-COURT-OF-TEXAS-IN-RE--CHARLES-DUSTIN-MYERS--RELATOR--On-Petition-for-Wr-a18071e7-1.pdf,extracted_research\vLex-Vincent-1-No-25-_____-IN-THE-SUPREME-COURT-OF-TEXAS-IN-RE--CHARLES-DUSTIN-MYERS--RELATOR--On-Petition-for-Wr-a18071e7-1.txt,,,49,0,8,1,0,0,0,2,10,0,0,28
research,RESEARCH\vLex-Vincent-What-are-all-the-grounds-1.pdf,extracted_research\vLex-Vincent-What-are-all-the-grounds-1.txt,,,49,10,2,8,0,0,0,24,5,0,0,0
research,RESEARCH\vLex-Vincent-What-are-all-the-grounds-4d8e11d6-1.pdf,extracted_research\vLex-Vincent-What-are-all-the-grounds-4d8e11d6-1.txt,,,49,10,2,8,0,0,0,24,5,0,0,0
research,RESEARCH\vLex-Vincent-What-are-all-the-grounds-f730eda7-1.pdf,extracted_research\vLex-Vincent-What-are-all-the-grounds-f730eda7-1.txt,,,49,10,2,8,0,0,0,24,5,0,0,0
case,CASE DOCS\03.24.25 - EMERGENCY EX-PARTE TRO-1.pdf,extracted_text\03.24.25 - EMERGENCY EX-PARTE TRO-1.txt,2025-03-24,,48,0,18,2,0,0,0,0,12,0,8,8
case,CASE DOCS\12.06.24 - 24-CV-01185-O REMAND ORDER-1.pdf,extracted_text\12.06.24 - 24-CV-01185-O REMAND ORDER-1.txt,2024-12-06,24-CV-01185-O,48,28,2,6,0,0,0,0,12,0,0,0
research,RESEARCH\vLex-Vincent-The-same-associate-judge-who-made-the-initial-ruling-is-presiding-over-the-de-novo-request--Due-proc-1.pdf,extracted_research\vLex-Vincent-The-same-associate-judge-who-made-the-initial-ruling-is-presiding-over-the-de-novo-request--Due-proc-1.txt,,,48,9,2,0,0,0,0,34,3,0,0,0
research,RESEARCH\vLex-Vincent-TIMELINE-OF-EVENTS--Myers--Defendant-Morgan-Michelle-Myers--Branthoover---Defendant-Daniel-Kenneth-B-1.pdf,extracted_research\vLex-Vincent-TIMELINE-OF-EVENTS--Myers--Defendant-Morgan-Michelle-Myers--Branthoover---Defendant-Daniel-Kenneth-B-1.txt,,,47,7,7,2,0,0,19,1,4,0,0,7
case,CASE DOCS\03.31.25 - PET'S STATEMENT-1.pdf,extracted_text\03.31.25 - PET'S STATEMENT-1.txt,2025-03-31,,46,2,24,0,10,0,0,6,4,0,0,0
case,CASE DOCS\03.31.25 - Petitioners Statement-1.pdf,extracted_text\03.31.25 - Petitioners Statement-1.txt,2025-03-31,,46,2,24,0,10,0,0,6,4,0,0,0
case,CASE DOCS\04.01.2025_233-765358-25 PETITIONERS STATEMENT-1.pdf,extracted_text\04.01.2025_233-765358-25 PETITIONERS STATEMENT-1.txt,2025-04-01,,46,2,24,0,10,0,0,6,4,0,0,0
case,CASE DOCS\09.25.25 - MANDAMUS RECORD.pdf,extracted_text\09.25.25 - MANDAMUS RECORD.txt,2025-09-25,,46,0,6,0,0,0,18,2,4,0,0,16
case,CASE DOCS\03.06.2025_UNOPPOSED MOTION TO DISMISS FOR LACK OF JURISDICTION-1.pdf,extracted_text\03.06.2025_UNOPPOSED MOTION TO DISMISS FOR LACK OF JURISDICTION-1.txt,2025-03-06,,44,10,4,2,8,0,0,0,20,0,0,0
case,CASE DOCS\03.31.25 - PETITIONER'S REQUEST FOR DECLARATORY JUDGMENT (2)-1.pdf,extracted_text\03.31.25 - PETITIONER'S REQUEST FOR DECLARATORY JUDGMENT (2)-1.txt,2025-03-31,,44,2,20,0,4,0,0,4,14,0,0,0
case,CASE DOCS\03.31.25 - REQUEST FOR DECLARATORY JUDGEMENT-1.pdf,extracted_text\03.31.25 - REQUEST FOR DECLARATORY JUDGEMENT-1.txt,2025-03-31,,44,2,20,0,4,0,0,4,14,0,0,0
case,CASE DOCS\04.10.25 - 02-25-00164-CV MOTION FOR REHEARING-1.pdf,extracted_text\04.10.25 - 02-25-00164-CV MOTION FOR REHEARING-1.txt,2025-04-10,02-25-00164-CV,44,2,10,0,0,0,0,6,8,0,0,18
case,CASE DOCS\04.25.24 - Rehearing Denied (2nd COA)-1.pdf,extracted_text\04.25.24 - Rehearing Denied (2nd COA)-1.txt,2024-04-25,,44,0,10,0,0,0,0,0,0,0,0,34
case,CASE DOCS\09.17.25 - OBJ TO LR 1.06B2-1.pdf,extracted_text\09.17.25 - OBJ TO LR 1.06B2-1.txt,2025-09-17,,44,12,4,0,0,0,0,28,0,0,0,0
case,CASE DOCS\03.06.25 - UNOPPOSED MOTION FOR LACK OF JURIS-1.pdf,extracted_text\03.06.25 - UNOPPOSED MOTION FOR LACK OF JURIS-1.txt,2025-03-06,,42,10,4,2,8,0,0,0,18,0,0,0
case,CASE DOCS\03.14.24 - TEMP ORDERS REDACTED-1.pdf,extracted_text\03.14.24 - TEMP ORDERS REDACTED-1.txt,2024-03-14,,42,30,2,0,0,0,0,0,6,0,4,0
case,CASE DOCS\03.26.2024_TEMPORARY ORDERS-1.pdf,extracted_text\03.26.2024_TEMPORARY ORDERS-1.txt,2024-03-26,,42,30,2,0,0,0,0,0,6,0,4,0
case,CASE DOCS\03.26.24 - TEMPORARY ORDERS (ILLEGAL)-1.pdf,extracted_text\03.26.24 - TEMPORARY ORDERS (ILLEGAL)-1.txt,2024-03-26,,42,30,2,0,0,0,0,0,6,0,4,0
case,CASE DOCS\03.26.24 - TEMPORARY ORDERS-1.pdf,extracted_text\03.26.24 - TEMPORARY ORDERS-1.txt,2024-03-26,,42,30,2,0,0,0,0,0,6,0,4,0
case,CASE DOCS\04.07.2025_RESPONDENTS NOTICE OF INTENT TO FILE PROHIBITION-1.pdf,extracted_text\04.07.2025_RESPONDENTS NOTICE OF INTENT TO FILE PROHIBITION-1.txt,2025-04-07,,42,2,12,0,0,0,0,0,24,0,2,2
case,CASE DOCS\04.07.25 - NOTICE OF INTENT TO FILE WRIT OF PROHIBITION-1.pdf,extracted_text\04.07.25 - NOTICE OF INTENT TO FILE WRIT OF PROHIBITION-1.txt,2025-04-07,,42,2,12,0,0,0,0,0,24,0,2,2
case,CASE DOCS\04.18.24 - 2ND COA REHEARING-1.pdf,extracted_text\04.18.24 - 2ND COA REHEARING-1.txt,2024-04-18,,42,0,8,0,0,0,0,0,0,0,0,34
case,CASE DOCS\04.27.25 - NOTCE OF INTENT PROHIBITION-1.pdf,extracted_text\04.27.25 - NOTCE OF INTENT PROHIBITION-1.txt,2025-04-27,,42,2,12,0,0,0,0,0,24,0,2,2
case,CASE DOCS\04.28.24 - MOTION FOR REHEARING WITH APPENDIX-1.pdf,extracted_text\04.28.24 - MOTION FOR REHEARING WITH APPENDIX-1.txt,2024-04-28,,42,0,8,0,0,0,0,0,0,0,0,34
case,CASE DOCS\11.11.2024_MOTION TO ENTER JUDGMENT-1.pdf,extracted_text\11.11.2024_MOTION TO ENTER JUDGMENT-1.txt,2024-11-11,,42,2,10,2,0,0,0,14,12,0,0,2
research,RESEARCH\vLex-Vincent-The-regional-presiding-judge-has (2)-1.pdf,extracted_research\vLex-Vincent-The-regional-presiding-judge-has (2)-1.txt,,,41,0,2,0,0,1,0,0,1,0,0,37
case,CASE DOCS\04.08.25 - NOTICE OF INCLUSION-1.pdf,extracted_text\04.08.25 - NOTICE OF INCLUSION-1.txt,2025-04-08,,40,0,16,0,6,0,0,4,6,0,2,6
case,CASE DOCS\10.10.25 - Response in Opposition to Petitioner's Motion for Sanctions-1.pdf,extracted_text\10.10.25 - Response in Opposition to Petitioner's Motion for Sanctions-1.txt,2025-10-10,,40,6,20,0,0,0,2,0,2,0,10,0
case,CASE DOCS\11.10.24 - MOTIONTOENTERJUDGEMENT_Redacted-1.pdf,extracted_text\11.10.24 - MOTIONTOENTERJUDGEMENT_Redacted-1.txt,2024-11-10,,40,2,14,3,0,0,0,16,3,0,0,2
case,CASE DOCS\04.22.2025_02-25-00171-CV - EN BANC CONSOLIDATION-1.pdf,extracted_text\04.22.2025_02-25-00171-CV - EN BANC CONSOLIDATION-1.txt,2025-04-22,,39,0,6,0,0,0,0,10,0,0,0,23
research,RESEARCH\vLex-Vincent-What-is-a-summary-judgment--and-how-is-it-defined-and-applied-under-Texas-law--1.pdf,extracted_research\vLex-Vincent-What-is-a-summary-judgment--and-how-is-it-defined-and-applied-under-Texas-law--1.txt,,,39,39,0,0,0,0,0,0,0,0,0,0
case,CASE DOCS\03.12.25 - REQUEST TO SET UN-OPPOSED SUMMARY JUDGMENT AND UN-OPPOSED RULE 12 MOTIONS FOR SUBMISSION-1.pdf,extracted_text\03.12.25 - REQUEST TO SET UN-OPPOSED SUMMARY JUDGMENT AND UN-OPPOSED RULE 12 MOTIONS FOR SUBMISSION-1.txt,2025-03-12,,38,8,12,6,0,0,0,12,0,0,0,0
case,CASE DOCS\07.30.25 - first amended MOTION REHEARING.pdf,extracted_text\07.30.25 - first amended MOTION REHEARING.txt,2025-07-30,,38,0,0,0,4,0,0,8,2,0,0,24
case,CASE DOCS\08.21.25 - SECOND AMENDED MOTION FOR REHEARING.pdf,extracted_text\08.21.25 - SECOND AMENDED MOTION FOR REHEARING.txt,2025-08-21,,38,0,8,0,0,0,0,2,18,0,0,10
case,CASE DOCS\11.24.24 - ORDER OF REFERRAL-1.pdf,extracted_text\11.24.24 - ORDER OF REFERRAL-1.txt,2024-11-24,,38,0,6,0,0,0,18,2,4,0,0,8
case,CASE DOCS\12.16.2024_MYERS V BRANTHOOVER Civil No 524-cv-01311-1.pdf,extracted_text\12.16.2024_MYERS V BRANTHOOVER Civil No 524-cv-01311-1.txt,2024-12-16,,38,18,4,6,0,0,0,0,8,0,0,2
research,RESEARCH\vLex-Vincent-Can-a-judge-be-recused-1.pdf,extracted_research\vLex-Vincent-Can-a-judge-be-recused-1.txt,,,38,5,2,14,3,0,0,11,1,0,0,2
research,RESEARCH\vLex-Vincent-Can-a-judge-be-recused-17f31b40-1.pdf,extracted_research\vLex-Vincent-Can-a-judge-be-recused-17f31b40-1.txt,,,38,5,2,14,3,0,0,11,1,0,0,2
research,RESEARCH\vLex-Vincent-Can-a-judge-be-recused-76e5928a-1.pdf,extracted_research\vLex-Vincent-Can-a-judge-be-recused-76e5928a-1.txt,,,38,5,2,14,3,0,0,11,1,0,0,2
research,RESEARCH\vLex-Vincent-What-are-the-fundamental-types-of-legal-documents--including-petitions--responses--motions--and-orde-1.pdf,extracted_research\vLex-Vincent-What-are-the-fundamental-types-of-legal-documents--including-petitions--responses--motions--and-orde-1.txt,,,38,0,3,12,0,0,0,4,13,0,1,5
case,CASE DOCS\09.09.25 - ORDER OF REFERRAL MUNFORD-1.pdf,extracted_text\09.09.25 - ORDER OF REFERRAL MUNFORD-1.txt,2025-09-09,,36,14,4,0,0,0,12,6,0,0,0,0
case,CASE DOCS\09.11.25 - MOTION TO RECUSE THE REGIONAL JUDGE-1.pdf,extracted_text\09.11.25 - MOTION TO RECUSE THE REGIONAL JUDGE-1.txt,2025-09-11,,36,0,4,0,0,0,18,2,4,0,0,8
case,CASE DOCS\09.12.25 - FIRST AMENDED MOTION TO RECUSE THE REGIONAL JUDGE-1.pdf,extracted_text\09.12.25 - FIRST AMENDED MOTION TO RECUSE THE REGIONAL JUDGE-1.txt,2025-09-12,,36,0,4,0,0,0,18,2,4,0,0,8
research,RESEARCH\vLex-Vincent-1-STATE-COMMISSION-ON-JUDICIAL-CONDUCT-HONORABLE-JAMES-MUNFORD--DISTRICT-JUDGE-OF-THE-322nd-DISTRICT-1.pdf,extracted_research\vLex-Vincent-1-STATE-COMMISSION-ON-JUDICIAL-CONDUCT-HONORABLE-JAMES-MUNFORD--DISTRICT-JUDGE-OF-THE-322nd-DISTRICT-1.txt,,,36,0,4,9,0,0,0,22,0,0,0,1
research,RESEARCH\vLex-Vincent-1-STATE-COMMISSION-ON-JUDICIAL-CONDUCT-HONORABLE-JAMES-MUNFORD--DISTRICT-JUDGE-OF-THE-322nd-DISTRICT-b3c003b4-1.pdf,extracted_research\vLex-Vincent-1-STATE-COMMISSION-ON-JUDICIAL-CONDUCT-HONORABLE-JAMES-MUNFORD--DISTRICT-JUDGE-OF-THE-322nd-DISTRICT-b3c003b4-1.txt,,,36,0,4,9,0,0,0,22,0,0,0,1
research,RESEARCH\vLex-Vincent-1-STATE-COMMISSION-ON-JUDICIAL-CONDUCT-HONORABLE-JAMES-MUNFORD--DISTRICT-JUDGE-OF-THE-322nd-DISTRICT-c96c595b-1.pdf,extracted_research\vLex-Vincent-1-STATE-COMMISSION-ON-JUDICIAL-CONDUCT-HONORABLE-JAMES-MUNFORD--DISTRICT-JUDGE-OF-THE-322nd-DISTRICT-c96c595b-1.txt,,,36,0,4,9,0,0,0,22,0,0,0,1
research,RESEARCH\regional_retired_judges.pdf,extracted_research\regional_retired_judges.txt,,,35,0,1,1,2,0,0,10,5,0,0,16
case,CASE DOCS\02.09.2024_EXHIBIT A1 - TEXT RECORDS AND VISUALIZATIONS-1.pdf,extracted_text\02.09.2024_EXHIBIT A1 - TEXT RECORDS AND VISUALIZATIONS-1.txt,2024-02-09,,34,0,0,0,0,16,0,0,18,0,0,0
case,CASE DOCS\02.09.25 - Exhibit A.1 TEXTS AND VIZUALIZATIONS-1.pdf,extracted_text\02.09.25 - Exhibit A.1 TEXTS AND VIZUALIZATIONS-1.txt,2025-02-09,,34,0,0,0,0,16,0,0,18,0,0,0
case,CASE DOCS\03.14.25 - BAKER JUDGE REINSTATEMENTS-1.pdf,extracted_text\03.14.25 - BAKER JUDGE REINSTATEMENTS-1.txt,2025-03-14,,34,8,4,2,20,0,0,0,0,0,0,0
case,CASE DOCS\03.14.25 - SUMMARY JUDGEMENT EMAIL BAKER-1.pdf,extracted_text\03.14.25 - SUMMARY JUDGEMENT EMAIL BAKER-1.txt,2025-03-14,,34,8,4,2,20,0,0,0,0,0,0,0
case,CASE DOCS\03.18.2025_233-765358-25 - COVER LETTER - SAPCR-1.pdf,extracted_text\03.18.2025_233-765358-25 - COVER LETTER - SAPCR-1.txt,2025-03-18,,34,8,0,0,10,0,0,0,10,0,4,2
case,CASE DOCS\03.18.25 - SAPCR COVER LETTER-1-1.pdf,extracted_text\03.18.25 - SAPCR COVER LETTER-1-1.txt,2025-03-18,,34,8,0,0,10,0,0,0,10,0,4,2
case,CASE DOCS\03.18.25 - SAPCR COVER LETTER-1.pdf,extracted_text\03.18.25 - SAPCR COVER LETTER-1.txt,2025-03-18,,34,8,0,0,10,0,0,0,10,0,4,2
case,CASE DOCS\07.05.24 - SECOND AMENDED COUNTERPETITION FOR DIVORCE (2)-1.pdf,extracted_text\07.05.24 - SECOND AMENDED COUNTERPETITION FOR DIVORCE (2)-1.txt,2024-07-05,,34,4,2,0,0,0,0,8,12,0,6,2
case,CASE DOCS\09.05.25 - MOTION TO RECUSE JAMES MUNFORD-1.pdf,extracted_text\09.05.25 - MOTION TO RECUSE JAMES MUNFORD-1.txt,2025-09-05,,34,14,2,0,0,0,12,6,0,0,0,0
research,RESEARCH\vLex-Vincent-The-ongoing-procedural-irregularities-and-judicial-inaction-have-caused-irreparable-harm-to-the-resp-1.pdf,extracted_research\vLex-Vincent-The-ongoing-procedural-irregularities-and-judicial-inaction-have-caused-irreparable-harm-to-the-resp-1.txt,,,34,8,1,5,0,0,0,20,0,0,0,0
research,RESEARCH\vLex-Vincent-There-is-a-documented-pattern-of-the-court-ignoring-or-mishandling-pleadings--failing-to-address-cre-1.pdf,extracted_research\vLex-Vincent-There-is-a-documented-pattern-of-the-court-ignoring-or-mishandling-pleadings--failing-to-address-cre-1.txt,,,33,7,1,7,0,0,0,18,0,0,0,0
case,CASE DOCS\06.20.24 Motion to Sign-1.pdf,extracted_text\06.20.24 Motion to Sign-1.txt,2024-06-20,,32,12,6,6,0,0,0,0,6,0,0,2
case,CASE DOCS\06.23.24 Objection to Title IV-1.pdf,extracted_text\06.23.24 Objection to Title IV-1.txt,2024-06-23,,32,16,8,0,0,0,0,4,4,0,0,0
case,CASE DOCS\06.30.24 - OBJECTION TO TITLE IV INTERVENTION-1.pdf,extracted_text\06.30.24 - OBJECTION TO TITLE IV INTERVENTION-1.txt,2024-06-30,,32,16,8,0,0,0,0,4,4,0,0,0
case,CASE DOCS\07.01.24 - OBJECTION TO TITLE-IV INTERVENTION-1.pdf,extracted_text\07.01.24 - OBJECTION TO TITLE-IV INTERVENTION-1.txt,2024-07-01,,32,16,8,0,0,0,0,4,4,0,0,0
case,CASE DOCS\09.25.25 - AFFIDAVIT OF CHARLES DUSTIN MYERS.pdf,extracted_text\09.25.25 - AFFIDAVIT OF CHARLES DUSTIN MYERS.txt,2025-09-25,,32,0,0,0,0,0,0,0,4,0,0,28
case,CASE DOCS\09.25.25 - LETTER TO CLERK 25-0861-1.pdf,extracted_text\09.25.25 - LETTER TO CLERK 25-0861-1.txt,2025-09-25,25-0861,32,0,0,0,0,0,0,0,4,0,0,28
case,CASE DOCS\11.25.25 - EXHIBIT 4.pdf,extracted_text\11.25.25 - EXHIBIT 4.txt,2025-11-25,,32,15,8,0,0,0,0,0,4,0,5,0
case,CASE DOCS\11.11.24 - MOTION TO ENTER JUDGMENT-1.pdf,extracted_text\11.11.24 - MOTION TO ENTER JUDGMENT-1.txt,2024-11-11,,30,0,8,2,0,0,0,16,2,0,0,2
research,RESEARCH\REFUSAL TO HEAR TRO2.pdf,extracted_research\REFUSAL TO HEAR TRO2.txt,,,30,0,0,0,0,0,0,16,0,0,11,3
research,RESEARCH\vLex-Vincent-CAUSE-NUMBER--2500011168-OFFENSE-CHARGED--LP---OPERATION-OF-MOTOR-VEHICLE-WITHOUT-LICENSE-PLATE-STAT-1.pdf,extracted_research\vLex-Vincent-CAUSE-NUMBER--2500011168-OFFENSE-CHARGED--LP---OPERATION-OF-MOTOR-VEHICLE-WITHOUT-LICENSE-PLATE-STAT-1.txt,,,30,0,1,0,4,0,0,6,19,0,0,0
research,RESEARCH\vLex-Vincent-CAUSE-NUMBER--2500011168-OFFENSE-CHARGED--LP---OPERATION-OF-MOTOR-VEHICLE-WITHOUT-LICENSE-PLATE-STAT-50e71d2f-1.pdf,extracted_research\vLex-Vincent-CAUSE-NUMBER--2500011168-OFFENSE-CHARGED--LP---OPERATION-OF-MOTOR-VEHICLE-WITHOUT-LICENSE-PLATE-STAT-50e71d2f-1.txt,,,30,0,1,0,4,0,0,6,19,0,0,0
case,CASE DOCS\09.11.25 - NOTICE-1.pdf,extracted_text\09.11.25 - NOTICE-1.txt,2025-09-11,,29,3,2,0,0,0,18,0,0,0,0,6
case,CASE DOCS\05.02.2024_2ND COA ORD ORIG PROC MTNREHEARING DENIED-1.pdf,extracted_text\05.02.2024_2ND COA ORD ORIG PROC MTNREHEARING DENIED-1.txt,2024-05-02,,28,2,10,0,0,0,0,12,2,0,0,2
case,CASE DOCS\10.09.24 - ORDER OF REFERRAL MUNFORD-1.pdf,extracted_text\10.09.24 - ORDER OF REFERRAL MUNFORD-1.txt,2024-10-09,,28,0,8,0,0,0,0,10,0,0,6,4
case,CASE DOCS\11.04.25 - MOTION FOR REHEARING.pdf,extracted_text\11.04.25 - MOTION FOR REHEARING.txt,2025-11-04,,28,0,2,0,2,0,0,0,4,0,0,20
research,RESEARCH\vLex-Vincent-322-744263-23-IN-THE-322ND-DISTRICT-COURT--OF-TARRANT-COUNTY--TEXAS--Morgan-Michelle-Myers---------- (1)-1.pdf,extracted_research\vLex-Vincent-322-744263-23-IN-THE-322ND-DISTRICT-COURT--OF-TARRANT-COUNTY--TEXAS--Morgan-Michelle-Myers---------- (1)-1.txt,,322-744263-23,27,7,2,1,0,0,7,9,1,0,0,0
research,RESEARCH\vLex-Vincent-322-744263-23-IN-THE-322ND-DISTRICT-COURT--OF-TARRANT-COUNTY--TEXAS--Morgan-Michelle-Myers---------- (2)-1.pdf,extracted_research\vLex-Vincent-322-744263-23-IN-THE-322ND-DISTRICT-COURT--OF-TARRANT-COUNTY--TEXAS--Morgan-Michelle-Myers---------- (2)-1.txt,,322-744263-23,27,7,2,1,0,0,7,9,1,0,0,0
case,CASE DOCS\03.21.25 - information to OPPOSING PARTY-1.pdf,extracted_text\03.21.25 - information to OPPOSING PARTY-1.txt,2025-03-21,,26,0,4,0,0,0,0,0,20,0,0,2
case,CASE DOCS\03.24.25 - PETS OBJ TO CONSOL-1.pdf,extracted_text\03.24.25 - PETS OBJ TO CONSOL-1.txt,2025-03-24,,26,4,2,2,2,0,0,0,16,0,0,0
case,CASE DOCS\03.24.25 - Petitioner's Objection to Consolidation (233)-1.pdf,extracted_text\03.24.25 - Petitioner's Objection to Consolidation (233)-1.txt,2025-03-24,,26,4,2,2,2,0,0,0,16,0,0,0
case,CASE DOCS\04.22.25 - EMERGENCY TRO APPLICATION-1.pdf,extracted_text\04.22.25 - EMERGENCY TRO APPLICATION-1.txt,2025-04-22,,26,0,14,11,0,0,0,0,1,0,0,0
case,CASE DOCS\04.26.24 - 02-24-00149-CV MOTION FOR EN BANC-1.pdf,extracted_text\04.26.24 - 02-24-00149-CV MOTION FOR EN BANC-1.txt,2024-04-26,02-24-00149-CV,26,2,8,0,0,0,0,12,2,0,0,2
case,CASE DOCS\04.26.24 - MOTION FOR EN BANC-1.pdf,extracted_text\04.26.24 - MOTION FOR EN BANC-1.txt,2024-04-26,,26,2,8,0,0,0,0,12,2,0,0,2
case,CASE DOCS\05.27.25 - COVER LETTER_D0948D0F.pdf,extracted_text\05.27.25 - COVER LETTER_D0948D0F.txt,2025-05-27,,26,0,0,0,0,0,0,0,8,0,0,18
research,RESEARCH\OAG IMPROPER ARREARS.pdf,extracted_research\OAG IMPROPER ARREARS.txt,,,26,7,7,0,1,0,0,0,11,0,0,0
research,RESEARCH\vLex-Vincent-A-party-cannot-be-removed-1.pdf,extracted_research\vLex-Vincent-A-party-cannot-be-removed-1.txt,,,25,0,0,18,0,0,0,7,0,0,0,0
research,RESEARCH\vLex-Vincent-A-party-cannot-be-removed-2131c9eb-1.pdf,extracted_research\vLex-Vincent-A-party-cannot-be-removed-2131c9eb-1.txt,,,25,0,0,18,0,0,0,7,0,0,0,0
research,RESEARCH\vLex-Vincent-A-party-cannot-be-removed-84276388-1.pdf,extracted_research\vLex-Vincent-A-party-cannot-be-removed-84276388-1.txt,,,25,0,0,18,0,0,0,7,0,0,0,0
research,RESEARCH\vLex-Vincent-The-court-did-not-hold-1.pdf,extracted_research\vLex-Vincent-The-court-did-not-hold-1.txt,,,25,0,5,0,0,0,0,0,0,0,0,20
research,RESEARCH\vLex-Vincent-The-court-did-not-hold-33cbbcdf-1.pdf,extracted_research\vLex-Vincent-The-court-did-not-hold-33cbbcdf-1.txt,,,25,0,5,0,0,0,0,0,0,0,0,20
research,RESEARCH\vLex-Vincent-The-court-did-not-hold-d9e38a00-1.pdf,extracted_research\vLex-Vincent-The-court-did-not-hold-d9e38a00-1.txt,,,25,0,5,0,0,0,0,0,0,0,0,20
case,CASE DOCS\02.22.24 - Partial Summary Judgment-1.pdf,extracted_text\02.22.24 - Partial Summary Judgment-1.txt,2024-02-22,,24,6,4,2,0,0,0,12,0,0,0,0
case,CASE DOCS\02.22.24 - SUMMARY JUDGMENT BRIEF-1.pdf,extracted_text\02.22.24 - SUMMARY JUDGMENT BRIEF-1.txt,2024-02-22,,24,6,4,2,0,0,0,12,0,0,0,0
case,CASE DOCS\02.24.24 - MOTION FOR SUMMARY JUDGMENT - BRIEF-1.pdf,extracted_text\02.24.24 - MOTION FOR SUMMARY JUDGMENT - BRIEF-1.txt,2024-02-24,,24,6,4,2,0,0,0,12,0,0,0,0
case,CASE DOCS\03.27.25 - 233rd COOPER INFLUENCE-1.pdf,extracted_text\03.27.25 - 233rd COOPER INFLUENCE-1.txt,2025-03-27,,24,0,12,0,4,0,0,4,4,0,0,0
case,CASE DOCS\03.27.25 - Cooper Carter Forward Looking Statement-1.pdf,extracted_text\03.27.25 - Cooper Carter Forward Looking Statement-1.txt,2025-03-27,,24,0,12,0,4,0,0,4,4,0,0,0
case,CASE DOCS\05.01.25 - 25-0361 EMERGENCY MOTION FOR TEMPORARY RELIEF-1.pdf,extracted_text\05.01.25 - 25-0361 EMERGENCY MOTION FOR TEMPORARY RELIEF-1.txt,2025-05-01,25-0361,24,0,8,0,0,0,0,0,0,0,0,16
case,CASE DOCS\11.25.25 - EXHIBIT 3.pdf,extracted_text\11.25.25 - EXHIBIT 3.txt,2025-11-25,,24,6,4,3,1,0,1,1,8,0,0,0
research,RESEARCH\vLex-Vincent-How-and-when-can-a-party-invoke-their-right-to-a-jury-trial--1.pdf,extracted_research\vLex-Vincent-How-and-when-can-a-party-invoke-their-right-to-a-jury-trial--1.txt,,,24,3,4,1,0,4,0,12,0,0,0,0
research,RESEARCH\vLex-Vincent-The-court-refused-to-hear-1.pdf,extracted_research\vLex-Vincent-The-court-refused-to-hear-1.txt,,,24,0,0,4,0,0,0,0,0,0,16,4
research,RESEARCH\vLex-Vincent-The-court-refused-to-hear-71df25d8-1.pdf,extracted_research\vLex-Vincent-The-court-refused-to-hear-71df25d8-1.txt,,,24,0,0,4,0,0,0,0,0,0,16,4
research,RESEARCH\vLex-Vincent-The-court-refused-to-hear-a98d376e-1.pdf,extracted_research\vLex-Vincent-The-court-refused-to-hear-a98d376e-1.txt,,,24,0,0,4,0,0,0,0,0,0,16,4
research,RESEARCH\vLex-Vincent-What-is-the-hierarchy-of-legal-authorities-in-Texas--including-the-Texas-Constitution--statutes--suc-1.pdf,extracted_research\vLex-Vincent-What-is-the-hierarchy-of-legal-authorities-in-Texas--including-the-Texas-Constitution--statutes--suc-1.txt,,,24,9,1,0,0,0,0,14,0,0,0,0
research,RESEARCH\vLex-Vincent-Your-daughter's-health-condition-required-1.pdf,extracted_research\vLex-Vincent-Your-daughter's-health-condition-required-1.txt,,,23,3,0,19,0,0,0,0,1,0,0,0
research,RESEARCH\vLex-Vincent-Your-daughter's-health-condition-required-555c3e18-1.pdf,extracted_research\vLex-Vincent-Your-daughter's-health-condition-required-555c3e18-1.txt,,,23,3,0,19,0,0,0,0,1,0,0,0
research,RESEARCH\vLex-Vincent-Your-daughter's-health-condition-required-8e98fb93-1.pdf,extracted_research\vLex-Vincent-Your-daughter's-health-condition-required-8e98fb93-1.txt,,,23,3,0,19,0,0,0,0,1,0,0,0
case,CASE DOCS\02.24.25 - OBJECTION AND REQUEST FOR JUDICIAL NOTICE-1.pdf,extracted_text\02.24.25 - OBJECTION AND REQUEST FOR JUDICIAL NOTICE-1.txt,2025-02-24,,22,2,6,0,0,0,0,12,0,0,2,0
case,CASE DOCS\02.25.2025_OBJECTION AND REQUEST FOR JUDICIAL NOTICE-1.pdf,extracted_text\02.25.2025_OBJECTION AND REQUEST FOR JUDICIAL NOTICE-1.txt,2025-02-25,,22,2,6,0,0,0,0,12,0,0,2,0
case,CASE DOCS\04.16.2025_02-25-00171-CV - MANDAMUS RECORD-1.pdf,extracted_text\04.16.2025_02-25-00171-CV - MANDAMUS RECORD-1.txt,2025-04-16,,22,0,6,0,0,0,0,0,0,0,2,14
case,CASE DOCS\05.05.2025_25-0361 HON KAITCER EMERGENCY MOTION FOR TEMPORARY RELIEF-1.pdf,extracted_text\05.05.2025_25-0361 HON KAITCER EMERGENCY MOTION FOR TEMPORARY RELIEF-1.txt,2025-05-05,,22,0,8,0,0,0,0,0,0,0,0,14
case,CASE DOCS\06.20.24 Motion to Signx2-1.pdf,extracted_text\06.20.24 Motion to Signx2-1.txt,2024-06-20,,22,6,4,0,0,0,0,10,2,0,0,0
case,CASE DOCS\11.25.25 - Response in Support of Granting NoEvidence Summary Judgment on Submission.pdf,extracted_text\11.25.25 - Response in Support of Granting NoEvidence Summary Judgment on Submission.txt,2025-11-25,,22,0,2,2,0,0,0,10,0,0,0,8
research,RESEARCH\NO ORDER OF REFERRAL - ASSOCIATE JUDGE.pdf,extracted_research\NO ORDER OF REFERRAL - ASSOCIATE JUDGE.txt,,,22,0,5,0,0,0,0,2,15,0,0,0
case,CASE DOCS\03.14.24 - Temporary Orders-1.pdf,extracted_text\03.14.24 - Temporary Orders-1.txt,2024-03-14,,21,15,1,0,0,0,0,0,3,0,2,0
case,CASE DOCS\11.25.25 - EXHIBIT 1.pdf,extracted_text\11.25.25 - EXHIBIT 1.txt,2025-11-25,,21,6,0,4,2,0,0,0,1,0,8,0
research,RESEARCH\vLex-Vincent-If-a-judge-orders-a-1.pdf,extracted_research\vLex-Vincent-If-a-judge-orders-a-1.txt,,,21,0,0,0,3,0,0,11,7,0,0,0
case,CASE DOCS\05.06.25 - OBJECTION TO ORDER OF ASSIGNMENT-1.pdf,extracted_text\05.06.25 - OBJECTION TO ORDER OF ASSIGNMENT-1.txt,2025-05-06,,20,0,12,0,0,0,0,8,0,0,0,0
case,CASE DOCS\05.07.2025_OBJECTION TO ORDER OF ASSIGNMENT-1.pdf,extracted_text\05.07.2025_OBJECTION TO ORDER OF ASSIGNMENT-1.txt,2025-05-07,,20,0,12,0,0,0,0,8,0,0,0,0
case,CASE DOCS\05.20.25 - 0426 Emergency Stay-1.pdf,extracted_text\05.20.25 - 0426 Emergency Stay-1.txt,2025-05-20,,20,0,6,0,0,0,0,0,2,0,0,12
case,CASE DOCS\05.20.25 - 25-0426 EMERGENCY STAY-1.pdf,extracted_text\05.20.25 - 25-0426 EMERGENCY STAY-1.txt,2025-05-20,25-0426,20,0,6,0,0,0,0,0,2,0,0,12
case,CASE DOCS\05.21.2025_NOTICE OF INTENT TO FILE MANDAMUS-1.pdf,extracted_text\05.21.2025_NOTICE OF INTENT TO FILE MANDAMUS-1.txt,2025-05-21,,20,0,2,0,0,0,0,2,0,0,0,16
case,CASE DOCS\06.24.24 - MOTION FOR JOINDER-1.pdf,extracted_text\06.24.24 - MOTION FOR JOINDER-1.txt,2024-06-24,,19,2,5,2,0,2,0,2,4,0,2,0
research,RESEARCH\HIDING DOCUMENTS FROM PUBLIC.pdf,extracted_research\HIDING DOCUMENTS FROM PUBLIC.txt,,,19,8,0,0,0,0,0,7,2,0,0,2
research,RESEARCH\vLex-Vincent-If-a-judge-orders-a-86b9e418-1.pdf,extracted_research\vLex-Vincent-If-a-judge-orders-a-86b9e418-1.txt,,,19,0,2,11,0,0,0,3,1,0,0,2
research,RESEARCH\vLex-Vincent-In-a-divorce-proceeding-that-has-not-been-finalized--if-a-third-party-fraudulently-induces-the-court-1.pdf,extracted_research\vLex-Vincent-In-a-divorce-proceeding-that-has-not-been-finalized--if-a-third-party-fraudulently-induces-the-court-1.txt,,,19,5,2,0,0,2,0,1,9,0,0,0
research,RESEARCH\vLex-Vincent-The-Order-of-Assignment-dated-May-6--2025--assigned-a-judge-to-rule-on-a-recusal-motion-against-Judg-1.pdf,extracted_research\vLex-Vincent-The-Order-of-Assignment-dated-May-6--2025--assigned-a-judge-to-rule-on-a-recusal-motion-against-Judg-1.txt,,,19,0,0,0,0,0,0,15,0,0,0,4
case,CASE DOCS\04.28.2025_NOTICE OF NON-APPEARANCE AND OBJ TO TRIAL SETTING-1.pdf,extracted_text\04.28.2025_NOTICE OF NON-APPEARANCE AND OBJ TO TRIAL SETTING-1.txt,2025-04-28,,18,0,2,0,0,0,0,10,6,0,0,0
case,CASE DOCS\04.28.25 - NOTICE AND OBJECTION-1.pdf,extracted_text\04.28.25 - NOTICE AND OBJECTION-1.txt,2025-04-28,,18,0,2,0,0,0,0,10,6,0,0,0
case,CASE DOCS\04.28.25 - NOTICE AND OBJECTION-a9ed2d2a-1.pdf,extracted_text\04.28.25 - NOTICE AND OBJECTION-a9ed2d2a-1.txt,2025-04-28,,18,0,2,0,0,0,0,10,6,0,0,0
case,CASE DOCS\05.09.24 Defective IWO-1.pdf,extracted_text\05.09.24 Defective IWO-1.txt,2024-05-09,,18,14,0,0,0,0,0,0,4,0,0,0
case,CASE DOCS\05.12.2025_AFFIDAVIT OF CHARLES DUSTIN MYERS-1.pdf,extracted_text\05.12.2025_AFFIDAVIT OF CHARLES DUSTIN MYERS-1.txt,2025-05-12,,18,2,4,4,0,0,0,0,2,0,0,6
case,CASE DOCS\05.12.25 - 25-0361 AFFIDAVIT OF CHARLES DUSTIN MYERS-1.pdf,extracted_text\05.12.25 - 25-0361 AFFIDAVIT OF CHARLES DUSTIN MYERS-1.txt,2025-05-12,25-0361,18,2,4,4,0,0,0,0,2,0,0,6
case,CASE DOCS\05.19.24 - EXHIBIT - DEFECTIVE IWO-1.pdf,extracted_text\05.19.24 - EXHIBIT - DEFECTIVE IWO-1.txt,2024-05-19,,18,14,0,0,0,0,0,0,4,0,0,0
case,CASE DOCS\05.21.25 - NOTICE OF INTENT TO FILE MANDAMUS-1.pdf,extracted_text\05.21.25 - NOTICE OF INTENT TO FILE MANDAMUS-1.txt,2025-05-21,,18,0,2,0,0,0,0,2,0,0,0,14
research,RESEARCH\vLex-Vincent-The-court-issued-orders-without-1.pdf,extracted_research\vLex-Vincent-The-court-issued-orders-without-1.txt,,,18,5,1,0,0,0,0,12,0,0,0,0
research,RESEARCH\vLex-Vincent-The-court-issued-orders-without-1be1f2b9-1.pdf,extracted_research\vLex-Vincent-The-court-issued-orders-without-1be1f2b9-1.txt,,,18,5,1,0,0,0,0,12,0,0,0,0
research,RESEARCH\vLex-Vincent-The-court-issued-orders-without-3437f7d2-1.pdf,extracted_research\vLex-Vincent-The-court-issued-orders-without-3437f7d2-1.txt,,,18,5,1,0,0,0,0,12,0,0,0,0
research,RESEARCH\vLex-Vincent-The-court-issued-orders-without-c9b3294a-1.pdf,extracted_research\vLex-Vincent-The-court-issued-orders-without-c9b3294a-1.txt,,,18,5,1,0,0,0,0,12,0,0,0,0
case,CASE DOCS\06.23.24 Motion for Joinder-1.pdf,extracted_text\06.23.24 Motion for Joinder-1.txt,2024-06-23,,17,0,5,2,0,2,0,2,4,0,2,0
research,RESEARCH\vLex-Vincent-CAUSE-NUMBER--2500011168--OFFENSE-CHARGED--LP---OPERATION-OF-MOTOR-VEHICLE-WITHOUT-LICENSE-PLATE--ST-1.pdf,extracted_research\vLex-Vincent-CAUSE-NUMBER--2500011168--OFFENSE-CHARGED--LP---OPERATION-OF-MOTOR-VEHICLE-WITHOUT-LICENSE-PLATE--ST-1.txt,,,17,1,0,0,0,0,0,5,11,0,0,0
research,RESEARCH\vLex-Vincent-Does-causing-a-risk-of-1.pdf,extracted_research\vLex-Vincent-Does-causing-a-risk-of-1.txt,,,17,1,0,0,2,1,0,11,0,0,0,2
research,RESEARCH\vLex-Vincent-Does-causing-a-risk-of-4894d2da-1.pdf,extracted_research\vLex-Vincent-Does-causing-a-risk-of-4894d2da-1.txt,,,17,1,0,0,2,1,0,11,0,0,0,2
research,RESEARCH\vLex-Vincent-Does-causing-a-risk-of-68a58cec-1.pdf,extracted_research\vLex-Vincent-Does-causing-a-risk-of-68a58cec-1.txt,,,17,1,0,0,2,1,0,11,0,0,0,2
case,CASE DOCS\03.05.2025 NOTICE - WATAUGA POLICE DEPT.-1.pdf,extracted_text\03.05.2025 NOTICE - WATAUGA POLICE DEPT.-1.txt,2025-03-05,,16,0,4,8,0,0,0,2,2,0,0,0
case,CASE DOCS\03.11.2025_NOTICE OF CONTINUED OBSTRUCTION-1.pdf,extracted_text\03.11.2025_NOTICE OF CONTINUED OBSTRUCTION-1.txt,2025-03-11,,16,0,4,2,0,0,0,2,4,0,0,4
case,CASE DOCS\03.11.25 - NOTICE OF CONTINUED OBSTRUCTION-1.pdf,extracted_text\03.11.25 - NOTICE OF CONTINUED OBSTRUCTION-1.txt,2025-03-11,,16,0,4,2,0,0,0,2,4,0,0,4
case,CASE DOCS\03.12.25 - NOTICE OF CONTINUED OBSTRUCTION-1.pdf,extracted_text\03.12.25 - NOTICE OF CONTINUED OBSTRUCTION-1.txt,2025-03-12,,16,0,4,2,0,0,0,2,4,0,0,4
case,CASE DOCS\03.20.2025_233-765358-25 EMERGENCY EX-PARTE MOTION TODECLARE JUDGMENT VOID AB INITIO AND FOR IMMEDIATE RE-ENTRY-1.pdf,extracted_text\03.20.2025_233-765358-25 EMERGENCY EX-PARTE MOTION TODECLARE JUDGMENT VOID AB INITIO AND FOR IMMEDIATE RE-ENTRY-1.txt,2025-03-20,,16,0,4,0,0,2,0,0,8,0,0,2
case,CASE DOCS\05.05.25 - Motion to Disqualify (CARTER)-1.pdf,extracted_text\05.05.25 - Motion to Disqualify (CARTER)-1.txt,2025-05-05,,16,6,6,0,0,0,0,0,4,0,0,0
case,CASE DOCS\05.16.25 - NOTICE OF INTENT TO FILE MANDAMUS-1.pdf,extracted_text\05.16.25 - NOTICE OF INTENT TO FILE MANDAMUS-1.txt,2025-05-16,,16,0,4,0,0,0,0,0,0,0,0,12
case,CASE DOCS\07.11.25 - RELATOR'S STATEMENT.pdf,extracted_text\07.11.25 - RELATOR'S STATEMENT.txt,2025-07-11,,16,0,0,0,0,0,0,4,0,0,0,12
case,CASE DOCS\08.31.21 - AGREED ORDER COOPER CARTER-1.pdf,extracted_text\08.31.21 - AGREED ORDER COOPER CARTER-1.txt,2021-08-31,,16,0,2,0,0,0,0,0,4,0,10,0
case,CASE DOCS\06.02.25 - BRANTHOOVER ORDER.pdf,extracted_text\06.02.25 - BRANTHOOVER ORDER.txt,2025-06-02,,15,9,2,0,0,0,0,2,0,0,0,2
case,CASE DOCS\06.24.24 - Motion for Joinder-1-1.pdf,extracted_text\06.24.24 - Motion for Joinder-1-1.txt,2024-06-24,,15,1,2,2,0,2,0,2,4,0,2,0
case,CASE DOCS\10.15.25 - INVENTORY AND APPRASALS.pdf,extracted_text\10.15.25 - INVENTORY AND APPRASALS.txt,2025-10-15,,15,2,7,4,0,0,0,0,2,0,0,0
research,RESEARCH\vLex-Vincent-If-a-district-judge-takes-up-a-case--makes-an-order--without-a-hearing-or-hearing-evidence--and-depr-1.pdf,extracted_research\vLex-Vincent-If-a-district-judge-takes-up-a-case--makes-an-order--without-a-hearing-or-hearing-evidence--and-depr-1.txt,,,15,0,0,0,0,0,0,0,15,0,0,0
research,RESEARCH\vLex-Vincent-The-district-judge-did-not-file-a-written-order-of-referral-to-the-associate-judge-as-required-by-Te-1.pdf,extracted_research\vLex-Vincent-The-district-judge-did-not-file-a-written-order-of-referral-to-the-associate-judge-as-required-by-Te-1.txt,,,15,0,1,0,0,0,0,0,14,0,0,0
research,RESEARCH\vLex-Vincent-The-regional-presiding-judge-has (1)-1.pdf,extracted_research\vLex-Vincent-The-regional-presiding-judge-has (1)-1.txt,,,15,0,0,0,0,0,0,4,0,0,0,11
case,CASE DOCS\02.09-1.pdf,extracted_text\02.09-1.txt,,,14,0,6,2,0,0,0,4,2,0,0,0
case,CASE DOCS\02.09.2024_MTN FOR RECONSIDERATION  TO VACATETEMPORARY ORDS-1.pdf,extracted_text\02.09.2024_MTN FOR RECONSIDERATION  TO VACATETEMPORARY ORDS-1.txt,2024-02-09,,14,0,6,2,0,0,0,4,2,0,0,0
case,CASE DOCS\02.09.24 - EMERGENCY MOTION TO RECONSIDER EVIDENCE AND VACATE TEMPORARY ORDERS-1.pdf,extracted_text\02.09.24 - EMERGENCY MOTION TO RECONSIDER EVIDENCE AND VACATE TEMPORARY ORDERS-1.txt,2024-02-09,,14,0,6,2,0,0,0,4,2,0,0,0
case,CASE DOCS\02.09.24 - EMERGENCY MOTION TO RECONSIDER-1.pdf,extracted_text\02.09.24 - EMERGENCY MOTION TO RECONSIDER-1.txt,2024-02-09,,14,0,6,2,0,0,0,4,2,0,0,0
case,CASE DOCS\02.09.24 - EMERGENCY MOTION.pdf,extracted_text\02.09.24 - EMERGENCY MOTION.txt,2024-02-09,,14,0,6,2,0,0,0,4,2,0,0,0
case,CASE DOCS\04.04.25 - Motion to Consol Set-1.pdf,extracted_text\04.04.25 - Motion to Consol Set-1.txt,2025-04-04,,14,0,8,0,0,0,0,2,4,0,0,0
case,CASE DOCS\04.04.25 - lindsey cooper SETTING IMPROPER HEARING-1.pdf,extracted_text\04.04.25 - lindsey cooper SETTING IMPROPER HEARING-1.txt,2025-04-04,,14,0,8,0,0,0,0,2,4,0,0,0
case,CASE DOCS\04.08.24 - Emergency Stay-1.pdf,extracted_text\04.08.24 - Emergency Stay-1.txt,2024-04-08,,14,0,6,2,0,0,0,4,2,0,0,0
case,CASE DOCS\07.28.25 - NOTICE OF RICO UPDATE-1.pdf,extracted_text\07.28.25 - NOTICE OF RICO UPDATE-1.txt,2025-07-28,,14,6,2,0,0,0,6,0,0,0,0,0
case,CASE DOCS\09.27.24 - FIRST AMENDED MOTION FOR TEMPORARY ORDERS-1.pdf,extracted_text\09.27.24 - FIRST AMENDED MOTION FOR TEMPORARY ORDERS-1.txt,2024-09-27,,14,0,12,0,0,0,0,2,0,0,0,0
case,CASE DOCS\10.08.24 Order of Referral Munford-1.pdf,extracted_text\10.08.24 Order of Referral Munford-1.txt,2024-10-08,,14,0,4,0,0,0,0,5,0,0,3,2
research,RESEARCH\vLex-Vincent-Is-it-appropriate-for-a-1.pdf,extracted_research\vLex-Vincent-Is-it-appropriate-for-a-1.txt,,,14,0,8,0,0,0,0,0,2,0,0,4
research,RESEARCH\vLex-Vincent-Is-it-appropriate-for-a-520939c1-1.pdf,extracted_research\vLex-Vincent-Is-it-appropriate-for-a-520939c1-1.txt,,,14,0,8,0,0,0,0,0,2,0,0,4
research,RESEARCH\vLex-Vincent-Is-it-appropriate-for-a-8b227c38-1.pdf,extracted_research\vLex-Vincent-Is-it-appropriate-for-a-8b227c38-1.txt,,,14,0,8,0,0,0,0,0,2,0,0,4
research,RESEARCH\vLex-Vincent-The-presiding-judge-is-the-subject-of-a-recusal-motion-and-has-failed-to-refer-the-motion-to-the-Chi-1.pdf,extracted_research\vLex-Vincent-The-presiding-judge-is-the-subject-of-a-recusal-motion-and-has-failed-to-refer-the-motion-to-the-Chi-1.txt,,,14,0,0,0,0,0,0,14,0,0,0,0
research,RESEARCH\vLex-Vincent-The-record-contains-unrefuted-evidence-of-procedural-irregularities--favoritism--and-disregard-for-m-1.pdf,extracted_research\vLex-Vincent-The-record-contains-unrefuted-evidence-of-procedural-irregularities--favoritism--and-disregard-for-m-1.txt,,,14,4,0,0,0,0,0,9,1,0,0,0
research,RESEARCH\vLex-Vincent-The-father-was-removed-from-1.pdf,extracted_research\vLex-Vincent-The-father-was-removed-from-1.txt,,,13,0,0,6,0,0,0,2,5,0,0,0
research,RESEARCH\vLex-Vincent-The-father-was-removed-from-507b4c64-1.pdf,extracted_research\vLex-Vincent-The-father-was-removed-from-507b4c64-1.txt,,,13,0,0,6,0,0,0,2,5,0,0,0
research,RESEARCH\vLex-Vincent-The-father-was-removed-from-ed1ffa49-1.pdf,extracted_research\vLex-Vincent-The-father-was-removed-from-ed1ffa49-1.txt,,,13,0,0,6,0,0,0,2,5,0,0,0
case,CASE DOCS\04.08.25 - ANGIE COORDINATOR DISTRICT JUDGE-1.pdf,extracted_text\04.08.25 - ANGIE COORDINATOR DISTRICT JUDGE-1.txt,2025-04-08,,12,0,2,2,0,0,0,0,0,0,0,8
case,CASE DOCS\04.24.24 - OBJECTION TO MOTION FOR PRE-TRIAL-1.pdf,extracted_text\04.24.24 - OBJECTION TO MOTION FOR PRE-TRIAL-1.txt,2024-04-24,,12,0,6,0,0,0,0,0,0,0,0,6
case,CASE DOCS\04.24.24 - OBJECTION TO MOTION FOR PRETRIAL CONFERENCE-1.pdf,extracted_text\04.24.24 - OBJECTION TO MOTION FOR PRETRIAL CONFERENCE-1.txt,2024-04-24,,12,0,6,0,0,0,0,0,0,0,0,6
case,CASE DOCS\05.13.2024_POST CARD SUPCT PETMAND FILED-1.pdf,extracted_text\05.13.2024_POST CARD SUPCT PETMAND FILED-1.txt,2024-05-13,,12,0,2,0,0,0,0,0,0,0,0,10
case,CASE DOCS\05.13.24 - 24-0395 MANDAMUS FILED POSTCARD-1.pdf,extracted_text\05.13.24 - 24-0395 MANDAMUS FILED POSTCARD-1.txt,2024-05-13,24-0395,12,0,2,0,0,0,0,0,0,0,0,10
case,CASE DOCS\05.13.24 - PETITION MANDAMUS RECEIVED-1.pdf,extracted_text\05.13.24 - PETITION MANDAMUS RECEIVED-1.txt,2024-05-13,,12,0,2,0,0,0,0,0,0,0,0,10
case,CASE DOCS\05.14.24 Notice of Clarification-1.pdf,extracted_text\05.14.24 Notice of Clarification-1.txt,2024-05-14,,12,0,4,0,0,0,0,0,2,0,0,6
case,CASE DOCS\06.23.24 - MOTION FOR JOINDER-1.pdf,extracted_text\06.23.24 - MOTION FOR JOINDER-1.txt,2024-06-23,,12,0,2,2,0,2,0,2,2,0,2,0
case,CASE DOCS\06.28.2024_IV-D INTERVENTION-1.pdf,extracted_text\06.28.2024_IV-D INTERVENTION-1.txt,2024-06-28,,12,6,2,0,0,0,0,0,4,0,0,0
case,CASE DOCS\06.28.24 - EXHIBIT -  INTERVENTION PLEADING-1.pdf,extracted_text\06.28.24 - EXHIBIT -  INTERVENTION PLEADING-1.txt,2024-06-28,,12,6,2,0,0,0,0,0,4,0,0,0
case,CASE DOCS\06.28.24 - INTERVENTION PLEADING-1.pdf,extracted_text\06.28.24 - INTERVENTION PLEADING-1.txt,2024-06-28,,12,6,2,0,0,0,0,0,4,0,0,0
case,CASE DOCS\08.30.2024_POST CARD SUPCT PETMAND DENIED-1.pdf,extracted_text\08.30.2024_POST CARD SUPCT PETMAND DENIED-1.txt,2024-08-30,,12,0,2,0,0,0,0,0,0,0,0,10
case,CASE DOCS\09.10.24 - 24-0395 REHEARING FILED POSTCARD-1.pdf,extracted_text\09.10.24 - 24-0395 REHEARING FILED POSTCARD-1.txt,2024-09-10,24-0395,12,0,2,0,0,0,0,0,0,0,0,10
case,CASE DOCS\10.18.24 - Rehearing Denied (24-0395)-1.pdf,extracted_text\10.18.24 - Rehearing Denied (24-0395)-1.txt,2024-10-18,24-0395,12,0,2,0,0,0,0,0,0,0,0,10
case,CASE DOCS\10.18.24 - SUP. CT REHEARING DENIAL-1.pdf,extracted_text\10.18.24 - SUP. CT REHEARING DENIAL-1.txt,2024-10-18,,12,0,2,0,0,0,0,0,0,0,0,10
case,CASE DOCS\11.15.2024_MOTION TO COMPEL DISCOVERY-1.pdf,extracted_text\11.15.2024_MOTION TO COMPEL DISCOVERY-1.txt,2024-11-15,,12,0,4,8,0,0,0,0,0,0,0,0
case,CASE DOCS\11.15.24 - MOTION TO COMPEL DISCOVERY-1.pdf,extracted_text\11.15.24 - MOTION TO COMPEL DISCOVERY-1.txt,2024-11-15,,12,0,4,8,0,0,0,0,0,0,0,0
case,CASE DOCS\12.31.24 - NOTICE OF RELATED CASE-1.pdf,extracted_text\12.31.24 - NOTICE OF RELATED CASE-1.txt,2024-12-31,,12,8,4,0,0,0,0,0,0,0,0,0
research,RESEARCH\vLex-Vincent-The-judge-s-conduct-involved-coercion-or-fraud--such-as-compelling-a-party-to-sign-a-settlement-agre-1.pdf,extracted_research\vLex-Vincent-The-judge-s-conduct-involved-coercion-or-fraud--such-as-compelling-a-party-to-sign-a-settlement-agre-1.txt,,,12,0,2,0,0,3,0,0,7,0,0,0
research,RESEARCH\vLex-Vincent-What-are-the-key-provisions-1.pdf,extracted_research\vLex-Vincent-What-are-the-key-provisions-1.txt,,,12,1,7,0,0,0,0,2,2,0,0,0
research,RESEARCH\vLex-Vincent-What-are-the-key-provisions-3d404f73-1.pdf,extracted_research\vLex-Vincent-What-are-the-key-provisions-3d404f73-1.txt,,,12,1,7,0,0,0,0,2,2,0,0,0
case,CASE DOCS\08.30.24 - SP. CT DENIAL POSTCARD-1.pdf,extracted_text\08.30.24 - SP. CT DENIAL POSTCARD-1.txt,2024-08-30,,11,0,1,0,0,0,0,0,0,0,0,10
case,CASE DOCS\03.21.25 -RULE 12-1.pdf,extracted_text\03.21.25 -RULE 12-1.txt,2025-03-21,,10,0,10,0,0,0,0,0,0,0,0,0
case,CASE DOCS\04.04.2025_233-765358-25 PETITIONERS PRE-OBJECTION TO TRANSFER-1.pdf,extracted_text\04.04.2025_233-765358-25 PETITIONERS PRE-OBJECTION TO TRANSFER-1.txt,2025-04-04,,10,0,6,0,0,0,0,2,2,0,0,0
case,CASE DOCS\04.04.25 - PRE-OBJECTION TO TRANSFER-1.pdf,extracted_text\04.04.25 - PRE-OBJECTION TO TRANSFER-1.txt,2025-04-04,,10,0,6,0,0,0,0,2,2,0,0,0
case,CASE DOCS\04.04.25 - PRE-OBJECTION TO TRANSFER-e62ddee6-1.pdf,extracted_text\04.04.25 - PRE-OBJECTION TO TRANSFER-e62ddee6-1.txt,2025-04-04,,10,0,6,0,0,0,0,2,2,0,0,0
case,CASE DOCS\04.23.2025_OBJECTION TO TRIAL SETTING AND REQUEST TO STAY PROCEEDINGS-1.pdf,extracted_text\04.23.2025_OBJECTION TO TRIAL SETTING AND REQUEST TO STAY PROCEEDINGS-1.txt,2025-04-23,,10,0,4,0,0,0,0,0,0,0,0,6
case,CASE DOCS\04.23.25 - Objection to Trial Setting and Request for Stay of Proceedings-1.pdf,extracted_text\04.23.25 - Objection to Trial Setting and Request for Stay of Proceedings-1.txt,2025-04-23,,10,0,4,0,0,0,0,0,0,0,0,6
case,CASE DOCS\04.23.25 - Objection to Trial Setting and Request for Stay of Proceedings-d657c201-1.pdf,extracted_text\04.23.25 - Objection to Trial Setting and Request for Stay of Proceedings-d657c201-1.txt,2025-04-23,,10,0,4,0,0,0,0,0,0,0,0,6
case,CASE DOCS\04.24.24 - Objection to Pretrial Conference-1.pdf,extracted_text\04.24.24 - Objection to Pretrial Conference-1.txt,2024-04-24,,10,0,4,0,0,0,0,0,0,0,0,6
case,CASE DOCS\09.16.2024_24-0395 REHEARING - SUPREME COURT MANDAMUS-1.pdf,extracted_text\09.16.2024_24-0395 REHEARING - SUPREME COURT MANDAMUS-1.txt,2024-09-16,,10,0,2,0,0,0,0,0,8,0,0,0
case,CASE DOCS\11.05.25 - MOTION FOR NOEVIDENCE SUMMARY JUDGMENT.pdf,extracted_text\11.05.25 - MOTION FOR NOEVIDENCE SUMMARY JUDGMENT.txt,2025-11-05,,10,0,2,0,0,0,0,0,0,0,4,4
case,CASE DOCS\11.08.25 - THREE YEAR RECOVERY VALUATION.pdf,extracted_text\11.08.25 - THREE YEAR RECOVERY VALUATION.txt,2025-11-08,,10,0,0,0,0,0,10,0,0,0,0,0
case,CASE DOCS\11.24.25 - SECOND AMENDED PETITION FOR DIVORCE.pdf,extracted_text\11.24.25 - SECOND AMENDED PETITION FOR DIVORCE.txt,2025-11-24,,10,0,2,0,0,0,0,0,2,0,6,0
case,CASE DOCS\12.06.24 - CERTIFIED COPY OF ORDER REMAND-1.pdf,extracted_text\12.06.24 - CERTIFIED COPY OF ORDER REMAND-1.txt,2024-12-06,,10,2,6,0,2,0,0,0,0,0,0,0
case,CASE DOCS\12.09.25 - RESPONDENT'S PROPOSED PARENTING PLAN.pdf,extracted_text\12.09.25 - RESPONDENT'S PROPOSED PARENTING PLAN.txt,2025-12-09,,10,0,4,4,0,0,0,0,0,0,0,2
case,CASE DOCS\12.11.12 - Electronic Filing  Misc. Docket No. 12-1.pdf,extracted_text\12.11.12 - Electronic Filing  Misc. Docket No. 12-1.txt,2012-12-11,,10,4,0,0,0,0,0,6,0,0,0,0
research,RESEARCH\vLex-Vincent-1--A-father-was-ordered-out-of-his-home-without-any-findings-and-without-issuing-any-protective-orde-1.pdf,extracted_research\vLex-Vincent-1--A-father-was-ordered-out-of-his-home-without-any-findings-and-without-issuing-any-protective-orde-1.txt,,,10,1,0,0,0,0,0,9,0,0,0,0
research,RESEARCH\vLex-Vincent-If-an-agreed-temporary-order--not-adopted-by-the-district-judge--bears-only-an-associate-judge-s-sig-1.pdf,extracted_research\vLex-Vincent-If-an-agreed-temporary-order--not-adopted-by-the-district-judge--bears-only-an-associate-judge-s-sig-1.txt,,,10,0,9,0,0,0,0,0,1,0,0,0
research,RESEARCH\vLex-Vincent-If-temporary-orders-in-Texas-are-issued-without-the-respondent-s-and-their-counsel-s-signatures--but-1.pdf,extracted_research\vLex-Vincent-If-temporary-orders-in-Texas-are-issued-without-the-respondent-s-and-their-counsel-s-signatures--but-1.txt,,,10,0,0,0,0,0,0,3,0,0,7,0
research,RESEARCH\vLex-Vincent-What-constitutes--fraud-on-the-court--in-Texas--and-what-are-the-available-remedies-if-proven-in-a-d-1.pdf,extracted_research\vLex-Vincent-What-constitutes--fraud-on-the-court--in-Texas--and-what-are-the-available-remedies-if-proven-in-a-d-1.txt,,,10,5,0,0,1,3,0,0,1,0,0,0
case,CASE DOCS\11.25.25 - EXHIBIT 2.pdf,extracted_text\11.25.25 - EXHIBIT 2.txt,2025-11-25,,9,1,1,1,0,0,0,2,0,0,2,2
case,CASE DOCS\12.18.23 - Original Petition For Divorce-1.pdf,extracted_text\12.18.23 - Original Petition For Divorce-1.txt,2023-12-18,,9,0,1,0,0,0,0,0,8,0,0,0
research,RESEARCH\rule 6.405(b) protections.pdf,extracted_research\rule 6.405(b) protections.txt,,,9,0,0,0,0,0,0,9,0,0,0,0
research,RESEARCH\vLex-Vincent-What-are-the-ethical-and-legal-consequences-for-attorneys-in-Texas-who-knowingly-participate-in-or-f-1.pdf,extracted_research\vLex-Vincent-What-are-the-ethical-and-legal-consequences-for-attorneys-in-Texas-who-knowingly-participate-in-or-f-1.txt,,,9,2,6,0,0,0,0,0,1,0,0,0
case,CASE DOCS\02.12.24 - Order of Withdraw (BACALIS)-1.pdf,extracted_text\02.12.24 - Order of Withdraw (BACALIS)-1.txt,2024-02-12,,8,0,6,0,0,0,0,0,0,0,2,0
case,CASE DOCS\02.28.2025_REQUEST FOR RULING-1.pdf,extracted_text\02.28.2025_REQUEST FOR RULING-1.txt,2025-02-28,,8,0,4,0,0,0,0,0,0,0,0,4
case,CASE DOCS\02.28.25 - REQUEST FOR RULING-1.pdf,extracted_text\02.28.25 - REQUEST FOR RULING-1.txt,2025-02-28,,8,0,4,0,0,0,0,0,0,0,0,4
case,CASE DOCS\03.04.2024_REQUIRED INITIAL DISCLOSURES-1.pdf,extracted_text\03.04.2024_REQUIRED INITIAL DISCLOSURES-1.txt,2024-03-04,,8,0,2,0,0,0,0,2,2,0,2,0
case,CASE DOCS\03.24.25 - PROPOSED ORDER TRO-1.pdf,extracted_text\03.24.25 - PROPOSED ORDER TRO-1.txt,2025-03-24,,8,0,2,2,0,0,0,0,0,0,4,0
case,CASE DOCS\04.04.25 - EMERGENCY NOTICE-1.pdf,extracted_text\04.04.25 - EMERGENCY NOTICE-1.txt,2025-04-04,,8,0,4,0,0,0,0,0,4,0,0,0
case,CASE DOCS\04.06.25 - LET'S USE OUR BRAINS-1.pdf,extracted_text\04.06.25 - LET'S USE OUR BRAINS-1.txt,2025-04-06,,8,2,2,0,0,0,0,0,2,0,0,2
case,CASE DOCS\04.09.25 - REJECTION OF EXHIBITS FROM CLERK-1.pdf,extracted_text\04.09.25 - REJECTION OF EXHIBITS FROM CLERK-1.txt,2025-04-09,,8,0,2,0,0,0,0,0,0,0,0,6
case,CASE DOCS\04.29.25 - OBJECTION RECUSAL HANDLING-1.pdf,extracted_text\04.29.25 - OBJECTION RECUSAL HANDLING-1.txt,2025-04-29,,8,0,2,0,0,0,0,6,0,0,0,0
case,CASE DOCS\04.29.25 - Objection to Recusal Handling-1.pdf,extracted_text\04.29.25 - Objection to Recusal Handling-1.txt,2025-04-29,,8,0,2,0,0,0,0,6,0,0,0,0
case,CASE DOCS\05.16.2025_EMERGENCY NOTICE-1.pdf,extracted_text\05.16.2025_EMERGENCY NOTICE-1.txt,2025-05-16,,8,0,4,0,0,0,0,0,0,0,0,4
case,CASE DOCS\05.22.25 - MOTION TO STRIKE INTERVENTION OF THE OAG-1.pdf,extracted_text\05.22.25 - MOTION TO STRIKE INTERVENTION OF THE OAG-1.txt,2025-05-22,,8,6,2,0,0,0,0,0,0,0,0,0
case,CASE DOCS\06.05.25 - REQUEST FOR HEARING ON DWOP-1.pdf,extracted_text\06.05.25 - REQUEST FOR HEARING ON DWOP-1.txt,2025-06-05,,8,0,8,0,0,0,0,0,0,0,0,0
case,CASE DOCS\10.10.2024_OBJECTION-1.pdf,extracted_text\10.10.2024_OBJECTION-1.txt,2024-10-10,,8,2,4,0,0,0,0,0,0,0,0,2
case,CASE DOCS\10.10.24 - OBJECTION-1.pdf,extracted_text\10.10.24 - OBJECTION-1.txt,2024-10-10,,8,2,4,0,0,0,0,0,0,0,0,2
case,CASE DOCS\11.04.25 - PT MOTION IN LIMINE-1.pdf,extracted_text\11.04.25 - PT MOTION IN LIMINE-1.txt,2025-11-04,,8,0,4,0,0,0,0,0,0,0,0,4
case,CASE DOCS\11.25.25 - RESPONSE TO MOTION FOR NO-EVIDENCE SUMMARY JUDGMENT PART 1.pdf,extracted_text\11.25.25 - RESPONSE TO MOTION FOR NO-EVIDENCE SUMMARY JUDGMENT PART 1.txt,2025-11-25,,8,2,2,0,0,0,0,0,2,0,0,2
case,CASE DOCS\11.25.25 - RESPONSE TO MOTION FOR NOEVIDENCE SUMMARY JUDGMENT PART 2.pdf,extracted_text\11.25.25 - RESPONSE TO MOTION FOR NOEVIDENCE SUMMARY JUDGMENT PART 2.txt,2025-11-25,,8,2,2,0,0,0,0,0,2,0,0,2
research,RESEARCH\ATTORNEY FAILURE TO PROSECUTE.pdf,extracted_research\ATTORNEY FAILURE TO PROSECUTE.txt,,,8,5,1,0,0,0,0,0,2,0,0,0
research,RESEARCH\FAILURE TO RESPOND.pdf,extracted_research\FAILURE TO RESPOND.txt,,,8,2,0,0,0,0,0,6,0,0,0,0
research,RESEARCH\rule 13 and rule 10.pdf,extracted_research\rule 13 and rule 10.txt,,,8,0,3,0,0,0,0,2,0,0,0,3
research,RESEARCH\vLex-Vincent-What-are-the-leading-Texas-cases-interpreting-the--best-interests-of-the-child--standard-in-family-l-1.pdf,extracted_research\vLex-Vincent-What-are-the-leading-Texas-cases-interpreting-the--best-interests-of-the-child--standard-in-family-l-1.txt,,,8,0,0,1,0,0,0,5,1,1,0,0
case,CASE DOCS\02.09.24 - Exhibit B.1 ORIGINAL PETITION FOR DIVORCE-1.pdf,extracted_text\02.09.24 - Exhibit B.1 ORIGINAL PETITION FOR DIVORCE-1.txt,2024-02-09,,7,0,3,0,0,0,0,0,4,0,0,0
case,CASE DOCS\02.09.24 - Exhibit C.1 DEFENDANT'S ORIGINAL ANSWER-1.pdf,extracted_text\02.09.24 - Exhibit C.1 DEFENDANT'S ORIGINAL ANSWER-1.txt,2024-02-09,,7,0,7,0,0,0,0,0,0,0,0,0
case,CASE DOCS\09.26.24 - Emergency Motion for Temp Orders-1.pdf,extracted_text\09.26.24 - Emergency Motion for Temp Orders-1.txt,2024-09-26,,7,0,5,0,0,0,0,2,0,0,0,0
case,CASE DOCS\12.19.23 Divorce Citation-1.pdf,extracted_text\12.19.23 Divorce Citation-1.txt,2023-12-19,,7,0,3,0,0,0,0,0,4,0,0,0
case,CASE DOCS\12.27.23 - Motion for TRO-1.pdf,extracted_text\12.27.23 - Motion for TRO-1.txt,2023-12-27,,7,0,1,0,0,0,0,0,0,0,6,0
research,RESEARCH\BEST INTERESTS.pdf,extracted_research\BEST INTERESTS.txt,,,7,1,0,0,0,1,0,5,0,0,0,0
research,RESEARCH\vLex-Vincent-Can-a-court-coordinator-in-1.pdf,extracted_research\vLex-Vincent-Can-a-court-coordinator-in-1.txt,,,7,0,0,0,0,0,0,0,1,0,0,6
research,RESEARCH\vLex-Vincent-The-court-coordinator-s-role-is-administrative--not-judicial--and-coordinators-are-not-authorized-to-1.pdf,extracted_research\vLex-Vincent-The-court-coordinator-s-role-is-administrative--not-judicial--and-coordinators-are-not-authorized-to-1.txt,,,7,0,0,0,0,0,0,7,0,0,0,0
research,RESEARCH\vLex-Vincent-The-court-coordinator-s-role-is-administrative--not-judicial--and-coordinators-are-not-authorized-to-bdb8d045-1.pdf,extracted_research\vLex-Vincent-The-court-coordinator-s-role-is-administrative--not-judicial--and-coordinators-are-not-authorized-to-bdb8d045-1.txt,,,7,0,0,0,0,0,0,7,0,0,0,0
case,CASE DOCS\02-24-00149-CV_24149CV-1.pdf,extracted_text\02-24-00149-CV_24149CV-1.txt,2014-02-24,,6,0,2,0,0,0,0,0,0,0,0,4
case,CASE DOCS\02-24-00149-CV_24149CV.cor-1.pdf,extracted_text\02-24-00149-CV_24149CV.cor-1.txt,2014-02-24,,6,0,2,0,0,0,0,0,0,0,0,4
case,CASE DOCS\02-24-00149-CV_24149CV.cor_961223C6-03e9250a-1.pdf,extracted_text\02-24-00149-CV_24149CV.cor_961223C6-03e9250a-1.txt,2014-02-24,,6,0,2,0,0,0,0,0,0,0,0,4
case,CASE DOCS\02-24-00149-CV_24149CV.cor_961223C6-1.pdf,extracted_text\02-24-00149-CV_24149CV.cor_961223C6-1.txt,2014-02-24,,6,0,2,0,0,0,0,0,0,0,0,4
case,CASE DOCS\02-25-00164-CV_25164CV-1.pdf,extracted_text\02-25-00164-CV_25164CV-1.txt,2016-02-25,,6,0,2,0,0,0,0,0,0,0,0,4
case,CASE DOCS\02-25-00166-CV_25166CV-1.pdf,extracted_text\02-25-00166-CV_25166CV-1.txt,2016-02-25,,6,0,2,0,0,0,0,0,0,0,0,4
case,CASE DOCS\02-25-00171-CV_25171CV-1.pdf,extracted_text\02-25-00171-CV_25171CV-1.txt,2017-02-25,,6,0,2,0,0,0,0,0,0,0,0,4
case,CASE DOCS\02-25-00582-CV_25582CV-1.pdf,extracted_text\02-25-00582-CV_25582CV-1.txt,2058-02-25,,6,0,2,0,0,0,0,0,0,0,0,4
case,CASE DOCS\02.01.24 - Agreed Order to Consolidation-1.pdf,extracted_text\02.01.24 - Agreed Order to Consolidation-1.txt,2024-02-01,,6,0,6,0,0,0,0,0,0,0,0,0
case,CASE DOCS\02.08.2024_AGREED ORDER FOR CONSOLIDATION SIGNED 2124-1.pdf,extracted_text\02.08.2024_AGREED ORDER FOR CONSOLIDATION SIGNED 2124-1.txt,2024-02-08,,6,0,6,0,0,0,0,0,0,0,0,0
case,CASE DOCS\02.08.24 - Agreed Motion to Consolidate-1.pdf,extracted_text\02.08.24 - Agreed Motion to Consolidate-1.txt,2024-02-08,,6,0,6,0,0,0,0,0,0,0,0,0
case,CASE DOCS\02.08.24 - Agreed Order for Consolidation-1-1.pdf,extracted_text\02.08.24 - Agreed Order for Consolidation-1-1.txt,2024-02-08,,6,0,6,0,0,0,0,0,0,0,0,0
case,CASE DOCS\02.09.24 - Exhibit B.2 Dismissed Eviction-1.pdf,extracted_text\02.09.24 - Exhibit B.2 Dismissed Eviction-1.txt,2024-02-09,,6,0,0,0,0,0,0,0,6,0,0,0
case,CASE DOCS\02.09.25 - Exhibit B.2 EVICTION DISMISSAL-1.pdf,extracted_text\02.09.25 - Exhibit B.2 EVICTION DISMISSAL-1.txt,2025-02-09,,6,0,0,0,0,0,0,0,6,0,0,0
case,CASE DOCS\02.26.25 - UNOPPOSED MOTIONS-1.pdf,extracted_text\02.26.25 - UNOPPOSED MOTIONS-1.txt,2025-02-26,,6,2,0,2,0,0,0,2,0,0,0,0
case,CASE DOCS\03.06.2025_PROPOSED ORDER ON UNOPPOSED MOTION TO DISMISS FOR LACK OF JURISDICTION-1.pdf,extracted_text\03.06.2025_PROPOSED ORDER ON UNOPPOSED MOTION TO DISMISS FOR LACK OF JURISDICTION-1.txt,2025-03-06,,6,0,2,0,0,0,0,0,4,0,0,0
case,CASE DOCS\03.14.25 - Notice of UNOPPOSED DWOP-1.pdf,extracted_text\03.14.25 - Notice of UNOPPOSED DWOP-1.txt,2025-03-14,,6,0,4,0,0,0,0,2,0,0,0,0
case,CASE DOCS\03.18.25 - ORIGINAL SAPCR-1.pdf,extracted_text\03.18.25 - ORIGINAL SAPCR-1.txt,2025-03-18,,6,0,2,0,0,0,0,0,4,0,0,0
case,CASE DOCS\03.18.25 - SAPCR PETITION-1.pdf,extracted_text\03.18.25 - SAPCR PETITION-1.txt,2025-03-18,,6,0,2,0,0,0,0,0,4,0,0,0
case,CASE DOCS\03.20.2025_233-765358-25 - MOTION TO CONSOLIDATE-1.pdf,extracted_text\03.20.2025_233-765358-25 - MOTION TO CONSOLIDATE-1.txt,2025-03-20,,6,0,6,0,0,0,0,0,0,0,0,0
case,CASE DOCS\03.20.25 - MOTION TO CONSOL-1.pdf,extracted_text\03.20.25 - MOTION TO CONSOL-1.txt,2025-03-20,,6,0,6,0,0,0,0,0,0,0,0,0
case,CASE DOCS\03.21.25 - Rule 12 Motion (233)-1.pdf,extracted_text\03.21.25 - Rule 12 Motion (233)-1.txt,2025-03-21,,6,0,6,0,0,0,0,0,0,0,0,0
case,CASE DOCS\03.24.25 - Cooper Carter Trying to Set Consolidation Motion-1.pdf,extracted_text\03.24.25 - Cooper Carter Trying to Set Consolidation Motion-1.txt,2025-03-24,,6,0,2,0,2,0,0,0,2,0,0,0
case,CASE DOCS\04.02.2025 - petitioner's notice-1.pdf,extracted_text\04.02.2025 - petitioner's notice-1.txt,2025-04-02,,6,0,2,4,0,0,0,0,0,0,0,0
case,CASE DOCS\04.02.2025_233-765358-25 - PETITIONERS NOTICE-1.pdf,extracted_text\04.02.2025_233-765358-25 - PETITIONERS NOTICE-1.txt,2025-04-02,,6,0,2,4,0,0,0,0,0,0,0,0
case,CASE DOCS\04.02.25 - PETITIONER'S notice-1.pdf,extracted_text\04.02.25 - PETITIONER'S notice-1.txt,2025-04-02,,6,0,2,4,0,0,0,0,0,0,0,0
case,CASE DOCS\04.03.2024_NOTICE OF FILING ORIGINAL PROCEEDINGMOTIONFOR TEMP RELIEF-1.pdf,extracted_text\04.03.2024_NOTICE OF FILING ORIGINAL PROCEEDINGMOTIONFOR TEMP RELIEF-1.txt,2024-04-03,,6,0,6,0,0,0,0,0,0,0,0,0
case,CASE DOCS\04.04.2025_RESPONDENTS NOTICE OF NEW INFORMATION-1.pdf,extracted_text\04.04.2025_RESPONDENTS NOTICE OF NEW INFORMATION-1.txt,2025-04-04,,6,0,4,0,0,0,0,2,0,0,0,0
case,CASE DOCS\04.04.25 - NOTICE OF NEW INFO-1.pdf,extracted_text\04.04.25 - NOTICE OF NEW INFO-1.txt,2025-04-04,,6,0,4,0,0,0,0,2,0,0,0,0
case,CASE DOCS\04.10.24 - MANDAMUS DENIAL-1.pdf,extracted_text\04.10.24 - MANDAMUS DENIAL-1.txt,2024-04-10,,6,0,2,0,0,0,0,0,0,0,0,4
case,CASE DOCS\04.11.2025_233-765358-25 - ORDER ON MOTION TO CONSOLIDATE-1.pdf,extracted_text\04.11.2025_233-765358-25 - ORDER ON MOTION TO CONSOLIDATE-1.txt,2025-04-11,,6,0,6,0,0,0,0,0,0,0,0,0
case,CASE DOCS\05.30.25 - UNOPPOSED MOTION TO STAY.pdf,extracted_text\05.30.25 - UNOPPOSED MOTION TO STAY.txt,2025-05-30,,6,0,2,0,0,0,0,0,0,0,0,4
case,CASE DOCS\09.19.24 - REQUEST FOR DISCOVERY-1.pdf,extracted_text\09.19.24 - REQUEST FOR DISCOVERY-1.txt,2024-09-19,,6,0,2,4,0,0,0,0,0,0,0,0
case,CASE DOCS\10.09.24 - NOTICE-1.pdf,extracted_text\10.09.24 - NOTICE-1.txt,2024-10-09,,6,0,4,0,0,0,0,0,0,0,0,2
case,CASE DOCS\10.25.22 - HOLLY HAYES-1.pdf,extracted_text\10.25.22 - HOLLY HAYES-1.txt,2022-10-25,,6,0,2,0,0,0,0,0,4,0,0,0
case,CASE DOCS\12.18.22 - HOLLY HAYES-1.pdf,extracted_text\12.18.22 - HOLLY HAYES-1.txt,2022-12-18,,6,0,2,0,0,0,0,0,4,0,0,0
case,CASE DOCS\12.18.23 - PRO-SE INSTRUCTIONS-1.pdf,extracted_text\12.18.23 - PRO-SE INSTRUCTIONS-1.txt,2023-12-18,,6,0,6,0,0,0,0,0,0,0,0,0
case,CASE DOCS\12.21.22 - Holly Hayes-1.pdf,extracted_text\12.21.22 - Holly Hayes-1.txt,2022-12-21,,6,0,2,0,0,0,0,0,4,0,0,0
case,CASE DOCS\12.28.23 Eviction Suit-1.pdf,extracted_text\12.28.23 Eviction Suit-1.txt,2023-12-28,,6,5,0,1,0,0,0,0,0,0,0,0
case,CASE DOCS\12.29.22 - HOLLY HAYES-1.pdf,extracted_text\12.29.22 - HOLLY HAYES-1.txt,2022-12-29,,6,0,2,0,0,0,0,0,4,0,0,0
research,RESEARCH\vLex-Vincent-Daniel-branthoover-1.pdf,extracted_research\vLex-Vincent-Daniel-branthoover-1.txt,,,6,1,0,0,0,0,0,0,5,0,0,0
research,"RESEARCH\vLex-Vincent-In-Texas,-if-a-party (2)-1.pdf","extracted_research\vLex-Vincent-In-Texas,-if-a-party (2)-1.txt",,,6,0,1,0,0,3,0,0,2,0,0,0
research,"RESEARCH\vLex-Vincent-In-Texas,-if-a-party (2)-923b3db8-1.pdf","extracted_research\vLex-Vincent-In-Texas,-if-a-party (2)-923b3db8-1.txt",,,6,0,1,0,0,3,0,0,2,0,0,0
research,"RESEARCH\vLex-Vincent-In-Texas,-if-a-party (2)-a557c79b-1.pdf","extracted_research\vLex-Vincent-In-Texas,-if-a-party (2)-a557c79b-1.txt",,,6,0,1,0,0,3,0,0,2,0,0,0
research,"RESEARCH\vLex-Vincent-In-Texas,-if-a-party (3)-1.pdf","extracted_research\vLex-Vincent-In-Texas,-if-a-party (3)-1.txt",,,6,0,1,0,0,3,0,0,2,0,0,0
case,CASE DOCS\03.14.2025_NOTICE OF SUBMISSION-1.pdf,extracted_text\03.14.2025_NOTICE OF SUBMISSION-1.txt,2025-03-14,,5,0,5,0,0,0,0,0,0,0,0,0
case,CASE DOCS\03.26.2024_REQUEST FOR CLERK TO PREPARE RECORD-1.pdf,extracted_text\03.26.2024_REQUEST FOR CLERK TO PREPARE RECORD-1.txt,2024-03-26,,5,0,2,0,0,0,0,0,0,0,0,3
case,CASE DOCS\12.18.2023_PRO SE INSTRUCTION SHEET-1.pdf,extracted_text\12.18.2023_PRO SE INSTRUCTION SHEET-1.txt,2023-12-18,,5,0,5,0,0,0,0,0,0,0,0,0
case,CASE DOCS\12.28.23 - ORDER TO SHOW CAUSE CITATION-1.pdf,extracted_text\12.28.23 - ORDER TO SHOW CAUSE CITATION-1.txt,2023-12-28,,5,0,5,0,0,0,0,0,0,0,0,0
research,RESEARCH\vLex-Vincent-In-Oklahoma--is-it-proper-to-sue-someone-under-personal-injury--other--if-they-deceived-you-by-claim-1.pdf,extracted_research\vLex-Vincent-In-Oklahoma--is-it-proper-to-sue-someone-under-personal-injury--other--if-they-deceived-you-by-claim-1.txt,,,5,1,0,0,0,0,0,0,2,0,2,0
research,RESEARCH\vLex-Vincent-THE-STATE-OF-TEXAS-8th-ADMINISTRATIVE-JUDICIAL-REGION-ORDER-OF-ASSIGNMENT-BY-THE-PRESIDING-JUDGE-Pur-1.pdf,extracted_research\vLex-Vincent-THE-STATE-OF-TEXAS-8th-ADMINISTRATIVE-JUDICIAL-REGION-ORDER-OF-ASSIGNMENT-BY-THE-PRESIDING-JUDGE-Pur-1.txt,,,5,0,1,0,0,0,0,0,0,0,0,4
research,RESEARCH\vLex-Vincent-Wife-conspired-with-someone-in-1.pdf,extracted_research\vLex-Vincent-Wife-conspired-with-someone-in-1.txt,,,5,0,0,0,0,0,0,0,5,0,0,0
research,RESEARCH\vLex-Vincent-Your-daughter-has-suffered-harm-1.pdf,extracted_research\vLex-Vincent-Your-daughter-has-suffered-harm-1.txt,,,5,1,0,2,0,0,0,0,2,0,0,0
research,RESEARCH\vLex-Vincent-Your-daughter-has-suffered-harm-5f96bcbc-1.pdf,extracted_research\vLex-Vincent-Your-daughter-has-suffered-harm-5f96bcbc-1.txt,,,5,1,0,2,0,0,0,0,2,0,0,0
research,RESEARCH\vLex-Vincent-Your-daughter-has-suffered-harm-818281b3-1.pdf,extracted_research\vLex-Vincent-Your-daughter-has-suffered-harm-818281b3-1.txt,,,5,1,0,2,0,0,0,0,2,0,0,0
case,CASE DOCS\02-24-00149-CV_PET MAND FLD_FILECOPY (2)-1.pdf,extracted_text\02-24-00149-CV_PET MAND FLD_FILECOPY (2)-1.txt,2014-02-24,,4,0,2,0,0,0,0,0,0,0,0,2
case,CASE DOCS\02-24-00149-CV_PET MAND FLD_FILECOPY (2)_3D0FAE00-07353b0d-1.pdf,extracted_text\02-24-00149-CV_PET MAND FLD_FILECOPY (2)_3D0FAE00-07353b0d-1.txt,2014-02-24,,4,0,2,0,0,0,0,0,0,0,0,2
case,CASE DOCS\02-24-00149-CV_PET MAND FLD_FILECOPY (2)_3D0FAE00-1-1.pdf,extracted_text\02-24-00149-CV_PET MAND FLD_FILECOPY (2)_3D0FAE00-1-1.txt,2014-02-24,,4,0,2,0,0,0,0,0,0,0,0,2
case,CASE DOCS\02-24-00149-CV_PET MAND FLD_FILECOPY (2)_3D0FAE00-1.pdf,extracted_text\02-24-00149-CV_PET MAND FLD_FILECOPY (2)_3D0FAE00-1.txt,2014-02-24,,4,0,2,0,0,0,0,0,0,0,0,2
case,CASE DOCS\02-25-00164-CV_MANDAMUS_FILED - 04.10.2025-1.pdf,extracted_text\02-25-00164-CV_MANDAMUS_FILED - 04.10.2025-1.txt,2016-02-25,,4,0,2,0,0,0,0,0,0,0,0,2
case,CASE DOCS\02-25-00582-CV_PET MAND FLD_FILECOPY-1.pdf,extracted_text\02-25-00582-CV_PET MAND FLD_FILECOPY-1.txt,2058-02-25,,4,0,2,0,0,0,0,0,0,0,0,2
case,CASE DOCS\02.01.24 - AJ's Report-1.pdf,extracted_text\02.01.24 - AJ's Report-1.txt,2024-02-01,,4,0,4,0,0,0,0,0,0,0,0,0
case,CASE DOCS\02.09.25 - Exhibit B.3 MUNFORD ILLEGAL ORDER-1.pdf,extracted_text\02.09.25 - Exhibit B.3 MUNFORD ILLEGAL ORDER-1.txt,2025-02-09,,4,0,4,0,0,0,0,0,0,0,0,0
case,CASE DOCS\02.14.24 - RESPONDENT'S ANSWER TO PETITIONERS DIVORCE PETITION-1.pdf,extracted_text\02.14.24 - RESPONDENT'S ANSWER TO PETITIONERS DIVORCE PETITION-1.txt,2024-02-14,,4,0,2,0,0,0,0,0,0,0,2,0
case,CASE DOCS\03.03.24 Notice and Unsworn Declaration-1.pdf,extracted_text\03.03.24 Notice and Unsworn Declaration-1.txt,2024-03-03,,4,2,2,0,0,0,0,0,0,0,0,0
case,CASE DOCS\03.04.2024_NOTICE  UNSWORN DECLARATION-1.pdf,extracted_text\03.04.2024_NOTICE  UNSWORN DECLARATION-1.txt,2024-03-04,,4,2,2,0,0,0,0,0,0,0,0,0
case,CASE DOCS\03.08.2025_EXHIBIT - SETTLEMENT OFFER - DAN BRANTHOOVER-1.pdf,extracted_text\03.08.2025_EXHIBIT - SETTLEMENT OFFER - DAN BRANTHOOVER-1.txt,2025-03-08,,4,0,2,2,0,0,0,0,0,0,0,0
case,CASE DOCS\03.09.2025_EXHIBIT - SETTLEMENT OFFER - MARGIE WILSON-1.pdf,extracted_text\03.09.2025_EXHIBIT - SETTLEMENT OFFER - MARGIE WILSON-1.txt,2025-03-09,,4,0,2,2,0,0,0,0,0,0,0,0
case,CASE DOCS\03.14.2024_ASSOCIATE JUDGE REPORT-1.pdf,extracted_text\03.14.2024_ASSOCIATE JUDGE REPORT-1.txt,2024-03-14,,4,0,4,0,0,0,0,0,0,0,0,0
case,CASE DOCS\03.17.25 - NOTICE OF SUBMISSION-1.pdf,extracted_text\03.17.25 - NOTICE OF SUBMISSION-1.txt,2025-03-17,,4,0,4,0,0,0,0,0,0,0,0,0
case,CASE DOCS\03.18.25 - IFP Statement-1.pdf,extracted_text\03.18.25 - IFP Statement-1.txt,2025-03-18,,4,2,2,0,0,0,0,0,0,0,0,0
case,CASE DOCS\03.20.2025_233-765358-25 MOTION TO STRIKE RESPONDENTS ANSWER AND MOTION TO CONSOLIDATE-1.pdf,extracted_text\03.20.2025_233-765358-25 MOTION TO STRIKE RESPONDENTS ANSWER AND MOTION TO CONSOLIDATE-1.txt,2025-03-20,,4,0,4,0,0,0,0,0,0,0,0,0
case,CASE DOCS\03.20.25 - MOTION TO STRIKE-1.pdf,extracted_text\03.20.25 - MOTION TO STRIKE-1.txt,2025-03-20,,4,0,4,0,0,0,0,0,0,0,0,0
case,CASE DOCS\03.20.25 - PROP. ORDER ON CONSOL-1.pdf,extracted_text\03.20.25 - PROP. ORDER ON CONSOL-1.txt,2025-03-20,,4,0,4,0,0,0,0,0,0,0,0,0
case,CASE DOCS\03.20.25 - REQUEST TO AMEND CASE CAPTION-1.pdf,extracted_text\03.20.25 - REQUEST TO AMEND CASE CAPTION-1.txt,2025-03-20,,4,0,4,0,0,0,0,0,0,0,0,0
case,CASE DOCS\03.21.25 - 233rd Rule 12 Motion-1.pdf,extracted_text\03.21.25 - 233rd Rule 12 Motion-1.txt,2025-03-21,,4,0,4,0,0,0,0,0,0,0,0,0
case,CASE DOCS\03.21.25 - PETITIONER'S RULE 12 MOTION TO SHOW AUTHORITY-1.pdf,extracted_text\03.21.25 - PETITIONER'S RULE 12 MOTION TO SHOW AUTHORITY-1.txt,2025-03-21,,4,0,4,0,0,0,0,0,0,0,0,0
case,CASE DOCS\03.24.25 - OBJ TO MANDATORY HEARING-1.pdf,extracted_text\03.24.25 - OBJ TO MANDATORY HEARING-1.txt,2025-03-24,,4,0,0,0,2,0,0,0,2,0,0,0
case,CASE DOCS\03.26.2024_ATTACH ASSOCIATE JUDGE REPORT-1.pdf,extracted_text\03.26.2024_ATTACH ASSOCIATE JUDGE REPORT-1.txt,2024-03-26,,4,0,4,0,0,0,0,0,0,0,0,0
case,CASE DOCS\03.26.24 - AJREP-1.pdf,extracted_text\03.26.24 - AJREP-1.txt,2024-03-26,,4,0,4,0,0,0,0,0,0,0,0,0
case,CASE DOCS\03.26.24 - DENIAL OF RECONSIDERATION-1.pdf,extracted_text\03.26.24 - DENIAL OF RECONSIDERATION-1.txt,2024-03-26,,4,0,4,0,0,0,0,0,0,0,0,0
case,CASE DOCS\03.28.25 - 233RD HEARING DATES-1.pdf,extracted_text\03.28.25 - 233RD HEARING DATES-1.txt,2025-03-28,,4,0,4,0,0,0,0,0,0,0,0,0
case,CASE DOCS\04.04.25 - LINDSEY GETS ANGRY-1.pdf,extracted_text\04.04.25 - LINDSEY GETS ANGRY-1.txt,2025-04-04,,4,0,4,0,0,0,0,0,0,0,0,0
case,CASE DOCS\04.04.25 - SCJC DENIAL 25-0586-1.pdf,extracted_text\04.04.25 - SCJC DENIAL 25-0586-1.txt,2025-04-04,25-0586,4,0,0,0,0,0,0,4,0,0,0,0
case,CASE DOCS\04.08.24 - MANDAMUS RECEIPT-1.pdf,extracted_text\04.08.24 - MANDAMUS RECEIPT-1.txt,2024-04-08,,4,0,2,0,0,0,0,0,0,0,0,2
case,CASE DOCS\04.08.24 - Mandamus Filed-1.pdf,extracted_text\04.08.24 - Mandamus Filed-1.txt,2024-04-08,,4,0,2,0,0,0,0,0,0,0,0,2
case,CASE DOCS\04.10.25 - ORDER GRANTING CONSOL-1.pdf,extracted_text\04.10.25 - ORDER GRANTING CONSOL-1.txt,2025-04-10,,4,0,4,0,0,0,0,0,0,0,0,0
case,CASE DOCS\04.10.25 - ORDER ON MOTION TO CONSOLIDATE (233)-1.pdf,extracted_text\04.10.25 - ORDER ON MOTION TO CONSOLIDATE (233)-1.txt,2025-04-10,,4,0,4,0,0,0,0,0,0,0,0,0
case,CASE DOCS\04.10.25 233rd ORDER ON CONSOLIDATION-1.pdf,extracted_text\04.10.25 233rd ORDER ON CONSOLIDATION-1.txt,2025-04-10,,4,0,4,0,0,0,0,0,0,0,0,0
case,CASE DOCS\04.23.24 - 02-24-00149-CV SUPPLEMENTAL APPENDIX-1.pdf,extracted_text\04.23.24 - 02-24-00149-CV SUPPLEMENTAL APPENDIX-1.txt,2024-04-23,02-24-00149-CV,4,0,2,0,0,0,0,0,0,0,0,2
case,CASE DOCS\04.23.24 - COA SUPPLEMENTAL APPENDIX-1.pdf,extracted_text\04.23.24 - COA SUPPLEMENTAL APPENDIX-1.txt,2024-04-23,,4,0,2,0,0,0,0,0,0,0,0,2
case,CASE DOCS\04.30.2024_NOTICE OF COMPLETION - CHARLES MYERS-1.pdf,extracted_text\04.30.2024_NOTICE OF COMPLETION - CHARLES MYERS-1.txt,2024-04-30,,4,0,4,0,0,0,0,0,0,0,0,0
case,CASE DOCS\04.30.24 - NOTICE OF COMPLETION-1.pdf,extracted_text\04.30.24 - NOTICE OF COMPLETION-1.txt,2024-04-30,,4,0,4,0,0,0,0,0,0,0,0,0
case,CASE DOCS\04.30.24 - Notice of Completion-e077c7fc-1.pdf,extracted_text\04.30.24 - Notice of Completion-e077c7fc-1.txt,2024-04-30,,4,0,4,0,0,0,0,0,0,0,0,0
case,CASE DOCS\05.22.2025_PROPOSED ORDER ON MOTION TO STRIKE OAG-1.pdf,extracted_text\05.22.2025_PROPOSED ORDER ON MOTION TO STRIKE OAG-1.txt,2025-05-22,,4,0,2,0,0,0,0,0,0,0,0,2
case,CASE DOCS\05.27.25 - IFP STATEMENT.pdf,extracted_text\05.27.25 - IFP STATEMENT.txt,2025-05-27,,4,0,2,0,0,0,0,0,0,0,0,2
case,CASE DOCS\06.03.24 - Heartfelt email to MARGIE-1.pdf,extracted_text\06.03.24 - Heartfelt email to MARGIE-1.txt,2024-06-03,,4,2,0,0,0,0,0,2,0,0,0,0
case,CASE DOCS\09.20.24 - RULE 12 MOTION-1.pdf,extracted_text\09.20.24 - RULE 12 MOTION-1.txt,2024-09-20,,4,0,4,0,0,0,0,0,0,0,0,0
case,CASE DOCS\11.06.24 - REQUEST FOR CONFIRMATION OF PROCEDURAL REQUIREMENTS-1.pdf,extracted_text\11.06.24 - REQUEST FOR CONFIRMATION OF PROCEDURAL REQUIREMENTS-1.txt,2024-11-06,,4,0,2,0,0,0,0,2,0,0,0,0
case,CASE DOCS\12.15.25 Notice of Submission.pdf,extracted_text\12.15.25 Notice of Submission.txt,2025-12-15,,4,0,4,0,0,0,0,0,0,0,0,0
case,CASE DOCS\12.22.2023_FROM 322-744538-23  APPLICATION FORPROTECTIVE ORDER-1.pdf,extracted_text\12.22.2023_FROM 322-744538-23  APPLICATION FORPROTECTIVE ORDER-1.txt,2023-12-22,322-744538-23,4,0,0,2,0,0,0,0,2,0,0,0
case,CASE DOCS\12.22.23 Application for Protective Order-1.pdf,extracted_text\12.22.23 Application for Protective Order-1.txt,2023-12-22,,4,0,0,2,0,0,0,0,2,0,0,0
case,CASE DOCS\12.27.23 - Show Cause Service-1.pdf,extracted_text\12.27.23 - Show Cause Service-1.txt,2023-12-27,,4,0,4,0,0,0,0,0,0,0,0,0
research,RESEARCH\vLex-Vincent-1--On-December-13--2023--Morgan-Michelle-Myers-had-a-private-meeting-with-Margie-Evonne-Wilson--Exhi-1.pdf,extracted_research\vLex-Vincent-1--On-December-13--2023--Morgan-Michelle-Myers-had-a-private-meeting-with-Margie-Evonne-Wilson--Exhi-1.txt,,,4,1,0,0,0,0,2,0,0,0,0,1
research,"RESEARCH\vLex-Vincent-In-Texas,-does-a-de-1.pdf","extracted_research\vLex-Vincent-In-Texas,-does-a-de-1.txt",,,4,0,3,0,1,0,0,0,0,0,0,0
research,RESEARCH\vLex-Vincent-Is-it-illegal-for-an-attorney-to-fill-out-an-associate-judge-s-report-and-then-just-get-the-judge-s--1.pdf,extracted_research\vLex-Vincent-Is-it-illegal-for-an-attorney-to-fill-out-an-associate-judge-s-report-and-then-just-get-the-judge-s--1.txt,,,4,1,0,0,0,0,0,3,0,0,0,0
research,RESEARCH\vLex-Vincent-The-wife-made-false-statements-1.pdf,extracted_research\vLex-Vincent-The-wife-made-false-statements-1.txt,,,4,1,0,0,0,0,0,0,3,0,0,0
research,RESEARCH\vLex-Vincent-The-wife-made-false-statements-1c29ea9b-1.pdf,extracted_research\vLex-Vincent-The-wife-made-false-statements-1c29ea9b-1.txt,,,4,1,0,0,0,0,0,0,3,0,0,0
research,RESEARCH\vLex-Vincent-The-wife-made-false-statements-30d75d59-1.pdf,extracted_research\vLex-Vincent-The-wife-made-false-statements-30d75d59-1.txt,,,4,1,0,0,0,0,0,0,3,0,0,0
research,RESEARCH\vLex-Vincent-The-wife-made-false-statements-40f465cd-1.pdf,extracted_research\vLex-Vincent-The-wife-made-false-statements-40f465cd-1.txt,,,4,1,0,0,0,0,0,0,3,0,0,0
research,RESEARCH\vLex-Vincent-What-case-law-in-Texas-1.pdf,extracted_research\vLex-Vincent-What-case-law-in-Texas-1.txt,,,4,0,0,1,0,0,0,3,0,0,0,0
case,CASE DOCS\03.18.2025_233-765358-25 - ORIGINAL SAPCR-1.pdf,extracted_text\03.18.2025_233-765358-25 - ORIGINAL SAPCR-1.txt,2025-03-18,,3,0,1,0,0,0,0,0,2,0,0,0
case,CASE DOCS\03.31.25 - Respondent's Statement-1.pdf,extracted_text\03.31.25 - Respondent's Statement-1.txt,2025-03-31,,3,0,3,0,0,0,0,0,0,0,0,0
case,CASE DOCS\04.01.25 - RESPONDENT'S STATEMENT-1.pdf,extracted_text\04.01.25 - RESPONDENT'S STATEMENT-1.txt,2025-04-01,,3,0,3,0,0,0,0,0,0,0,0,0
research,RESEARCH\protective ORDER.pdf,extracted_research\protective ORDER.txt,,,3,0,0,0,0,0,0,1,0,0,2,0
research,RESEARCH\vLex-Vincent-Can-a-coordinator-be-involved-1.pdf,extracted_research\vLex-Vincent-Can-a-coordinator-be-involved-1.txt,,,3,0,2,0,0,0,0,1,0,0,0,0
research,RESEARCH\vLex-Vincent-Can-a-divorce-case-be-1.pdf,extracted_research\vLex-Vincent-Can-a-divorce-case-be-1.txt,,,3,1,0,0,0,0,0,0,2,0,0,0
research,RESEARCH\vLex-Vincent-Does-a-party-have-to-1.pdf,extracted_research\vLex-Vincent-Does-a-party-have-to-1.txt,,,3,3,0,0,0,0,0,0,0,0,0,0
research,RESEARCH\vLex-Vincent-List-what-precludes-an-attorney-from-arguing-at-trial-when-she-has-been-non-responsive-to-every-sing-1.pdf,extracted_research\vLex-Vincent-List-what-precludes-an-attorney-from-arguing-at-trial-when-she-has-been-non-responsive-to-every-sing-1.txt,,,3,0,0,0,0,0,0,3,0,0,0,0
research,RESEARCH\vLex-Vincent-The-initial-orders-evolved-into-0d1f0edc-1.pdf,extracted_research\vLex-Vincent-The-initial-orders-evolved-into-0d1f0edc-1.txt,,,3,0,0,0,0,3,0,0,0,0,0,0
research,RESEARCH\vLex-Vincent-The-initial-orders-evolved-into-1.pdf,extracted_research\vLex-Vincent-The-initial-orders-evolved-into-1.txt,,,3,0,0,0,0,3,0,0,0,0,0,0
research,RESEARCH\vLex-Vincent-The-initial-orders-evolved-into-810e98e7-1.pdf,extracted_research\vLex-Vincent-The-initial-orders-evolved-into-810e98e7-1.txt,,,3,0,0,0,0,3,0,0,0,0,0,0
research,RESEARCH\vLex-Vincent-The-initial-orders-evolved-into-a424e802-1.pdf,extracted_research\vLex-Vincent-The-initial-orders-evolved-into-a424e802-1.txt,,,3,0,0,0,0,3,0,0,0,0,0,0
case,CASE DOCS\02-24-00149-CV_CORR OPINION PAGE_FILECOPY_FC8D2EE3-0f787c6f-1.pdf,extracted_text\02-24-00149-CV_CORR OPINION PAGE_FILECOPY_FC8D2EE3-0f787c6f-1.txt,2014-02-24,,2,0,2,0,0,0,0,0,0,0,0,0
case,CASE DOCS\02-24-00149-CV_MEM OPINION ISSD_OPINION ISSD_FILECOPY-1.pdf,extracted_text\02-24-00149-CV_MEM OPINION ISSD_OPINION ISSD_FILECOPY-1.txt,2014-02-24,,2,0,2,0,0,0,0,0,0,0,0,0
case,CASE DOCS\02-24-00149-CV_MT REHEAR DISP ORIG PROC CV_FILECOPY_BDCA6517-1-1.pdf,extracted_text\02-24-00149-CV_MT REHEAR DISP ORIG PROC CV_FILECOPY_BDCA6517-1-1.txt,2014-02-24,,2,0,2,0,0,0,0,0,0,0,0,0
case,CASE DOCS\02-24-00149-CV_MT REHEAR DISP ORIG PROC CV_FILECOPY_BDCA6517-1.pdf,extracted_text\02-24-00149-CV_MT REHEAR DISP ORIG PROC CV_FILECOPY_BDCA6517-1.txt,2014-02-24,,2,0,2,0,0,0,0,0,0,0,0,0
case,CASE DOCS\02-25-00164-CV_MT REHEAR DISP ORIG PROC CV_FILECOPY-1.pdf,extracted_text\02-25-00164-CV_MT REHEAR DISP ORIG PROC CV_FILECOPY-1.txt,2016-02-25,,2,0,2,0,0,0,0,0,0,0,0,0
case,CASE DOCS\02-25-00166-CV_MEM OPINION ISSD_OPINION ISSD_FILECOPY-1.pdf,extracted_text\02-25-00166-CV_MEM OPINION ISSD_OPINION ISSD_FILECOPY-1.txt,2016-02-25,,2,0,2,0,0,0,0,0,0,0,0,0
case,CASE DOCS\02-25-00171-CV_MT REHEAR DISP ORIG PROC CV_FILECOPY-1.pdf,extracted_text\02-25-00171-CV_MT REHEAR DISP ORIG PROC CV_FILECOPY-1.txt,2017-02-25,,2,0,2,0,0,0,0,0,0,0,0,0
case,CASE DOCS\02.01.24 - AJ Report-1.pdf,extracted_text\02.01.24 - AJ Report-1.txt,2024-02-01,,2,0,2,0,0,0,0,0,0,0,0,0
case,CASE DOCS\02.01.24 - AJR-1.pdf,extracted_text\02.01.24 - AJR-1.txt,2024-02-01,,2,0,2,0,0,0,0,0,0,0,0,0
case,CASE DOCS\02.05.2024_NOTICE OF TERMINATION OF LEGAL COUNSEL -BACALIS-1.pdf,extracted_text\02.05.2024_NOTICE OF TERMINATION OF LEGAL COUNSEL -BACALIS-1.txt,2024-02-05,,2,0,2,0,0,0,0,0,0,0,0,0
case,CASE DOCS\02.05.24 - NOTICE OF TERMINATION OF LEGAL COUNSEL-1.pdf,extracted_text\02.05.24 - NOTICE OF TERMINATION OF LEGAL COUNSEL-1.txt,2024-02-05,,2,0,2,0,0,0,0,0,0,0,0,0
case,CASE DOCS\02.06.2024_AGREED MOTION FOR WITHDRAWAL OF ATTY BACALIS-1.pdf,extracted_text\02.06.2024_AGREED MOTION FOR WITHDRAWAL OF ATTY BACALIS-1.txt,2024-02-06,,2,0,2,0,0,0,0,0,0,0,0,0
case,CASE DOCS\02.08.2024_AGREED AJS REPORT FOR TEMP ORDS-1.pdf,extracted_text\02.08.2024_AGREED AJS REPORT FOR TEMP ORDS-1.txt,2024-02-08,,2,0,2,0,0,0,0,0,0,0,0,0
case,CASE DOCS\02.08.24 - ASSOCIATE JUDGE'S REPORT-1.pdf,extracted_text\02.08.24 - ASSOCIATE JUDGE'S REPORT-1.txt,2024-02-08,,2,0,2,0,0,0,0,0,0,0,0,0
case,CASE DOCS\02.08.24 - Associate Judge's Report-1-1.pdf,extracted_text\02.08.24 - Associate Judge's Report-1-1.txt,2024-02-08,,2,0,2,0,0,0,0,0,0,0,0,0
case,CASE DOCS\02.09.24 - EMERGENCY MOTION TO VACATE.pdf,extracted_text\02.09.24 - EMERGENCY MOTION TO VACATE.txt,2024-02-09,,2,0,2,0,0,0,0,0,0,0,0,0
case,CASE DOCS\02.12.24 - ORDER FOR WD OF ATTORNEY-1.pdf,extracted_text\02.12.24 - ORDER FOR WD OF ATTORNEY-1.txt,2024-02-12,,2,0,2,0,0,0,0,0,0,0,0,0
case,CASE DOCS\02.22.2024_PROP ORDER ON MOTION FOR PRETRIAL SUMMARYJUDGMENT-1.pdf,extracted_text\02.22.2024_PROP ORDER ON MOTION FOR PRETRIAL SUMMARYJUDGMENT-1.txt,2024-02-22,,2,0,2,0,0,0,0,0,0,0,0,0
case,CASE DOCS\02.22.24 - PROPOSED ORDER ON MOTION FOR SUMMARY JUDGMENT-1.pdf,extracted_text\02.22.24 - PROPOSED ORDER ON MOTION FOR SUMMARY JUDGMENT-1.txt,2024-02-22,,2,0,2,0,0,0,0,0,0,0,0,0
case,CASE DOCS\02.22.24 - SUMM JUDGEMENT NOTICE OF HEARING-1.pdf,extracted_text\02.22.24 - SUMM JUDGEMENT NOTICE OF HEARING-1.txt,2024-02-22,,2,0,2,0,0,0,0,0,0,0,0,0
case,CASE DOCS\02.22.24 Order on Motion for Summary Judgment-1.pdf,extracted_text\02.22.24 Order on Motion for Summary Judgment-1.txt,2024-02-22,,2,0,2,0,0,0,0,0,0,0,0,0
case,CASE DOCS\02.25.24 Notice of Termination of Legal Counsel-1.pdf,extracted_text\02.25.24 Notice of Termination of Legal Counsel-1.txt,2024-02-25,,2,0,2,0,0,0,0,0,0,0,0,0
case,CASE DOCS\02.25.25 - Notice Loss of Employmnet-1.pdf,extracted_text\02.25.25 - Notice Loss of Employmnet-1.txt,2025-02-25,,2,0,2,0,0,0,0,0,0,0,0,0
case,CASE DOCS\02.25.25 - Proposed Order on Motion to Sign-1.pdf,extracted_text\02.25.25 - Proposed Order on Motion to Sign-1.txt,2025-02-25,,2,0,2,0,0,0,0,0,0,0,0,0
case,CASE DOCS\02.27.2024_NOTICE OF HEARING 31424  9AM-1.pdf,extracted_text\02.27.2024_NOTICE OF HEARING 31424  9AM-1.txt,2024-02-27,,2,0,2,0,0,0,0,0,0,0,0,0
case,CASE DOCS\03.14.24 - AJR-1.pdf,extracted_text\03.14.24 - AJR-1.txt,2024-03-14,,2,0,2,0,0,0,0,0,0,0,0,0
case,CASE DOCS\03.14.24 - ASSOCIATE JUDGE REPORT-1.pdf,extracted_text\03.14.24 - ASSOCIATE JUDGE REPORT-1.txt,2024-03-14,,2,0,2,0,0,0,0,0,0,0,0,0
case,CASE DOCS\03.14.24 - Associate Judge's Report-1.pdf,extracted_text\03.14.24 - Associate Judge's Report-1.txt,2024-03-14,,2,0,2,0,0,0,0,0,0,0,0,0
case,CASE DOCS\03.20.2025_233-765358-25 - RESPONDENTS ORIGINAL ANSWER-1.pdf,extracted_text\03.20.2025_233-765358-25 - RESPONDENTS ORIGINAL ANSWER-1.txt,2025-03-20,,2,0,2,0,0,0,0,0,0,0,0,0
case,CASE DOCS\03.20.25 - RESPONDENT'S ORIGINAL ANSWER redacted-1.pdf,extracted_text\03.20.25 - RESPONDENT'S ORIGINAL ANSWER redacted-1.txt,2025-03-20,,2,0,2,0,0,0,0,0,0,0,0,0
case,CASE DOCS\03.20.25 - RESPONDENT'S ORIGINAL ANSWER-1.pdf,extracted_text\03.20.25 - RESPONDENT'S ORIGINAL ANSWER-1.txt,2025-03-20,,2,0,2,0,0,0,0,0,0,0,0,0
case,CASE DOCS\03.20.25 - orginal answer-1.pdf,extracted_text\03.20.25 - orginal answer-1.txt,2025-03-20,,2,0,2,0,0,0,0,0,0,0,0,0
case,CASE DOCS\03.21.25 - PROP RULE 12 ORD-1.pdf,extracted_text\03.21.25 - PROP RULE 12 ORD-1.txt,2025-03-21,,2,0,2,0,0,0,0,0,0,0,0,0
case,CASE DOCS\03.24.25 - 233 REQUEST TO SET EMERGENCY HEARING ON SUBMISSION-1.pdf,extracted_text\03.24.25 - 233 REQUEST TO SET EMERGENCY HEARING ON SUBMISSION-1.txt,2025-03-24,,2,0,2,0,0,0,0,0,0,0,0,0
case,CASE DOCS\03.24.25 - Gmail - What's the point_-1.pdf,extracted_text\03.24.25 - Gmail - What's the point_-1.txt,2025-03-24,,2,0,0,0,0,0,0,0,2,0,0,0
case,CASE DOCS\03.24.25 - NO HEARING REQUIRED COORDINATOR-1.pdf,extracted_text\03.24.25 - NO HEARING REQUIRED COORDINATOR-1.txt,2025-03-24,,2,0,2,0,0,0,0,0,0,0,0,0
case,CASE DOCS\03.26.2024_ATTACH BRIANNA GALBO AFFIDAVIT-1.pdf,extracted_text\03.26.2024_ATTACH BRIANNA GALBO AFFIDAVIT-1.txt,2024-03-26,,2,0,2,0,0,0,0,0,0,0,0,0
case,CASE DOCS\03.26.2024_REQUEST FOR FINDINGS OF FACT  CONCLUSIONSOF LAW-1.pdf,extracted_text\03.26.2024_REQUEST FOR FINDINGS OF FACT  CONCLUSIONSOF LAW-1.txt,2024-03-26,,2,0,2,0,0,0,0,0,0,0,0,0
case,CASE DOCS\03.26.24 - REQUEST FOR FINDINGS OF FACT AND CONCLUSIONS OF LAW-1.pdf,extracted_text\03.26.24 - REQUEST FOR FINDINGS OF FACT AND CONCLUSIONS OF LAW-1.txt,2024-03-26,,2,0,2,0,0,0,0,0,0,0,0,0
case,CASE DOCS\03.27.25 - EMAIL INFORMING COOPER OF TIME TO PRESENT-1.pdf,extracted_text\03.27.25 - EMAIL INFORMING COOPER OF TIME TO PRESENT-1.txt,2025-03-27,,2,0,2,0,0,0,0,0,0,0,0,0
case,CASE DOCS\04.01.2025_RESPONDENTS STATEMENT-1.pdf,extracted_text\04.01.2025_RESPONDENTS STATEMENT-1.txt,2025-04-01,,2,0,2,0,0,0,0,0,0,0,0,0
case,CASE DOCS\04.03.25 - OBJECTION TO CONSOLIDATION FILED BY UNNAMED PARTY-1.pdf,extracted_text\04.03.25 - OBJECTION TO CONSOLIDATION FILED BY UNNAMED PARTY-1.txt,2025-04-03,,2,0,2,0,0,0,0,0,0,0,0,0
case,CASE DOCS\04.04.25 - frustrated with cooper-1.pdf,extracted_text\04.04.25 - frustrated with cooper-1.txt,2025-04-04,,2,0,0,0,0,0,0,0,2,0,0,0
case,CASE DOCS\04.10.24 - Mandamus Denied (2nd CoA)-1.pdf,extracted_text\04.10.24 - Mandamus Denied (2nd CoA)-1.txt,2024-04-10,,2,0,2,0,0,0,0,0,0,0,0,0
case,CASE DOCS\04.11.25 - DENIAL MANDAMUS NOTICE-1.pdf,extracted_text\04.11.25 - DENIAL MANDAMUS NOTICE-1.txt,2025-04-11,,2,0,2,0,0,0,0,0,0,0,0,0
case,CASE DOCS\04.22.25 - NOTICE SETTING A COURT PROCEEDING-1.pdf,extracted_text\04.22.25 - NOTICE SETTING A COURT PROCEEDING-1.txt,2025-04-22,,2,0,2,0,0,0,0,0,0,0,0,0
case,CASE DOCS\04.23.25 - 02-25-001166-CV LETTER TO SUPREME COURT-1.pdf,extracted_text\04.23.25 - 02-25-001166-CV LETTER TO SUPREME COURT-1.txt,2025-04-23,,2,0,0,0,0,0,0,0,0,0,0,2
case,CASE DOCS\04.23.25 - APRIL 23 LETTER-1.pdf,extracted_text\04.23.25 - APRIL 23 LETTER-1.txt,2025-04-23,,2,0,0,0,0,0,0,0,0,0,0,2
case,CASE DOCS\04.24.2024_MOTION FOR PRETRIAL CONFERENCE-1.pdf,extracted_text\04.24.2024_MOTION FOR PRETRIAL CONFERENCE-1.txt,2024-04-24,,2,0,2,0,0,0,0,0,0,0,0,0
case,CASE DOCS\04.24.24 - MOTION FOR PT CONFERENCE-1-1.pdf,extracted_text\04.24.24 - MOTION FOR PT CONFERENCE-1-1.txt,2024-04-24,,2,0,2,0,0,0,0,0,0,0,0,0
case,CASE DOCS\04.24.24 - MOTION FOR PT CONFERENCE-1.pdf,extracted_text\04.24.24 - MOTION FOR PT CONFERENCE-1.txt,2024-04-24,,2,0,2,0,0,0,0,0,0,0,0,0
case,CASE DOCS\04.24.24 Motion for Pretrial Conference-1.pdf,extracted_text\04.24.24 Motion for Pretrial Conference-1.txt,2024-04-24,,2,0,2,0,0,0,0,0,0,0,0,0
case,CASE DOCS\04.24.25 - DENIAL OF MANDAMUS EN BANC-1.pdf,extracted_text\04.24.25 - DENIAL OF MANDAMUS EN BANC-1.txt,2025-04-24,,2,0,2,0,0,0,0,0,0,0,0,0
case,CASE DOCS\04.25.2024_CORRECTED CT APPEALS ORIG PROC PETMAND DENIED-1.pdf,extracted_text\04.25.2024_CORRECTED CT APPEALS ORIG PROC PETMAND DENIED-1.txt,2024-04-25,,2,0,2,0,0,0,0,0,0,0,0,0
case,CASE DOCS\04.25.2025_EMERGENCY NOTICE TO THE COURT-1.pdf,extracted_text\04.25.2025_EMERGENCY NOTICE TO THE COURT-1.txt,2025-04-25,,2,0,2,0,0,0,0,0,0,0,0,0
case,CASE DOCS\04.25.24 - 2nd COA Corrected Opinion-1.pdf,extracted_text\04.25.24 - 2nd COA Corrected Opinion-1.txt,2024-04-25,,2,0,2,0,0,0,0,0,0,0,0,0
case,CASE DOCS\04.25.24 - COA ORDER REHEARING-1.pdf,extracted_text\04.25.24 - COA ORDER REHEARING-1.txt,2024-04-25,,2,0,2,0,0,0,0,0,0,0,0,0
case,CASE DOCS\04.25.24 - MANDAMUS RECEIPT CORRECTION-1.pdf,extracted_text\04.25.24 - MANDAMUS RECEIPT CORRECTION-1.txt,2024-04-25,,2,0,2,0,0,0,0,0,0,0,0,0
case,CASE DOCS\04.25.25 - 2ND COA EMERGENCY LETTER-1.pdf,extracted_text\04.25.25 - 2ND COA EMERGENCY LETTER-1.txt,2025-04-25,,2,0,0,0,0,0,0,0,0,0,0,2
case,CASE DOCS\04.25.25 - EMERGENCY NOTICE TO THE COURT-1.pdf,extracted_text\04.25.25 - EMERGENCY NOTICE TO THE COURT-1.txt,2025-04-25,,2,0,2,0,0,0,0,0,0,0,0,0
case,CASE DOCS\04.25.25 - FIRST AMENDED EMERGENCY NOTRICE-1.pdf,extracted_text\04.25.25 - FIRST AMENDED EMERGENCY NOTRICE-1.txt,2025-04-25,,2,0,2,0,0,0,0,0,0,0,0,0
case,CASE DOCS\04.29.25 322 744263 23 JK ORDER-1.pdf,extracted_text\04.29.25 322 744263 23 JK ORDER-1.txt,2025-04-29,,2,0,2,0,0,0,0,0,0,0,0,0
case,CASE DOCS\04.29.25 322 744263 23 JM ORDER-1.pdf,extracted_text\04.29.25 322 744263 23 JM ORDER-1.txt,2025-04-29,,2,0,2,0,0,0,0,0,0,0,0,0
case,CASE DOCS\05.01.25  -En Banc Denial (Newell)-1.pdf,extracted_text\05.01.25  -En Banc Denial (Newell)-1.txt,2025-05-01,,2,0,2,0,0,0,0,0,0,0,0,0
case,CASE DOCS\05.01.25 - FEE REQUEST-1.pdf,extracted_text\05.01.25 - FEE REQUEST-1.txt,2025-05-01,,2,0,0,0,0,0,0,0,0,0,0,2
case,CASE DOCS\05.02.24 - En Banc Denial-1.pdf,extracted_text\05.02.24 - En Banc Denial-1.txt,2024-05-02,,2,0,2,0,0,0,0,0,0,0,0,0
case,CASE DOCS\05.06.25 - ORDER OF ASSIGNMENT-1.pdf,extracted_text\05.06.25 - ORDER OF ASSIGNMENT-1.txt,2025-05-06,,2,0,2,0,0,0,0,0,0,0,0,0
case,CASE DOCS\05.15.25 - ORDER DENYING OBJECTION TO ORDER OF ASSIGNMENT-1.pdf,extracted_text\05.15.25 - ORDER DENYING OBJECTION TO ORDER OF ASSIGNMENT-1.txt,2025-05-15,,2,0,2,0,0,0,0,0,0,0,0,0
case,CASE DOCS\05.15.25 - ORDER OVERRULING OBJECTION-1.pdf,extracted_text\05.15.25 - ORDER OVERRULING OBJECTION-1.txt,2025-05-15,,2,0,2,0,0,0,0,0,0,0,0,0
case,CASE DOCS\05.19.25 - ORDER TERMINATING ASSIGNMENT REDACTED-1.pdf,extracted_text\05.19.25 - ORDER TERMINATING ASSIGNMENT REDACTED-1.txt,2025-05-19,,2,0,2,0,0,0,0,0,0,0,0,0
case,CASE DOCS\05.19.25 - ORDER TERMINATING ASSIGNMENT-1.pdf,extracted_text\05.19.25 - ORDER TERMINATING ASSIGNMENT-1.txt,2025-05-19,,2,0,2,0,0,0,0,0,0,0,0,0
case,CASE DOCS\05.20.25 - Order Summarily Denying Recusal (Kaitcer)-1.pdf,extracted_text\05.20.25 - Order Summarily Denying Recusal (Kaitcer)-1.txt,2025-05-20,,2,0,2,0,0,0,0,0,0,0,0,0
case,CASE DOCS\05.20.25 - Order Summarily Denying Recusal-1.pdf,extracted_text\05.20.25 - Order Summarily Denying Recusal-1.txt,2025-05-20,,2,0,2,0,0,0,0,0,0,0,0,0
case,CASE DOCS\06.27.25 - CERT OF SERVICE (DAN)-1.pdf,extracted_text\06.27.25 - CERT OF SERVICE (DAN)-1.txt,2025-06-27,,2,1,1,0,0,0,0,0,0,0,0,0
case,CASE DOCS\07.04.24 Statement-1.pdf,extracted_text\07.04.24 Statement-1.txt,2024-07-04,,2,2,0,0,0,0,0,0,0,0,0,0
case,CASE DOCS\07.11.25 - 25-0361 Denial (Motions)-1.pdf,extracted_text\07.11.25 - 25-0361 Denial (Motions)-1.txt,2025-07-11,25-0361,2,0,0,0,0,0,0,0,0,0,0,2
case,CASE DOCS\07.11.25 - 25-0361 Denial-1.pdf,extracted_text\07.11.25 - 25-0361 Denial-1.txt,2025-07-11,25-0361,2,0,0,0,0,0,0,0,0,0,0,2
case,CASE DOCS\07.11.25 - 25-0367 Rehearing Denial-1.pdf,extracted_text\07.11.25 - 25-0367 Rehearing Denial-1.txt,2025-07-11,25-0367,2,0,0,0,0,0,0,0,0,0,0,2
case,CASE DOCS\07.11.25 - 25-0367 Rehearing Receipt-1.pdf,extracted_text\07.11.25 - 25-0367 Rehearing Receipt-1.txt,2025-07-11,25-0367,2,0,0,0,0,0,0,0,0,0,0,2
case,CASE DOCS\07.11.25 - 25-0378 Denial-1.pdf,extracted_text\07.11.25 - 25-0378 Denial-1.txt,2025-07-11,25-0378,2,0,0,0,0,0,0,0,0,0,0,2
case,CASE DOCS\07.11.25 - 25-0378 Rehearing Receipt-1.pdf,extracted_text\07.11.25 - 25-0378 Rehearing Receipt-1.txt,2025-07-11,25-0378,2,0,0,0,0,0,0,0,0,0,0,2
case,CASE DOCS\07.11.25 - 25-0426 Denial-1.pdf,extracted_text\07.11.25 - 25-0426 Denial-1.txt,2025-07-11,25-0426,2,0,0,0,0,0,0,0,0,0,0,2
case,CASE DOCS\07.11.25 - 25-0426 Rehearing Receipt-1.pdf,extracted_text\07.11.25 - 25-0426 Rehearing Receipt-1.txt,2025-07-11,25-0426,2,0,0,0,0,0,0,0,0,0,0,2
case,CASE DOCS\07.11.25 - 25-0458 Denial-1.pdf,extracted_text\07.11.25 - 25-0458 Denial-1.txt,2025-07-11,25-0458,2,0,0,0,0,0,0,0,0,0,0,2
case,CASE DOCS\07.11.25 - 25-0458 Rehearing Receipt-1.pdf,extracted_text\07.11.25 - 25-0458 Rehearing Receipt-1.txt,2025-07-11,25-0458,2,0,0,0,0,0,0,0,0,0,0,2
case,CASE DOCS\07.15.25 - 25-0367 Denial-1.pdf,extracted_text\07.15.25 - 25-0367 Denial-1.txt,2025-07-15,25-0367,2,0,0,0,0,0,0,0,0,0,0,2
case,CASE DOCS\08.15.25 - 25-0361 Rehearing Denial-1.pdf,extracted_text\08.15.25 - 25-0361 Rehearing Denial-1.txt,2025-08-15,25-0361,2,0,0,0,0,0,0,0,0,0,0,2
case,CASE DOCS\08.15.25 - 25-0426 Rehearing Denial-1.pdf,extracted_text\08.15.25 - 25-0426 Rehearing Denial-1.txt,2025-08-15,25-0426,2,0,0,0,0,0,0,0,0,0,0,2
case,CASE DOCS\08.27.25 -ORDER OF REFERRAL MUNFORD-1.pdf,extracted_text\08.27.25 -ORDER OF REFERRAL MUNFORD-1.txt,2025-08-27,,2,0,2,0,0,0,0,0,0,0,0,0
case,CASE DOCS\08.29.25 - 25-0458 Rehearing Denial-1.pdf,extracted_text\08.29.25 - 25-0458 Rehearing Denial-1.txt,2025-08-29,25-0458,2,0,0,0,0,0,0,0,0,0,0,2
case,CASE DOCS\08.29.25 - OBJECTION TO ORDER OF REFERRAL-1.pdf,extracted_text\08.29.25 - OBJECTION TO ORDER OF REFERRAL-1.txt,2025-08-29,,2,0,2,0,0,0,0,0,0,0,0,0
case,CASE DOCS\09.11.25 - PROPOSED ORDER ON MOTION TO RECUSE THE REGIONAL JUDGE-1.pdf,extracted_text\09.11.25 - PROPOSED ORDER ON MOTION TO RECUSE THE REGIONAL JUDGE-1.txt,2025-09-11,,2,0,2,0,0,0,0,0,0,0,0,0
case,CASE DOCS\09.20.24 - Rule 12 Order-1.pdf,extracted_text\09.20.24 - Rule 12 Order-1.txt,2024-09-20,,2,0,2,0,0,0,0,0,0,0,0,0
case,CASE DOCS\09.20.24 - rule 12 motion order_DA9BD973-1.pdf,extracted_text\09.20.24 - rule 12 motion order_DA9BD973-1.txt,2024-09-20,,2,0,2,0,0,0,0,0,0,0,0,0
case,CASE DOCS\09.26.2024_PROPOSED ORDER ON MOTION FOR TEMPORARY ORDERS-1.pdf,extracted_text\09.26.2024_PROPOSED ORDER ON MOTION FOR TEMPORARY ORDERS-1.txt,2024-09-26,,2,0,2,0,0,0,0,0,0,0,0,0
case,CASE DOCS\09.26.25 - ORDER SUMMARILY DENYING KAITCER-1.pdf,extracted_text\09.26.25 - ORDER SUMMARILY DENYING KAITCER-1.txt,2025-09-26,,2,0,2,0,0,0,0,0,0,0,0,0
case,CASE DOCS\09.26.25 - ORDER SUMMARILY DENYING MUNFORD-1.pdf,extracted_text\09.26.25 - ORDER SUMMARILY DENYING MUNFORD-1.txt,2025-09-26,,2,0,2,0,0,0,0,0,0,0,0,0
case,CASE DOCS\10.02.25 - Attorney's Fees Request-1.pdf,extracted_text\10.02.25 - Attorney's Fees Request-1.txt,2025-10-02,,2,0,2,0,0,0,0,0,0,0,0,0
case,CASE DOCS\10.02.25 - MOTION FOR SANCTIONS AND REQUEST FOR ATTORNEY'S FEES-1.pdf,extracted_text\10.02.25 - MOTION FOR SANCTIONS AND REQUEST FOR ATTORNEY'S FEES-1.txt,2025-10-02,,2,0,2,0,0,0,0,0,0,0,0,0
case,CASE DOCS\10.10.2024_AMENDED JUDGES RULING LETTER-1.pdf,extracted_text\10.10.2024_AMENDED JUDGES RULING LETTER-1.txt,2024-10-10,,2,0,2,0,0,0,0,0,0,0,0,0
case,CASE DOCS\10.11.24 - Order of Referral (Kaitcer)-1.pdf,extracted_text\10.11.24 - Order of Referral (Kaitcer)-1.txt,2024-10-11,,2,0,2,0,0,0,0,0,0,0,0,0
case,CASE DOCS\10.21.24 - ORDER SETTING VIDEOCONFERENCE HEARING-1.pdf,extracted_text\10.21.24 - ORDER SETTING VIDEOCONFERENCE HEARING-1.txt,2024-10-21,,2,0,2,0,0,0,0,0,0,0,0,0
case,CASE DOCS\10.24.2024_EXHIBIT 6 - Affidavit of Steve Myers for recusal proceedings-1.pdf,extracted_text\10.24.2024_EXHIBIT 6 - Affidavit of Steve Myers for recusal proceedings-1.txt,2024-10-24,,2,0,2,0,0,0,0,0,0,0,0,0
case,CASE DOCS\10.28.24 - ORD OF ASSIGNMENT-1.pdf,extracted_text\10.28.24 - ORD OF ASSIGNMENT-1.txt,2024-10-28,,2,0,2,0,0,0,0,0,0,0,0,0
case,CASE DOCS\10.28.24 - ORD SETTING VIDEO HEARING-1.pdf,extracted_text\10.28.24 - ORD SETTING VIDEO HEARING-1.txt,2024-10-28,,2,0,2,0,0,0,0,0,0,0,0,0
case,CASE DOCS\11.01.24 - ORDER OF ASSIGNMENT-1.pdf,extracted_text\11.01.24 - ORDER OF ASSIGNMENT-1.txt,2024-11-01,,2,0,2,0,0,0,0,0,0,0,0,0
case,CASE DOCS\11.04.24 - PROPOSED ORDER ON MOTION IN LIMINE-1.pdf,extracted_text\11.04.24 - PROPOSED ORDER ON MOTION IN LIMINE-1.txt,2024-11-04,,2,0,2,0,0,0,0,0,0,0,0,0
case,CASE DOCS\11.05.25 - PROPOSED ORDER.pdf,extracted_text\11.05.25 - PROPOSED ORDER.txt,2025-11-05,,2,0,2,0,0,0,0,0,0,0,0,0
case,CASE DOCS\11.07.2024_FATHER INFORMS THE COURT OF EMERGENCY-1.pdf,extracted_text\11.07.2024_FATHER INFORMS THE COURT OF EMERGENCY-1.txt,2024-11-07,,2,0,2,0,0,0,0,0,0,0,0,0
case,CASE DOCS\11.07.25 - RECUSAL DENIAL redact-1.pdf,extracted_text\11.07.25 - RECUSAL DENIAL redact-1.txt,2025-11-07,,2,0,2,0,0,0,0,0,0,0,0,0
case,CASE DOCS\11.07.25 - RECUSAL DENIAL-1.pdf,extracted_text\11.07.25 - RECUSAL DENIAL-1.txt,2025-11-07,,2,0,2,0,0,0,0,0,0,0,0,0
case,CASE DOCS\11.11.24 - ORDER ON MOTION TO ENTER JUDGMENT-1.pdf,extracted_text\11.11.24 - ORDER ON MOTION TO ENTER JUDGMENT-1.txt,2024-11-11,,2,0,2,0,0,0,0,0,0,0,0,0
case,CASE DOCS\11.15.2024_PROPOSED ORDER ON MOTION TO COMPEL DISCOVERY-1.pdf,extracted_text\11.15.2024_PROPOSED ORDER ON MOTION TO COMPEL DISCOVERY-1.txt,2024-11-15,,2,0,2,0,0,0,0,0,0,0,0,0
case,CASE DOCS\11.15.24 - Prop. Order Compel Discovery-1.pdf,extracted_text\11.15.24 - Prop. Order Compel Discovery-1.txt,2024-11-15,,2,0,2,0,0,0,0,0,0,0,0,0
case,CASE DOCS\11.19.2024_ORDER DENYING JOINT MOTION TO RECUSE JUDGE MUNFORD-1.pdf,extracted_text\11.19.2024_ORDER DENYING JOINT MOTION TO RECUSE JUDGE MUNFORD-1.txt,2024-11-19,,2,0,2,0,0,0,0,0,0,0,0,0
case,CASE DOCS\12.01.25 - OBJECTION TO PETITIONER'S SUMMARY JUDGMENT EVIDENCE.pdf,extracted_text\12.01.25 - OBJECTION TO PETITIONER'S SUMMARY JUDGMENT EVIDENCE.txt,2025-12-01,,2,0,2,0,0,0,0,0,0,0,0,0
case,CASE DOCS\12.04.24 - SAPPHIRE STATEMENT-1.pdf,extracted_text\12.04.24 - SAPPHIRE STATEMENT-1.txt,2024-12-04,,2,2,0,0,0,0,0,0,0,0,0,0
case,CASE DOCS\12.08.25 - NOTICE OF NEW INFORMATION.pdf,extracted_text\12.08.25 - NOTICE OF NEW INFORMATION.txt,2025-12-08,,2,0,2,0,0,0,0,0,0,0,0,0
case,CASE DOCS\12.09.25 - 193.6 OBJECTION.pdf,extracted_text\12.09.25 - 193.6 OBJECTION.txt,2025-12-09,,2,0,2,0,0,0,0,0,0,0,0,0
case,CASE DOCS\12.18.2023_STATEMENT OF INABILITY TO AFFORD PYMT OF CRT COSTS-1.pdf,extracted_text\12.18.2023_STATEMENT OF INABILITY TO AFFORD PYMT OF CRT COSTS-1.txt,2023-12-18,,2,0,2,0,0,0,0,0,0,0,0,0
case,CASE DOCS\12.18.23 - Statement of Inability to Afford Payment-1.pdf,extracted_text\12.18.23 - Statement of Inability to Afford Payment-1.txt,2023-12-18,,2,0,2,0,0,0,0,0,0,0,0,0
case,CASE DOCS\12.18.25 - Statement of Inability-1.pdf,extracted_text\12.18.25 - Statement of Inability-1.txt,2025-12-18,,2,0,2,0,0,0,0,0,0,0,0,0
research,RESEARCH\COORDINATOR IN RECUSAL PROCESS.pdf,extracted_research\COORDINATOR IN RECUSAL PROCESS.txt,,,2,0,0,1,0,0,0,0,0,0,0,1
research,RESEARCH\RULE 12.pdf,extracted_research\RULE 12.txt,,,2,1,0,0,0,0,0,0,0,0,1,0
research,RESEARCH\SELF-HELP EVICTION.pdf,extracted_research\SELF-HELP EVICTION.txt,,,2,0,0,2,0,0,0,0,0,0,0,0
research,RESEARCH\allegations such as drug.pdf,extracted_research\allegations such as drug.txt,,,2,0,0,1,0,0,0,1,0,0,0,0
research,RESEARCH\vLex-Vincent-What-factors-can-a-trial-1.pdf,extracted_research\vLex-Vincent-What-factors-can-a-trial-1.txt,,,2,0,0,0,0,0,0,0,0,2,0,0
research,RESEARCH\wifes admission to knowingly submitting false pleadings.pdf,extracted_research\wifes admission to knowingly submitting false pleadings.txt,,,2,0,0,0,0,0,0,0,2,0,0,0
case,CASE DOCS\02.01.24 - Defendant's Answer-1.pdf,extracted_text\02.01.24 - Defendant's Answer-1.txt,2024-02-01,,1,0,1,0,0,0,0,0,0,0,0,0
case,CASE DOCS\02.06.24 - Agreed Motion for Withdraw-1.pdf,extracted_text\02.06.24 - Agreed Motion for Withdraw-1.txt,2024-02-06,,1,0,1,0,0,0,0,0,0,0,0,0
case,CASE DOCS\02.06.24 - Agreed Motion for Withdrawal of Attorney-1.pdf,extracted_text\02.06.24 - Agreed Motion for Withdrawal of Attorney-1.txt,2024-02-06,,1,0,1,0,0,0,0,0,0,0,0,0
case,CASE DOCS\02.06.24 - Agreed Motion for Withdrawal of Attorney_2694B50A-1.pdf,extracted_text\02.06.24 - Agreed Motion for Withdrawal of Attorney_2694B50A-1.txt,2024-02-06,,1,0,1,0,0,0,0,0,0,0,0,0
case,CASE DOCS\02.09.24 - EXHIBIT D - PROPOSED PARENTING PLAN-1.pdf,extracted_text\02.09.24 - EXHIBIT D - PROPOSED PARENTING PLAN-1.txt,2024-02-09,,1,0,1,0,0,0,0,0,0,0,0,0
case,CASE DOCS\03.09.24 - JOHN VARELA AFFIDAVIT-1.pdf,extracted_text\03.09.24 - JOHN VARELA AFFIDAVIT-1.txt,2024-03-09,,1,0,1,0,0,0,0,0,0,0,0,0
case,CASE DOCS\03.10.24 - BRIANA GALBO-1.pdf,extracted_text\03.10.24 - BRIANA GALBO-1.txt,2024-03-10,,1,0,1,0,0,0,0,0,0,0,0,0
case,CASE DOCS\03.10.24 - CHRISTIAN VROOM AFFIDAVIT-1.pdf,extracted_text\03.10.24 - CHRISTIAN VROOM AFFIDAVIT-1.txt,2024-03-10,,1,0,1,0,0,0,0,0,0,0,0,0
case,CASE DOCS\03.11.24 - AARON WATSON-1.pdf,extracted_text\03.11.24 - AARON WATSON-1.txt,2024-03-11,,1,0,1,0,0,0,0,0,0,0,0,0
case,CASE DOCS\03.11.24 - DANNY SLADE-1.pdf,extracted_text\03.11.24 - DANNY SLADE-1.txt,2024-03-11,,1,0,1,0,0,0,0,0,0,0,0,0
case,CASE DOCS\03.13.24 - LUZ OBLE-1.pdf,extracted_text\03.13.24 - LUZ OBLE-1.txt,2024-03-13,,1,0,1,0,0,0,0,0,0,0,0,0
case,CASE DOCS\03.13.24 - NICHOLAS MORVAN-1.pdf,extracted_text\03.13.24 - NICHOLAS MORVAN-1.txt,2024-03-13,,1,0,1,0,0,0,0,0,0,0,0,0
case,CASE DOCS\03.26.2024_ATTACH AARON WATSON AFFIDAVIT-1.pdf,extracted_text\03.26.2024_ATTACH AARON WATSON AFFIDAVIT-1.txt,2024-03-26,,1,0,1,0,0,0,0,0,0,0,0,0
case,CASE DOCS\03.26.2024_ATTACH CHRISTIAN VROOM AFFIDAVIT-1.pdf,extracted_text\03.26.2024_ATTACH CHRISTIAN VROOM AFFIDAVIT-1.txt,2024-03-26,,1,0,1,0,0,0,0,0,0,0,0,0
case,CASE DOCS\03.26.2024_ATTACH DANNY SLADE BURT AFFIDAVIT-1.pdf,extracted_text\03.26.2024_ATTACH DANNY SLADE BURT AFFIDAVIT-1.txt,2024-03-26,,1,0,1,0,0,0,0,0,0,0,0,0
case,CASE DOCS\03.26.2024_ATTACH JOHN VALERA AFFIDAVIT-1.pdf,extracted_text\03.26.2024_ATTACH JOHN VALERA AFFIDAVIT-1.txt,2024-03-26,,1,0,1,0,0,0,0,0,0,0,0,0
case,CASE DOCS\03.26.24 - Luz Oble Affidavit-1.pdf,extracted_text\03.26.24 - Luz Oble Affidavit-1.txt,2024-03-26,,1,0,1,0,0,0,0,0,0,0,0,0
case,CASE DOCS\03.26.24 - Morvan Affidavit-1.pdf,extracted_text\03.26.24 - Morvan Affidavit-1.txt,2024-03-26,,1,0,1,0,0,0,0,0,0,0,0,0
case,CASE DOCS\04.15.21 - COOPER CARTER APPEARANCE-1.pdf,extracted_text\04.15.21 - COOPER CARTER APPEARANCE-1.txt,2021-04-15,,1,0,1,0,0,0,0,0,0,0,0,0
case,CASE DOCS\04.23.2025_NOTICE OF TRIAL SETTING-1.pdf,extracted_text\04.23.2025_NOTICE OF TRIAL SETTING-1.txt,2025-04-23,,1,0,1,0,0,0,0,0,0,0,0,0
case,CASE DOCS\04.23.25 - NOCP MYERS-1.pdf,extracted_text\04.23.25 - NOCP MYERS-1.txt,2025-04-23,,1,0,1,0,0,0,0,0,0,0,0,0
case,CASE DOCS\04.23.25 - NOTICE OF TRIAL SETTING-f712d07f-1.pdf,extracted_text\04.23.25 - NOTICE OF TRIAL SETTING-f712d07f-1.txt,2025-04-23,,1,0,1,0,0,0,0,0,0,0,0,0
case,CASE DOCS\04.29.25 - Erroneous Kaitcer Referral-1.pdf,extracted_text\04.29.25 - Erroneous Kaitcer Referral-1.txt,2025-04-29,,1,0,1,0,0,0,0,0,0,0,0,0
case,CASE DOCS\04.29.25 - Order of Referral Munford-1.pdf,extracted_text\04.29.25 - Order of Referral Munford-1.txt,2025-04-29,,1,0,1,0,0,0,0,0,0,0,0,0
case,CASE DOCS\05.06.2025_ORDER OF ASSIGNMENT BY HON EVANS-1.pdf,extracted_text\05.06.2025_ORDER OF ASSIGNMENT BY HON EVANS-1.txt,2025-05-06,,1,0,1,0,0,0,0,0,0,0,0,0
case,CASE DOCS\05.06.24 - ORDER OF ASSIGNMENT-1.pdf,extracted_text\05.06.24 - ORDER OF ASSIGNMENT-1.txt,2024-05-06,,1,0,1,0,0,0,0,0,0,0,0,0
case,CASE DOCS\05.15.25 Order Denying Objection to Order of Referral-1.pdf,extracted_text\05.15.25 Order Denying Objection to Order of Referral-1.txt,2025-05-15,,1,0,1,0,0,0,0,0,0,0,0,0
case,CASE DOCS\10.24.24 - Steve Myers Affidavit-1.pdf,extracted_text\10.24.24 - Steve Myers Affidavit-1.txt,2024-10-24,,1,0,1,0,0,0,0,0,0,0,0,0
case,CASE DOCS\11.07.24 - RECUSAL DENIAL - JUSTICE GABRIEL-1.pdf,extracted_text\11.07.24 - RECUSAL DENIAL - JUSTICE GABRIEL-1.txt,2024-11-07,,1,0,1,0,0,0,0,0,0,0,0,0
case,CASE DOCS\12.28.2023_FROM 322-744538-23  ORDER SETTING HEARING 11624  900 AM-1.pdf,extracted_text\12.28.2023_FROM 322-744538-23  ORDER SETTING HEARING 11624  900 AM-1.txt,2023-12-28,322-744538-23,1,0,0,0,0,0,0,0,1,0,0,0
research,RESEARCH\transfer of funds to herself.pdf,extracted_research\transfer of funds to herself.txt,,,1,0,0,0,0,0,0,1,0,0,0,0
research,RESEARCH\vLex-Vincent-Can-an-administrative-judge-use-1.pdf,extracted_research\vLex-Vincent-Can-an-administrative-judge-use-1.txt,,,1,0,1,0,0,0,0,0,0,0,0,0
research,RESEARCH\vLex-Vincent-Daniel-Kenneth-Branthoover-1.pdf,extracted_research\vLex-Vincent-Daniel-Kenneth-Branthoover-1.txt,,,1,0,0,0,0,0,0,0,1,0,0,0
research,RESEARCH\vLex-Vincent-If-someone-pleads-no-contest-to-a-speeding-ticket-in-Texas--what-are-some-lesser-known-legal-strateg-1.pdf,extracted_research\vLex-Vincent-If-someone-pleads-no-contest-to-a-speeding-ticket-in-Texas--what-are-some-lesser-known-legal-strateg-1.txt,,,1,1,0,0,0,0,0,0,0,0,0,0
research,RESEARCH\vLex-Vincent-Is-it-improper-for-a-1.pdf,extracted_research\vLex-Vincent-Is-it-improper-for-a-1.txt,,,1,0,1,0,0,0,0,0,0,0,0,0
research,RESEARCH\vLex-Vincent-Roderick-Marx-1.pdf,extracted_research\vLex-Vincent-Roderick-Marx-1.txt,,,1,0,0,0,0,0,0,1,0,0,0,0
