corpus,issue,source_pdf,source_txt,date,hit_count
case,mandamus,CASE DOCS\02-24-00149-CV_24149CV-1.pdf,extracted_text\02-24-00149-CV_24149CV-1.txt,2014-02-24,10
case,appeal,CASE DOCS\02-24-00149-CV_24149CV-1.pdf,extracted_text\02-24-00149-CV_24149CV-1.txt,2014-02-24,4
case,federal_court,CASE DOCS\02-24-00149-CV_24149CV-1.pdf,extracted_text\02-24-00149-CV_24149CV-1.txt,2014-02-24,2
case,mandamus,CASE DOCS\02-24-00149-CV_24149CV.cor-1.pdf,extracted_text\02-24-00149-CV_24149CV.cor-1.txt,2014-02-24,10
case,appeal,CASE DOCS\02-24-00149-CV_24149CV.cor-1.pdf,extracted_text\02-24-00149-CV_24149CV.cor-1.txt,2014-02-24,4
case,federal_court,CASE DOCS\02-24-00149-CV_24149CV.cor-1.pdf,extracted_text\02-24-00149-CV_24149CV.cor-1.txt,2014-02-24,2
case,mandamus,CASE DOCS\02-24-00149-CV_24149CV.cor_961223C6-03e9250a-1.pdf,extracted_text\02-24-00149-CV_24149CV.cor_961223C6-03e9250a-1.txt,2014-02-24,10
case,appeal,CASE DOCS\02-24-00149-CV_24149CV.cor_961223C6-03e9250a-1.pdf,extracted_text\02-24-00149-CV_24149CV.cor_961223C6-03e9250a-1.txt,2014-02-24,4
case,federal_court,CASE DOCS\02-24-00149-CV_24149CV.cor_961223C6-03e9250a-1.pdf,extracted_text\02-24-00149-CV_24149CV.cor_961223C6-03e9250a-1.txt,2014-02-24,2
case,mandamus,CASE DOCS\02-24-00149-CV_24149CV.cor_961223C6-1.pdf,extracted_text\02-24-00149-CV_24149CV.cor_961223C6-1.txt,2014-02-24,10
case,appeal,CASE DOCS\02-24-00149-CV_24149CV.cor_961223C6-1.pdf,extracted_text\02-24-00149-CV_24149CV.cor_961223C6-1.txt,2014-02-24,4
case,federal_court,CASE DOCS\02-24-00149-CV_24149CV.cor_961223C6-1.pdf,extracted_text\02-24-00149-CV_24149CV.cor_961223C6-1.txt,2014-02-24,2
case,recusal,CASE DOCS\02-24-00149-CV_CORR OPINION PAGE_FILECOPY_FC8D2EE3-0f787c6f-1.pdf,extracted_text\02-24-00149-CV_CORR OPINION PAGE_FILECOPY_FC8D2EE3-0f787c6f-1.txt,2014-02-24,2
case,appeal,CASE DOCS\02-24-00149-CV_CORR OPINION PAGE_FILECOPY_FC8D2EE3-0f787c6f-1.pdf,extracted_text\02-24-00149-CV_CORR OPINION PAGE_FILECOPY_FC8D2EE3-0f787c6f-1.txt,2014-02-24,6
case,federal_court,CASE DOCS\02-24-00149-CV_CORR OPINION PAGE_FILECOPY_FC8D2EE3-0f787c6f-1.pdf,extracted_text\02-24-00149-CV_CORR OPINION PAGE_FILECOPY_FC8D2EE3-0f787c6f-1.txt,2014-02-24,2
case,recusal,CASE DOCS\02-24-00149-CV_MEM OPINION ISSD_OPINION ISSD_FILECOPY-1.pdf,extracted_text\02-24-00149-CV_MEM OPINION ISSD_OPINION ISSD_FILECOPY-1.txt,2014-02-24,2
case,appeal,CASE DOCS\02-24-00149-CV_MEM OPINION ISSD_OPINION ISSD_FILECOPY-1.pdf,extracted_text\02-24-00149-CV_MEM OPINION ISSD_OPINION ISSD_FILECOPY-1.txt,2014-02-24,6
case,federal_court,CASE DOCS\02-24-00149-CV_MEM OPINION ISSD_OPINION ISSD_FILECOPY-1.pdf,extracted_text\02-24-00149-CV_MEM OPINION ISSD_OPINION ISSD_FILECOPY-1.txt,2014-02-24,2
case,notice,CASE DOCS\02-24-00149-CV_MT REHEAR DISP ORIG PROC CV_FILECOPY_BDCA6517-1-1.pdf,extracted_text\02-24-00149-CV_MT REHEAR DISP ORIG PROC CV_FILECOPY_BDCA6517-1-1.txt,2014-02-24,2
case,mandamus,CASE DOCS\02-24-00149-CV_MT REHEAR DISP ORIG PROC CV_FILECOPY_BDCA6517-1-1.pdf,extracted_text\02-24-00149-CV_MT REHEAR DISP ORIG PROC CV_FILECOPY_BDCA6517-1-1.txt,2014-02-24,2
case,appeal,CASE DOCS\02-24-00149-CV_MT REHEAR DISP ORIG PROC CV_FILECOPY_BDCA6517-1-1.pdf,extracted_text\02-24-00149-CV_MT REHEAR DISP ORIG PROC CV_FILECOPY_BDCA6517-1-1.txt,2014-02-24,4
case,federal_court,CASE DOCS\02-24-00149-CV_MT REHEAR DISP ORIG PROC CV_FILECOPY_BDCA6517-1-1.pdf,extracted_text\02-24-00149-CV_MT REHEAR DISP ORIG PROC CV_FILECOPY_BDCA6517-1-1.txt,2014-02-24,2
case,notice,CASE DOCS\02-24-00149-CV_MT REHEAR DISP ORIG PROC CV_FILECOPY_BDCA6517-1.pdf,extracted_text\02-24-00149-CV_MT REHEAR DISP ORIG PROC CV_FILECOPY_BDCA6517-1.txt,2014-02-24,2
case,mandamus,CASE DOCS\02-24-00149-CV_MT REHEAR DISP ORIG PROC CV_FILECOPY_BDCA6517-1.pdf,extracted_text\02-24-00149-CV_MT REHEAR DISP ORIG PROC CV_FILECOPY_BDCA6517-1.txt,2014-02-24,2
case,appeal,CASE DOCS\02-24-00149-CV_MT REHEAR DISP ORIG PROC CV_FILECOPY_BDCA6517-1.pdf,extracted_text\02-24-00149-CV_MT REHEAR DISP ORIG PROC CV_FILECOPY_BDCA6517-1.txt,2014-02-24,4
case,federal_court,CASE DOCS\02-24-00149-CV_MT REHEAR DISP ORIG PROC CV_FILECOPY_BDCA6517-1.pdf,extracted_text\02-24-00149-CV_MT REHEAR DISP ORIG PROC CV_FILECOPY_BDCA6517-1.txt,2014-02-24,2
case,mandamus,CASE DOCS\02-24-00149-CV_PET MAND FLD_FILECOPY (2)-1.pdf,extracted_text\02-24-00149-CV_PET MAND FLD_FILECOPY (2)-1.txt,2014-02-24,4
case,appeal,CASE DOCS\02-24-00149-CV_PET MAND FLD_FILECOPY (2)-1.pdf,extracted_text\02-24-00149-CV_PET MAND FLD_FILECOPY (2)-1.txt,2014-02-24,4
case,federal_court,CASE DOCS\02-24-00149-CV_PET MAND FLD_FILECOPY (2)-1.pdf,extracted_text\02-24-00149-CV_PET MAND FLD_FILECOPY (2)-1.txt,2014-02-24,2
case,mandamus,CASE DOCS\02-24-00149-CV_PET MAND FLD_FILECOPY (2)_3D0FAE00-07353b0d-1.pdf,extracted_text\02-24-00149-CV_PET MAND FLD_FILECOPY (2)_3D0FAE00-07353b0d-1.txt,2014-02-24,4
case,appeal,CASE DOCS\02-24-00149-CV_PET MAND FLD_FILECOPY (2)_3D0FAE00-07353b0d-1.pdf,extracted_text\02-24-00149-CV_PET MAND FLD_FILECOPY (2)_3D0FAE00-07353b0d-1.txt,2014-02-24,4
case,federal_court,CASE DOCS\02-24-00149-CV_PET MAND FLD_FILECOPY (2)_3D0FAE00-07353b0d-1.pdf,extracted_text\02-24-00149-CV_PET MAND FLD_FILECOPY (2)_3D0FAE00-07353b0d-1.txt,2014-02-24,2
case,mandamus,CASE DOCS\02-24-00149-CV_PET MAND FLD_FILECOPY (2)_3D0FAE00-1-1.pdf,extracted_text\02-24-00149-CV_PET MAND FLD_FILECOPY (2)_3D0FAE00-1-1.txt,2014-02-24,4
case,appeal,CASE DOCS\02-24-00149-CV_PET MAND FLD_FILECOPY (2)_3D0FAE00-1-1.pdf,extracted_text\02-24-00149-CV_PET MAND FLD_FILECOPY (2)_3D0FAE00-1-1.txt,2014-02-24,4
case,federal_court,CASE DOCS\02-24-00149-CV_PET MAND FLD_FILECOPY (2)_3D0FAE00-1-1.pdf,extracted_text\02-24-00149-CV_PET MAND FLD_FILECOPY (2)_3D0FAE00-1-1.txt,2014-02-24,2
case,mandamus,CASE DOCS\02-24-00149-CV_PET MAND FLD_FILECOPY (2)_3D0FAE00-1.pdf,extracted_text\02-24-00149-CV_PET MAND FLD_FILECOPY (2)_3D0FAE00-1.txt,2014-02-24,4
case,appeal,CASE DOCS\02-24-00149-CV_PET MAND FLD_FILECOPY (2)_3D0FAE00-1.pdf,extracted_text\02-24-00149-CV_PET MAND FLD_FILECOPY (2)_3D0FAE00-1.txt,2014-02-24,4
case,federal_court,CASE DOCS\02-24-00149-CV_PET MAND FLD_FILECOPY (2)_3D0FAE00-1.pdf,extracted_text\02-24-00149-CV_PET MAND FLD_FILECOPY (2)_3D0FAE00-1.txt,2014-02-24,2
case,mandamus,CASE DOCS\02-25-00164-CV_25164CV-1.pdf,extracted_text\02-25-00164-CV_25164CV-1.txt,2016-02-25,10
case,appeal,CASE DOCS\02-25-00164-CV_25164CV-1.pdf,extracted_text\02-25-00164-CV_25164CV-1.txt,2016-02-25,4
case,federal_court,CASE DOCS\02-25-00164-CV_25164CV-1.pdf,extracted_text\02-25-00164-CV_25164CV-1.txt,2016-02-25,2
case,associate_judge,CASE DOCS\02-25-00164-CV_MANDAMUS_FILED - 04.10.2025-1.pdf,extracted_text\02-25-00164-CV_MANDAMUS_FILED - 04.10.2025-1.txt,2016-02-25,2
case,mandamus,CASE DOCS\02-25-00164-CV_MANDAMUS_FILED - 04.10.2025-1.pdf,extracted_text\02-25-00164-CV_MANDAMUS_FILED - 04.10.2025-1.txt,2016-02-25,4
case,appeal,CASE DOCS\02-25-00164-CV_MANDAMUS_FILED - 04.10.2025-1.pdf,extracted_text\02-25-00164-CV_MANDAMUS_FILED - 04.10.2025-1.txt,2016-02-25,4
case,federal_court,CASE DOCS\02-25-00164-CV_MANDAMUS_FILED - 04.10.2025-1.pdf,extracted_text\02-25-00164-CV_MANDAMUS_FILED - 04.10.2025-1.txt,2016-02-25,2
case,notice,CASE DOCS\02-25-00164-CV_MT REHEAR DISP ORIG PROC CV_FILECOPY-1.pdf,extracted_text\02-25-00164-CV_MT REHEAR DISP ORIG PROC CV_FILECOPY-1.txt,2016-02-25,2
case,mandamus,CASE DOCS\02-25-00164-CV_MT REHEAR DISP ORIG PROC CV_FILECOPY-1.pdf,extracted_text\02-25-00164-CV_MT REHEAR DISP ORIG PROC CV_FILECOPY-1.txt,2016-02-25,2
case,appeal,CASE DOCS\02-25-00164-CV_MT REHEAR DISP ORIG PROC CV_FILECOPY-1.pdf,extracted_text\02-25-00164-CV_MT REHEAR DISP ORIG PROC CV_FILECOPY-1.txt,2016-02-25,4
case,federal_court,CASE DOCS\02-25-00164-CV_MT REHEAR DISP ORIG PROC CV_FILECOPY-1.pdf,extracted_text\02-25-00164-CV_MT REHEAR DISP ORIG PROC CV_FILECOPY-1.txt,2016-02-25,2
case,mandamus,CASE DOCS\02-25-00166-CV_25166CV-1.pdf,extracted_text\02-25-00166-CV_25166CV-1.txt,2016-02-25,10
case,appeal,CASE DOCS\02-25-00166-CV_25166CV-1.pdf,extracted_text\02-25-00166-CV_25166CV-1.txt,2016-02-25,4
case,federal_court,CASE DOCS\02-25-00166-CV_25166CV-1.pdf,extracted_text\02-25-00166-CV_25166CV-1.txt,2016-02-25,2
case,recusal,CASE DOCS\02-25-00166-CV_MEM OPINION ISSD_OPINION ISSD_FILECOPY-1.pdf,extracted_text\02-25-00166-CV_MEM OPINION ISSD_OPINION ISSD_FILECOPY-1.txt,2016-02-25,2
case,associate_judge,CASE DOCS\02-25-00166-CV_MEM OPINION ISSD_OPINION ISSD_FILECOPY-1.pdf,extracted_text\02-25-00166-CV_MEM OPINION ISSD_OPINION ISSD_FILECOPY-1.txt,2016-02-25,2
case,appeal,CASE DOCS\02-25-00166-CV_MEM OPINION ISSD_OPINION ISSD_FILECOPY-1.pdf,extracted_text\02-25-00166-CV_MEM OPINION ISSD_OPINION ISSD_FILECOPY-1.txt,2016-02-25,6
case,federal_court,CASE DOCS\02-25-00166-CV_MEM OPINION ISSD_OPINION ISSD_FILECOPY-1.pdf,extracted_text\02-25-00166-CV_MEM OPINION ISSD_OPINION ISSD_FILECOPY-1.txt,2016-02-25,2
case,child_support_oag,CASE DOCS\02-25-00166-CV_MEM OPINION ISSD_OPINION ISSD_FILECOPY-1.pdf,extracted_text\02-25-00166-CV_MEM OPINION ISSD_OPINION ISSD_FILECOPY-1.txt,2016-02-25,2
case,due_process,CASE DOCS\02-25-00171-CV MANDAMUS RECORD-1.pdf,extracted_text\02-25-00171-CV MANDAMUS RECORD-1.txt,2017-02-25,14
case,notice,CASE DOCS\02-25-00171-CV MANDAMUS RECORD-1.pdf,extracted_text\02-25-00171-CV MANDAMUS RECORD-1.txt,2017-02-25,192
case,hearing,CASE DOCS\02-25-00171-CV MANDAMUS RECORD-1.pdf,extracted_text\02-25-00171-CV MANDAMUS RECORD-1.txt,2017-02-25,184
case,recusal,CASE DOCS\02-25-00171-CV MANDAMUS RECORD-1.pdf,extracted_text\02-25-00171-CV MANDAMUS RECORD-1.txt,2017-02-25,11
case,associate_judge,CASE DOCS\02-25-00171-CV MANDAMUS RECORD-1.pdf,extracted_text\02-25-00171-CV MANDAMUS RECORD-1.txt,2017-02-25,62
case,mandamus,CASE DOCS\02-25-00171-CV MANDAMUS RECORD-1.pdf,extracted_text\02-25-00171-CV MANDAMUS RECORD-1.txt,2017-02-25,56
case,appeal,CASE DOCS\02-25-00171-CV MANDAMUS RECORD-1.pdf,extracted_text\02-25-00171-CV MANDAMUS RECORD-1.txt,2017-02-25,68
case,jurisdiction,CASE DOCS\02-25-00171-CV MANDAMUS RECORD-1.pdf,extracted_text\02-25-00171-CV MANDAMUS RECORD-1.txt,2017-02-25,112
case,removal_remand,CASE DOCS\02-25-00171-CV MANDAMUS RECORD-1.pdf,extracted_text\02-25-00171-CV MANDAMUS RECORD-1.txt,2017-02-25,50
case,federal_court,CASE DOCS\02-25-00171-CV MANDAMUS RECORD-1.pdf,extracted_text\02-25-00171-CV MANDAMUS RECORD-1.txt,2017-02-25,151
case,protective_order,CASE DOCS\02-25-00171-CV MANDAMUS RECORD-1.pdf,extracted_text\02-25-00171-CV MANDAMUS RECORD-1.txt,2017-02-25,125
case,temporary_orders,CASE DOCS\02-25-00171-CV MANDAMUS RECORD-1.pdf,extracted_text\02-25-00171-CV MANDAMUS RECORD-1.txt,2017-02-25,198
case,custody,CASE DOCS\02-25-00171-CV MANDAMUS RECORD-1.pdf,extracted_text\02-25-00171-CV MANDAMUS RECORD-1.txt,2017-02-25,303
case,property_financial,CASE DOCS\02-25-00171-CV MANDAMUS RECORD-1.pdf,extracted_text\02-25-00171-CV MANDAMUS RECORD-1.txt,2017-02-25,366
case,fraud_perjury,CASE DOCS\02-25-00171-CV MANDAMUS RECORD-1.pdf,extracted_text\02-25-00171-CV MANDAMUS RECORD-1.txt,2017-02-25,128
case,discovery,CASE DOCS\02-25-00171-CV MANDAMUS RECORD-1.pdf,extracted_text\02-25-00171-CV MANDAMUS RECORD-1.txt,2017-02-25,24
case,sanctions_contempt,CASE DOCS\02-25-00171-CV MANDAMUS RECORD-1.pdf,extracted_text\02-25-00171-CV MANDAMUS RECORD-1.txt,2017-02-25,22
case,injunction,CASE DOCS\02-25-00171-CV MANDAMUS RECORD-1.pdf,extracted_text\02-25-00171-CV MANDAMUS RECORD-1.txt,2017-02-25,205
case,child_support_oag,CASE DOCS\02-25-00171-CV MANDAMUS RECORD-1.pdf,extracted_text\02-25-00171-CV MANDAMUS RECORD-1.txt,2017-02-25,17
case,law_enforcement,CASE DOCS\02-25-00171-CV MANDAMUS RECORD-1.pdf,extracted_text\02-25-00171-CV MANDAMUS RECORD-1.txt,2017-02-25,32
case,ex_parte,CASE DOCS\02-25-00171-CV MANDAMUS RECORD-1.pdf,extracted_text\02-25-00171-CV MANDAMUS RECORD-1.txt,2017-02-25,20
case,lockout_eviction,CASE DOCS\02-25-00171-CV MANDAMUS RECORD-1.pdf,extracted_text\02-25-00171-CV MANDAMUS RECORD-1.txt,2017-02-25,22
case,mandamus,CASE DOCS\02-25-00171-CV_25171CV-1.pdf,extracted_text\02-25-00171-CV_25171CV-1.txt,2017-02-25,10
case,appeal,CASE DOCS\02-25-00171-CV_25171CV-1.pdf,extracted_text\02-25-00171-CV_25171CV-1.txt,2017-02-25,4
case,federal_court,CASE DOCS\02-25-00171-CV_25171CV-1.pdf,extracted_text\02-25-00171-CV_25171CV-1.txt,2017-02-25,2
case,notice,CASE DOCS\02-25-00171-CV_MT REHEAR DISP ORIG PROC CV_FILECOPY-1.pdf,extracted_text\02-25-00171-CV_MT REHEAR DISP ORIG PROC CV_FILECOPY-1.txt,2017-02-25,2
case,mandamus,CASE DOCS\02-25-00171-CV_MT REHEAR DISP ORIG PROC CV_FILECOPY-1.pdf,extracted_text\02-25-00171-CV_MT REHEAR DISP ORIG PROC CV_FILECOPY-1.txt,2017-02-25,2
case,appeal,CASE DOCS\02-25-00171-CV_MT REHEAR DISP ORIG PROC CV_FILECOPY-1.pdf,extracted_text\02-25-00171-CV_MT REHEAR DISP ORIG PROC CV_FILECOPY-1.txt,2017-02-25,4
case,federal_court,CASE DOCS\02-25-00171-CV_MT REHEAR DISP ORIG PROC CV_FILECOPY-1.pdf,extracted_text\02-25-00171-CV_MT REHEAR DISP ORIG PROC CV_FILECOPY-1.txt,2017-02-25,2
case,mandamus,CASE DOCS\02-25-00582-CV_25582CV-1.pdf,extracted_text\02-25-00582-CV_25582CV-1.txt,2058-02-25,8
case,appeal,CASE DOCS\02-25-00582-CV_25582CV-1.pdf,extracted_text\02-25-00582-CV_25582CV-1.txt,2058-02-25,4
case,federal_court,CASE DOCS\02-25-00582-CV_25582CV-1.pdf,extracted_text\02-25-00582-CV_25582CV-1.txt,2058-02-25,2
case,mandamus,CASE DOCS\02-25-00582-CV_PET MAND FLD_FILECOPY-1.pdf,extracted_text\02-25-00582-CV_PET MAND FLD_FILECOPY-1.txt,2058-02-25,4
case,appeal,CASE DOCS\02-25-00582-CV_PET MAND FLD_FILECOPY-1.pdf,extracted_text\02-25-00582-CV_PET MAND FLD_FILECOPY-1.txt,2058-02-25,4
case,federal_court,CASE DOCS\02-25-00582-CV_PET MAND FLD_FILECOPY-1.pdf,extracted_text\02-25-00582-CV_PET MAND FLD_FILECOPY-1.txt,2058-02-25,2
case,child_support_oag,CASE DOCS\02-25-00582-CV_PET MAND FLD_FILECOPY-1.pdf,extracted_text\02-25-00582-CV_PET MAND FLD_FILECOPY-1.txt,2058-02-25,2
case,federal_court,CASE DOCS\02.01.24 - Agreed Order to Consolidation-1.pdf,extracted_text\02.01.24 - Agreed Order to Consolidation-1.txt,2024-02-01,6
case,associate_judge,CASE DOCS\02.01.24 - AJ Report-1.pdf,extracted_text\02.01.24 - AJ Report-1.txt,2024-02-01,4
case,federal_court,CASE DOCS\02.01.24 - AJ Report-1.pdf,extracted_text\02.01.24 - AJ Report-1.txt,2024-02-01,2
case,temporary_orders,CASE DOCS\02.01.24 - AJ Report-1.pdf,extracted_text\02.01.24 - AJ Report-1.txt,2024-02-01,6
case,custody,CASE DOCS\02.01.24 - AJ Report-1.pdf,extracted_text\02.01.24 - AJ Report-1.txt,2024-02-01,27
case,property_financial,CASE DOCS\02.01.24 - AJ Report-1.pdf,extracted_text\02.01.24 - AJ Report-1.txt,2024-02-01,16
case,child_support_oag,CASE DOCS\02.01.24 - AJ Report-1.pdf,extracted_text\02.01.24 - AJ Report-1.txt,2024-02-01,4
case,associate_judge,CASE DOCS\02.01.24 - AJ's Report-1.pdf,extracted_text\02.01.24 - AJ's Report-1.txt,2024-02-01,3
case,federal_court,CASE DOCS\02.01.24 - AJ's Report-1.pdf,extracted_text\02.01.24 - AJ's Report-1.txt,2024-02-01,4
case,custody,CASE DOCS\02.01.24 - AJ's Report-1.pdf,extracted_text\02.01.24 - AJ's Report-1.txt,2024-02-01,2
case,child_support_oag,CASE DOCS\02.01.24 - AJ's Report-1.pdf,extracted_text\02.01.24 - AJ's Report-1.txt,2024-02-01,2
case,associate_judge,CASE DOCS\02.01.24 - AJR-1.pdf,extracted_text\02.01.24 - AJR-1.txt,2024-02-01,4
case,federal_court,CASE DOCS\02.01.24 - AJR-1.pdf,extracted_text\02.01.24 - AJR-1.txt,2024-02-01,2
case,temporary_orders,CASE DOCS\02.01.24 - AJR-1.pdf,extracted_text\02.01.24 - AJR-1.txt,2024-02-01,6
case,custody,CASE DOCS\02.01.24 - AJR-1.pdf,extracted_text\02.01.24 - AJR-1.txt,2024-02-01,27
case,property_financial,CASE DOCS\02.01.24 - AJR-1.pdf,extracted_text\02.01.24 - AJR-1.txt,2024-02-01,16
case,child_support_oag,CASE DOCS\02.01.24 - AJR-1.pdf,extracted_text\02.01.24 - AJR-1.txt,2024-02-01,4
case,notice,CASE DOCS\02.01.24 - Defendant's Answer-1.pdf,extracted_text\02.01.24 - Defendant's Answer-1.txt,2024-02-01,2
case,federal_court,CASE DOCS\02.01.24 - Defendant's Answer-1.pdf,extracted_text\02.01.24 - Defendant's Answer-1.txt,2024-02-01,1
case,fraud_perjury,CASE DOCS\02.01.24 - Defendant's Answer-1.pdf,extracted_text\02.01.24 - Defendant's Answer-1.txt,2024-02-01,9
case,discovery,CASE DOCS\02.01.24 - Defendant's Answer-1.pdf,extracted_text\02.01.24 - Defendant's Answer-1.txt,2024-02-01,1
case,notice,CASE DOCS\02.05.2024_NOTICE OF TERMINATION OF LEGAL COUNSEL -BACALIS-1.pdf,extracted_text\02.05.2024_NOTICE OF TERMINATION OF LEGAL COUNSEL -BACALIS-1.txt,2024-02-05,16
case,federal_court,CASE DOCS\02.05.2024_NOTICE OF TERMINATION OF LEGAL COUNSEL -BACALIS-1.pdf,extracted_text\02.05.2024_NOTICE OF TERMINATION OF LEGAL COUNSEL -BACALIS-1.txt,2024-02-05,2
case,notice,CASE DOCS\02.05.24 - NOTICE OF TERMINATION OF LEGAL COUNSEL-1.pdf,extracted_text\02.05.24 - NOTICE OF TERMINATION OF LEGAL COUNSEL-1.txt,2024-02-05,18
case,federal_court,CASE DOCS\02.05.24 - NOTICE OF TERMINATION OF LEGAL COUNSEL-1.pdf,extracted_text\02.05.24 - NOTICE OF TERMINATION OF LEGAL COUNSEL-1.txt,2024-02-05,2
case,notice,CASE DOCS\02.06.2024_AGREED MOTION FOR WITHDRAWAL OF ATTY BACALIS-1.pdf,extracted_text\02.06.2024_AGREED MOTION FOR WITHDRAWAL OF ATTY BACALIS-1.txt,2024-02-06,2
case,federal_court,CASE DOCS\02.06.2024_AGREED MOTION FOR WITHDRAWAL OF ATTY BACALIS-1.pdf,extracted_text\02.06.2024_AGREED MOTION FOR WITHDRAWAL OF ATTY BACALIS-1.txt,2024-02-06,2
case,discovery,CASE DOCS\02.06.2024_AGREED MOTION FOR WITHDRAWAL OF ATTY BACALIS-1.pdf,extracted_text\02.06.2024_AGREED MOTION FOR WITHDRAWAL OF ATTY BACALIS-1.txt,2024-02-06,2
case,notice,CASE DOCS\02.06.24 - Agreed Motion for Withdraw-1.pdf,extracted_text\02.06.24 - Agreed Motion for Withdraw-1.txt,2024-02-06,1
case,federal_court,CASE DOCS\02.06.24 - Agreed Motion for Withdraw-1.pdf,extracted_text\02.06.24 - Agreed Motion for Withdraw-1.txt,2024-02-06,1
case,discovery,CASE DOCS\02.06.24 - Agreed Motion for Withdraw-1.pdf,extracted_text\02.06.24 - Agreed Motion for Withdraw-1.txt,2024-02-06,1
case,notice,CASE DOCS\02.06.24 - Agreed Motion for Withdrawal of Attorney-1.pdf,extracted_text\02.06.24 - Agreed Motion for Withdrawal of Attorney-1.txt,2024-02-06,1
case,federal_court,CASE DOCS\02.06.24 - Agreed Motion for Withdrawal of Attorney-1.pdf,extracted_text\02.06.24 - Agreed Motion for Withdrawal of Attorney-1.txt,2024-02-06,1
case,discovery,CASE DOCS\02.06.24 - Agreed Motion for Withdrawal of Attorney-1.pdf,extracted_text\02.06.24 - Agreed Motion for Withdrawal of Attorney-1.txt,2024-02-06,1
case,notice,CASE DOCS\02.06.24 - Agreed Motion for Withdrawal of Attorney_2694B50A-1.pdf,extracted_text\02.06.24 - Agreed Motion for Withdrawal of Attorney_2694B50A-1.txt,2024-02-06,1
case,federal_court,CASE DOCS\02.06.24 - Agreed Motion for Withdrawal of Attorney_2694B50A-1.pdf,extracted_text\02.06.24 - Agreed Motion for Withdrawal of Attorney_2694B50A-1.txt,2024-02-06,1
case,discovery,CASE DOCS\02.06.24 - Agreed Motion for Withdrawal of Attorney_2694B50A-1.pdf,extracted_text\02.06.24 - Agreed Motion for Withdrawal of Attorney_2694B50A-1.txt,2024-02-06,1
case,associate_judge,CASE DOCS\02.08.2024_AGREED AJS REPORT FOR TEMP ORDS-1.pdf,extracted_text\02.08.2024_AGREED AJS REPORT FOR TEMP ORDS-1.txt,2024-02-08,4
case,federal_court,CASE DOCS\02.08.2024_AGREED AJS REPORT FOR TEMP ORDS-1.pdf,extracted_text\02.08.2024_AGREED AJS REPORT FOR TEMP ORDS-1.txt,2024-02-08,2
case,temporary_orders,CASE DOCS\02.08.2024_AGREED AJS REPORT FOR TEMP ORDS-1.pdf,extracted_text\02.08.2024_AGREED AJS REPORT FOR TEMP ORDS-1.txt,2024-02-08,6
case,custody,CASE DOCS\02.08.2024_AGREED AJS REPORT FOR TEMP ORDS-1.pdf,extracted_text\02.08.2024_AGREED AJS REPORT FOR TEMP ORDS-1.txt,2024-02-08,26
case,property_financial,CASE DOCS\02.08.2024_AGREED AJS REPORT FOR TEMP ORDS-1.pdf,extracted_text\02.08.2024_AGREED AJS REPORT FOR TEMP ORDS-1.txt,2024-02-08,16
case,child_support_oag,CASE DOCS\02.08.2024_AGREED AJS REPORT FOR TEMP ORDS-1.pdf,extracted_text\02.08.2024_AGREED AJS REPORT FOR TEMP ORDS-1.txt,2024-02-08,4
case,federal_court,CASE DOCS\02.08.2024_AGREED ORDER FOR CONSOLIDATION SIGNED 2124-1.pdf,extracted_text\02.08.2024_AGREED ORDER FOR CONSOLIDATION SIGNED 2124-1.txt,2024-02-08,6
case,federal_court,CASE DOCS\02.08.24 - Agreed Motion to Consolidate-1.pdf,extracted_text\02.08.24 - Agreed Motion to Consolidate-1.txt,2024-02-08,6
case,federal_court,CASE DOCS\02.08.24 - Agreed Order for Consolidation-1-1.pdf,extracted_text\02.08.24 - Agreed Order for Consolidation-1-1.txt,2024-02-08,6
case,associate_judge,CASE DOCS\02.08.24 - Associate Judge's Report-1-1.pdf,extracted_text\02.08.24 - Associate Judge's Report-1-1.txt,2024-02-08,4
case,federal_court,CASE DOCS\02.08.24 - Associate Judge's Report-1-1.pdf,extracted_text\02.08.24 - Associate Judge's Report-1-1.txt,2024-02-08,2
case,temporary_orders,CASE DOCS\02.08.24 - Associate Judge's Report-1-1.pdf,extracted_text\02.08.24 - Associate Judge's Report-1-1.txt,2024-02-08,6
case,custody,CASE DOCS\02.08.24 - Associate Judge's Report-1-1.pdf,extracted_text\02.08.24 - Associate Judge's Report-1-1.txt,2024-02-08,27
case,property_financial,CASE DOCS\02.08.24 - Associate Judge's Report-1-1.pdf,extracted_text\02.08.24 - Associate Judge's Report-1-1.txt,2024-02-08,16
case,child_support_oag,CASE DOCS\02.08.24 - Associate Judge's Report-1-1.pdf,extracted_text\02.08.24 - Associate Judge's Report-1-1.txt,2024-02-08,4
case,associate_judge,CASE DOCS\02.08.24 - ASSOCIATE JUDGE'S REPORT-1.pdf,extracted_text\02.08.24 - ASSOCIATE JUDGE'S REPORT-1.txt,2024-02-08,4
case,federal_court,CASE DOCS\02.08.24 - ASSOCIATE JUDGE'S REPORT-1.pdf,extracted_text\02.08.24 - ASSOCIATE JUDGE'S REPORT-1.txt,2024-02-08,2
case,temporary_orders,CASE DOCS\02.08.24 - ASSOCIATE JUDGE'S REPORT-1.pdf,extracted_text\02.08.24 - ASSOCIATE JUDGE'S REPORT-1.txt,2024-02-08,6
case,custody,CASE DOCS\02.08.24 - ASSOCIATE JUDGE'S REPORT-1.pdf,extracted_text\02.08.24 - ASSOCIATE JUDGE'S REPORT-1.txt,2024-02-08,27
case,property_financial,CASE DOCS\02.08.24 - ASSOCIATE JUDGE'S REPORT-1.pdf,extracted_text\02.08.24 - ASSOCIATE JUDGE'S REPORT-1.txt,2024-02-08,16
case,child_support_oag,CASE DOCS\02.08.24 - ASSOCIATE JUDGE'S REPORT-1.pdf,extracted_text\02.08.24 - ASSOCIATE JUDGE'S REPORT-1.txt,2024-02-08,4
case,due_process,CASE DOCS\02.09-1.pdf,extracted_text\02.09-1.txt,,4
case,notice,CASE DOCS\02.09-1.pdf,extracted_text\02.09-1.txt,,16
case,hearing,CASE DOCS\02.09-1.pdf,extracted_text\02.09-1.txt,,24
case,jurisdiction,CASE DOCS\02.09-1.pdf,extracted_text\02.09-1.txt,,2
case,removal_remand,CASE DOCS\02.09-1.pdf,extracted_text\02.09-1.txt,,2
case,federal_court,CASE DOCS\02.09-1.pdf,extracted_text\02.09-1.txt,,6
case,protective_order,CASE DOCS\02.09-1.pdf,extracted_text\02.09-1.txt,,32
case,temporary_orders,CASE DOCS\02.09-1.pdf,extracted_text\02.09-1.txt,,20
case,custody,CASE DOCS\02.09-1.pdf,extracted_text\02.09-1.txt,,10
case,property_financial,CASE DOCS\02.09-1.pdf,extracted_text\02.09-1.txt,,34
case,fraud_perjury,CASE DOCS\02.09-1.pdf,extracted_text\02.09-1.txt,,4
case,discovery,CASE DOCS\02.09-1.pdf,extracted_text\02.09-1.txt,,5
case,child_support_oag,CASE DOCS\02.09-1.pdf,extracted_text\02.09-1.txt,,4
case,law_enforcement,CASE DOCS\02.09-1.pdf,extracted_text\02.09-1.txt,,6
case,lockout_eviction,CASE DOCS\02.09-1.pdf,extracted_text\02.09-1.txt,,30
case,jurisdiction,CASE DOCS\02.09.2024_EXHIBIT A1 - TEXT RECORDS AND VISUALIZATIONS-1.pdf,extracted_text\02.09.2024_EXHIBIT A1 - TEXT RECORDS AND VISUALIZATIONS-1.txt,2024-02-09,18
case,removal_remand,CASE DOCS\02.09.2024_EXHIBIT A1 - TEXT RECORDS AND VISUALIZATIONS-1.pdf,extracted_text\02.09.2024_EXHIBIT A1 - TEXT RECORDS AND VISUALIZATIONS-1.txt,2024-02-09,22
case,civil_rights_1983,CASE DOCS\02.09.2024_EXHIBIT A1 - TEXT RECORDS AND VISUALIZATIONS-1.pdf,extracted_text\02.09.2024_EXHIBIT A1 - TEXT RECORDS AND VISUALIZATIONS-1.txt,2024-02-09,16
case,notice,CASE DOCS\02.09.2024_EXHIBIT A5 - EVICTION NOTICE TORN-1.pdf,extracted_text\02.09.2024_EXHIBIT A5 - EVICTION NOTICE TORN-1.txt,2024-02-09,19
case,protective_order,CASE DOCS\02.09.2024_EXHIBIT A5 - EVICTION NOTICE TORN-1.pdf,extracted_text\02.09.2024_EXHIBIT A5 - EVICTION NOTICE TORN-1.txt,2024-02-09,2
case,custody,CASE DOCS\02.09.2024_EXHIBIT A5 - EVICTION NOTICE TORN-1.pdf,extracted_text\02.09.2024_EXHIBIT A5 - EVICTION NOTICE TORN-1.txt,2024-02-09,4
case,property_financial,CASE DOCS\02.09.2024_EXHIBIT A5 - EVICTION NOTICE TORN-1.pdf,extracted_text\02.09.2024_EXHIBIT A5 - EVICTION NOTICE TORN-1.txt,2024-02-09,9
case,lockout_eviction,CASE DOCS\02.09.2024_EXHIBIT A5 - EVICTION NOTICE TORN-1.pdf,extracted_text\02.09.2024_EXHIBIT A5 - EVICTION NOTICE TORN-1.txt,2024-02-09,23
case,due_process,CASE DOCS\02.09.2024_MTN FOR RECONSIDERATION  TO VACATETEMPORARY ORDS-1.pdf,extracted_text\02.09.2024_MTN FOR RECONSIDERATION  TO VACATETEMPORARY ORDS-1.txt,2024-02-09,4
case,notice,CASE DOCS\02.09.2024_MTN FOR RECONSIDERATION  TO VACATETEMPORARY ORDS-1.pdf,extracted_text\02.09.2024_MTN FOR RECONSIDERATION  TO VACATETEMPORARY ORDS-1.txt,2024-02-09,16
case,hearing,CASE DOCS\02.09.2024_MTN FOR RECONSIDERATION  TO VACATETEMPORARY ORDS-1.pdf,extracted_text\02.09.2024_MTN FOR RECONSIDERATION  TO VACATETEMPORARY ORDS-1.txt,2024-02-09,24
case,jurisdiction,CASE DOCS\02.09.2024_MTN FOR RECONSIDERATION  TO VACATETEMPORARY ORDS-1.pdf,extracted_text\02.09.2024_MTN FOR RECONSIDERATION  TO VACATETEMPORARY ORDS-1.txt,2024-02-09,2
case,removal_remand,CASE DOCS\02.09.2024_MTN FOR RECONSIDERATION  TO VACATETEMPORARY ORDS-1.pdf,extracted_text\02.09.2024_MTN FOR RECONSIDERATION  TO VACATETEMPORARY ORDS-1.txt,2024-02-09,2
case,federal_court,CASE DOCS\02.09.2024_MTN FOR RECONSIDERATION  TO VACATETEMPORARY ORDS-1.pdf,extracted_text\02.09.2024_MTN FOR RECONSIDERATION  TO VACATETEMPORARY ORDS-1.txt,2024-02-09,6
case,protective_order,CASE DOCS\02.09.2024_MTN FOR RECONSIDERATION  TO VACATETEMPORARY ORDS-1.pdf,extracted_text\02.09.2024_MTN FOR RECONSIDERATION  TO VACATETEMPORARY ORDS-1.txt,2024-02-09,32
case,temporary_orders,CASE DOCS\02.09.2024_MTN FOR RECONSIDERATION  TO VACATETEMPORARY ORDS-1.pdf,extracted_text\02.09.2024_MTN FOR RECONSIDERATION  TO VACATETEMPORARY ORDS-1.txt,2024-02-09,20
case,custody,CASE DOCS\02.09.2024_MTN FOR RECONSIDERATION  TO VACATETEMPORARY ORDS-1.pdf,extracted_text\02.09.2024_MTN FOR RECONSIDERATION  TO VACATETEMPORARY ORDS-1.txt,2024-02-09,10
case,property_financial,CASE DOCS\02.09.2024_MTN FOR RECONSIDERATION  TO VACATETEMPORARY ORDS-1.pdf,extracted_text\02.09.2024_MTN FOR RECONSIDERATION  TO VACATETEMPORARY ORDS-1.txt,2024-02-09,34
case,fraud_perjury,CASE DOCS\02.09.2024_MTN FOR RECONSIDERATION  TO VACATETEMPORARY ORDS-1.pdf,extracted_text\02.09.2024_MTN FOR RECONSIDERATION  TO VACATETEMPORARY ORDS-1.txt,2024-02-09,4
case,discovery,CASE DOCS\02.09.2024_MTN FOR RECONSIDERATION  TO VACATETEMPORARY ORDS-1.pdf,extracted_text\02.09.2024_MTN FOR RECONSIDERATION  TO VACATETEMPORARY ORDS-1.txt,2024-02-09,5
case,child_support_oag,CASE DOCS\02.09.2024_MTN FOR RECONSIDERATION  TO VACATETEMPORARY ORDS-1.pdf,extracted_text\02.09.2024_MTN FOR RECONSIDERATION  TO VACATETEMPORARY ORDS-1.txt,2024-02-09,4
case,law_enforcement,CASE DOCS\02.09.2024_MTN FOR RECONSIDERATION  TO VACATETEMPORARY ORDS-1.pdf,extracted_text\02.09.2024_MTN FOR RECONSIDERATION  TO VACATETEMPORARY ORDS-1.txt,2024-02-09,6
case,lockout_eviction,CASE DOCS\02.09.2024_MTN FOR RECONSIDERATION  TO VACATETEMPORARY ORDS-1.pdf,extracted_text\02.09.2024_MTN FOR RECONSIDERATION  TO VACATETEMPORARY ORDS-1.txt,2024-02-09,32
case,notice,CASE DOCS\02.09.24 -  Exhibit A.5 EVICTION NOTICE-1.pdf,extracted_text\02.09.24 -  Exhibit A.5 EVICTION NOTICE-1.txt,2024-02-09,9
case,protective_order,CASE DOCS\02.09.24 -  Exhibit A.5 EVICTION NOTICE-1.pdf,extracted_text\02.09.24 -  Exhibit A.5 EVICTION NOTICE-1.txt,2024-02-09,1
case,custody,CASE DOCS\02.09.24 -  Exhibit A.5 EVICTION NOTICE-1.pdf,extracted_text\02.09.24 -  Exhibit A.5 EVICTION NOTICE-1.txt,2024-02-09,2
case,property_financial,CASE DOCS\02.09.24 -  Exhibit A.5 EVICTION NOTICE-1.pdf,extracted_text\02.09.24 -  Exhibit A.5 EVICTION NOTICE-1.txt,2024-02-09,6
case,lockout_eviction,CASE DOCS\02.09.24 -  Exhibit A.5 EVICTION NOTICE-1.pdf,extracted_text\02.09.24 -  Exhibit A.5 EVICTION NOTICE-1.txt,2024-02-09,10
case,due_process,CASE DOCS\02.09.24 - EMERGENCY MOTION TO RECONSIDER EVIDENCE AND VACATE TEMPORARY ORDERS-1.pdf,extracted_text\02.09.24 - EMERGENCY MOTION TO RECONSIDER EVIDENCE AND VACATE TEMPORARY ORDERS-1.txt,2024-02-09,4
case,notice,CASE DOCS\02.09.24 - EMERGENCY MOTION TO RECONSIDER EVIDENCE AND VACATE TEMPORARY ORDERS-1.pdf,extracted_text\02.09.24 - EMERGENCY MOTION TO RECONSIDER EVIDENCE AND VACATE TEMPORARY ORDERS-1.txt,2024-02-09,16
case,hearing,CASE DOCS\02.09.24 - EMERGENCY MOTION TO RECONSIDER EVIDENCE AND VACATE TEMPORARY ORDERS-1.pdf,extracted_text\02.09.24 - EMERGENCY MOTION TO RECONSIDER EVIDENCE AND VACATE TEMPORARY ORDERS-1.txt,2024-02-09,20
case,jurisdiction,CASE DOCS\02.09.24 - EMERGENCY MOTION TO RECONSIDER EVIDENCE AND VACATE TEMPORARY ORDERS-1.pdf,extracted_text\02.09.24 - EMERGENCY MOTION TO RECONSIDER EVIDENCE AND VACATE TEMPORARY ORDERS-1.txt,2024-02-09,2
case,removal_remand,CASE DOCS\02.09.24 - EMERGENCY MOTION TO RECONSIDER EVIDENCE AND VACATE TEMPORARY ORDERS-1.pdf,extracted_text\02.09.24 - EMERGENCY MOTION TO RECONSIDER EVIDENCE AND VACATE TEMPORARY ORDERS-1.txt,2024-02-09,2
case,federal_court,CASE DOCS\02.09.24 - EMERGENCY MOTION TO RECONSIDER EVIDENCE AND VACATE TEMPORARY ORDERS-1.pdf,extracted_text\02.09.24 - EMERGENCY MOTION TO RECONSIDER EVIDENCE AND VACATE TEMPORARY ORDERS-1.txt,2024-02-09,6
case,protective_order,CASE DOCS\02.09.24 - EMERGENCY MOTION TO RECONSIDER EVIDENCE AND VACATE TEMPORARY ORDERS-1.pdf,extracted_text\02.09.24 - EMERGENCY MOTION TO RECONSIDER EVIDENCE AND VACATE TEMPORARY ORDERS-1.txt,2024-02-09,31
case,temporary_orders,CASE DOCS\02.09.24 - EMERGENCY MOTION TO RECONSIDER EVIDENCE AND VACATE TEMPORARY ORDERS-1.pdf,extracted_text\02.09.24 - EMERGENCY MOTION TO RECONSIDER EVIDENCE AND VACATE TEMPORARY ORDERS-1.txt,2024-02-09,20
case,custody,CASE DOCS\02.09.24 - EMERGENCY MOTION TO RECONSIDER EVIDENCE AND VACATE TEMPORARY ORDERS-1.pdf,extracted_text\02.09.24 - EMERGENCY MOTION TO RECONSIDER EVIDENCE AND VACATE TEMPORARY ORDERS-1.txt,2024-02-09,8
case,property_financial,CASE DOCS\02.09.24 - EMERGENCY MOTION TO RECONSIDER EVIDENCE AND VACATE TEMPORARY ORDERS-1.pdf,extracted_text\02.09.24 - EMERGENCY MOTION TO RECONSIDER EVIDENCE AND VACATE TEMPORARY ORDERS-1.txt,2024-02-09,30
case,fraud_perjury,CASE DOCS\02.09.24 - EMERGENCY MOTION TO RECONSIDER EVIDENCE AND VACATE TEMPORARY ORDERS-1.pdf,extracted_text\02.09.24 - EMERGENCY MOTION TO RECONSIDER EVIDENCE AND VACATE TEMPORARY ORDERS-1.txt,2024-02-09,4
case,discovery,CASE DOCS\02.09.24 - EMERGENCY MOTION TO RECONSIDER EVIDENCE AND VACATE TEMPORARY ORDERS-1.pdf,extracted_text\02.09.24 - EMERGENCY MOTION TO RECONSIDER EVIDENCE AND VACATE TEMPORARY ORDERS-1.txt,2024-02-09,4
case,child_support_oag,CASE DOCS\02.09.24 - EMERGENCY MOTION TO RECONSIDER EVIDENCE AND VACATE TEMPORARY ORDERS-1.pdf,extracted_text\02.09.24 - EMERGENCY MOTION TO RECONSIDER EVIDENCE AND VACATE TEMPORARY ORDERS-1.txt,2024-02-09,2
case,law_enforcement,CASE DOCS\02.09.24 - EMERGENCY MOTION TO RECONSIDER EVIDENCE AND VACATE TEMPORARY ORDERS-1.pdf,extracted_text\02.09.24 - EMERGENCY MOTION TO RECONSIDER EVIDENCE AND VACATE TEMPORARY ORDERS-1.txt,2024-02-09,5
case,lockout_eviction,CASE DOCS\02.09.24 - EMERGENCY MOTION TO RECONSIDER EVIDENCE AND VACATE TEMPORARY ORDERS-1.pdf,extracted_text\02.09.24 - EMERGENCY MOTION TO RECONSIDER EVIDENCE AND VACATE TEMPORARY ORDERS-1.txt,2024-02-09,30
case,due_process,CASE DOCS\02.09.24 - EMERGENCY MOTION TO RECONSIDER-1.pdf,extracted_text\02.09.24 - EMERGENCY MOTION TO RECONSIDER-1.txt,2024-02-09,4
case,notice,CASE DOCS\02.09.24 - EMERGENCY MOTION TO RECONSIDER-1.pdf,extracted_text\02.09.24 - EMERGENCY MOTION TO RECONSIDER-1.txt,2024-02-09,16
case,hearing,CASE DOCS\02.09.24 - EMERGENCY MOTION TO RECONSIDER-1.pdf,extracted_text\02.09.24 - EMERGENCY MOTION TO RECONSIDER-1.txt,2024-02-09,24
case,jurisdiction,CASE DOCS\02.09.24 - EMERGENCY MOTION TO RECONSIDER-1.pdf,extracted_text\02.09.24 - EMERGENCY MOTION TO RECONSIDER-1.txt,2024-02-09,2
case,removal_remand,CASE DOCS\02.09.24 - EMERGENCY MOTION TO RECONSIDER-1.pdf,extracted_text\02.09.24 - EMERGENCY MOTION TO RECONSIDER-1.txt,2024-02-09,2
case,federal_court,CASE DOCS\02.09.24 - EMERGENCY MOTION TO RECONSIDER-1.pdf,extracted_text\02.09.24 - EMERGENCY MOTION TO RECONSIDER-1.txt,2024-02-09,6
case,protective_order,CASE DOCS\02.09.24 - EMERGENCY MOTION TO RECONSIDER-1.pdf,extracted_text\02.09.24 - EMERGENCY MOTION TO RECONSIDER-1.txt,2024-02-09,32
case,temporary_orders,CASE DOCS\02.09.24 - EMERGENCY MOTION TO RECONSIDER-1.pdf,extracted_text\02.09.24 - EMERGENCY MOTION TO RECONSIDER-1.txt,2024-02-09,20
case,custody,CASE DOCS\02.09.24 - EMERGENCY MOTION TO RECONSIDER-1.pdf,extracted_text\02.09.24 - EMERGENCY MOTION TO RECONSIDER-1.txt,2024-02-09,10
case,property_financial,CASE DOCS\02.09.24 - EMERGENCY MOTION TO RECONSIDER-1.pdf,extracted_text\02.09.24 - EMERGENCY MOTION TO RECONSIDER-1.txt,2024-02-09,34
case,fraud_perjury,CASE DOCS\02.09.24 - EMERGENCY MOTION TO RECONSIDER-1.pdf,extracted_text\02.09.24 - EMERGENCY MOTION TO RECONSIDER-1.txt,2024-02-09,4
case,discovery,CASE DOCS\02.09.24 - EMERGENCY MOTION TO RECONSIDER-1.pdf,extracted_text\02.09.24 - EMERGENCY MOTION TO RECONSIDER-1.txt,2024-02-09,5
case,child_support_oag,CASE DOCS\02.09.24 - EMERGENCY MOTION TO RECONSIDER-1.pdf,extracted_text\02.09.24 - EMERGENCY MOTION TO RECONSIDER-1.txt,2024-02-09,4
case,law_enforcement,CASE DOCS\02.09.24 - EMERGENCY MOTION TO RECONSIDER-1.pdf,extracted_text\02.09.24 - EMERGENCY MOTION TO RECONSIDER-1.txt,2024-02-09,6
case,lockout_eviction,CASE DOCS\02.09.24 - EMERGENCY MOTION TO RECONSIDER-1.pdf,extracted_text\02.09.24 - EMERGENCY MOTION TO RECONSIDER-1.txt,2024-02-09,30
case,notice,CASE DOCS\02.09.24 - EMERGENCY MOTION TO VACATE.pdf,extracted_text\02.09.24 - EMERGENCY MOTION TO VACATE.txt,2024-02-09,4
case,hearing,CASE DOCS\02.09.24 - EMERGENCY MOTION TO VACATE.pdf,extracted_text\02.09.24 - EMERGENCY MOTION TO VACATE.txt,2024-02-09,4
case,federal_court,CASE DOCS\02.09.24 - EMERGENCY MOTION TO VACATE.pdf,extracted_text\02.09.24 - EMERGENCY MOTION TO VACATE.txt,2024-02-09,2
case,temporary_orders,CASE DOCS\02.09.24 - EMERGENCY MOTION TO VACATE.pdf,extracted_text\02.09.24 - EMERGENCY MOTION TO VACATE.txt,2024-02-09,6
case,lockout_eviction,CASE DOCS\02.09.24 - EMERGENCY MOTION TO VACATE.pdf,extracted_text\02.09.24 - EMERGENCY MOTION TO VACATE.txt,2024-02-09,3
case,due_process,CASE DOCS\02.09.24 - EMERGENCY MOTION.pdf,extracted_text\02.09.24 - EMERGENCY MOTION.txt,2024-02-09,4
case,notice,CASE DOCS\02.09.24 - EMERGENCY MOTION.pdf,extracted_text\02.09.24 - EMERGENCY MOTION.txt,2024-02-09,16
case,hearing,CASE DOCS\02.09.24 - EMERGENCY MOTION.pdf,extracted_text\02.09.24 - EMERGENCY MOTION.txt,2024-02-09,24
case,jurisdiction,CASE DOCS\02.09.24 - EMERGENCY MOTION.pdf,extracted_text\02.09.24 - EMERGENCY MOTION.txt,2024-02-09,2
case,removal_remand,CASE DOCS\02.09.24 - EMERGENCY MOTION.pdf,extracted_text\02.09.24 - EMERGENCY MOTION.txt,2024-02-09,2
case,federal_court,CASE DOCS\02.09.24 - EMERGENCY MOTION.pdf,extracted_text\02.09.24 - EMERGENCY MOTION.txt,2024-02-09,6
case,protective_order,CASE DOCS\02.09.24 - EMERGENCY MOTION.pdf,extracted_text\02.09.24 - EMERGENCY MOTION.txt,2024-02-09,32
case,temporary_orders,CASE DOCS\02.09.24 - EMERGENCY MOTION.pdf,extracted_text\02.09.24 - EMERGENCY MOTION.txt,2024-02-09,20
case,custody,CASE DOCS\02.09.24 - EMERGENCY MOTION.pdf,extracted_text\02.09.24 - EMERGENCY MOTION.txt,2024-02-09,10
case,property_financial,CASE DOCS\02.09.24 - EMERGENCY MOTION.pdf,extracted_text\02.09.24 - EMERGENCY MOTION.txt,2024-02-09,34
case,fraud_perjury,CASE DOCS\02.09.24 - EMERGENCY MOTION.pdf,extracted_text\02.09.24 - EMERGENCY MOTION.txt,2024-02-09,4
case,discovery,CASE DOCS\02.09.24 - EMERGENCY MOTION.pdf,extracted_text\02.09.24 - EMERGENCY MOTION.txt,2024-02-09,5
case,child_support_oag,CASE DOCS\02.09.24 - EMERGENCY MOTION.pdf,extracted_text\02.09.24 - EMERGENCY MOTION.txt,2024-02-09,4
case,law_enforcement,CASE DOCS\02.09.24 - EMERGENCY MOTION.pdf,extracted_text\02.09.24 - EMERGENCY MOTION.txt,2024-02-09,6
case,lockout_eviction,CASE DOCS\02.09.24 - EMERGENCY MOTION.pdf,extracted_text\02.09.24 - EMERGENCY MOTION.txt,2024-02-09,30
case,property_financial,CASE DOCS\02.09.24 - Exhibit A.2 Text to Papaw-1.pdf,extracted_text\02.09.24 - Exhibit A.2 Text to Papaw-1.txt,2024-02-09,2
case,property_financial,CASE DOCS\02.09.24 - Exhibit A.3 Financial Transaction-1.pdf,extracted_text\02.09.24 - Exhibit A.3 Financial Transaction-1.txt,2024-02-09,2
case,property_financial,CASE DOCS\02.09.24 - Exhibit A.4 BANK OVERDRAFT AND BUSINESS ADS-1.pdf,extracted_text\02.09.24 - Exhibit A.4 BANK OVERDRAFT AND BUSINESS ADS-1.txt,2024-02-09,2
case,property_financial,CASE DOCS\02.09.24 - Exhibit A.4 Overdrawn Account-1.pdf,extracted_text\02.09.24 - Exhibit A.4 Overdrawn Account-1.txt,2024-02-09,2
case,notice,CASE DOCS\02.09.24 - Exhibit B.1 ORIGINAL PETITION FOR DIVORCE-1.pdf,extracted_text\02.09.24 - Exhibit B.1 ORIGINAL PETITION FOR DIVORCE-1.txt,2024-02-09,5
case,jurisdiction,CASE DOCS\02.09.24 - Exhibit B.1 ORIGINAL PETITION FOR DIVORCE-1.pdf,extracted_text\02.09.24 - Exhibit B.1 ORIGINAL PETITION FOR DIVORCE-1.txt,2024-02-09,4
case,federal_court,CASE DOCS\02.09.24 - Exhibit B.1 ORIGINAL PETITION FOR DIVORCE-1.pdf,extracted_text\02.09.24 - Exhibit B.1 ORIGINAL PETITION FOR DIVORCE-1.txt,2024-02-09,3
case,protective_order,CASE DOCS\02.09.24 - Exhibit B.1 ORIGINAL PETITION FOR DIVORCE-1.pdf,extracted_text\02.09.24 - Exhibit B.1 ORIGINAL PETITION FOR DIVORCE-1.txt,2024-02-09,25
case,custody,CASE DOCS\02.09.24 - Exhibit B.1 ORIGINAL PETITION FOR DIVORCE-1.pdf,extracted_text\02.09.24 - Exhibit B.1 ORIGINAL PETITION FOR DIVORCE-1.txt,2024-02-09,23
case,property_financial,CASE DOCS\02.09.24 - Exhibit B.1 ORIGINAL PETITION FOR DIVORCE-1.pdf,extracted_text\02.09.24 - Exhibit B.1 ORIGINAL PETITION FOR DIVORCE-1.txt,2024-02-09,36
case,discovery,CASE DOCS\02.09.24 - Exhibit B.1 ORIGINAL PETITION FOR DIVORCE-1.pdf,extracted_text\02.09.24 - Exhibit B.1 ORIGINAL PETITION FOR DIVORCE-1.txt,2024-02-09,2
case,child_support_oag,CASE DOCS\02.09.24 - Exhibit B.1 ORIGINAL PETITION FOR DIVORCE-1.pdf,extracted_text\02.09.24 - Exhibit B.1 ORIGINAL PETITION FOR DIVORCE-1.txt,2024-02-09,4
case,law_enforcement,CASE DOCS\02.09.24 - Exhibit B.1 ORIGINAL PETITION FOR DIVORCE-1.pdf,extracted_text\02.09.24 - Exhibit B.1 ORIGINAL PETITION FOR DIVORCE-1.txt,2024-02-09,2
case,hearing,CASE DOCS\02.09.24 - Exhibit B.2 Dismissed Eviction-1.pdf,extracted_text\02.09.24 - Exhibit B.2 Dismissed Eviction-1.txt,2024-02-09,2
case,appeal,CASE DOCS\02.09.24 - Exhibit B.2 Dismissed Eviction-1.pdf,extracted_text\02.09.24 - Exhibit B.2 Dismissed Eviction-1.txt,2024-02-09,2
case,jurisdiction,CASE DOCS\02.09.24 - Exhibit B.2 Dismissed Eviction-1.pdf,extracted_text\02.09.24 - Exhibit B.2 Dismissed Eviction-1.txt,2024-02-09,6
case,lockout_eviction,CASE DOCS\02.09.24 - Exhibit B.2 Dismissed Eviction-1.pdf,extracted_text\02.09.24 - Exhibit B.2 Dismissed Eviction-1.txt,2024-02-09,2
case,notice,CASE DOCS\02.09.24 - Exhibit C.1 DEFENDANT'S ORIGINAL ANSWER-1.pdf,extracted_text\02.09.24 - Exhibit C.1 DEFENDANT'S ORIGINAL ANSWER-1.txt,2024-02-09,12
case,hearing,CASE DOCS\02.09.24 - Exhibit C.1 DEFENDANT'S ORIGINAL ANSWER-1.pdf,extracted_text\02.09.24 - Exhibit C.1 DEFENDANT'S ORIGINAL ANSWER-1.txt,2024-02-09,14
case,federal_court,CASE DOCS\02.09.24 - Exhibit C.1 DEFENDANT'S ORIGINAL ANSWER-1.pdf,extracted_text\02.09.24 - Exhibit C.1 DEFENDANT'S ORIGINAL ANSWER-1.txt,2024-02-09,7
case,protective_order,CASE DOCS\02.09.24 - Exhibit C.1 DEFENDANT'S ORIGINAL ANSWER-1.pdf,extracted_text\02.09.24 - Exhibit C.1 DEFENDANT'S ORIGINAL ANSWER-1.txt,2024-02-09,23
case,custody,CASE DOCS\02.09.24 - Exhibit C.1 DEFENDANT'S ORIGINAL ANSWER-1.pdf,extracted_text\02.09.24 - Exhibit C.1 DEFENDANT'S ORIGINAL ANSWER-1.txt,2024-02-09,2
case,property_financial,CASE DOCS\02.09.24 - Exhibit C.1 DEFENDANT'S ORIGINAL ANSWER-1.pdf,extracted_text\02.09.24 - Exhibit C.1 DEFENDANT'S ORIGINAL ANSWER-1.txt,2024-02-09,2
case,fraud_perjury,CASE DOCS\02.09.24 - Exhibit C.1 DEFENDANT'S ORIGINAL ANSWER-1.pdf,extracted_text\02.09.24 - Exhibit C.1 DEFENDANT'S ORIGINAL ANSWER-1.txt,2024-02-09,13
case,discovery,CASE DOCS\02.09.24 - Exhibit C.1 DEFENDANT'S ORIGINAL ANSWER-1.pdf,extracted_text\02.09.24 - Exhibit C.1 DEFENDANT'S ORIGINAL ANSWER-1.txt,2024-02-09,1
case,sanctions_contempt,CASE DOCS\02.09.24 - Exhibit C.1 DEFENDANT'S ORIGINAL ANSWER-1.pdf,extracted_text\02.09.24 - Exhibit C.1 DEFENDANT'S ORIGINAL ANSWER-1.txt,2024-02-09,1
case,lockout_eviction,CASE DOCS\02.09.24 - Exhibit C.1 DEFENDANT'S ORIGINAL ANSWER-1.pdf,extracted_text\02.09.24 - Exhibit C.1 DEFENDANT'S ORIGINAL ANSWER-1.txt,2024-02-09,10
case,federal_court,CASE DOCS\02.09.24 - EXHIBIT D - PROPOSED PARENTING PLAN-1.pdf,extracted_text\02.09.24 - EXHIBIT D - PROPOSED PARENTING PLAN-1.txt,2024-02-09,1
case,custody,CASE DOCS\02.09.24 - EXHIBIT D - PROPOSED PARENTING PLAN-1.pdf,extracted_text\02.09.24 - EXHIBIT D - PROPOSED PARENTING PLAN-1.txt,2024-02-09,6
case,property_financial,CASE DOCS\02.09.24 - EXHIBIT D - PROPOSED PARENTING PLAN-1.pdf,extracted_text\02.09.24 - EXHIBIT D - PROPOSED PARENTING PLAN-1.txt,2024-02-09,1
case,jurisdiction,CASE DOCS\02.09.25 - Exhibit A.1 TEXTS AND VIZUALIZATIONS-1.pdf,extracted_text\02.09.25 - Exhibit A.1 TEXTS AND VIZUALIZATIONS-1.txt,2025-02-09,18
case,removal_remand,CASE DOCS\02.09.25 - Exhibit A.1 TEXTS AND VIZUALIZATIONS-1.pdf,extracted_text\02.09.25 - Exhibit A.1 TEXTS AND VIZUALIZATIONS-1.txt,2025-02-09,22
case,civil_rights_1983,CASE DOCS\02.09.25 - Exhibit A.1 TEXTS AND VIZUALIZATIONS-1.pdf,extracted_text\02.09.25 - Exhibit A.1 TEXTS AND VIZUALIZATIONS-1.txt,2025-02-09,16
case,property_financial,CASE DOCS\02.09.25 - Exhibit A.2 TEXT TO PAPAW-1.pdf,extracted_text\02.09.25 - Exhibit A.2 TEXT TO PAPAW-1.txt,2025-02-09,2
case,hearing,CASE DOCS\02.09.25 - Exhibit B.2 EVICTION DISMISSAL-1.pdf,extracted_text\02.09.25 - Exhibit B.2 EVICTION DISMISSAL-1.txt,2025-02-09,2
case,appeal,CASE DOCS\02.09.25 - Exhibit B.2 EVICTION DISMISSAL-1.pdf,extracted_text\02.09.25 - Exhibit B.2 EVICTION DISMISSAL-1.txt,2025-02-09,2
case,jurisdiction,CASE DOCS\02.09.25 - Exhibit B.2 EVICTION DISMISSAL-1.pdf,extracted_text\02.09.25 - Exhibit B.2 EVICTION DISMISSAL-1.txt,2025-02-09,6
case,federal_court,CASE DOCS\02.09.25 - Exhibit B.3 MUNFORD ILLEGAL ORDER-1.pdf,extracted_text\02.09.25 - Exhibit B.3 MUNFORD ILLEGAL ORDER-1.txt,2025-02-09,4
case,custody,CASE DOCS\02.09.25 - Exhibit B.3 MUNFORD ILLEGAL ORDER-1.pdf,extracted_text\02.09.25 - Exhibit B.3 MUNFORD ILLEGAL ORDER-1.txt,2025-02-09,1
case,child_support_oag,CASE DOCS\02.09.25 - Exhibit B.3 MUNFORD ILLEGAL ORDER-1.pdf,extracted_text\02.09.25 - Exhibit B.3 MUNFORD ILLEGAL ORDER-1.txt,2025-02-09,2
case,due_process,CASE DOCS\02.10.25 - EMERGENCY EX-PARTE ORDER-1.pdf,extracted_text\02.10.25 - EMERGENCY EX-PARTE ORDER-1.txt,2025-02-10,4
case,notice,CASE DOCS\02.10.25 - EMERGENCY EX-PARTE ORDER-1.pdf,extracted_text\02.10.25 - EMERGENCY EX-PARTE ORDER-1.txt,2025-02-10,158
case,hearing,CASE DOCS\02.10.25 - EMERGENCY EX-PARTE ORDER-1.pdf,extracted_text\02.10.25 - EMERGENCY EX-PARTE ORDER-1.txt,2025-02-10,27
case,recusal,CASE DOCS\02.10.25 - EMERGENCY EX-PARTE ORDER-1.pdf,extracted_text\02.10.25 - EMERGENCY EX-PARTE ORDER-1.txt,2025-02-10,11
case,associate_judge,CASE DOCS\02.10.25 - EMERGENCY EX-PARTE ORDER-1.pdf,extracted_text\02.10.25 - EMERGENCY EX-PARTE ORDER-1.txt,2025-02-10,13
case,mandamus,CASE DOCS\02.10.25 - EMERGENCY EX-PARTE ORDER-1.pdf,extracted_text\02.10.25 - EMERGENCY EX-PARTE ORDER-1.txt,2025-02-10,4
case,appeal,CASE DOCS\02.10.25 - EMERGENCY EX-PARTE ORDER-1.pdf,extracted_text\02.10.25 - EMERGENCY EX-PARTE ORDER-1.txt,2025-02-10,37
case,jurisdiction,CASE DOCS\02.10.25 - EMERGENCY EX-PARTE ORDER-1.pdf,extracted_text\02.10.25 - EMERGENCY EX-PARTE ORDER-1.txt,2025-02-10,14
case,removal_remand,CASE DOCS\02.10.25 - EMERGENCY EX-PARTE ORDER-1.pdf,extracted_text\02.10.25 - EMERGENCY EX-PARTE ORDER-1.txt,2025-02-10,4
case,federal_court,CASE DOCS\02.10.25 - EMERGENCY EX-PARTE ORDER-1.pdf,extracted_text\02.10.25 - EMERGENCY EX-PARTE ORDER-1.txt,2025-02-10,47
case,protective_order,CASE DOCS\02.10.25 - EMERGENCY EX-PARTE ORDER-1.pdf,extracted_text\02.10.25 - EMERGENCY EX-PARTE ORDER-1.txt,2025-02-10,107
case,temporary_orders,CASE DOCS\02.10.25 - EMERGENCY EX-PARTE ORDER-1.pdf,extracted_text\02.10.25 - EMERGENCY EX-PARTE ORDER-1.txt,2025-02-10,40
case,custody,CASE DOCS\02.10.25 - EMERGENCY EX-PARTE ORDER-1.pdf,extracted_text\02.10.25 - EMERGENCY EX-PARTE ORDER-1.txt,2025-02-10,553
case,property_financial,CASE DOCS\02.10.25 - EMERGENCY EX-PARTE ORDER-1.pdf,extracted_text\02.10.25 - EMERGENCY EX-PARTE ORDER-1.txt,2025-02-10,359
case,fraud_perjury,CASE DOCS\02.10.25 - EMERGENCY EX-PARTE ORDER-1.pdf,extracted_text\02.10.25 - EMERGENCY EX-PARTE ORDER-1.txt,2025-02-10,17
case,discovery,CASE DOCS\02.10.25 - EMERGENCY EX-PARTE ORDER-1.pdf,extracted_text\02.10.25 - EMERGENCY EX-PARTE ORDER-1.txt,2025-02-10,8
case,sanctions_contempt,CASE DOCS\02.10.25 - EMERGENCY EX-PARTE ORDER-1.pdf,extracted_text\02.10.25 - EMERGENCY EX-PARTE ORDER-1.txt,2025-02-10,36
case,injunction,CASE DOCS\02.10.25 - EMERGENCY EX-PARTE ORDER-1.pdf,extracted_text\02.10.25 - EMERGENCY EX-PARTE ORDER-1.txt,2025-02-10,20
case,child_support_oag,CASE DOCS\02.10.25 - EMERGENCY EX-PARTE ORDER-1.pdf,extracted_text\02.10.25 - EMERGENCY EX-PARTE ORDER-1.txt,2025-02-10,58
case,law_enforcement,CASE DOCS\02.10.25 - EMERGENCY EX-PARTE ORDER-1.pdf,extracted_text\02.10.25 - EMERGENCY EX-PARTE ORDER-1.txt,2025-02-10,30
case,ex_parte,CASE DOCS\02.10.25 - EMERGENCY EX-PARTE ORDER-1.pdf,extracted_text\02.10.25 - EMERGENCY EX-PARTE ORDER-1.txt,2025-02-10,10
case,lockout_eviction,CASE DOCS\02.10.25 - EMERGENCY EX-PARTE ORDER-1.pdf,extracted_text\02.10.25 - EMERGENCY EX-PARTE ORDER-1.txt,2025-02-10,18
case,notice,CASE DOCS\02.12.24 - ORDER FOR WD OF ATTORNEY-1.pdf,extracted_text\02.12.24 - ORDER FOR WD OF ATTORNEY-1.txt,2024-02-12,4
case,federal_court,CASE DOCS\02.12.24 - ORDER FOR WD OF ATTORNEY-1.pdf,extracted_text\02.12.24 - ORDER FOR WD OF ATTORNEY-1.txt,2024-02-12,2
case,due_process,CASE DOCS\02.12.24 - Order of Withdraw (BACALIS)-1.pdf,extracted_text\02.12.24 - Order of Withdraw (BACALIS)-1.txt,2024-02-12,2
case,notice,CASE DOCS\02.12.24 - Order of Withdraw (BACALIS)-1.pdf,extracted_text\02.12.24 - Order of Withdraw (BACALIS)-1.txt,2024-02-12,10
case,hearing,CASE DOCS\02.12.24 - Order of Withdraw (BACALIS)-1.pdf,extracted_text\02.12.24 - Order of Withdraw (BACALIS)-1.txt,2024-02-12,12
case,federal_court,CASE DOCS\02.12.24 - Order of Withdraw (BACALIS)-1.pdf,extracted_text\02.12.24 - Order of Withdraw (BACALIS)-1.txt,2024-02-12,6
case,protective_order,CASE DOCS\02.12.24 - Order of Withdraw (BACALIS)-1.pdf,extracted_text\02.12.24 - Order of Withdraw (BACALIS)-1.txt,2024-02-12,10
case,temporary_orders,CASE DOCS\02.12.24 - Order of Withdraw (BACALIS)-1.pdf,extracted_text\02.12.24 - Order of Withdraw (BACALIS)-1.txt,2024-02-12,24
case,custody,CASE DOCS\02.12.24 - Order of Withdraw (BACALIS)-1.pdf,extracted_text\02.12.24 - Order of Withdraw (BACALIS)-1.txt,2024-02-12,16
case,property_financial,CASE DOCS\02.12.24 - Order of Withdraw (BACALIS)-1.pdf,extracted_text\02.12.24 - Order of Withdraw (BACALIS)-1.txt,2024-02-12,12
case,fraud_perjury,CASE DOCS\02.12.24 - Order of Withdraw (BACALIS)-1.pdf,extracted_text\02.12.24 - Order of Withdraw (BACALIS)-1.txt,2024-02-12,6
case,discovery,CASE DOCS\02.12.24 - Order of Withdraw (BACALIS)-1.pdf,extracted_text\02.12.24 - Order of Withdraw (BACALIS)-1.txt,2024-02-12,2
case,injunction,CASE DOCS\02.12.24 - Order of Withdraw (BACALIS)-1.pdf,extracted_text\02.12.24 - Order of Withdraw (BACALIS)-1.txt,2024-02-12,2
case,lockout_eviction,CASE DOCS\02.12.24 - Order of Withdraw (BACALIS)-1.pdf,extracted_text\02.12.24 - Order of Withdraw (BACALIS)-1.txt,2024-02-12,2
case,notice,CASE DOCS\02.13.24 - Correspondence Cooper Carter-1.pdf,extracted_text\02.13.24 - Correspondence Cooper Carter-1.txt,2024-02-13,2
case,hearing,CASE DOCS\02.13.24 - Correspondence Cooper Carter-1.pdf,extracted_text\02.13.24 - Correspondence Cooper Carter-1.txt,2024-02-13,8
case,temporary_orders,CASE DOCS\02.13.24 - Correspondence Cooper Carter-1.pdf,extracted_text\02.13.24 - Correspondence Cooper Carter-1.txt,2024-02-13,4
case,lockout_eviction,CASE DOCS\02.13.24 - Correspondence Cooper Carter-1.pdf,extracted_text\02.13.24 - Correspondence Cooper Carter-1.txt,2024-02-13,2
case,hearing,CASE DOCS\02.14.24 - First COOPER COMMUNICATIONS-1.pdf,extracted_text\02.14.24 - First COOPER COMMUNICATIONS-1.txt,2024-02-14,4
case,temporary_orders,CASE DOCS\02.14.24 - First COOPER COMMUNICATIONS-1.pdf,extracted_text\02.14.24 - First COOPER COMMUNICATIONS-1.txt,2024-02-14,2
case,lockout_eviction,CASE DOCS\02.14.24 - First COOPER COMMUNICATIONS-1.pdf,extracted_text\02.14.24 - First COOPER COMMUNICATIONS-1.txt,2024-02-14,1
case,due_process,CASE DOCS\02.14.24 - RESPONDENT'S ANSWER TO PETITIONERS DIVORCE PETITION-1.pdf,extracted_text\02.14.24 - RESPONDENT'S ANSWER TO PETITIONERS DIVORCE PETITION-1.txt,2024-02-14,2
case,notice,CASE DOCS\02.14.24 - RESPONDENT'S ANSWER TO PETITIONERS DIVORCE PETITION-1.pdf,extracted_text\02.14.24 - RESPONDENT'S ANSWER TO PETITIONERS DIVORCE PETITION-1.txt,2024-02-14,2
case,hearing,CASE DOCS\02.14.24 - RESPONDENT'S ANSWER TO PETITIONERS DIVORCE PETITION-1.pdf,extracted_text\02.14.24 - RESPONDENT'S ANSWER TO PETITIONERS DIVORCE PETITION-1.txt,2024-02-14,8
case,federal_court,CASE DOCS\02.14.24 - RESPONDENT'S ANSWER TO PETITIONERS DIVORCE PETITION-1.pdf,extracted_text\02.14.24 - RESPONDENT'S ANSWER TO PETITIONERS DIVORCE PETITION-1.txt,2024-02-14,2
case,protective_order,CASE DOCS\02.14.24 - RESPONDENT'S ANSWER TO PETITIONERS DIVORCE PETITION-1.pdf,extracted_text\02.14.24 - RESPONDENT'S ANSWER TO PETITIONERS DIVORCE PETITION-1.txt,2024-02-14,10
case,temporary_orders,CASE DOCS\02.14.24 - RESPONDENT'S ANSWER TO PETITIONERS DIVORCE PETITION-1.pdf,extracted_text\02.14.24 - RESPONDENT'S ANSWER TO PETITIONERS DIVORCE PETITION-1.txt,2024-02-14,24
case,custody,CASE DOCS\02.14.24 - RESPONDENT'S ANSWER TO PETITIONERS DIVORCE PETITION-1.pdf,extracted_text\02.14.24 - RESPONDENT'S ANSWER TO PETITIONERS DIVORCE PETITION-1.txt,2024-02-14,16
case,property_financial,CASE DOCS\02.14.24 - RESPONDENT'S ANSWER TO PETITIONERS DIVORCE PETITION-1.pdf,extracted_text\02.14.24 - RESPONDENT'S ANSWER TO PETITIONERS DIVORCE PETITION-1.txt,2024-02-14,12
case,fraud_perjury,CASE DOCS\02.14.24 - RESPONDENT'S ANSWER TO PETITIONERS DIVORCE PETITION-1.pdf,extracted_text\02.14.24 - RESPONDENT'S ANSWER TO PETITIONERS DIVORCE PETITION-1.txt,2024-02-14,6
case,discovery,CASE DOCS\02.14.24 - RESPONDENT'S ANSWER TO PETITIONERS DIVORCE PETITION-1.pdf,extracted_text\02.14.24 - RESPONDENT'S ANSWER TO PETITIONERS DIVORCE PETITION-1.txt,2024-02-14,2
case,injunction,CASE DOCS\02.14.24 - RESPONDENT'S ANSWER TO PETITIONERS DIVORCE PETITION-1.pdf,extracted_text\02.14.24 - RESPONDENT'S ANSWER TO PETITIONERS DIVORCE PETITION-1.txt,2024-02-14,2
case,lockout_eviction,CASE DOCS\02.14.24 - RESPONDENT'S ANSWER TO PETITIONERS DIVORCE PETITION-1.pdf,extracted_text\02.14.24 - RESPONDENT'S ANSWER TO PETITIONERS DIVORCE PETITION-1.txt,2024-02-14,2
case,notice,CASE DOCS\02.20.25 - MOTION TO SIGN-1-1.pdf,extracted_text\02.20.25 - MOTION TO SIGN-1-1.txt,2025-02-20,14
case,hearing,CASE DOCS\02.20.25 - MOTION TO SIGN-1-1.pdf,extracted_text\02.20.25 - MOTION TO SIGN-1-1.txt,2025-02-20,10
case,recusal,CASE DOCS\02.20.25 - MOTION TO SIGN-1-1.pdf,extracted_text\02.20.25 - MOTION TO SIGN-1-1.txt,2025-02-20,3
case,associate_judge,CASE DOCS\02.20.25 - MOTION TO SIGN-1-1.pdf,extracted_text\02.20.25 - MOTION TO SIGN-1-1.txt,2025-02-20,4
case,jurisdiction,CASE DOCS\02.20.25 - MOTION TO SIGN-1-1.pdf,extracted_text\02.20.25 - MOTION TO SIGN-1-1.txt,2025-02-20,2
case,removal_remand,CASE DOCS\02.20.25 - MOTION TO SIGN-1-1.pdf,extracted_text\02.20.25 - MOTION TO SIGN-1-1.txt,2025-02-20,18
case,federal_court,CASE DOCS\02.20.25 - MOTION TO SIGN-1-1.pdf,extracted_text\02.20.25 - MOTION TO SIGN-1-1.txt,2025-02-20,8
case,protective_order,CASE DOCS\02.20.25 - MOTION TO SIGN-1-1.pdf,extracted_text\02.20.25 - MOTION TO SIGN-1-1.txt,2025-02-20,2
case,temporary_orders,CASE DOCS\02.20.25 - MOTION TO SIGN-1-1.pdf,extracted_text\02.20.25 - MOTION TO SIGN-1-1.txt,2025-02-20,40
case,custody,CASE DOCS\02.20.25 - MOTION TO SIGN-1-1.pdf,extracted_text\02.20.25 - MOTION TO SIGN-1-1.txt,2025-02-20,12
case,property_financial,CASE DOCS\02.20.25 - MOTION TO SIGN-1-1.pdf,extracted_text\02.20.25 - MOTION TO SIGN-1-1.txt,2025-02-20,106
case,fraud_perjury,CASE DOCS\02.20.25 - MOTION TO SIGN-1-1.pdf,extracted_text\02.20.25 - MOTION TO SIGN-1-1.txt,2025-02-20,24
case,discovery,CASE DOCS\02.20.25 - MOTION TO SIGN-1-1.pdf,extracted_text\02.20.25 - MOTION TO SIGN-1-1.txt,2025-02-20,26
case,sanctions_contempt,CASE DOCS\02.20.25 - MOTION TO SIGN-1-1.pdf,extracted_text\02.20.25 - MOTION TO SIGN-1-1.txt,2025-02-20,14
case,injunction,CASE DOCS\02.20.25 - MOTION TO SIGN-1-1.pdf,extracted_text\02.20.25 - MOTION TO SIGN-1-1.txt,2025-02-20,24
case,child_support_oag,CASE DOCS\02.20.25 - MOTION TO SIGN-1-1.pdf,extracted_text\02.20.25 - MOTION TO SIGN-1-1.txt,2025-02-20,2
case,lockout_eviction,CASE DOCS\02.20.25 - MOTION TO SIGN-1-1.pdf,extracted_text\02.20.25 - MOTION TO SIGN-1-1.txt,2025-02-20,10
case,notice,CASE DOCS\02.20.25 - MOTION TO SIGN-1.pdf,extracted_text\02.20.25 - MOTION TO SIGN-1.txt,2025-02-20,14
case,hearing,CASE DOCS\02.20.25 - MOTION TO SIGN-1.pdf,extracted_text\02.20.25 - MOTION TO SIGN-1.txt,2025-02-20,10
case,recusal,CASE DOCS\02.20.25 - MOTION TO SIGN-1.pdf,extracted_text\02.20.25 - MOTION TO SIGN-1.txt,2025-02-20,3
case,associate_judge,CASE DOCS\02.20.25 - MOTION TO SIGN-1.pdf,extracted_text\02.20.25 - MOTION TO SIGN-1.txt,2025-02-20,4
case,jurisdiction,CASE DOCS\02.20.25 - MOTION TO SIGN-1.pdf,extracted_text\02.20.25 - MOTION TO SIGN-1.txt,2025-02-20,2
case,removal_remand,CASE DOCS\02.20.25 - MOTION TO SIGN-1.pdf,extracted_text\02.20.25 - MOTION TO SIGN-1.txt,2025-02-20,18
case,federal_court,CASE DOCS\02.20.25 - MOTION TO SIGN-1.pdf,extracted_text\02.20.25 - MOTION TO SIGN-1.txt,2025-02-20,8
case,protective_order,CASE DOCS\02.20.25 - MOTION TO SIGN-1.pdf,extracted_text\02.20.25 - MOTION TO SIGN-1.txt,2025-02-20,2
case,temporary_orders,CASE DOCS\02.20.25 - MOTION TO SIGN-1.pdf,extracted_text\02.20.25 - MOTION TO SIGN-1.txt,2025-02-20,40
case,custody,CASE DOCS\02.20.25 - MOTION TO SIGN-1.pdf,extracted_text\02.20.25 - MOTION TO SIGN-1.txt,2025-02-20,12
case,property_financial,CASE DOCS\02.20.25 - MOTION TO SIGN-1.pdf,extracted_text\02.20.25 - MOTION TO SIGN-1.txt,2025-02-20,106
case,fraud_perjury,CASE DOCS\02.20.25 - MOTION TO SIGN-1.pdf,extracted_text\02.20.25 - MOTION TO SIGN-1.txt,2025-02-20,24
case,discovery,CASE DOCS\02.20.25 - MOTION TO SIGN-1.pdf,extracted_text\02.20.25 - MOTION TO SIGN-1.txt,2025-02-20,26
case,sanctions_contempt,CASE DOCS\02.20.25 - MOTION TO SIGN-1.pdf,extracted_text\02.20.25 - MOTION TO SIGN-1.txt,2025-02-20,14
case,injunction,CASE DOCS\02.20.25 - MOTION TO SIGN-1.pdf,extracted_text\02.20.25 - MOTION TO SIGN-1.txt,2025-02-20,24
case,child_support_oag,CASE DOCS\02.20.25 - MOTION TO SIGN-1.pdf,extracted_text\02.20.25 - MOTION TO SIGN-1.txt,2025-02-20,2
case,lockout_eviction,CASE DOCS\02.20.25 - MOTION TO SIGN-1.pdf,extracted_text\02.20.25 - MOTION TO SIGN-1.txt,2025-02-20,10
case,notice,CASE DOCS\02.22.2024_PROP ORDER ON MOTION FOR PRETRIAL SUMMARYJUDGMENT-1.pdf,extracted_text\02.22.2024_PROP ORDER ON MOTION FOR PRETRIAL SUMMARYJUDGMENT-1.txt,2024-02-22,2
case,federal_court,CASE DOCS\02.22.2024_PROP ORDER ON MOTION FOR PRETRIAL SUMMARYJUDGMENT-1.pdf,extracted_text\02.22.2024_PROP ORDER ON MOTION FOR PRETRIAL SUMMARYJUDGMENT-1.txt,2024-02-22,2
case,due_process,CASE DOCS\02.22.24 - Partial Summary Judgment-1.pdf,extracted_text\02.22.24 - Partial Summary Judgment-1.txt,2024-02-22,14
case,notice,CASE DOCS\02.22.24 - Partial Summary Judgment-1.pdf,extracted_text\02.22.24 - Partial Summary Judgment-1.txt,2024-02-22,8
case,hearing,CASE DOCS\02.22.24 - Partial Summary Judgment-1.pdf,extracted_text\02.22.24 - Partial Summary Judgment-1.txt,2024-02-22,20
case,removal_remand,CASE DOCS\02.22.24 - Partial Summary Judgment-1.pdf,extracted_text\02.22.24 - Partial Summary Judgment-1.txt,2024-02-22,2
case,federal_court,CASE DOCS\02.22.24 - Partial Summary Judgment-1.pdf,extracted_text\02.22.24 - Partial Summary Judgment-1.txt,2024-02-22,10
case,protective_order,CASE DOCS\02.22.24 - Partial Summary Judgment-1.pdf,extracted_text\02.22.24 - Partial Summary Judgment-1.txt,2024-02-22,36
case,temporary_orders,CASE DOCS\02.22.24 - Partial Summary Judgment-1.pdf,extracted_text\02.22.24 - Partial Summary Judgment-1.txt,2024-02-22,40
case,custody,CASE DOCS\02.22.24 - Partial Summary Judgment-1.pdf,extracted_text\02.22.24 - Partial Summary Judgment-1.txt,2024-02-22,42
case,property_financial,CASE DOCS\02.22.24 - Partial Summary Judgment-1.pdf,extracted_text\02.22.24 - Partial Summary Judgment-1.txt,2024-02-22,34
case,fraud_perjury,CASE DOCS\02.22.24 - Partial Summary Judgment-1.pdf,extracted_text\02.22.24 - Partial Summary Judgment-1.txt,2024-02-22,8
case,discovery,CASE DOCS\02.22.24 - Partial Summary Judgment-1.pdf,extracted_text\02.22.24 - Partial Summary Judgment-1.txt,2024-02-22,6
case,sanctions_contempt,CASE DOCS\02.22.24 - Partial Summary Judgment-1.pdf,extracted_text\02.22.24 - Partial Summary Judgment-1.txt,2024-02-22,2
case,law_enforcement,CASE DOCS\02.22.24 - Partial Summary Judgment-1.pdf,extracted_text\02.22.24 - Partial Summary Judgment-1.txt,2024-02-22,8
case,lockout_eviction,CASE DOCS\02.22.24 - Partial Summary Judgment-1.pdf,extracted_text\02.22.24 - Partial Summary Judgment-1.txt,2024-02-22,10
case,notice,CASE DOCS\02.22.24 - PROPOSED ORDER ON MOTION FOR SUMMARY JUDGMENT-1.pdf,extracted_text\02.22.24 - PROPOSED ORDER ON MOTION FOR SUMMARY JUDGMENT-1.txt,2024-02-22,2
case,federal_court,CASE DOCS\02.22.24 - PROPOSED ORDER ON MOTION FOR SUMMARY JUDGMENT-1.pdf,extracted_text\02.22.24 - PROPOSED ORDER ON MOTION FOR SUMMARY JUDGMENT-1.txt,2024-02-22,2
case,notice,CASE DOCS\02.22.24 - SUMM JUDGEMENT NOTICE OF HEARING-1.pdf,extracted_text\02.22.24 - SUMM JUDGEMENT NOTICE OF HEARING-1.txt,2024-02-22,4
case,hearing,CASE DOCS\02.22.24 - SUMM JUDGEMENT NOTICE OF HEARING-1.pdf,extracted_text\02.22.24 - SUMM JUDGEMENT NOTICE OF HEARING-1.txt,2024-02-22,4
case,federal_court,CASE DOCS\02.22.24 - SUMM JUDGEMENT NOTICE OF HEARING-1.pdf,extracted_text\02.22.24 - SUMM JUDGEMENT NOTICE OF HEARING-1.txt,2024-02-22,2
case,due_process,CASE DOCS\02.22.24 - SUMMARY JUDGMENT BRIEF-1.pdf,extracted_text\02.22.24 - SUMMARY JUDGMENT BRIEF-1.txt,2024-02-22,14
case,notice,CASE DOCS\02.22.24 - SUMMARY JUDGMENT BRIEF-1.pdf,extracted_text\02.22.24 - SUMMARY JUDGMENT BRIEF-1.txt,2024-02-22,8
case,hearing,CASE DOCS\02.22.24 - SUMMARY JUDGMENT BRIEF-1.pdf,extracted_text\02.22.24 - SUMMARY JUDGMENT BRIEF-1.txt,2024-02-22,20
case,removal_remand,CASE DOCS\02.22.24 - SUMMARY JUDGMENT BRIEF-1.pdf,extracted_text\02.22.24 - SUMMARY JUDGMENT BRIEF-1.txt,2024-02-22,2
case,federal_court,CASE DOCS\02.22.24 - SUMMARY JUDGMENT BRIEF-1.pdf,extracted_text\02.22.24 - SUMMARY JUDGMENT BRIEF-1.txt,2024-02-22,10
case,protective_order,CASE DOCS\02.22.24 - SUMMARY JUDGMENT BRIEF-1.pdf,extracted_text\02.22.24 - SUMMARY JUDGMENT BRIEF-1.txt,2024-02-22,36
case,temporary_orders,CASE DOCS\02.22.24 - SUMMARY JUDGMENT BRIEF-1.pdf,extracted_text\02.22.24 - SUMMARY JUDGMENT BRIEF-1.txt,2024-02-22,40
case,custody,CASE DOCS\02.22.24 - SUMMARY JUDGMENT BRIEF-1.pdf,extracted_text\02.22.24 - SUMMARY JUDGMENT BRIEF-1.txt,2024-02-22,42
case,property_financial,CASE DOCS\02.22.24 - SUMMARY JUDGMENT BRIEF-1.pdf,extracted_text\02.22.24 - SUMMARY JUDGMENT BRIEF-1.txt,2024-02-22,34
case,fraud_perjury,CASE DOCS\02.22.24 - SUMMARY JUDGMENT BRIEF-1.pdf,extracted_text\02.22.24 - SUMMARY JUDGMENT BRIEF-1.txt,2024-02-22,8
case,discovery,CASE DOCS\02.22.24 - SUMMARY JUDGMENT BRIEF-1.pdf,extracted_text\02.22.24 - SUMMARY JUDGMENT BRIEF-1.txt,2024-02-22,6
case,sanctions_contempt,CASE DOCS\02.22.24 - SUMMARY JUDGMENT BRIEF-1.pdf,extracted_text\02.22.24 - SUMMARY JUDGMENT BRIEF-1.txt,2024-02-22,2
case,law_enforcement,CASE DOCS\02.22.24 - SUMMARY JUDGMENT BRIEF-1.pdf,extracted_text\02.22.24 - SUMMARY JUDGMENT BRIEF-1.txt,2024-02-22,8
case,lockout_eviction,CASE DOCS\02.22.24 - SUMMARY JUDGMENT BRIEF-1.pdf,extracted_text\02.22.24 - SUMMARY JUDGMENT BRIEF-1.txt,2024-02-22,10
case,notice,CASE DOCS\02.22.24 Order on Motion for Summary Judgment-1.pdf,extracted_text\02.22.24 Order on Motion for Summary Judgment-1.txt,2024-02-22,2
case,federal_court,CASE DOCS\02.22.24 Order on Motion for Summary Judgment-1.pdf,extracted_text\02.22.24 Order on Motion for Summary Judgment-1.txt,2024-02-22,2
case,due_process,CASE DOCS\02.24.24 - MOTION FOR SUMMARY JUDGMENT - BRIEF-1.pdf,extracted_text\02.24.24 - MOTION FOR SUMMARY JUDGMENT - BRIEF-1.txt,2024-02-24,14
case,notice,CASE DOCS\02.24.24 - MOTION FOR SUMMARY JUDGMENT - BRIEF-1.pdf,extracted_text\02.24.24 - MOTION FOR SUMMARY JUDGMENT - BRIEF-1.txt,2024-02-24,8
case,hearing,CASE DOCS\02.24.24 - MOTION FOR SUMMARY JUDGMENT - BRIEF-1.pdf,extracted_text\02.24.24 - MOTION FOR SUMMARY JUDGMENT - BRIEF-1.txt,2024-02-24,20
case,removal_remand,CASE DOCS\02.24.24 - MOTION FOR SUMMARY JUDGMENT - BRIEF-1.pdf,extracted_text\02.24.24 - MOTION FOR SUMMARY JUDGMENT - BRIEF-1.txt,2024-02-24,2
case,federal_court,CASE DOCS\02.24.24 - MOTION FOR SUMMARY JUDGMENT - BRIEF-1.pdf,extracted_text\02.24.24 - MOTION FOR SUMMARY JUDGMENT - BRIEF-1.txt,2024-02-24,10
case,protective_order,CASE DOCS\02.24.24 - MOTION FOR SUMMARY JUDGMENT - BRIEF-1.pdf,extracted_text\02.24.24 - MOTION FOR SUMMARY JUDGMENT - BRIEF-1.txt,2024-02-24,36
case,temporary_orders,CASE DOCS\02.24.24 - MOTION FOR SUMMARY JUDGMENT - BRIEF-1.pdf,extracted_text\02.24.24 - MOTION FOR SUMMARY JUDGMENT - BRIEF-1.txt,2024-02-24,40
case,custody,CASE DOCS\02.24.24 - MOTION FOR SUMMARY JUDGMENT - BRIEF-1.pdf,extracted_text\02.24.24 - MOTION FOR SUMMARY JUDGMENT - BRIEF-1.txt,2024-02-24,42
case,property_financial,CASE DOCS\02.24.24 - MOTION FOR SUMMARY JUDGMENT - BRIEF-1.pdf,extracted_text\02.24.24 - MOTION FOR SUMMARY JUDGMENT - BRIEF-1.txt,2024-02-24,34
case,fraud_perjury,CASE DOCS\02.24.24 - MOTION FOR SUMMARY JUDGMENT - BRIEF-1.pdf,extracted_text\02.24.24 - MOTION FOR SUMMARY JUDGMENT - BRIEF-1.txt,2024-02-24,8
case,discovery,CASE DOCS\02.24.24 - MOTION FOR SUMMARY JUDGMENT - BRIEF-1.pdf,extracted_text\02.24.24 - MOTION FOR SUMMARY JUDGMENT - BRIEF-1.txt,2024-02-24,6
case,sanctions_contempt,CASE DOCS\02.24.24 - MOTION FOR SUMMARY JUDGMENT - BRIEF-1.pdf,extracted_text\02.24.24 - MOTION FOR SUMMARY JUDGMENT - BRIEF-1.txt,2024-02-24,2
case,law_enforcement,CASE DOCS\02.24.24 - MOTION FOR SUMMARY JUDGMENT - BRIEF-1.pdf,extracted_text\02.24.24 - MOTION FOR SUMMARY JUDGMENT - BRIEF-1.txt,2024-02-24,8
case,lockout_eviction,CASE DOCS\02.24.24 - MOTION FOR SUMMARY JUDGMENT - BRIEF-1.pdf,extracted_text\02.24.24 - MOTION FOR SUMMARY JUDGMENT - BRIEF-1.txt,2024-02-24,10
case,due_process,CASE DOCS\02.24.25 - OBJECTION AND REQUEST FOR JUDICIAL NOTICE-1.pdf,extracted_text\02.24.25 - OBJECTION AND REQUEST FOR JUDICIAL NOTICE-1.txt,2025-02-24,12
case,notice,CASE DOCS\02.24.25 - OBJECTION AND REQUEST FOR JUDICIAL NOTICE-1.pdf,extracted_text\02.24.25 - OBJECTION AND REQUEST FOR JUDICIAL NOTICE-1.txt,2025-02-24,6
case,hearing,CASE DOCS\02.24.25 - OBJECTION AND REQUEST FOR JUDICIAL NOTICE-1.pdf,extracted_text\02.24.25 - OBJECTION AND REQUEST FOR JUDICIAL NOTICE-1.txt,2025-02-24,4
case,recusal,CASE DOCS\02.24.25 - OBJECTION AND REQUEST FOR JUDICIAL NOTICE-1.pdf,extracted_text\02.24.25 - OBJECTION AND REQUEST FOR JUDICIAL NOTICE-1.txt,2025-02-24,90
case,associate_judge,CASE DOCS\02.24.25 - OBJECTION AND REQUEST FOR JUDICIAL NOTICE-1.pdf,extracted_text\02.24.25 - OBJECTION AND REQUEST FOR JUDICIAL NOTICE-1.txt,2025-02-24,4
case,appeal,CASE DOCS\02.24.25 - OBJECTION AND REQUEST FOR JUDICIAL NOTICE-1.pdf,extracted_text\02.24.25 - OBJECTION AND REQUEST FOR JUDICIAL NOTICE-1.txt,2025-02-24,6
case,federal_court,CASE DOCS\02.24.25 - OBJECTION AND REQUEST FOR JUDICIAL NOTICE-1.pdf,extracted_text\02.24.25 - OBJECTION AND REQUEST FOR JUDICIAL NOTICE-1.txt,2025-02-24,8
case,custody,CASE DOCS\02.24.25 - OBJECTION AND REQUEST FOR JUDICIAL NOTICE-1.pdf,extracted_text\02.24.25 - OBJECTION AND REQUEST FOR JUDICIAL NOTICE-1.txt,2025-02-24,2
case,property_financial,CASE DOCS\02.24.25 - OBJECTION AND REQUEST FOR JUDICIAL NOTICE-1.pdf,extracted_text\02.24.25 - OBJECTION AND REQUEST FOR JUDICIAL NOTICE-1.txt,2025-02-24,8
case,sanctions_contempt,CASE DOCS\02.24.25 - OBJECTION AND REQUEST FOR JUDICIAL NOTICE-1.pdf,extracted_text\02.24.25 - OBJECTION AND REQUEST FOR JUDICIAL NOTICE-1.txt,2025-02-24,2
case,injunction,CASE DOCS\02.24.25 - OBJECTION AND REQUEST FOR JUDICIAL NOTICE-1.pdf,extracted_text\02.24.25 - OBJECTION AND REQUEST FOR JUDICIAL NOTICE-1.txt,2025-02-24,2
case,law_enforcement,CASE DOCS\02.24.25 - OBJECTION AND REQUEST FOR JUDICIAL NOTICE-1.pdf,extracted_text\02.24.25 - OBJECTION AND REQUEST FOR JUDICIAL NOTICE-1.txt,2025-02-24,4
case,notice,CASE DOCS\02.25.2025_MOTION TO SIGN-1.pdf,extracted_text\02.25.2025_MOTION TO SIGN-1.txt,2025-02-25,14
case,hearing,CASE DOCS\02.25.2025_MOTION TO SIGN-1.pdf,extracted_text\02.25.2025_MOTION TO SIGN-1.txt,2025-02-25,10
case,recusal,CASE DOCS\02.25.2025_MOTION TO SIGN-1.pdf,extracted_text\02.25.2025_MOTION TO SIGN-1.txt,2025-02-25,3
case,associate_judge,CASE DOCS\02.25.2025_MOTION TO SIGN-1.pdf,extracted_text\02.25.2025_MOTION TO SIGN-1.txt,2025-02-25,4
case,jurisdiction,CASE DOCS\02.25.2025_MOTION TO SIGN-1.pdf,extracted_text\02.25.2025_MOTION TO SIGN-1.txt,2025-02-25,2
case,removal_remand,CASE DOCS\02.25.2025_MOTION TO SIGN-1.pdf,extracted_text\02.25.2025_MOTION TO SIGN-1.txt,2025-02-25,18
case,federal_court,CASE DOCS\02.25.2025_MOTION TO SIGN-1.pdf,extracted_text\02.25.2025_MOTION TO SIGN-1.txt,2025-02-25,8
case,protective_order,CASE DOCS\02.25.2025_MOTION TO SIGN-1.pdf,extracted_text\02.25.2025_MOTION TO SIGN-1.txt,2025-02-25,2
case,temporary_orders,CASE DOCS\02.25.2025_MOTION TO SIGN-1.pdf,extracted_text\02.25.2025_MOTION TO SIGN-1.txt,2025-02-25,40
case,custody,CASE DOCS\02.25.2025_MOTION TO SIGN-1.pdf,extracted_text\02.25.2025_MOTION TO SIGN-1.txt,2025-02-25,12
case,property_financial,CASE DOCS\02.25.2025_MOTION TO SIGN-1.pdf,extracted_text\02.25.2025_MOTION TO SIGN-1.txt,2025-02-25,106
case,fraud_perjury,CASE DOCS\02.25.2025_MOTION TO SIGN-1.pdf,extracted_text\02.25.2025_MOTION TO SIGN-1.txt,2025-02-25,24
case,discovery,CASE DOCS\02.25.2025_MOTION TO SIGN-1.pdf,extracted_text\02.25.2025_MOTION TO SIGN-1.txt,2025-02-25,26
case,sanctions_contempt,CASE DOCS\02.25.2025_MOTION TO SIGN-1.pdf,extracted_text\02.25.2025_MOTION TO SIGN-1.txt,2025-02-25,14
case,injunction,CASE DOCS\02.25.2025_MOTION TO SIGN-1.pdf,extracted_text\02.25.2025_MOTION TO SIGN-1.txt,2025-02-25,24
case,child_support_oag,CASE DOCS\02.25.2025_MOTION TO SIGN-1.pdf,extracted_text\02.25.2025_MOTION TO SIGN-1.txt,2025-02-25,2
case,lockout_eviction,CASE DOCS\02.25.2025_MOTION TO SIGN-1.pdf,extracted_text\02.25.2025_MOTION TO SIGN-1.txt,2025-02-25,10
case,due_process,CASE DOCS\02.25.2025_OBJECTION AND REQUEST FOR JUDICIAL NOTICE-1.pdf,extracted_text\02.25.2025_OBJECTION AND REQUEST FOR JUDICIAL NOTICE-1.txt,2025-02-25,12
case,notice,CASE DOCS\02.25.2025_OBJECTION AND REQUEST FOR JUDICIAL NOTICE-1.pdf,extracted_text\02.25.2025_OBJECTION AND REQUEST FOR JUDICIAL NOTICE-1.txt,2025-02-25,6
case,hearing,CASE DOCS\02.25.2025_OBJECTION AND REQUEST FOR JUDICIAL NOTICE-1.pdf,extracted_text\02.25.2025_OBJECTION AND REQUEST FOR JUDICIAL NOTICE-1.txt,2025-02-25,4
case,recusal,CASE DOCS\02.25.2025_OBJECTION AND REQUEST FOR JUDICIAL NOTICE-1.pdf,extracted_text\02.25.2025_OBJECTION AND REQUEST FOR JUDICIAL NOTICE-1.txt,2025-02-25,90
case,associate_judge,CASE DOCS\02.25.2025_OBJECTION AND REQUEST FOR JUDICIAL NOTICE-1.pdf,extracted_text\02.25.2025_OBJECTION AND REQUEST FOR JUDICIAL NOTICE-1.txt,2025-02-25,4
case,appeal,CASE DOCS\02.25.2025_OBJECTION AND REQUEST FOR JUDICIAL NOTICE-1.pdf,extracted_text\02.25.2025_OBJECTION AND REQUEST FOR JUDICIAL NOTICE-1.txt,2025-02-25,6
case,federal_court,CASE DOCS\02.25.2025_OBJECTION AND REQUEST FOR JUDICIAL NOTICE-1.pdf,extracted_text\02.25.2025_OBJECTION AND REQUEST FOR JUDICIAL NOTICE-1.txt,2025-02-25,8
case,custody,CASE DOCS\02.25.2025_OBJECTION AND REQUEST FOR JUDICIAL NOTICE-1.pdf,extracted_text\02.25.2025_OBJECTION AND REQUEST FOR JUDICIAL NOTICE-1.txt,2025-02-25,2
case,property_financial,CASE DOCS\02.25.2025_OBJECTION AND REQUEST FOR JUDICIAL NOTICE-1.pdf,extracted_text\02.25.2025_OBJECTION AND REQUEST FOR JUDICIAL NOTICE-1.txt,2025-02-25,8
case,sanctions_contempt,CASE DOCS\02.25.2025_OBJECTION AND REQUEST FOR JUDICIAL NOTICE-1.pdf,extracted_text\02.25.2025_OBJECTION AND REQUEST FOR JUDICIAL NOTICE-1.txt,2025-02-25,2
case,injunction,CASE DOCS\02.25.2025_OBJECTION AND REQUEST FOR JUDICIAL NOTICE-1.pdf,extracted_text\02.25.2025_OBJECTION AND REQUEST FOR JUDICIAL NOTICE-1.txt,2025-02-25,2
case,law_enforcement,CASE DOCS\02.25.2025_OBJECTION AND REQUEST FOR JUDICIAL NOTICE-1.pdf,extracted_text\02.25.2025_OBJECTION AND REQUEST FOR JUDICIAL NOTICE-1.txt,2025-02-25,4
case,notice,CASE DOCS\02.25.24 Notice of Termination of Legal Counsel-1.pdf,extracted_text\02.25.24 Notice of Termination of Legal Counsel-1.txt,2024-02-25,14
case,federal_court,CASE DOCS\02.25.24 Notice of Termination of Legal Counsel-1.pdf,extracted_text\02.25.24 Notice of Termination of Legal Counsel-1.txt,2024-02-25,2
case,notice,CASE DOCS\02.25.25 - Notice Loss of Employmnet-1.pdf,extracted_text\02.25.25 - Notice Loss of Employmnet-1.txt,2025-02-25,14
case,federal_court,CASE DOCS\02.25.25 - Notice Loss of Employmnet-1.pdf,extracted_text\02.25.25 - Notice Loss of Employmnet-1.txt,2025-02-25,2
case,temporary_orders,CASE DOCS\02.25.25 - Notice Loss of Employmnet-1.pdf,extracted_text\02.25.25 - Notice Loss of Employmnet-1.txt,2025-02-25,4
case,property_financial,CASE DOCS\02.25.25 - Notice Loss of Employmnet-1.pdf,extracted_text\02.25.25 - Notice Loss of Employmnet-1.txt,2025-02-25,4
case,fraud_perjury,CASE DOCS\02.25.25 - Notice Loss of Employmnet-1.pdf,extracted_text\02.25.25 - Notice Loss of Employmnet-1.txt,2025-02-25,2
case,child_support_oag,CASE DOCS\02.25.25 - Notice Loss of Employmnet-1.pdf,extracted_text\02.25.25 - Notice Loss of Employmnet-1.txt,2025-02-25,2
case,notice,CASE DOCS\02.25.25 - Proposed Order on Motion to Sign-1.pdf,extracted_text\02.25.25 - Proposed Order on Motion to Sign-1.txt,2025-02-25,2
case,federal_court,CASE DOCS\02.25.25 - Proposed Order on Motion to Sign-1.pdf,extracted_text\02.25.25 - Proposed Order on Motion to Sign-1.txt,2025-02-25,2
case,due_process,CASE DOCS\02.26.25 - UNOPPOSED MOTIONS-1.pdf,extracted_text\02.26.25 - UNOPPOSED MOTIONS-1.txt,2025-02-26,2
case,hearing,CASE DOCS\02.26.25 - UNOPPOSED MOTIONS-1.pdf,extracted_text\02.26.25 - UNOPPOSED MOTIONS-1.txt,2025-02-26,2
case,recusal,CASE DOCS\02.26.25 - UNOPPOSED MOTIONS-1.pdf,extracted_text\02.26.25 - UNOPPOSED MOTIONS-1.txt,2025-02-26,4
case,appeal,CASE DOCS\02.26.25 - UNOPPOSED MOTIONS-1.pdf,extracted_text\02.26.25 - UNOPPOSED MOTIONS-1.txt,2025-02-26,2
case,removal_remand,CASE DOCS\02.26.25 - UNOPPOSED MOTIONS-1.pdf,extracted_text\02.26.25 - UNOPPOSED MOTIONS-1.txt,2025-02-26,2
case,federal_court,CASE DOCS\02.26.25 - UNOPPOSED MOTIONS-1.pdf,extracted_text\02.26.25 - UNOPPOSED MOTIONS-1.txt,2025-02-26,2
case,protective_order,CASE DOCS\02.26.25 - UNOPPOSED MOTIONS-1.pdf,extracted_text\02.26.25 - UNOPPOSED MOTIONS-1.txt,2025-02-26,6
case,temporary_orders,CASE DOCS\02.26.25 - UNOPPOSED MOTIONS-1.pdf,extracted_text\02.26.25 - UNOPPOSED MOTIONS-1.txt,2025-02-26,4
case,custody,CASE DOCS\02.26.25 - UNOPPOSED MOTIONS-1.pdf,extracted_text\02.26.25 - UNOPPOSED MOTIONS-1.txt,2025-02-26,4
case,property_financial,CASE DOCS\02.26.25 - UNOPPOSED MOTIONS-1.pdf,extracted_text\02.26.25 - UNOPPOSED MOTIONS-1.txt,2025-02-26,12
case,discovery,CASE DOCS\02.26.25 - UNOPPOSED MOTIONS-1.pdf,extracted_text\02.26.25 - UNOPPOSED MOTIONS-1.txt,2025-02-26,2
case,law_enforcement,CASE DOCS\02.26.25 - UNOPPOSED MOTIONS-1.pdf,extracted_text\02.26.25 - UNOPPOSED MOTIONS-1.txt,2025-02-26,4
case,lockout_eviction,CASE DOCS\02.26.25 - UNOPPOSED MOTIONS-1.pdf,extracted_text\02.26.25 - UNOPPOSED MOTIONS-1.txt,2025-02-26,2
case,notice,CASE DOCS\02.27.2024_NOTICE OF HEARING 31424  9AM-1.pdf,extracted_text\02.27.2024_NOTICE OF HEARING 31424  9AM-1.txt,2024-02-27,8
case,hearing,CASE DOCS\02.27.2024_NOTICE OF HEARING 31424  9AM-1.pdf,extracted_text\02.27.2024_NOTICE OF HEARING 31424  9AM-1.txt,2024-02-27,8
case,federal_court,CASE DOCS\02.27.2024_NOTICE OF HEARING 31424  9AM-1.pdf,extracted_text\02.27.2024_NOTICE OF HEARING 31424  9AM-1.txt,2024-02-27,2
case,temporary_orders,CASE DOCS\02.27.2024_NOTICE OF HEARING 31424  9AM-1.pdf,extracted_text\02.27.2024_NOTICE OF HEARING 31424  9AM-1.txt,2024-02-27,5
case,lockout_eviction,CASE DOCS\02.27.2024_NOTICE OF HEARING 31424  9AM-1.pdf,extracted_text\02.27.2024_NOTICE OF HEARING 31424  9AM-1.txt,2024-02-27,3
case,hearing,CASE DOCS\02.28.2025_REQUEST FOR RULING-1.pdf,extracted_text\02.28.2025_REQUEST FOR RULING-1.txt,2025-02-28,10
case,mandamus,CASE DOCS\02.28.2025_REQUEST FOR RULING-1.pdf,extracted_text\02.28.2025_REQUEST FOR RULING-1.txt,2025-02-28,4
case,appeal,CASE DOCS\02.28.2025_REQUEST FOR RULING-1.pdf,extracted_text\02.28.2025_REQUEST FOR RULING-1.txt,2025-02-28,10
case,federal_court,CASE DOCS\02.28.2025_REQUEST FOR RULING-1.pdf,extracted_text\02.28.2025_REQUEST FOR RULING-1.txt,2025-02-28,4
case,temporary_orders,CASE DOCS\02.28.2025_REQUEST FOR RULING-1.pdf,extracted_text\02.28.2025_REQUEST FOR RULING-1.txt,2025-02-28,2
case,custody,CASE DOCS\02.28.2025_REQUEST FOR RULING-1.pdf,extracted_text\02.28.2025_REQUEST FOR RULING-1.txt,2025-02-28,22
case,property_financial,CASE DOCS\02.28.2025_REQUEST FOR RULING-1.pdf,extracted_text\02.28.2025_REQUEST FOR RULING-1.txt,2025-02-28,10
case,fraud_perjury,CASE DOCS\02.28.2025_REQUEST FOR RULING-1.pdf,extracted_text\02.28.2025_REQUEST FOR RULING-1.txt,2025-02-28,2
case,discovery,CASE DOCS\02.28.2025_REQUEST FOR RULING-1.pdf,extracted_text\02.28.2025_REQUEST FOR RULING-1.txt,2025-02-28,10
case,sanctions_contempt,CASE DOCS\02.28.2025_REQUEST FOR RULING-1.pdf,extracted_text\02.28.2025_REQUEST FOR RULING-1.txt,2025-02-28,14
case,ex_parte,CASE DOCS\02.28.2025_REQUEST FOR RULING-1.pdf,extracted_text\02.28.2025_REQUEST FOR RULING-1.txt,2025-02-28,8
case,hearing,CASE DOCS\02.28.25 - REQUEST FOR RULING-1.pdf,extracted_text\02.28.25 - REQUEST FOR RULING-1.txt,2025-02-28,10
case,mandamus,CASE DOCS\02.28.25 - REQUEST FOR RULING-1.pdf,extracted_text\02.28.25 - REQUEST FOR RULING-1.txt,2025-02-28,4
case,appeal,CASE DOCS\02.28.25 - REQUEST FOR RULING-1.pdf,extracted_text\02.28.25 - REQUEST FOR RULING-1.txt,2025-02-28,10
case,federal_court,CASE DOCS\02.28.25 - REQUEST FOR RULING-1.pdf,extracted_text\02.28.25 - REQUEST FOR RULING-1.txt,2025-02-28,4
case,temporary_orders,CASE DOCS\02.28.25 - REQUEST FOR RULING-1.pdf,extracted_text\02.28.25 - REQUEST FOR RULING-1.txt,2025-02-28,2
case,custody,CASE DOCS\02.28.25 - REQUEST FOR RULING-1.pdf,extracted_text\02.28.25 - REQUEST FOR RULING-1.txt,2025-02-28,22
case,property_financial,CASE DOCS\02.28.25 - REQUEST FOR RULING-1.pdf,extracted_text\02.28.25 - REQUEST FOR RULING-1.txt,2025-02-28,10
case,fraud_perjury,CASE DOCS\02.28.25 - REQUEST FOR RULING-1.pdf,extracted_text\02.28.25 - REQUEST FOR RULING-1.txt,2025-02-28,2
case,discovery,CASE DOCS\02.28.25 - REQUEST FOR RULING-1.pdf,extracted_text\02.28.25 - REQUEST FOR RULING-1.txt,2025-02-28,10
case,sanctions_contempt,CASE DOCS\02.28.25 - REQUEST FOR RULING-1.pdf,extracted_text\02.28.25 - REQUEST FOR RULING-1.txt,2025-02-28,14
case,ex_parte,CASE DOCS\02.28.25 - REQUEST FOR RULING-1.pdf,extracted_text\02.28.25 - REQUEST FOR RULING-1.txt,2025-02-28,8
case,notice,CASE DOCS\03.03.24 Notice and Unsworn Declaration-1.pdf,extracted_text\03.03.24 Notice and Unsworn Declaration-1.txt,2024-03-03,8
case,hearing,CASE DOCS\03.03.24 Notice and Unsworn Declaration-1.pdf,extracted_text\03.03.24 Notice and Unsworn Declaration-1.txt,2024-03-03,2
case,federal_court,CASE DOCS\03.03.24 Notice and Unsworn Declaration-1.pdf,extracted_text\03.03.24 Notice and Unsworn Declaration-1.txt,2024-03-03,4
case,protective_order,CASE DOCS\03.03.24 Notice and Unsworn Declaration-1.pdf,extracted_text\03.03.24 Notice and Unsworn Declaration-1.txt,2024-03-03,2
case,custody,CASE DOCS\03.03.24 Notice and Unsworn Declaration-1.pdf,extracted_text\03.03.24 Notice and Unsworn Declaration-1.txt,2024-03-03,4
case,property_financial,CASE DOCS\03.03.24 Notice and Unsworn Declaration-1.pdf,extracted_text\03.03.24 Notice and Unsworn Declaration-1.txt,2024-03-03,12
case,fraud_perjury,CASE DOCS\03.03.24 Notice and Unsworn Declaration-1.pdf,extracted_text\03.03.24 Notice and Unsworn Declaration-1.txt,2024-03-03,2
case,lockout_eviction,CASE DOCS\03.03.24 Notice and Unsworn Declaration-1.pdf,extracted_text\03.03.24 Notice and Unsworn Declaration-1.txt,2024-03-03,2
case,notice,CASE DOCS\03.04.2024_NOTICE  UNSWORN DECLARATION-1.pdf,extracted_text\03.04.2024_NOTICE  UNSWORN DECLARATION-1.txt,2024-03-04,10
case,hearing,CASE DOCS\03.04.2024_NOTICE  UNSWORN DECLARATION-1.pdf,extracted_text\03.04.2024_NOTICE  UNSWORN DECLARATION-1.txt,2024-03-04,2
case,federal_court,CASE DOCS\03.04.2024_NOTICE  UNSWORN DECLARATION-1.pdf,extracted_text\03.04.2024_NOTICE  UNSWORN DECLARATION-1.txt,2024-03-04,4
case,protective_order,CASE DOCS\03.04.2024_NOTICE  UNSWORN DECLARATION-1.pdf,extracted_text\03.04.2024_NOTICE  UNSWORN DECLARATION-1.txt,2024-03-04,2
case,custody,CASE DOCS\03.04.2024_NOTICE  UNSWORN DECLARATION-1.pdf,extracted_text\03.04.2024_NOTICE  UNSWORN DECLARATION-1.txt,2024-03-04,4
case,property_financial,CASE DOCS\03.04.2024_NOTICE  UNSWORN DECLARATION-1.pdf,extracted_text\03.04.2024_NOTICE  UNSWORN DECLARATION-1.txt,2024-03-04,12
case,fraud_perjury,CASE DOCS\03.04.2024_NOTICE  UNSWORN DECLARATION-1.pdf,extracted_text\03.04.2024_NOTICE  UNSWORN DECLARATION-1.txt,2024-03-04,2
case,lockout_eviction,CASE DOCS\03.04.2024_NOTICE  UNSWORN DECLARATION-1.pdf,extracted_text\03.04.2024_NOTICE  UNSWORN DECLARATION-1.txt,2024-03-04,2
case,due_process,CASE DOCS\03.04.2024_REQUIRED INITIAL DISCLOSURES-1.pdf,extracted_text\03.04.2024_REQUIRED INITIAL DISCLOSURES-1.txt,2024-03-04,4
case,notice,CASE DOCS\03.04.2024_REQUIRED INITIAL DISCLOSURES-1.pdf,extracted_text\03.04.2024_REQUIRED INITIAL DISCLOSURES-1.txt,2024-03-04,8
case,hearing,CASE DOCS\03.04.2024_REQUIRED INITIAL DISCLOSURES-1.pdf,extracted_text\03.04.2024_REQUIRED INITIAL DISCLOSURES-1.txt,2024-03-04,10
case,associate_judge,CASE DOCS\03.04.2024_REQUIRED INITIAL DISCLOSURES-1.pdf,extracted_text\03.04.2024_REQUIRED INITIAL DISCLOSURES-1.txt,2024-03-04,2
case,jurisdiction,CASE DOCS\03.04.2024_REQUIRED INITIAL DISCLOSURES-1.pdf,extracted_text\03.04.2024_REQUIRED INITIAL DISCLOSURES-1.txt,2024-03-04,2
case,federal_court,CASE DOCS\03.04.2024_REQUIRED INITIAL DISCLOSURES-1.pdf,extracted_text\03.04.2024_REQUIRED INITIAL DISCLOSURES-1.txt,2024-03-04,2
case,protective_order,CASE DOCS\03.04.2024_REQUIRED INITIAL DISCLOSURES-1.pdf,extracted_text\03.04.2024_REQUIRED INITIAL DISCLOSURES-1.txt,2024-03-04,6
case,temporary_orders,CASE DOCS\03.04.2024_REQUIRED INITIAL DISCLOSURES-1.pdf,extracted_text\03.04.2024_REQUIRED INITIAL DISCLOSURES-1.txt,2024-03-04,8
case,custody,CASE DOCS\03.04.2024_REQUIRED INITIAL DISCLOSURES-1.pdf,extracted_text\03.04.2024_REQUIRED INITIAL DISCLOSURES-1.txt,2024-03-04,18
case,property_financial,CASE DOCS\03.04.2024_REQUIRED INITIAL DISCLOSURES-1.pdf,extracted_text\03.04.2024_REQUIRED INITIAL DISCLOSURES-1.txt,2024-03-04,18
case,injunction,CASE DOCS\03.04.2024_REQUIRED INITIAL DISCLOSURES-1.pdf,extracted_text\03.04.2024_REQUIRED INITIAL DISCLOSURES-1.txt,2024-03-04,2
case,lockout_eviction,CASE DOCS\03.04.2024_REQUIRED INITIAL DISCLOSURES-1.pdf,extracted_text\03.04.2024_REQUIRED INITIAL DISCLOSURES-1.txt,2024-03-04,8
case,due_process,CASE DOCS\03.05.2025 NOTICE - WATAUGA POLICE DEPT.-1.pdf,extracted_text\03.05.2025 NOTICE - WATAUGA POLICE DEPT.-1.txt,2025-03-05,2
case,notice,CASE DOCS\03.05.2025 NOTICE - WATAUGA POLICE DEPT.-1.pdf,extracted_text\03.05.2025 NOTICE - WATAUGA POLICE DEPT.-1.txt,2025-03-05,12
case,hearing,CASE DOCS\03.05.2025 NOTICE - WATAUGA POLICE DEPT.-1.pdf,extracted_text\03.05.2025 NOTICE - WATAUGA POLICE DEPT.-1.txt,2025-03-05,4
case,associate_judge,CASE DOCS\03.05.2025 NOTICE - WATAUGA POLICE DEPT.-1.pdf,extracted_text\03.05.2025 NOTICE - WATAUGA POLICE DEPT.-1.txt,2025-03-05,4
case,jurisdiction,CASE DOCS\03.05.2025 NOTICE - WATAUGA POLICE DEPT.-1.pdf,extracted_text\03.05.2025 NOTICE - WATAUGA POLICE DEPT.-1.txt,2025-03-05,2
case,removal_remand,CASE DOCS\03.05.2025 NOTICE - WATAUGA POLICE DEPT.-1.pdf,extracted_text\03.05.2025 NOTICE - WATAUGA POLICE DEPT.-1.txt,2025-03-05,8
case,federal_court,CASE DOCS\03.05.2025 NOTICE - WATAUGA POLICE DEPT.-1.pdf,extracted_text\03.05.2025 NOTICE - WATAUGA POLICE DEPT.-1.txt,2025-03-05,4
case,protective_order,CASE DOCS\03.05.2025 NOTICE - WATAUGA POLICE DEPT.-1.pdf,extracted_text\03.05.2025 NOTICE - WATAUGA POLICE DEPT.-1.txt,2025-03-05,4
case,temporary_orders,CASE DOCS\03.05.2025 NOTICE - WATAUGA POLICE DEPT.-1.pdf,extracted_text\03.05.2025 NOTICE - WATAUGA POLICE DEPT.-1.txt,2025-03-05,4
case,custody,CASE DOCS\03.05.2025 NOTICE - WATAUGA POLICE DEPT.-1.pdf,extracted_text\03.05.2025 NOTICE - WATAUGA POLICE DEPT.-1.txt,2025-03-05,2
case,property_financial,CASE DOCS\03.05.2025 NOTICE - WATAUGA POLICE DEPT.-1.pdf,extracted_text\03.05.2025 NOTICE - WATAUGA POLICE DEPT.-1.txt,2025-03-05,30
case,fraud_perjury,CASE DOCS\03.05.2025 NOTICE - WATAUGA POLICE DEPT.-1.pdf,extracted_text\03.05.2025 NOTICE - WATAUGA POLICE DEPT.-1.txt,2025-03-05,10
case,law_enforcement,CASE DOCS\03.05.2025 NOTICE - WATAUGA POLICE DEPT.-1.pdf,extracted_text\03.05.2025 NOTICE - WATAUGA POLICE DEPT.-1.txt,2025-03-05,16
case,lockout_eviction,CASE DOCS\03.05.2025 NOTICE - WATAUGA POLICE DEPT.-1.pdf,extracted_text\03.05.2025 NOTICE - WATAUGA POLICE DEPT.-1.txt,2025-03-05,2
case,notice,CASE DOCS\03.06.2025_PROPOSED ORDER ON UNOPPOSED MOTION TO DISMISS FOR LACK OF JURISDICTION-1.pdf,extracted_text\03.06.2025_PROPOSED ORDER ON UNOPPOSED MOTION TO DISMISS FOR LACK OF JURISDICTION-1.txt,2025-03-06,2
case,jurisdiction,CASE DOCS\03.06.2025_PROPOSED ORDER ON UNOPPOSED MOTION TO DISMISS FOR LACK OF JURISDICTION-1.pdf,extracted_text\03.06.2025_PROPOSED ORDER ON UNOPPOSED MOTION TO DISMISS FOR LACK OF JURISDICTION-1.txt,2025-03-06,4
case,federal_court,CASE DOCS\03.06.2025_PROPOSED ORDER ON UNOPPOSED MOTION TO DISMISS FOR LACK OF JURISDICTION-1.pdf,extracted_text\03.06.2025_PROPOSED ORDER ON UNOPPOSED MOTION TO DISMISS FOR LACK OF JURISDICTION-1.txt,2025-03-06,2
case,notice,CASE DOCS\03.06.2025_UNOPPOSED MOTION TO DISMISS FOR LACK OF JURISDICTION-1.pdf,extracted_text\03.06.2025_UNOPPOSED MOTION TO DISMISS FOR LACK OF JURISDICTION-1.txt,2025-03-06,8
case,hearing,CASE DOCS\03.06.2025_UNOPPOSED MOTION TO DISMISS FOR LACK OF JURISDICTION-1.pdf,extracted_text\03.06.2025_UNOPPOSED MOTION TO DISMISS FOR LACK OF JURISDICTION-1.txt,2025-03-06,4
case,recusal,CASE DOCS\03.06.2025_UNOPPOSED MOTION TO DISMISS FOR LACK OF JURISDICTION-1.pdf,extracted_text\03.06.2025_UNOPPOSED MOTION TO DISMISS FOR LACK OF JURISDICTION-1.txt,2025-03-06,2
case,jurisdiction,CASE DOCS\03.06.2025_UNOPPOSED MOTION TO DISMISS FOR LACK OF JURISDICTION-1.pdf,extracted_text\03.06.2025_UNOPPOSED MOTION TO DISMISS FOR LACK OF JURISDICTION-1.txt,2025-03-06,20
case,removal_remand,CASE DOCS\03.06.2025_UNOPPOSED MOTION TO DISMISS FOR LACK OF JURISDICTION-1.pdf,extracted_text\03.06.2025_UNOPPOSED MOTION TO DISMISS FOR LACK OF JURISDICTION-1.txt,2025-03-06,12
case,federal_court,CASE DOCS\03.06.2025_UNOPPOSED MOTION TO DISMISS FOR LACK OF JURISDICTION-1.pdf,extracted_text\03.06.2025_UNOPPOSED MOTION TO DISMISS FOR LACK OF JURISDICTION-1.txt,2025-03-06,10
case,notice,CASE DOCS\03.06.25 - UNOPPOSED MOTION FOR LACK OF JURIS-1.pdf,extracted_text\03.06.25 - UNOPPOSED MOTION FOR LACK OF JURIS-1.txt,2025-03-06,8
case,hearing,CASE DOCS\03.06.25 - UNOPPOSED MOTION FOR LACK OF JURIS-1.pdf,extracted_text\03.06.25 - UNOPPOSED MOTION FOR LACK OF JURIS-1.txt,2025-03-06,4
case,recusal,CASE DOCS\03.06.25 - UNOPPOSED MOTION FOR LACK OF JURIS-1.pdf,extracted_text\03.06.25 - UNOPPOSED MOTION FOR LACK OF JURIS-1.txt,2025-03-06,2
case,jurisdiction,CASE DOCS\03.06.25 - UNOPPOSED MOTION FOR LACK OF JURIS-1.pdf,extracted_text\03.06.25 - UNOPPOSED MOTION FOR LACK OF JURIS-1.txt,2025-03-06,18
case,removal_remand,CASE DOCS\03.06.25 - UNOPPOSED MOTION FOR LACK OF JURIS-1.pdf,extracted_text\03.06.25 - UNOPPOSED MOTION FOR LACK OF JURIS-1.txt,2025-03-06,12
case,federal_court,CASE DOCS\03.06.25 - UNOPPOSED MOTION FOR LACK OF JURIS-1.pdf,extracted_text\03.06.25 - UNOPPOSED MOTION FOR LACK OF JURIS-1.txt,2025-03-06,10
case,notice,CASE DOCS\03.08.2025_EXHIBIT - SETTLEMENT OFFER - DAN BRANTHOOVER-1.pdf,extracted_text\03.08.2025_EXHIBIT - SETTLEMENT OFFER - DAN BRANTHOOVER-1.txt,2025-03-08,6
case,hearing,CASE DOCS\03.08.2025_EXHIBIT - SETTLEMENT OFFER - DAN BRANTHOOVER-1.pdf,extracted_text\03.08.2025_EXHIBIT - SETTLEMENT OFFER - DAN BRANTHOOVER-1.txt,2025-03-08,2
case,appeal,CASE DOCS\03.08.2025_EXHIBIT - SETTLEMENT OFFER - DAN BRANTHOOVER-1.pdf,extracted_text\03.08.2025_EXHIBIT - SETTLEMENT OFFER - DAN BRANTHOOVER-1.txt,2025-03-08,2
case,removal_remand,CASE DOCS\03.08.2025_EXHIBIT - SETTLEMENT OFFER - DAN BRANTHOOVER-1.pdf,extracted_text\03.08.2025_EXHIBIT - SETTLEMENT OFFER - DAN BRANTHOOVER-1.txt,2025-03-08,2
case,federal_court,CASE DOCS\03.08.2025_EXHIBIT - SETTLEMENT OFFER - DAN BRANTHOOVER-1.pdf,extracted_text\03.08.2025_EXHIBIT - SETTLEMENT OFFER - DAN BRANTHOOVER-1.txt,2025-03-08,2
case,protective_order,CASE DOCS\03.08.2025_EXHIBIT - SETTLEMENT OFFER - DAN BRANTHOOVER-1.pdf,extracted_text\03.08.2025_EXHIBIT - SETTLEMENT OFFER - DAN BRANTHOOVER-1.txt,2025-03-08,8
case,property_financial,CASE DOCS\03.08.2025_EXHIBIT - SETTLEMENT OFFER - DAN BRANTHOOVER-1.pdf,extracted_text\03.08.2025_EXHIBIT - SETTLEMENT OFFER - DAN BRANTHOOVER-1.txt,2025-03-08,40
case,fraud_perjury,CASE DOCS\03.08.2025_EXHIBIT - SETTLEMENT OFFER - DAN BRANTHOOVER-1.pdf,extracted_text\03.08.2025_EXHIBIT - SETTLEMENT OFFER - DAN BRANTHOOVER-1.txt,2025-03-08,6
case,discovery,CASE DOCS\03.08.2025_EXHIBIT - SETTLEMENT OFFER - DAN BRANTHOOVER-1.pdf,extracted_text\03.08.2025_EXHIBIT - SETTLEMENT OFFER - DAN BRANTHOOVER-1.txt,2025-03-08,2
case,lockout_eviction,CASE DOCS\03.08.2025_EXHIBIT - SETTLEMENT OFFER - DAN BRANTHOOVER-1.pdf,extracted_text\03.08.2025_EXHIBIT - SETTLEMENT OFFER - DAN BRANTHOOVER-1.txt,2025-03-08,2
case,notice,CASE DOCS\03.09.2025_EXHIBIT - SETTLEMENT OFFER - MARGIE WILSON-1.pdf,extracted_text\03.09.2025_EXHIBIT - SETTLEMENT OFFER - MARGIE WILSON-1.txt,2025-03-09,6
case,hearing,CASE DOCS\03.09.2025_EXHIBIT - SETTLEMENT OFFER - MARGIE WILSON-1.pdf,extracted_text\03.09.2025_EXHIBIT - SETTLEMENT OFFER - MARGIE WILSON-1.txt,2025-03-09,2
case,appeal,CASE DOCS\03.09.2025_EXHIBIT - SETTLEMENT OFFER - MARGIE WILSON-1.pdf,extracted_text\03.09.2025_EXHIBIT - SETTLEMENT OFFER - MARGIE WILSON-1.txt,2025-03-09,2
case,removal_remand,CASE DOCS\03.09.2025_EXHIBIT - SETTLEMENT OFFER - MARGIE WILSON-1.pdf,extracted_text\03.09.2025_EXHIBIT - SETTLEMENT OFFER - MARGIE WILSON-1.txt,2025-03-09,2
case,federal_court,CASE DOCS\03.09.2025_EXHIBIT - SETTLEMENT OFFER - MARGIE WILSON-1.pdf,extracted_text\03.09.2025_EXHIBIT - SETTLEMENT OFFER - MARGIE WILSON-1.txt,2025-03-09,2
case,protective_order,CASE DOCS\03.09.2025_EXHIBIT - SETTLEMENT OFFER - MARGIE WILSON-1.pdf,extracted_text\03.09.2025_EXHIBIT - SETTLEMENT OFFER - MARGIE WILSON-1.txt,2025-03-09,8
case,property_financial,CASE DOCS\03.09.2025_EXHIBIT - SETTLEMENT OFFER - MARGIE WILSON-1.pdf,extracted_text\03.09.2025_EXHIBIT - SETTLEMENT OFFER - MARGIE WILSON-1.txt,2025-03-09,40
case,fraud_perjury,CASE DOCS\03.09.2025_EXHIBIT - SETTLEMENT OFFER - MARGIE WILSON-1.pdf,extracted_text\03.09.2025_EXHIBIT - SETTLEMENT OFFER - MARGIE WILSON-1.txt,2025-03-09,6
case,discovery,CASE DOCS\03.09.2025_EXHIBIT - SETTLEMENT OFFER - MARGIE WILSON-1.pdf,extracted_text\03.09.2025_EXHIBIT - SETTLEMENT OFFER - MARGIE WILSON-1.txt,2025-03-09,2
case,lockout_eviction,CASE DOCS\03.09.2025_EXHIBIT - SETTLEMENT OFFER - MARGIE WILSON-1.pdf,extracted_text\03.09.2025_EXHIBIT - SETTLEMENT OFFER - MARGIE WILSON-1.txt,2025-03-09,2
case,federal_court,CASE DOCS\03.09.24 - JOHN VARELA AFFIDAVIT-1.pdf,extracted_text\03.09.24 - JOHN VARELA AFFIDAVIT-1.txt,2024-03-09,1
case,federal_court,CASE DOCS\03.10.24 - BRIANA GALBO-1.pdf,extracted_text\03.10.24 - BRIANA GALBO-1.txt,2024-03-10,1
case,custody,CASE DOCS\03.10.24 - BRIANA GALBO-1.pdf,extracted_text\03.10.24 - BRIANA GALBO-1.txt,2024-03-10,4
case,property_financial,CASE DOCS\03.10.24 - BRIANA GALBO-1.pdf,extracted_text\03.10.24 - BRIANA GALBO-1.txt,2024-03-10,10
case,federal_court,CASE DOCS\03.10.24 - CHRISTIAN VROOM AFFIDAVIT-1.pdf,extracted_text\03.10.24 - CHRISTIAN VROOM AFFIDAVIT-1.txt,2024-03-10,1
case,due_process,CASE DOCS\03.11.2025_NOTICE OF CONTINUED OBSTRUCTION-1.pdf,extracted_text\03.11.2025_NOTICE OF CONTINUED OBSTRUCTION-1.txt,2025-03-11,2
case,notice,CASE DOCS\03.11.2025_NOTICE OF CONTINUED OBSTRUCTION-1.pdf,extracted_text\03.11.2025_NOTICE OF CONTINUED OBSTRUCTION-1.txt,2025-03-11,39
case,hearing,CASE DOCS\03.11.2025_NOTICE OF CONTINUED OBSTRUCTION-1.pdf,extracted_text\03.11.2025_NOTICE OF CONTINUED OBSTRUCTION-1.txt,2025-03-11,2
case,recusal,CASE DOCS\03.11.2025_NOTICE OF CONTINUED OBSTRUCTION-1.pdf,extracted_text\03.11.2025_NOTICE OF CONTINUED OBSTRUCTION-1.txt,2025-03-11,4
case,mandamus,CASE DOCS\03.11.2025_NOTICE OF CONTINUED OBSTRUCTION-1.pdf,extracted_text\03.11.2025_NOTICE OF CONTINUED OBSTRUCTION-1.txt,2025-03-11,10
case,jurisdiction,CASE DOCS\03.11.2025_NOTICE OF CONTINUED OBSTRUCTION-1.pdf,extracted_text\03.11.2025_NOTICE OF CONTINUED OBSTRUCTION-1.txt,2025-03-11,4
case,removal_remand,CASE DOCS\03.11.2025_NOTICE OF CONTINUED OBSTRUCTION-1.pdf,extracted_text\03.11.2025_NOTICE OF CONTINUED OBSTRUCTION-1.txt,2025-03-11,2
case,federal_court,CASE DOCS\03.11.2025_NOTICE OF CONTINUED OBSTRUCTION-1.pdf,extracted_text\03.11.2025_NOTICE OF CONTINUED OBSTRUCTION-1.txt,2025-03-11,4
case,protective_order,CASE DOCS\03.11.2025_NOTICE OF CONTINUED OBSTRUCTION-1.pdf,extracted_text\03.11.2025_NOTICE OF CONTINUED OBSTRUCTION-1.txt,2025-03-11,2
case,temporary_orders,CASE DOCS\03.11.2025_NOTICE OF CONTINUED OBSTRUCTION-1.pdf,extracted_text\03.11.2025_NOTICE OF CONTINUED OBSTRUCTION-1.txt,2025-03-11,16
case,custody,CASE DOCS\03.11.2025_NOTICE OF CONTINUED OBSTRUCTION-1.pdf,extracted_text\03.11.2025_NOTICE OF CONTINUED OBSTRUCTION-1.txt,2025-03-11,2
case,property_financial,CASE DOCS\03.11.2025_NOTICE OF CONTINUED OBSTRUCTION-1.pdf,extracted_text\03.11.2025_NOTICE OF CONTINUED OBSTRUCTION-1.txt,2025-03-11,2
case,fraud_perjury,CASE DOCS\03.11.2025_NOTICE OF CONTINUED OBSTRUCTION-1.pdf,extracted_text\03.11.2025_NOTICE OF CONTINUED OBSTRUCTION-1.txt,2025-03-11,2
case,discovery,CASE DOCS\03.11.2025_NOTICE OF CONTINUED OBSTRUCTION-1.pdf,extracted_text\03.11.2025_NOTICE OF CONTINUED OBSTRUCTION-1.txt,2025-03-11,8
case,child_support_oag,CASE DOCS\03.11.2025_NOTICE OF CONTINUED OBSTRUCTION-1.pdf,extracted_text\03.11.2025_NOTICE OF CONTINUED OBSTRUCTION-1.txt,2025-03-11,2
case,law_enforcement,CASE DOCS\03.11.2025_NOTICE OF CONTINUED OBSTRUCTION-1.pdf,extracted_text\03.11.2025_NOTICE OF CONTINUED OBSTRUCTION-1.txt,2025-03-11,2
case,federal_court,CASE DOCS\03.11.24 - AARON WATSON-1.pdf,extracted_text\03.11.24 - AARON WATSON-1.txt,2024-03-11,1
case,custody,CASE DOCS\03.11.24 - AARON WATSON-1.pdf,extracted_text\03.11.24 - AARON WATSON-1.txt,2024-03-11,2
case,property_financial,CASE DOCS\03.11.24 - AARON WATSON-1.pdf,extracted_text\03.11.24 - AARON WATSON-1.txt,2024-03-11,5
case,federal_court,CASE DOCS\03.11.24 - DANNY SLADE-1.pdf,extracted_text\03.11.24 - DANNY SLADE-1.txt,2024-03-11,1
case,due_process,CASE DOCS\03.11.25 - NOTICE OF CONTINUED OBSTRUCTION-1.pdf,extracted_text\03.11.25 - NOTICE OF CONTINUED OBSTRUCTION-1.txt,2025-03-11,2
case,notice,CASE DOCS\03.11.25 - NOTICE OF CONTINUED OBSTRUCTION-1.pdf,extracted_text\03.11.25 - NOTICE OF CONTINUED OBSTRUCTION-1.txt,2025-03-11,33
case,hearing,CASE DOCS\03.11.25 - NOTICE OF CONTINUED OBSTRUCTION-1.pdf,extracted_text\03.11.25 - NOTICE OF CONTINUED OBSTRUCTION-1.txt,2025-03-11,2
case,recusal,CASE DOCS\03.11.25 - NOTICE OF CONTINUED OBSTRUCTION-1.pdf,extracted_text\03.11.25 - NOTICE OF CONTINUED OBSTRUCTION-1.txt,2025-03-11,4
case,mandamus,CASE DOCS\03.11.25 - NOTICE OF CONTINUED OBSTRUCTION-1.pdf,extracted_text\03.11.25 - NOTICE OF CONTINUED OBSTRUCTION-1.txt,2025-03-11,10
case,jurisdiction,CASE DOCS\03.11.25 - NOTICE OF CONTINUED OBSTRUCTION-1.pdf,extracted_text\03.11.25 - NOTICE OF CONTINUED OBSTRUCTION-1.txt,2025-03-11,4
case,removal_remand,CASE DOCS\03.11.25 - NOTICE OF CONTINUED OBSTRUCTION-1.pdf,extracted_text\03.11.25 - NOTICE OF CONTINUED OBSTRUCTION-1.txt,2025-03-11,2
case,federal_court,CASE DOCS\03.11.25 - NOTICE OF CONTINUED OBSTRUCTION-1.pdf,extracted_text\03.11.25 - NOTICE OF CONTINUED OBSTRUCTION-1.txt,2025-03-11,4
case,protective_order,CASE DOCS\03.11.25 - NOTICE OF CONTINUED OBSTRUCTION-1.pdf,extracted_text\03.11.25 - NOTICE OF CONTINUED OBSTRUCTION-1.txt,2025-03-11,2
case,temporary_orders,CASE DOCS\03.11.25 - NOTICE OF CONTINUED OBSTRUCTION-1.pdf,extracted_text\03.11.25 - NOTICE OF CONTINUED OBSTRUCTION-1.txt,2025-03-11,16
case,custody,CASE DOCS\03.11.25 - NOTICE OF CONTINUED OBSTRUCTION-1.pdf,extracted_text\03.11.25 - NOTICE OF CONTINUED OBSTRUCTION-1.txt,2025-03-11,2
case,property_financial,CASE DOCS\03.11.25 - NOTICE OF CONTINUED OBSTRUCTION-1.pdf,extracted_text\03.11.25 - NOTICE OF CONTINUED OBSTRUCTION-1.txt,2025-03-11,2
case,fraud_perjury,CASE DOCS\03.11.25 - NOTICE OF CONTINUED OBSTRUCTION-1.pdf,extracted_text\03.11.25 - NOTICE OF CONTINUED OBSTRUCTION-1.txt,2025-03-11,2
case,discovery,CASE DOCS\03.11.25 - NOTICE OF CONTINUED OBSTRUCTION-1.pdf,extracted_text\03.11.25 - NOTICE OF CONTINUED OBSTRUCTION-1.txt,2025-03-11,8
case,child_support_oag,CASE DOCS\03.11.25 - NOTICE OF CONTINUED OBSTRUCTION-1.pdf,extracted_text\03.11.25 - NOTICE OF CONTINUED OBSTRUCTION-1.txt,2025-03-11,2
case,law_enforcement,CASE DOCS\03.11.25 - NOTICE OF CONTINUED OBSTRUCTION-1.pdf,extracted_text\03.11.25 - NOTICE OF CONTINUED OBSTRUCTION-1.txt,2025-03-11,2
case,due_process,CASE DOCS\03.12.25 - NOTICE OF CONTINUED OBSTRUCTION-1.pdf,extracted_text\03.12.25 - NOTICE OF CONTINUED OBSTRUCTION-1.txt,2025-03-12,2
case,notice,CASE DOCS\03.12.25 - NOTICE OF CONTINUED OBSTRUCTION-1.pdf,extracted_text\03.12.25 - NOTICE OF CONTINUED OBSTRUCTION-1.txt,2025-03-12,37
case,hearing,CASE DOCS\03.12.25 - NOTICE OF CONTINUED OBSTRUCTION-1.pdf,extracted_text\03.12.25 - NOTICE OF CONTINUED OBSTRUCTION-1.txt,2025-03-12,2
case,recusal,CASE DOCS\03.12.25 - NOTICE OF CONTINUED OBSTRUCTION-1.pdf,extracted_text\03.12.25 - NOTICE OF CONTINUED OBSTRUCTION-1.txt,2025-03-12,4
case,mandamus,CASE DOCS\03.12.25 - NOTICE OF CONTINUED OBSTRUCTION-1.pdf,extracted_text\03.12.25 - NOTICE OF CONTINUED OBSTRUCTION-1.txt,2025-03-12,10
case,jurisdiction,CASE DOCS\03.12.25 - NOTICE OF CONTINUED OBSTRUCTION-1.pdf,extracted_text\03.12.25 - NOTICE OF CONTINUED OBSTRUCTION-1.txt,2025-03-12,4
case,removal_remand,CASE DOCS\03.12.25 - NOTICE OF CONTINUED OBSTRUCTION-1.pdf,extracted_text\03.12.25 - NOTICE OF CONTINUED OBSTRUCTION-1.txt,2025-03-12,2
case,federal_court,CASE DOCS\03.12.25 - NOTICE OF CONTINUED OBSTRUCTION-1.pdf,extracted_text\03.12.25 - NOTICE OF CONTINUED OBSTRUCTION-1.txt,2025-03-12,4
case,protective_order,CASE DOCS\03.12.25 - NOTICE OF CONTINUED OBSTRUCTION-1.pdf,extracted_text\03.12.25 - NOTICE OF CONTINUED OBSTRUCTION-1.txt,2025-03-12,2
case,temporary_orders,CASE DOCS\03.12.25 - NOTICE OF CONTINUED OBSTRUCTION-1.pdf,extracted_text\03.12.25 - NOTICE OF CONTINUED OBSTRUCTION-1.txt,2025-03-12,16
case,custody,CASE DOCS\03.12.25 - NOTICE OF CONTINUED OBSTRUCTION-1.pdf,extracted_text\03.12.25 - NOTICE OF CONTINUED OBSTRUCTION-1.txt,2025-03-12,2
case,property_financial,CASE DOCS\03.12.25 - NOTICE OF CONTINUED OBSTRUCTION-1.pdf,extracted_text\03.12.25 - NOTICE OF CONTINUED OBSTRUCTION-1.txt,2025-03-12,2
case,fraud_perjury,CASE DOCS\03.12.25 - NOTICE OF CONTINUED OBSTRUCTION-1.pdf,extracted_text\03.12.25 - NOTICE OF CONTINUED OBSTRUCTION-1.txt,2025-03-12,2
case,discovery,CASE DOCS\03.12.25 - NOTICE OF CONTINUED OBSTRUCTION-1.pdf,extracted_text\03.12.25 - NOTICE OF CONTINUED OBSTRUCTION-1.txt,2025-03-12,8
case,child_support_oag,CASE DOCS\03.12.25 - NOTICE OF CONTINUED OBSTRUCTION-1.pdf,extracted_text\03.12.25 - NOTICE OF CONTINUED OBSTRUCTION-1.txt,2025-03-12,2
case,law_enforcement,CASE DOCS\03.12.25 - NOTICE OF CONTINUED OBSTRUCTION-1.pdf,extracted_text\03.12.25 - NOTICE OF CONTINUED OBSTRUCTION-1.txt,2025-03-12,2
case,due_process,CASE DOCS\03.12.25 - REQUEST TO SET UN-OPPOSED SUMMARY JUDGMENT AND UN-OPPOSED RULE 12 MOTIONS FOR SUBMISSION-1.pdf,extracted_text\03.12.25 - REQUEST TO SET UN-OPPOSED SUMMARY JUDGMENT AND UN-OPPOSED RULE 12 MOTIONS FOR SUBMISSION-1.txt,2025-03-12,14
case,notice,CASE DOCS\03.12.25 - REQUEST TO SET UN-OPPOSED SUMMARY JUDGMENT AND UN-OPPOSED RULE 12 MOTIONS FOR SUBMISSION-1.pdf,extracted_text\03.12.25 - REQUEST TO SET UN-OPPOSED SUMMARY JUDGMENT AND UN-OPPOSED RULE 12 MOTIONS FOR SUBMISSION-1.txt,2025-03-12,18
case,hearing,CASE DOCS\03.12.25 - REQUEST TO SET UN-OPPOSED SUMMARY JUDGMENT AND UN-OPPOSED RULE 12 MOTIONS FOR SUBMISSION-1.pdf,extracted_text\03.12.25 - REQUEST TO SET UN-OPPOSED SUMMARY JUDGMENT AND UN-OPPOSED RULE 12 MOTIONS FOR SUBMISSION-1.txt,2025-03-12,24
case,removal_remand,CASE DOCS\03.12.25 - REQUEST TO SET UN-OPPOSED SUMMARY JUDGMENT AND UN-OPPOSED RULE 12 MOTIONS FOR SUBMISSION-1.pdf,extracted_text\03.12.25 - REQUEST TO SET UN-OPPOSED SUMMARY JUDGMENT AND UN-OPPOSED RULE 12 MOTIONS FOR SUBMISSION-1.txt,2025-03-12,6
case,federal_court,CASE DOCS\03.12.25 - REQUEST TO SET UN-OPPOSED SUMMARY JUDGMENT AND UN-OPPOSED RULE 12 MOTIONS FOR SUBMISSION-1.pdf,extracted_text\03.12.25 - REQUEST TO SET UN-OPPOSED SUMMARY JUDGMENT AND UN-OPPOSED RULE 12 MOTIONS FOR SUBMISSION-1.txt,2025-03-12,20
case,protective_order,CASE DOCS\03.12.25 - REQUEST TO SET UN-OPPOSED SUMMARY JUDGMENT AND UN-OPPOSED RULE 12 MOTIONS FOR SUBMISSION-1.pdf,extracted_text\03.12.25 - REQUEST TO SET UN-OPPOSED SUMMARY JUDGMENT AND UN-OPPOSED RULE 12 MOTIONS FOR SUBMISSION-1.txt,2025-03-12,42
case,temporary_orders,CASE DOCS\03.12.25 - REQUEST TO SET UN-OPPOSED SUMMARY JUDGMENT AND UN-OPPOSED RULE 12 MOTIONS FOR SUBMISSION-1.pdf,extracted_text\03.12.25 - REQUEST TO SET UN-OPPOSED SUMMARY JUDGMENT AND UN-OPPOSED RULE 12 MOTIONS FOR SUBMISSION-1.txt,2025-03-12,44
case,custody,CASE DOCS\03.12.25 - REQUEST TO SET UN-OPPOSED SUMMARY JUDGMENT AND UN-OPPOSED RULE 12 MOTIONS FOR SUBMISSION-1.pdf,extracted_text\03.12.25 - REQUEST TO SET UN-OPPOSED SUMMARY JUDGMENT AND UN-OPPOSED RULE 12 MOTIONS FOR SUBMISSION-1.txt,2025-03-12,46
case,property_financial,CASE DOCS\03.12.25 - REQUEST TO SET UN-OPPOSED SUMMARY JUDGMENT AND UN-OPPOSED RULE 12 MOTIONS FOR SUBMISSION-1.pdf,extracted_text\03.12.25 - REQUEST TO SET UN-OPPOSED SUMMARY JUDGMENT AND UN-OPPOSED RULE 12 MOTIONS FOR SUBMISSION-1.txt,2025-03-12,60
case,fraud_perjury,CASE DOCS\03.12.25 - REQUEST TO SET UN-OPPOSED SUMMARY JUDGMENT AND UN-OPPOSED RULE 12 MOTIONS FOR SUBMISSION-1.pdf,extracted_text\03.12.25 - REQUEST TO SET UN-OPPOSED SUMMARY JUDGMENT AND UN-OPPOSED RULE 12 MOTIONS FOR SUBMISSION-1.txt,2025-03-12,8
